,Search Keyword,Platform,Job ID,Job Title,Company Name,Location,Job Description,Rating,Employment Type,Company URL,Job URL,Job Age,Job Age Number,Collection Date,Language,Gender
51,publieke administratie,Indeed,p_17eded77d857943f,Adviseur projectbeheersing,ELLBRU, Amsterdam,"Voor het Ingenieursbureau van de gemeente Amsterdam zijn wij voor 36 uur per week op zoek naar een adviseur projectbeheersing voor diverse civiele projecten. Heb jij ervaring bij civiele projecten in Amsterdam en kennis van WIOR? Lees dan snel verder!
Organisatie
Amsterdam groeit en bloeit. De gemeente investeert jaarlijks honderden miljoenen in de openbare ruimte. Het Ingenieursbureau van de gemeente is hét projecten- en adviescentrum van de stad en zet alle ambities om naar de praktijk. Het bureau staat voor projectrealisatie, advies en inkoop binnen de grond-, weg- en waterbouw waarbij de passie ligt bij de complexiteit van stedelijke gebieden. Vakinhoudelijke expertise, betrouwbaarheid en kennis van de stad Amsterdam zijn de kracht van het Ingenieursbureau.
Al deze opgaven vragen om structuur, inzicht in kritieke paden elementen, passende stuurinformatie, doordachte processen, orde en overzicht op financieel gebied; ofwel, volwassen projectbeheersing. Alleen dan kan het Ingenieursbureau als 'projectencentrum' van de stad de wensen van het bestuur en onze opdrachtgevers betrouwbaar, voorspelbaar en binnen de afgesproken kaders realiseren. Het werkveld Projectbeheersing speelt een belangrijke rol in het ingenieursbureau. De veelvoud aan diverse projecten, vraagt om een frisse aanpak; realistisch, werkbaar en van toegevoegde waarde voor de projectleiders en opdrachtgever(s). Voor nu en de toekomst.
Het Ingenieursbureau is, in opdracht van de eigenaren in de stad, verantwoordelijk voor de integrale voorbereiding, contractering en realisatie van alle projecten in de openbare ruimte van Amsterdam, ter waarde van jaarlijks honderden miljoenen euro's. Dit verschilt van grote, langlopende projecten (met contractwaarden van > € 100 miljoen) tot meer standaard, kortlopende projecten van veel kleinere omvang.
De afdeling 'Projectbeheersing' is een adviesafdeling binnen het Ingenieursbureau met projectbeheersers, financieel adviseur en financieel ondersteuners. Het aanverwante team herbergt de planningsadviseurs, kostendeskundigen en risicomanagement adviseurs. Dit tezamen telt zo'n 90 mensen zowel een structurele inzet in projecten (als onderdeel van het projectteam) als een enkelvoudige betrokkenheid op productbasis of met een adviesopdracht.
Het Ingenieursbureau heeft een stevige ambitie op de doorontwikkeling van projectbeheersing. Daarin wordt kennis er ervaringen gedeeld, werkwijzen ontwikkeld en verschillende ontwikkelingen aangestuurd.
Functieomschrijving
Je werkt in de rol van projectadviseur met financiële affiniteit aan een of enkele projectteams die conform het IPM-gedachtegoed werken aan opgaven in de stad. Je zorgt voor de passende financiële stuurinformatie die in die fase van het project het meest bijdraagt aan een goede projectsturing. Je bent betrokken bij de ambtelijke voortgangsrapportages en besluitvorming in de projecten.
In deze functie is het de bedoeling om de scope op een transparante en inzichtelijke wijze te vertalen naar een projectraming en budget. Inzicht te bieden in de uitgaven-, ontvangsten-, verplichtingenstromen en prognoses. Hierover wordt tijdig gerapporteerd ten behoeve van de financiële sturing van het project.
Vanuit de financiële projectbeheersing draag je bij aan de structuur, overzicht en voortgangsbewaking binnen de gestelde kaders en bent daarin een sparringpartner voor de projectbeheerser en, mede kader stellend en faciliterend voor de projectmedewerkers samen zorg je ervoor dat de financiële basis op orde in het project, De projectbeheerser stuurt de (financieel) adviseurs aan binnen het werkveld van projectbeheersing. Je werkt regelmatig samen met de financiële ondersteuner i.v.m. het inkoop en factureerproces.
Je draagt zorg voor:

Inzicht/analyse/bewaken van het budget: raming, realisatie én kosten en dekkings prognoses in contact met de (deel) projectleiders van het project: actuele, volledige en betrouwbare financiële overzichten vanuit de integrale projectadministratie (inclusief inzicht in jaarschijven);
Financiële afsluiting en decharge project;
Aanvragen/onderbouwen/afhandelen subsidies waar van toepassing;
Inrichting en beheer projectadministratie (budgetten, inrichting, mandaat);
Bijdrage aan P&C cyclus w.o de jaarafsluiting;
Bijdrage aan financiële paragraaf bij bestuurlijke besluitvorming;
Vraagbaak voor van je collega's binnen en buiten het projectteam;
Je bent adviseur en sparringpartner voor projectmanager en andere teamleden;
Kennis delen: je levert een bijdrage aam kennisthema's in de vakgroep financiële projectbeheersing. Je levert een bijdrage in het verbeteren van de standaard binnen de vakgroep en het IB;
Faciliteren van het inkoopproces binnen het Amsterdamse inkoopbeleid;
Je bewaakt rechtmatigheid en de naleving van wet en regelgeving.
Voor deze functie is bij één project een specifieke opgave, nl:
Het maken van definitieve afspraken over de financiële bijdrages project met een aantal zogeheten interne en externe ""meelifters/werk met werk"" (Waternet, Verkeerslichten, Hoofdnet Auto en Fiets, Openbare Verlichting, Kunstwerken (waterbouw), Stadsdeel, ed. Vanuit het project zijn er extra werkzaamheden meegenomen voor deze partijen, die uiteindelijk ook door hen betaald worden. Er is begeleiding hierbij door een jr. financieel adviseur, die door tijdgebrek hier echter niet aan toekomt. Het proces begint met overleg met de technisch manager, omgevingsmanager, assetmanagers om uit te pluizen welke kosten (bouwkosten/ bestek of SSK uitpluizen, tekeningen erbij, BLVC-kosten, engineering, ed.) we vanuit het project redelijkerwijs in rekening kunnen brengen. Hierbij is ook kennis van Amsterdamse procedures benodigd, zoals de WIOR (Werken in de Openbare Ruimte). In veel gevallen zijn de afspraken vooraf niet goed vastgelegd via een SOK (Samenwerkingsovereenkomst), oid. De kostenopstelling die volgt uit de gesprekken laten we toetsen door een van onze kostendeskundigen. Daarna moeten we overeenstemming zien te bereiken met de betreffende meeliftende partij (deels onderhandelingen). Als die er is, volgt nog een administratief proces om het geheel goed vast te leggen. Opstellen offerte van project aan meelifter (namens V&OR), opdrachtbevestiging van meelifter en opstellen verkoopfacturen.
Functie-eisen
Je beschikt minimaal over een HBO werk- en denkniveau (Als studie-achtergrond valt te denken aan civiele techniek of (technische) bedrijfskunde);
We zien jouw ervaring (1-2 jaar) met adviseurs projectbeheersing binnen een gemeentelijke projectenafdeling en met het opstellen van project voortgangsrapportages en het bewaren van overzicht in en over projecten graag terug in een schiftelijke motivatie van maximaal 1 A4 pagina;
Je beschikt over goede schriftelijke vaardigheden (vertaling van informatie naar stuurinformatie voor project, opdrachtgever en accounthouder);
Het opstellen van aanbiedingen en offertes op basis van de gevoerde onderhandeling;
Je hebt kennis van en ervaring met de rol van financieel projectadviseur op in de infrastructuur in voorbereidings- en uitvoeringsfase binnen grootstedelijke omgeving; Ervaring binnen het IPM-model als financieel projectadviseur is een pre;
Je hebt kennis en ervaring op het gebied van financiële systemen, overzichten en rapportage en de implementatie ervan in projecten (pré is Amsterdams financieel systeem AFS);
Je hebt affiniteit/ervaring met werken in de publieke sector en besluitvorming in een bestuurlijke setting.
Ons aanbod
Wij bieden een goed salaris (€5.500 - €6.500) met bijbehorende marktconforme secundaire arbeidsvoorwaarden volgens de 'inlenersbeloning' waarbij je als professional werkt via ELLBRU. Op deze vacature kunnen ZZP'ers ook reageren. De opdracht biedt een verlengingsmogelijkheid van 1 x 12 maanden en mogelijkheid in dienst te treden bij de gemeente Amsterdam. U kunt reageren tot 1 februari.",-1.0,-1,https://indeed.nl/rc/clk?jk=17eded77d857943f&from=vj&mvj=0&vjfrom=vjs&pos=bottom&astse=991029f4fa3520a6&assa=6239,https://nl.indeed.com/vacature-bekijken?jk=17eded77d857943f&fccid=27d0e7e056c48e6f&vjs=3,9 dagen geleden,9 dagen geleden,2021-01-24,en,Neutral
52,publieke administratie,Indeed,p_a1c0a7ed3449317d,Operationeel Inkoper,Veolia Nederland BV, Schiphol,"Afwisseling en in contact staan met je collega’s en leveranciers! Iedere dag bijleren en zelfstandig werken in een leuk team. Geen dag hetzelfde in een snelgroeiende organisatie. Ontwikkeling vind jij belangrijk voor jezelf en teamwork staat voorop. Goede secundaire arbeidsvoorwaarden zoals pensioen en veel vrije dagen zitten uiteraard in je pakket. Spreekt dit je aan, lees dan snel verder!
Hoe ziet jouw dag eruit als Operationeel inkoper bij Veolia Nederland?
De dag begint om 8.30 uur op ons hoofdkantoor in Schiphol-Rijk en je opent je mailbox. Je stelt prioriteiten voor de dag en overlegt indien nodig even met je collega’s. In jouw functie zorg je ervoor dat het operationele inkoopproces binnen Veolia in goede banen wordt geleid. Je bent namens de afdeling inkoop het eerste aanspreekpunt en maakt nieuwe leveranciers aan wanneer hier aanvragen voor binnen komen vanuit de organisatie. Je bent tevens verantwoordelijk voor een aantal inkoopgebieden. Hiertoe onderhandel je met leveranciers over leveringscondities om tegen zo gunstig mogelijke prijs-kwaliteitverhouding te contracteren. Daarnaast support je de afdeling waar nodig op administratief vlak. In deze rol ben je nauwkeurig, goed in plannen, organiseren en flexibel ingesteld. Je zoekt continu verbetering en je brengt lijn aan in je werkzaamheden en in de samenwerking met je collega’s. Je bent een open, no-nonsense type, oplossingsgericht met een hands on aanpak. Ben jij onze nieuwe ambitieuze operationeel inkoper die zich verder wil gaan ontwikkelen in het inkoop vak?
Rondleiding door Veolia Nederland B.V.
Veolia is al ruim 40 jaar actief in Nederland en ondersteunt haar klanten in de sectoren voeding, chemie, olie en gas, onderwijs, gezondheidszorg en lokale overheden. Om een circulaire en meer duurzame economie te realiseren werken we met onze klanten samen om schaarse hulpbronnen te beheren maar ook door deze bronnen zo efficiënt mogelijke te benutten. Denk aan de transformatie van slib in bio-plastic of de omzetting van koffiedik in een brandstofbron, met als doel het leveren van nutsdiensten. Via onze ervaring op het gebied van bedrijfsvoering, techniek en technologie verminderen we de milieubelasting van de activiteiten van onze klanten en helpen we tegelijkertijd industriële bedrijven, dienstverlenende organisaties en de publieke sector om op een efficiëntere wijze te opereren.
Arbeidsvoorwaarden
Als operationeel inkoper krijg jij in ieder geval:
marktconform salaris;
jaarcontract met het voornemen tot een contract voor onbepaalde tijd;
25 vakantiedagen en 13 ADV dagen;
een goed pensioen;
ontwikkelkansen door middel van training waar nodig.
auto, laptop en telefoon ter beschikking.

Functie-eisen
In jouw rol als operationeel inkoper heb jij:
een afgeronde hbo-opleiding richting bijvoorbeeld commerciële economie, bedrijfseconomie
1-3 jaar ervaring in een soortgelijke functie;
stressbestendig, hectische omgevingen ben je gewend;
je beschikt over een goede schriftelijke en mondelinge uitdrukkingsvaardigheid;
de ambitie om door te groeien in het inkoop vak;
een diploma voor NEVI-1 (wordt gezien als een pré).

Enthousiast?
Solliciteer dan direct op deze operationeel inkoper functie via de button. Wil je eerst meer weten over de functie? Dat kan natuurlijk ook! Bel, WhatsApp of e-mail mij, Vera van de Wetering, via [email protected] , 06-34526912.
Solliciteren",-1.0,-1,https://indeed.nl/rc/clk?jk=a1c0a7ed3449317d&from=vj&sjdu=DBzF7r7rN4u9w-4rSY5QaWHwHEVOFXKnN6Qc-niAYe35kXRvqZz-_7IAuO2GzzYVPlvVmiasV4iafIq2hSPEFWERzmzAs36T8xVeynGOCO_xoGwOJXn7uXHLuoWci4z2&mvj=0&vjfrom=vjs&pos=bottom&astse=9dcb0156b5c28bea&assa=7681,https://nl.indeed.com/vacature-bekijken?jk=a1c0a7ed3449317d&fccid=28ee277926be0542&vjs=3,9 dagen geleden,9 dagen geleden,2021-01-24,en,Neutral
53,publieke administratie,Indeed,p_5ecf9163bf52f4d0,Salesmanager Tempo-Team Payrolling,TempoTeam, Diemen,"Van markttrends en klantbehoeften tot brancheontwikkelingen: jouw honger naar informatie is niet te stillen. Logisch, want al die kennis stelt jou als salesmanager in staat om een hoogwaardig partnership op te bouwen met toonaangevende bedrijven. Je signaleert trends en speelt daar tijdig en tactisch op in met de juiste payroll-oplossingen. Aan de hand van een salesplan genereer je interessante nieuwe klanten en opdrachten. Met als doel: de contractwaarde omzetten naar feitelijke omzet voor Tempo-Team Payrolling. Ben jij er klaar voor?

Zo ziet jouw functie eruit
Jij krijgt een verantwoordelijke baan met veel sales uitdaging. Aan de hand van een regionaal salesplan breng je jouw markt in kaart en ga je zelfstandig aan de slag. Je weet als geen ander wat er speelt op het gebied van flexibele arbeid en payrolling. Je steekt veel energie in het vinden van nieuwe prospects. Doordat je ontwikkelingen op de voet volgt, kennis deelt en proactief inspeelt op klantvragen en situaties, ben je een gelijkwaardige gesprekspartner en adviseur voor bestaande en potentiële klanten. Naast deze sales verantwoordelijkheid, krijg je ook een aantal actieve klanten in je portefeuille.

Als sales manager van Tempo-Team Payrolling heb je:
de vrijheid om zelf prioriteiten te stellen, beslissingen te nemen en op jouw manier nieuwe klanten en opdrachten binnen te halen.
de verantwoordelijkheid voor een goede relatie met grote prospects in jouw regio en het binnenhalen van nieuwe omzet.
de drive om – als specialist in flexibele arbeid – continu op de hoogte te zijn van belangrijke marktontwikkelingen binnen payrolling, veranderingen in wet- en regelgeving, en de behoeften van prospects.
de taak om de payroll-oplossingen bij bestaande klanten uit te bouwen.
de kans om oplossingsgericht met de klant mee te denken over de meest uiteenlopende vraagstukken op het gebied van personeelsinzet en flexibilisering van arbeid.
de regie bij de implementatie van payroll-oplossingen bij klanten en de verantwoordelijkheid voor een goede informatieoverdracht richting Salessupport.
een afwisselende doelgroep omdat de prospects zich zowel in de private als de publieke markt bevinden.
de verantwoordelijkheid bij publieke aanbestedingen om zowel pre-tender trajecten op te starten, het proces te begeleiden, de juiste vragen te stellen en het schrijven van de offerteteksten.
Roy de Vos, salesmanager Tempo-Team Payrolling
'Bedrijven kiezen steeds vaker voor het uitbesteden van de werkgeversrisico's en de administratieve rompslomp. Mijn baan – toch al de mooiste binnen Tempo-Team! – is daardoor nog leuker geworden. Ik kom bij allerlei bedrijven over de vloer en heb echt een adviserende rol. Daarbij vind ik het belangrijk om gesprekken breed in te steken en de klant de best passende oplossing te bieden. Vaak is dat payrolling, maar dat hoeft niet per se. Zo werkt dat bij Tempo-Team; we proberen elkaar allemaal te helpen. Bovendien is er een schat aan kennis aanwezig, die ook nog eens goed ontsloten wordt. Is er bijvoorbeeld een wetswijziging? Dan staat er gelijk een e-learningmodule klaar over dat onderwerp. Zo ben je altijd up-to-date.’

Meer lezen van onze collega’s? Lees dan snel de blogs op onze website.

Dit heb je in huis
Minimaal een afgeronde hbo-opleiding.
Twee tot vijf jaar commerciële werkervaring in een soortgelijke functie en een bewezen trackrecord op het gebied van sales.
Pré: Affiniteit met payrolling ervaring met het implementeren van payrolling-trajecten.
Goede netwerkkwaliteiten: je zoekt de verbinding met prospects en collega’s en legt makkelijk contact.
Een ondernemende houding: je bent resultaatgericht en initiatiefrijk, gaat recht op je doel af en neemt verantwoordelijkheid.
En je beschikt over een gezonde (over)dosis overtuigingskracht, doorzettingsvermogen, uitstekende communicatieve vaardigheden en goede presentatietechnieken.
Waarom Tempo-Team Payrolling?
Deel uitmaken van het sterkste team. Wie wil dat nou niet? Tempo-Team is een topspeler in de markt, met prachtige klanten en een geweldig team. Dat laatste is onze onderscheidende kracht. Wij geloven in persoonlijke ontwikkeling, eigen initiatief en ruimte voor talent. En in een sterke teamgeest. Met z’n allen de schouders eronder; samen werken aan succes. Het resultaat? Een goede teamspirit en prestaties waar we met z’n allen trots op zijn. Als salesmanager Payrolling werk je in een team van enthousiaste en ondernemende professionals waar een informele sfeer heerst en collegialiteit voorop staat. Binnen Tempo-Team Payrolling heb jij de verantwoordelijkheid voor je eigen gebied. Natuurlijk zoek je in dit gebied de samenwerking op met collega’s van andere Tempo-Team-labels, want samen bereik je meer dan alleen. Je staat bovendien in nauw contact met je collega-salesmanagers van Tempo-Team Payrolling. Eens per maand komen jullie bij elkaar voor een themadag.
Arbeidsvoorwaarden
Mensen bij Tempo-Team presteren zo goed omdat ze zich gewaardeerd voelen. Omdat de werksfeer zo prettig is en collega’s net dat stapje extra voor elkaar zetten. En omdat er volop mogelijkheden zijn voor persoonlijke groei. En dat alles natuurlijk in combinatie met een marktconform salaris, goede secundaire arbeidsvoorwaarden en een fijne balans tussen werk en privé. Kort samengevat:
Een goede werksfeer in een ondernemend team!
Veel opleidingsmogelijkheden en ontwikkelkansen.
een bruto maandsalaris tussen € 3500 en € 4250 (afhankelijk van je werkervaring) en een auto
25 vakantiedagen en 8,5% vakantietoeslag
choose your own phone regeling (met werkgeversbijdrage van €225)
een ruim maandelijks benefit budget waarmee je zelf kunt kiezen tussen vrije tijd of geld of voor inzet van je budget voor oa een fiets, tablet, sportabonnement of opleiding
een interessante bonusregeling met daarnaast mogelijkheid om 2x per jaar een outperformance bonus te behalen
Ben jij onze nieuwe collega?
Zie jij jezelf al aan het werk als sales manager bij Tempo-Team? Dan maken we graag kennis met jou! Je kunt direct solliciteren. Wil je eerst antwoord op je vragen? Bel dan Ernestine Pareau Dumont, Senior Corporate Recruiter via 06 11341863 of e-mail ernestine.pareau.dumont@randstadgroep.nl. Altijd op de hoogte blijven? Volg onze activiteiten op onze Facebookpagina.",-1.0,-1,https://indeed.nl/rc/clk?jk=5ecf9163bf52f4d0&from=vj&mvj=0&vjfrom=vjs&pos=bottom&astse=a39cd2bb1c11b499&assa=771,https://nl.indeed.com/vacature-bekijken?jk=5ecf9163bf52f4d0&fccid=43cb1310be8d8577&vjs=3,9 dagen geleden,9 dagen geleden,2021-01-24,en,Neutral
54,publieke administratie,Indeed,p_4234e79b488a6502,Assistent Accountant Samenstelpraktijk,VDB Consultancy, Amsterdam,"Je hebt de eerste stappen in jouw carrière al gemaakt maar mist de uitdaging. Van win-win situaties, word jij blij. Bijvoorbeeld: door lokale MKB ondernemers uit de regio te helpen met hun administratie en strategie, en tegelijkertijd verder studeren. Dat kan in de samenstelpraktijk van onze klant

Als ervaren Assistent Accountant in de samenstelpraktijk ga je mee naar klanten.

Van het kleine MKB tot bedrijven tegen de controlegrens, en van familiebedrijven tot publieke instellingen. Zo kom je in aanraking met veel verschillende branches, zoals bijvoorbeeld horeca, advocatuur, bouw, IT en gezondheidszorg. Iets wat je wellicht mist in je huidige baan.

Je stelt voor klanten jaarrekeningen, tussentijdse cijfers en begrotingen op. Je doet dat met behulp van innovatieve software en de ondersteuning van data-specialisten, IT-collega’s, belastingadviseurs, HR-experts en juristen. Uiteindelijk gaat het om veel meer dan alleen administratie. Je gaat samen met het team op zoek naar het verhaal achter de cijfers, en leert hoe je bedrijven strategisch kunt adviseren. Zo kun jij je blijven ontwikkelen én meteen iets betekenen voor klanten.

Je kunt erop vertrouwen dat je iedere dag wordt uitgedaagd. Maar ook dat je er nooit alleen voor staat. Met de klant, met je directe collega’s, de andere kantoren in Nederland en met het internationale netwerk van experts. Vanzelfsprekend ga jij net als wij voor kwaliteit. Samen werken wij aan morgen.

Wat biedt men de Assistent Accountant Samenstelpraktijk
40-urige werkweek en 30 vrije dagen
Informele sfeer waar hard gewerkt wordt maar ook tijd is voor ontspanning
Ruimte en financiële ondersteuning voor je scriptie of vervolgopleiding
Hoogste kwaliteit en deskundigheid
Steeds weer nieuwe uitdagingen en doorgroeimogelijkheden
Functie eisen Assistent Accountant Samenstelpraktijk
HBO/WO Accountancy
4 tot 6 jaar relevante werkervaring
Studerende voor AA of de ambitie om je AA-titel te halen
Nauwkeurig en perfectionistisch
Leergierig, klantgericht en enthousiast",-1.0,-1,https://indeed.nl/rc/clk?jk=4234e79b488a6502&from=vj&mvj=0&vjfrom=vjs&pos=bottom&astse=ef4bab638aaa3181&assa=2344,https://nl.indeed.com/vacature-bekijken?jk=4234e79b488a6502&fccid=e46de83c13ad409e&vjs=3,9 dagen geleden,9 dagen geleden,2021-01-24,en,Neutral
