,Search Keyword,Platform,Job ID,Job Title,Company Name,Location,Job Description,Rating,Employment Type,Company URL,Job URL,Job Age,Job Age Number,Collection Date,Language,Gender
16,accommodation,Indeed,p_5327ec629aa0fd34,Junior Analyst (1 year contract),Sustainalytics  MyHire, Amsterdam,"ABOUT SUSTAINALYTICS
Sustainalytics has been a leading independent provider of Environmental, Social and Governance (ESG) research for the last 25 years. Our insights are used by clients to make better informed investment decisions, engage with companies in relation to their business activities and drive change.
Sustainalytics is a growing organization with 800 employees and 17 offices globally. We have a flexible and supportive working culture and empower our employees to progress and develop quickly in an entrepreneurial environment.
For more information, visit www.sustainalytics.com (https://www.sustainalytics.com/)
Under COVID-19 circumstances, all Sustainalytics employees are now working from home. More than ever, ESG factors are critical to building a more ethical and sustainable global economy. Our teams need passionate colleagues to join us in delivering quality research products to our clients worldwide.
Our recruitment and selection process is continuing via phone or video meetings. New team members are onboarded and start their first day with the company from the safety of their homes.
We rely on virtual team meetings and management practices, as well as a remote buddy program, to support a smooth integration in our virtual offices.

ABOUT THE ENGAGEMENT SERVICES TEAM
Sustainalytics and its predecessors have close to 30 years' experience in engagement services and aims to become the leading provider globally. Working collaboratively with our asset owner and asset manager clients, we aim to foster a constructive dialogue with portfolio companies. All our engagements are informed by our extensive company-level research. On behalf of investors, we facilitate all avenues of engagement, including direct constructive dialogue with companies, assisting with shareholder resolutions and proxy-voting decisions.
Our Engagement Managers are able to leverage Sustainalytics' in-depth and diverse ESG research, which is supported by over 200 research analysts and the largest dedicated ESG client servicing team in the industry.

POSITION PURPOSE
Sustainalytics is expanding its Engagement Services (https://stewardship.sustainalytics.com/) team. We are offering an exciting opportunity for an entry-level candidate to play a critical support role to the team. The role blends administrative support, client support, report coordination and data analysis. You will join a strategically important team and contribute to the development of a vibrant community of engagement specialists.

KEY RESPONSIBILITIES
Provide support to Product Managers in administrative tasks such as planning, coordination and reporting
Support Engagement Managers with various requests, such as maintaining information in the database, consistency checks, compiling information for reports, or issuer contacts
Support the analysis and monitoring of key quality metrics against KPIs
Support with the development and management of documentation such as manuals, templates, product materials and tracking files
Coordinate timely responses to client inquiries
Play a role in process improvements and tools development
Support in project coordination and execution.

QUALIFICATIONS
Required:
Bachelors or Masters degree
1-2 years relevant work experience
Knowledge of and interest in responsible investing and engagement
Strong technical skills, including some proficiency in MS Excel and PowerPoint
Meticulous, detail oriented
Able to consistently meet deadlines while working on a variety of tasks
Proactive and service-minded
Comfortable working in a dynamic and fast-paced environment
Alignment with the company's mission, vision and values (https://www.sustainalytics.com/about-us/)

The following qualifications are considered assets:
Degree in English, or previous experience in editing/proofreading
Certificate in project management, or previous experience in managing projects
Graphic design and layout skills
Microsoft Power BI

APPLICATION & INTERVIEW PROCESS
In keeping with our ongoing efforts to represent the diversity of our community, we strongly encourage people from diverse groups to apply. Sustainalytics is committed to providing accommodations for individuals with disabilities, upon request.
Sustainalytics thanks all applicants for their interest, however only those applicants requested to participate in the interview process will be contacted.
Your privacy while being in contact with Sustainalytics is one of our fundamental commitments here. Review our Privacy Policy (https://www.sustainalytics.com/privacy-and-cookie-policy/) to find out more about how we handle the personal data you provide us during the recruitment process.",-1.0,-1,https://indeed.nljavascript:void(0);,https://nl.indeed.com/vacature-bekijken?jk=5327ec629aa0fd34&fccid=f3ffd4c1e0769cfd&vjs=3,Meer dan 30 dagen geleden,Meer dan 30 dagen geleden,2021-01-23,en,Female
17,accommodation,Indeed,p_0d3d2e7958cc6fff,Early in Career - Associate Contracts Negotiator,University Program, AmsterdamDuivendrecht,"Company Description

At Palo Alto Networks® everything starts and ends with our mission!
Being the cybersecurity partner of choice, protecting our digital way of life!
We have the vision of a world where each day is safer and more secure than the one before. These aren’t easy goals to accomplish – but we’re not here for easy. We’re here for better. We are a company built on the foundation of challenging and disrupting the way things are done, and we’re looking for innovators who are as committed to shaping the future of cybersecurity as we are.

Job Description

Your Career
Palo Alto Networks is looking for a motivated recent graduate to join our EMEA Legal Department in the Transactions, Technology and Privacy team in Amsterdam and be part of the LEAP program.
We are looking for someone who would like to apply their legal skills to learn how to negotiate contracts, protect our company from legal risks and solve other legal problems as they may arise. To be successful in this job it will help tremendously to be self-motivated, resilient, eager to learn on the job and, of course, have a sense of humour about it all.
LEAP EMEA Grad Program
You’re graduating—congratulations! But now you face a new challenge: building a career. In school, your curriculum helped guide you, but your professional life is an open world of possibilities. It can be both exciting and intimidating and we are here to help you find your own path to success.
We have built our company on a foundation of challenging the way things are done, and we’re looking for incredible talent to help us continue this trajectory. In return, your career will have a tangible impact – one that’s working toward technology that affects every level of society. Join us to help build a more secure future for the world.
What is LEAP?
The LEAP program is made up of early-in-career professionals launching into a variety of fields who want to be part of an industry committed to protecting our digital way of life.
LEAP is a two-year-long program designed to equip you with the knowledge and skills to excel in your career. The LEAP Program focuses on skills like communication, adaptability, and performance elevation to help enable you as you launch your career.
We also provide a global community for new grads to create connections with each other throughout the company and throughout the world
What you’ll learn
We’re a small team that works together closely. In this role as Associate Contract Negotiator you will report into the Sr Corporate Counsel for EMEA but work often with other team members, both in our region and around the world. You will also engage with team members from other departments in the company such as Sales, Finance, Workplace Resources and others. This will be a ‘learning by doing’ starter role where you will be supported and trusted to take the initiative to identify and solve problems by applying your analytical skills and legal knowhow. As our geographic footprint has grown, this role will have an EMEA scope. You will work across a wide range of legal matter, including:
Negotiating and concluding contracts;
The contract lifecycle and other legal operations systems;
Corporate compliance;
Data protection and privacy;
Technology partnership agreements and licensing
Together, we will make a plan for your short and long term development as a professional within our company.

Qualifications

Successful candidates will have
A Bachelor’s / Master’s degree in law, law and business administration or a related field.
Strong computer skills
Strong communication skills
A strong sense of responsibility, organization and self motivation
Willingness to adapt to the rapid business and organizational demands that result from a high-growth environment
Quick learner and an independent, proactive working style
Ability to translate ideas into actions
Working proficiency in verbal and written English and, preferably, German.
Willingness to occasionally travel (including to the US)
Note: This role is aimed for persons who recently completed their graduate/undergraduate degree
Additional Information

The Team
The TTP Team in EMEA currently consists of 4 people but is growing! We work together closely and build relationships on trust. We respect each other as diverse individuals and professionals. That respect and trust is the cornerstone of our success as a team.
Our Commitment
We’re trailblazers that dream big, take risks, and challenge cybersecurity’s status quo. It’s simple: we can’t accomplish our mission without diverse teams innovating, together.
We are committed to providing reasonable accommodations for all qualified individuals with a disability. If you require assistance or accommodation due to a disability or special need, please contact us at accommodations@paloaltonetworks.com.
Palo Alto Networks is an equal opportunity employer. We celebrate diversity in our workplace, and all qualified applicants will receive consideration for employment without regard to age, ancestry, color, family or medical care leave, gender identity or expression, genetic information, marital status, medical condition, national origin, physical or mental disability, political affiliation, protected veteran status, race, religion, sex (including pregnancy), sexual orientation, or other‘s legally protected characteristics.
AFTER YOU SUBMIT YOUR APPLICATION HERE IS WHAT HAPPENS NEXT:
Our recruiters review your application
If a suitable match we will follow up and arrange pre-screening
Flexible start date: February-April 2021
All your information will be kept confidential according to EEO guidelines.",-1.0,-1,https://indeed.nl/rc/clk?jk=0d3d2e7958cc6fff&from=vj&mvj=0&vjfrom=vjs&pos=bottom&astse=a1f5389f1d8bcef1&assa=4060,https://nl.indeed.com/vacature-bekijken?jk=0d3d2e7958cc6fff&fccid=0daf89856edaacc5&vjs=3,Meer dan 30 dagen geleden,Meer dan 30 dagen geleden,2021-01-23,en,Female
18,accommodation,Indeed,p_fc6f5ac7cf4e318e,Digital Campaign Consultant,Mighty Earth, Amsterdam,"Location: Netherlands, preferably Amsterdam
Hours: 10-15 hours per week (possibility to increase)
Term: 6 months (possibility to extend)

Summary

Mighty Earth, a leading global environmental advocacy organization, is seeking a Digital Campaign Consultant to support our Latin American Campaign. We are looking for a talented digital campaigner with experience in executing an array of digital campaign tactics including managing social media, delivering online petitions, and producing digital communications. Your work will centre on building and deploying a powerful movement that can convince leading private sector actors like supermarkets, fast food chains, and agribusiness giants to eliminate deforestation and move to sustainable practices across their supply chains.

This position will play a critical role in supporting the bourgeoning digital campaigns of Mighty Earth, working directly with our EU Digital Manager and Netherlands Director. Under the direct management of the EU Director, and in daily coordination with the Europe Digital Manager, this Digital Campaigner will support the implementation of all digital campaign activities in the Netherlands, including petitions, advertising, social media, and online communications.

This position will support long term digital goals of our campaign work including winning corporate and policy campaigns, expanding our membership, and broadening public awareness of forest issues. To achieve this, the Digital Campaigner will support staff in the Netherlands – as well as across the Europe to implement digital campaign plans to help Mighty Earth achieve our aims to tackle climate-damaging deforestation.

Responsibilities:

Manage posts for Mighty Earth through Facebook, Twitter, and Instagram in the Netherlands

Implement all advertising including the approval of ads, resolving blocked ads, running tests, and monitoring performance
Translate content as needed into Dutch
With support from the EU Digital Manager, draft content for ads, petitions, emails, and social
Create a social media posting schedule and social media toolkits
Help design and produce graphical content from social media shares to infographics.
Track and analyse digital metrics to identify key lessons from campaigns and projects — and use those metrics to share learnings and recommendations with digital and non-digital campaigners alike to help strengthen future work.

Required Qualifications

2-3 years of experience as a digital campaigner and/or social media management or in content creation roles.
Demonstrated experience in working on teams across different backgrounds, ideally, including race, class, age, sexual orientation, gender identity, language fluency, nationality
Experience using tools similar to — Action Network, WordPress, Canva, social media platforms and digital advertising and the ability to adapt to use new tools as needed.
Familiar with social media advertising techniques, especially Facebook and LinkedIn, including A/B testing.
Experience with running advocacy email programmes large lists, list growth, and list health
Excellent verbal and written communications skills, with high level English language skills C1+
A good understanding of how to write for digital audiences, and an ability to write inspiring and engaging digital copy to inspire our supporters to take action.
Fluency in Dutch

Preferred skills

Design skills such as creating graphical content for social media, web design, infographics and using tools such as Canva, Photoshop or other design software.
Experience working on environmental or supermarket campaigns
Experience in working with media (e.g., with writing press releases and doing interviews)

More about our team: Mighty Earth is made up of people from various backgrounds including people with a background in non-profit organizations, election campaigns, government, the private sector, and legislative offices, at a range of experience levels. We pride ourselves on being a welcoming place for people of color, members of the LGBTQ community, parents, empty-nesters, and more.

Details: This is a part-time consultancy and candidates can be based anywhere in the Netherlands. You will report to the EU Digital Director and Netherlands Director, and work on a daily basis with the EU Digital Director, as well as other team members around the world.

Application Deadline: Please submit your application as soon as possible. Please click on the apply button below and include a brief, thoughtful cover letter which speaks to our mission and demonstrates your writing abilities and let us know where you heard about the job. The position will remain posted until it is filled.

Compensation: This is a part-time role hired on a consultancy basis. Mighty Earth’s compensation ranges are €30-45 per hour depending on location and experience for 10-16 hours of work. We can discuss your desired hourly rate during the interview process.

If you require reasonable accommodation in completing this application, interviewing, completing any pre-employment testing, or otherwise participating in the employee selection process, please contact Aliya at aliya@waxmanstrategies.com.

Mighty Earth is an equal opportunity employer; we strictly prohibit discrimination against any employee or applicant on the basis of race, creed, colour, sex, religion, national origin, age, sexual orientation, disability, gender identity or expression and any other characteristic protected by law. Women, people of colour, and members of the LGBTQ community are strongly encouraged to apply.",-1.0,-1,https://indeed.nl/rc/clk?jk=fc6f5ac7cf4e318e&from=vj&mvj=0&vjfrom=vjs&pos=bottom&astse=9c79aee7ea0f21b9&assa=9875,https://nl.indeed.com/vacature-bekijken?jk=fc6f5ac7cf4e318e&fccid=a754a9cd157d7600&vjs=3,Meer dan 30 dagen geleden,Meer dan 30 dagen geleden,2021-01-23,en,Female
19,accommodation,Indeed,p_5c865e4b6974fcb8,Associate,Wilshire Associates Incorporated, Amsterdam,"As part of the Wilshire family you can rest assured that every day you are contributing to an organization that is helping millions of people around the world make better investment decisions for a more secure future. We are known for creating a global brand with market defining products such as the Wilshire 5000 Total Market Index. Our solutions-based approach supported by a strong commitment to research remains the cornerstone of what keeps us at the leading edge of modern quantitative finance. For nearly 50 years, our clients have trusted Wilshire to transform complex theory into practical investment applications.


What you’ll do:

Wilshire is seeking an investment professional to act as a contributing member of the investment team, with responsibilities throughout the investment process. You will act as a key member of deal teams with responsibilities for sourcing potential investment opportunities, conducting due diligence and drafting investment memorandums for fund investments, co-investments and secondaries. The individual will also help monitor ongoing existing investments and with the completion of special project assignments.


What you have:

3-4 years of relevant investment experience within the private markets
Outstanding written and oral communication skills
Excellent analytical skills (both quantitative and qualitative)
High Proficiency in Microsoft Office (particularly Excel)
Ability to work independently and efficiently under time pressure in a fast-paced environment with a special attention to detail
in finance, economics, engineering or business-related studies preferred


Personal Qualities:

A self-starter who is hard working and results oriented
Strong verbal and written English communication skills
A passion for excellence
An entrepreneurial bent and a “roll-up-the-sleeves” orientation
Excellent analytical skills (both quantitative and qualitative)
Must be comfortable with Microsoft Office (particularly Excel)
Easygoing and team-oriented individual who can work well with different personality types and with colleagues across functions and global geographies
A high degree of integrity and professionalism


What you get:

An international, dynamic, entrepreneurial work environment
Competitive compensation package, including bonus


Visit www.wilshire.com for additional company information.


We are an equal opportunity employer, which means we afford equal employment opportunity to all individuals regardless of race, creed, color, religion, sex (including gender and gender identity), national origin, ancestry, age, marital status, veteran status, citizenship status, disability, medical condition (as defined by California Government Code section 12926), or sexual orientation (defined as having a preference for heterosexuality, homosexuality or bisexuality, having a history of such a preference or being identified with such a preference). Our employees, as well as applicants and others with whom we do business, will not be subjected to sexual, racial, religious, ethnic, or any other form of unlawful harassment. In addition, Wilshire Associates adheres to the equal employment opportunity requirements of all states and localities in which it does business. We are completely committed to these principles not only because of the various laws which address these subjects, but because it is the right thing to do.


Wilshire Associates Incorporated is an SEC registered investment adviser and required to track certain political contributions under Rule 206(4)-5. As such, you may be required to disclose your prior political contributions.


No phone calls.


If you have a disability, and require reasonable accommodations in the application process, contact Human Resources at ApplicantAccessibility@wilshire.com or 310-584-6011.
Required Skills

Required Experience",-1.0,-1,https://indeed.nl/rc/clk?jk=5c865e4b6974fcb8&from=vj&mvj=0&vjfrom=vjs&pos=bottom&astse=ab66f64c71541ca8&assa=6419,https://nl.indeed.com/vacature-bekijken?jk=5c865e4b6974fcb8&fccid=99fedacf17b4ec65&vjs=3,Meer dan 30 dagen geleden,Meer dan 30 dagen geleden,2021-01-23,en,Female
