,Search Keyword,Platform,Job ID,Job Title,Company Name,Location,Job Description,Rating,Employment Type,Company URL,Job URL,Job Age,Job Age Number,Collection Date,Language,Gender
0,social worker,Indeed,p_b9cae1c65ee0ceb9,Hbo-verpleegkundige,Derec, Amsterdam,"Als gediplomeerd mbo- of hbo-verpleegkundige ben jij van groot belang voor de cliënten van de revalidatieafdeling van dit Amsterdamse huis. Jij zorgt ervoor dat zij met de juiste handvatten aan de slag kunnen, waarbij jij zelfredzaamheid weet te stimuleren. Veel cliënten zullen met jouw hulp uiteindelijk weer naar huis kunnen, je maakt hier dus echt het verschil! Starten kan direct en voor 28-32 uur.
Hier ga je aan de slag
Deze Amsterdamse zorgorganisatie biedt verschillende soorten zorg, zowel intra- als extramuraal. Er is veel structuur, begeleiding en ondersteuning waardoor de cliënten altijd weten waar zij aan toe zijn. Samen met jouw collega's kennen jullie de bewoners/cliënten door en door, waardoor zorg op maat geboden kan worden. Je bent hierdoor een groot onderdeel van het leven van alle cliënten. Zo maken jullie het verschil voor de bewoners, zeker in deze onzekere en bizarre tijd! Naast de verzorgers en verpleegkundigen, lopen er hier ook behandelaren zoals specialisten ouderengeneeskunde, fysiotherapeuten, ergotherapeuten, psychologen en ander maatschappelijke werkers rond.
Dit ga je doen
Als gediplomeerd mbo- of hbo-verpleegkundige ga je binnen deze Amsterdamse zorgorganisatie aan de slag op de afdeling revalidatie. Ervaring met het werken op deze afdeling is voor deze vacature een grote pre. Je weet de cliënten van deze afdeling het juiste duwtje in de rug te geven en zorgt ervoor dat zij met de nodige handvatten, écht stappen kunnen maken. Binnen deze rol ben je goed in staat om zelfstandig verpleegkundige handelingen uit te voeren en sta je klaar voor vragen van cliënt, familie of behandelaars. Jij maakt als gediplomeerd verpleegkundige binnen deze afdeling echt het verschil! Je kan hier voor 28-32 uur in loondienst aan de slag!
Wat we van jou verwachten
Je bent een gediplomeerd mbo- of hbo-verpleegkundige;
je bent voor 28-32 uur beschikbaar;
je wilt aan de slag in loondienst;
je bent voor alle diensten beschikbaar;
ervaring met het werken op een revalidatieafdeling is een grote pre.
Dit bieden wij
Ons werk draait om jou. Daarom houden we het persoonlijk en zorgen we goed voor je. We vinden altijd een balans tussen jouw wensen en die van je nieuwe werkgever.

Is je interesse gewekt? We doen je graag een goed aanbod.

Wij bieden jou:

Uitstekende arbeidsvoorwaarden;
Opleidingsmogelijkheden;
Persoonlijk contact;
Flexibiliteit of vastigheid, afhankelijk van jouw eigen wensen.",-1,-1,https://indeed.nl/rc/clk?jk=b9cae1c65ee0ceb9&from=vj&mvj=0&vjfrom=vjs&pos=bottom&astse=07286f79f5d20e98&assa=447,https://nl.indeed.com/vacature-bekijken?jk=b9cae1c65ee0ceb9&fccid=9cf65a9e1f528f3f&vjs=3,20 dagen geleden,20 dagen geleden,23/02/2021,en,Female
1,social worker,Indeed,pj_dfec68ec5191d960,Klinisch fysicus audioloog,Koninklijke Kentalis, Nederland,"Klinisch fysicus audioloog
Locatie
Landelijk
16-36 uur
Ben jij een net afgestudeerd Klinisch Fisicus Audioloog of heb je meerder jaren werkervaring en ben je toe aan een nieuwe uitdaging? Lees dan verder?
Wat maakt jouw werk bijzonder?
Jij bent eindverantwoordelijk voor de kwaliteit van de audiologische zorgverlening en voert complexe audiologische diagnostiek uit. Je informeert en adviseert de cliënt over vervolg begeleiding, behandeling of onderzoek. Je stuurt de inhoudsdeskundige collega’s functioneel aan en draagt zorg voor de ontwikkeling van de audiologische zorgverlening.
Wat ga jij doen?
Je vervult de rol van hoofdbehandelaar en verricht o.a. de volgende werkzaamheden;
Je stelt de audiologische diagnose op, informeert en adviseert de cliënt over begeleiding, behandeling of onderzoek;
Je draagt zorg voor de ontwikkeling en kwaliteit van de audiologische zorg.
Je bepaalt en implementeert mede het strategisch en medisch fysische beleid van het AC;
Je bent eindverantwoordelijk voor het juiste gebruik van medische apparatuur en het op juiste wijze toepassen van protocollen;
Je bent in gezamenlijkheid met de locatiemanager verantwoordelijk voor de bedrijfsvoering en continuïteit van zorg van de locatie;
Je onderhoudt actief je externe netwerk en doet aan relatiebeheer;
Je valt hiërarchisch onder de sectormanager die je adviseert ten aanzien van de kwaliteit van de audiologische zorg.
Werken bij het Audiologisch Centrum
Het Audiologisch Centrum (AC) onderzoekt, begeleidt en adviseert kinderen en volwassenen met spraak-/taalproblemen en/of gehoorproblemen. Onze medewerkers hebben veel kennis van en ervaring met diagnostiek en revalidatie bij gehoor-, taal- en spraak problemen. Wij onderzoeken niet alleen gehoor, taal en spraak, maar kijken ook naar samenhang van de onderzoeken en de eventuele gevolgen die het kan hebben op ontwikkeling en welbevinden. Hierbij werken we in een multidisciplinair team met logopedisten, linguïsten, gedragskundigen, social worker, audiologieassistenten en hbo-, universitair en klinisch fysicus audiologen.
De diverse locaties van het Audiologisch Centrum zijn over het land verspreid. Er wordt op landelijk niveau samengewerkt aan harmonisering en optimalisering van de dienstverlening van het AC en het verder vorm geven van de sector.
De klinisch fysicus audiologen (KFA) werken o.a. met elkaar samen in de vakgroep die begin 2019 is opgericht. Ze werken vanuit een professioneel statuut waarin afspraken zijn vastgelegd ten aanzien van de eindverantwoordelijkheid van zorg. De voorzitter van de vakgroep KFA vormt samen met de sectormanager de directie van het AC. Het team bestaat op dit moment landelijk uit 12 KFA’s.
De KFA werkt nauw samen met zijn collega KFA’s in de regio en met de locatiemanager van de locatie(s) waar hij voor werkt.
Kentalis in het kort
Als landelijke expertiseorganisatie is Kentalis er voor mensen die een taalontwikkelingsstoornis of communicatief meervoudige beperking hebben of die slechthorend, doof of doofblind zijn. Daarnaast kunnen zij andere beperkingen hebben. Zij kunnen bij ons terecht voor onderzoek, diagnostiek, onderwijs en zorg. Kentalis heeft scholen, zorglocaties en audiologische centra door heel Nederland.
Wij bieden jou:
Een bruto maandsalaris van € 4387,- tot € 6613,- (FWG 70) bij een volledige werkweek van 36 uur. Alle arbeidsvoorwaarden zijn conform Cao Gehandicaptenzorg;
Een 1e instantie een jaarcontract, met de intentie het contract om te zetten naar onbepaalde tijd;
Een mooie uitdaging binnen een organisatie met een maatschappelijk belang;
5,5 week verlof bij een 36-urige werkweek;
Extra’s zoals 8,33% eindejaarsuitkering, pensioenopbouw bij PFZW, reiskostenvergoeding en onregelmatigheidstoeslag;
Laptop, mobiele telefoon en mogelijkheden tot thuiswerken;
Opleidingsmogelijkheden;
Een arbeidsvoorwaardenpakket dat je zelf kunt samenstellen. Kies jij voor een sportabonnement, een fiets of vakliteratuur?
Wie ben jij?
Je bent in het bezit van een afgeronde opleiding tot klinisch fysicus audioloog of werkend in het laatste jaar van de opleiding.
Je kunt goed communiceren met cliënten en collega’s;
Je beschikt over teamgeest en improvisatievermogen;
In je functionele aansturing weet je op de juiste wijze je overtuigingskracht te combineren met je organisatiesensitiviteit;
Je bent zelfstandig, flexibel en stressbestendig.
Interesse?
Ben je enthousiast over de functie en wil je meer weten? Neem dan contact op met je mogelijk toekomstige collega’s: Erwin Baas, klinisch fysicus audioloog via mail: E.Baas@kentalis,nl of nummer 06-83286344 of Harry Simkens, vakgroep voorzitter KFA’s via mail: H.Simkens@kentalis.nl of nummer 06-125691871. Uiteraard kun je ook terecht bij de sectormanager AC, Sybren Verschoor via mail:S.Verschoor@kentalis.nl of nummer 06-10641665. Wij zijn doorlopend op zoek naar nieuw talent.
Ben je doof of slechthorend of heb je een taalontwikkelingsstoornis? Pascalle Hessels, recruiter doelgroepen, ondersteunt je graag bij je sollicitatie. Solliciteer via de website en mail je brief en cv ook naar p.hessels@kentalis.nl
We vragen altijd om referenties en een Verklaring omtrent het gedrag (VOG). Dit is een vast onderdeel van de procedure.
Ben je een intermediair? Wij werven zelf of met onze vaste partners. Acquisitie is niet gewenst.
.
.",-1,-1,https://indeed.nl/rc/clk?jk=dfec68ec5191d960&from=vj&sjdu=ThZKDtdDn4Xl6z9MWzaPNwr3cySsBnKK64uZ-1-FhGALa4a2TNJ1WRChTyQV7kFTw0JfhRYXuqraC-D0juJ-uLgsP4xvMT6NHbk_qT-JATobtgW8hFJuuM4TQxY7PrAKUYumbW-ExBQcFI9WsnYFDTQ2b9Il319ZICwwVIqdchs&spon=1&adid=255591758&mvj=0&vjfrom=vjs&pos=bottom&ad=-6NYlbfkN0Cz9BZxI4mr-o0aF80wLb2n3n3ISX1-yua27PVzf9Ckrs4MXQMZojMyJP1Y248tZwjD6t7lrNHYSmNKSLqT2sghyMHC9x1eHLqb3B0kIK802Gq4aCx34vuNosCf88Sgmqa_o21X1vdg5VGge8P4J3RgHwlKlfg6mnBjO6PJs-MoPCeLzYO2PfLMa1WxNKfrMz-eql49cafQyqPkg5YkKkT-jz0dBT3Hb2fbcjmpgGJI4Lf0fCM__JqmYN8kzwlBcI7Vzhb4zujOTre5S1W169jSyflfXneqXk9r8zsjfMU3T3JVlrhXj8dqDaBsSW7BkJgD8oyA5Jj22MDhdxBTDiWzxlZ16ixv5J8lQv0_SBAbk7rIIdTegc6quife5WgBagkLL8VbmHz5pbBxtaqcyBBWUD8mA8TTMTOlrQuJWzdUJLa-Xd4S9i3f9gweu-BiDXtBWPdvuP9nYGOPkJKJd7UR0P2nBAfGsypEla0HYmTHa3iIMEi_ep16HSgB_U0WYfUwej6gG_jQxnVC5SkMMmFb30z-NddBzKvzhVW1_Q4zhUnIIi6CO7rqbWRyXDdtAdoOGLlKTLkYYpbEmoZHFuIsWHgFoWAI6RmdG7OY35ZjeUz_MxQetalh_EIlagTjOJjhq1e8bukPbeYNuU4n5-3Sbt8dVjLR0_4=&astse=d074aa33a3df85d9&assa=4693,https://nl.indeed.com/vacature-bekijken/pagead/clk?mo=r&ad=-6NYlbfkN0Cz9BZxI4mr-o0aF80wLb2n3n3ISX1-yua27PVzf9Ckrs4MXQMZojMyJP1Y248tZwjD6t7lrNHYSmNKSLqT2sghyMHC9x1eHLqb3B0kIK802Gq4aCx34vuNosCf88Sgmqa_o21X1vdg5VGge8P4J3RgHwlKlfg6mnBjO6PJs-MoPCeLzYO2PfLMa1WxNKfrMz-eql49cafQyqPkg5YkKkT-jz0dBT3Hb2fbcjmpgGJI4Lf0fCM__JqmYN8kzwlBcI7Vzhb4zujOTre5S1W169jSyflfXneqXk9r8zsjfMU3T3JVlrhXj8dqDaBsSW7BkJgD8oyA5Jj22MDhdxBTDiWzxlZ16ixv5J8lQv0_SBAbk7rIIdTegc6quife5WgBagkLL8VbmHz5pbBxtaqcyBBWUD8mA8TTMTOlrQuJWzdUJLa-Xd4S9i3f9gweu-BiDXtBWPdvuP9nYGOPkJKJd7UR0P2nBAfGsypEla0HYmTHa3iIMEi_ep16HSgB_U0WYfUwej6gG_jQxnVC5SkMMmFb30z-NddBzKvzhVW1_Q4zhUnIIi6CO7rqbWRyXDdtAdoOGLlKTLkYYpbEmoZHFuIsWHgFoWAI6RmdG7OY35ZjeUz_MxQetalh_EIlagTjOJjhq1e8bukPbeYNuU4n5-3Sbt8dVjLR0_4=&p=1&fvj=0&vjs=3,20 dagen geleden,20 dagen geleden,23/02/2021,en,Female
2,social worker,Indeed,p_f2b8b2ae46522817,GZ-psycholoog forensische doelgroep (ZZP),Spijtenburg, Amsterdam Oost,"Wat ga je doen?

Ben jij als zzp GZ-psycholoog zorgvuldig en detailgericht maar kun je de grote lijn blijven zien binnen een (lang) behandeltraject? Heb je daarnaast goede communicatieve vaardigheden en ben je overtuigend en besluitvaardig? Dan is deze vacature echt iets voor jou!
Als GZ-psycholoog ga je zorg bieden aan mensen met een psychotische kwetsbaarheid, bij wie een ontregeling heeft geleid tot grensoverschrijdend gedrag met een strafrechtelijke veroordeling tot gevolg. Je gaat aan de slag als hoofdbehandelaar / regiebehandelaar voor tbs-gestelden en je maakt onderdeel uit van het behandel- en diagnostiekteam van de vakgroep psychologen.
Daarnaast:
Ben je verantwoordelijk voor het behandeltraject van 10 cliënten (één afdeling).
Coördineer je in-, door- en uitstroom van cliënten.
Geef je werkbegeleiding aan Master-Psychologen en deel je jouw expertise met het behandelteam.
Kun je eventueel ingezet worden t.b.v. psychologen-in-opleiding.
Maak je deel uit van het multidisciplinaire behandelteam bestaande uit verpleegkundigen, sociotherapeuten, psychologen, maatschappelijk werker, psychiater, en arts assistent.
Waar ga je werken?

Je gaat aan de slag als GZ-psycholoog bij een organisatie die behandeling, begeleiding en reclasseringsprogramma’s voor volwassenen met complexe meervoudige problemen op psychiatrisch en forensisch gebied biedt.
De organisatie is gespecialiseerd in de behandeling van forensische cliënten met een psychotische stoornis. Daarnaast hebben de cliënten vaak een verslaving, persoonlijkheidsstoornis, traumatische ervaringen, autisme of een licht verstandelijke beperking. De cliënten verschillen op gebied van psychiatrische problematiek, de ernst van het delict, de culturele achtergrond en het juridisch opnamekader. Er worden cliënten uit het hele land opgenomen.
De werkwijze en huisvesting zijn afgestemd op een veilige behandeling en begeleiding van de cliënten. Het is een gesloten kliniek die de cliënten niet zonder toestemming kunnen verlaten.

Wie ben jij als GZ-psycholoog?

Je bent zorgvuldig en detailgericht maar kunt de grote lijn blijven zien binnen een (lang) behandeltraject. Verder:
Ben je een BIG geregistreerd GZ- of Klinisch Psycholoog.
Heb je goede communicatieve vaardigheden en ben je overtuigend en besluitvaardig.
Beschik je over goede schriftelijke vaardigheden.
Het overleggen van een Verklaring Omtrent Gedrag maakt onderdeel van de procedure uit.

Wat krijg je?

Als zzp GZ-psycholoog krijg je een freelance contract voor 16-36 uur per week.

Hoe ziet de procedure eruit?

Heb jij interesse in deze GZ-psycholoog vacature? Voor meer informatie over deze functie kun je contact opnemen met Camilla Hakkens via 06 81234720 of c.hakkens@spijtenburg.nl.
Wie is Spijtenburg?
Spijtenburg is gespecialiseerd in het werven en selecteren van kandidaten voor tijdelijke en vaste functies binnen het publieke domein. We werken met verschillende arbeidsvormen, namelijk op basis van werving en selectie, interim/ZZP en detachering. Wil je meer weten? Bekijk dan onze over ons pagina!",-1,-1,https://indeed.nl/rc/clk?jk=f2b8b2ae46522817&from=vj&mvj=0&vjfrom=vjs&pos=bottom&astse=d943ef569718cece&assa=6067,https://nl.indeed.com/vacature-bekijken?jk=f2b8b2ae46522817&fccid=489a018b01ef6e88&vjs=3,20 dagen geleden,20 dagen geleden,23/02/2021,en,Female
3,social worker,Indeed,p_02836013c4ce8d99,Interim verpleegkundig specialist,BKV, Amsterdam,"Spreekt dit jou aan?
Goede en toegankelijke zorg leveren is jouw nieuwe uitdaging! Ga aan de slag met grootstedelijke problematiek en een breed scala aan psychische aandoening.
Jouw nieuwe baan
De zorg die deze ggz-instelling levert is veelal specialistisch. Denk aan trauma, psychose, verslaving en comorbiditeit. Je werkt met als doel cliënten weer voldoende voor zichtzelf te kunnen laten zorgen. Dit doe je zodat ze terug de maatschappij in kunnen.
Als verpleegkundig specialist denk je mee aan de visie van de afdeling. Je gaat aan de slag in een inspirerende en lerende werkomgeving. Je deelt kennis, versterkt elkaars kwaliteiten en blijft op de hoogte van relevante ontwikkelingen in elkaars vakgebied. Bovendien ben je omgeven door een wetenschappelijk netwerk dat tot de internationale top behoort.
Jouw nieuwe werkplek
Binnen dit onderdeel gaat het voornamelijk over cliënten met een ernstige psychiatrische aandoening. De kliniek waar jij werkzaam gaat zijn bestaat uit drie verschillende verblijfsafdelingen. Er wordt gewerkt volgens het ART model. Jouw team is groot en bestaat uit maar liefst 50 medewerkers. Van begeleiders en social worker tot aan psychiaters en huisartsen.
Wat breng je mee?
Om in aanmerking te komen voor deze vacature ben je BIG-geregistreerd verpleegkundig specialist met affiniteit met het begeleiden van verpleegkundig specialisten in opleiding en basisartsen. Je bent op de hoogte van de laatste ontwikkelingen op het gebied van WvGGZ zaken. Daarnaast ben je bereid diensten te draaien als achterwacht.
Arbeidsvoorwaarden
Voor deze interim opdracht geldt een marktconform uurtarief. Je werkt bij voorkeur minimaal 24 uur per week op zzp-basis.
Verdere informatie
Reageer via de website of stuur een mail naar Mike via mike@bkv.jobs. Je mag ook een bericht sturen via WhatsApp: +31 6 – 13 48 91 08. Is deze vacature niet helemaal wat je zoekt? Geef jouw baanwensen door via de job alert, dan ontvang je passende vacatures.",-1,-1,https://indeed.nl/rc/clk?jk=02836013c4ce8d99&from=vj&mvj=0&vjfrom=vjs&pos=bottom&astse=22a2b5d4163fe25c&assa=7766,https://nl.indeed.com/vacature-bekijken?jk=02836013c4ce8d99&fccid=9cf283ce88e44a34&vjs=3,20 dagen geleden,20 dagen geleden,23/02/2021,en,Female
4,social worker,Indeed,pj_6fd6d383ea3b44c8,Directeur - Stichting Algemeen Opvangcentrum Purmerend,K  V, Purmerend,"Organisatie | Stichting Algemeen Opvangcentrum Purmerend
Stichting Algemeen Opvangcentrum Purmerend biedt tijdelijk opvang en begeleiding aan mannen en vrouwen met of zonder kinderen die niet meer thuis (kunnen) wonen, hun onderkomen dreigen te verliezen en/of niet in staat zijn zich op eigen kracht in de maatschappij te handhaven. De hulpverlening is erop gericht deze mensen in staat te stellen (weer of meer) zelfstandig te functioneren.
AOP wil bijdragen aan een samenleving die hecht aan waarden als respect, gelijkwaardigheid en ontplooiing. Samen met andere instellingen zet zij zich dan ook in om machtsmisbruik te voorkomen en wil zij ervoor zorgen dat vrouwen, mannen en kinderen, ieder met hun eigen achtergrond, de ondersteuning krijgen die zij nodig hebben om een veilige toekomst op te bouwen. Het AOP wil kansarme mensen de best mogelijke hulp geven.
Het aantal dak- en thuislozen in de regio Waterland is de afgelopen jaren sterk gegroeid, en ook de persoonlijke problematiek is gecompliceerder geworden. Psychiatrie, verslaving, schulden of verstoorde relaties spelen daarin regelmatig een rol.
Vaste arrangementen zijn niet langer leidend. Centraal staat de dak- of thuisloze inwoner, die tijdelijk ondersteuning nodig heeft. Hierbij past een vorm van werken die flexibel is en zich verhoudt tot de context. Dit vraagt een open oog voor de eigen (on) mogelijkheden en die van andere ketenpartners in het werkgebied, waaronder de gemeente. Verbinden en gebruik maken van elkaars kwaliteiten zijn kernbegrippen.
Daarom werken er bij het AOP professionele medewerkers. Het zijn specialisten op hun vakgebied, social worker met een centrale plaats in de directe cliëntenzorg. Zij zijn verantwoordelijk voor de begeleiding van cliënten. AOP kent ongeveer 30 medewerkers, het MT bestaat uit een tweetal teamleiders, de controller en de Directeur.
Functie l Directeur
AOP is op zoek naar een Directeur die in staat is de missie en visie van de organisatie te vertalen naar de hectische en problematische situatie van haar cliënten. Je bent in staat met jouw team te werken aan directe en adequate oplossingen op het gebied van hulpverlening en woonruimte. Je geeft op inspirerende leiding aan je team en vertaalt waar mogelijk de hulpvragen in dagelijkse maar ook structurele oplossingen. Je weet, samen, met andere betrokken organisaties zoals de gemeente, ggz instellingen en schuldhulpverlening tot adequate oplossingen en vernieuwingen te komen. Je werkt daarbij aan een uitstekend netwerk van organisaties in de directe omgeving aan structurele voorzieningen. Zo sociaal mogelijk als het kan maar ook zakelijk en pragmatisch als het moet. Je legt in het verlengde van de opdracht verantwoording af aan de Raad van Toezicht van de stichting.
Profiel
We zijn op zoek naar een Directeur met ambitie en potentie, die in staat is om d.m.v. een duidelijke visie en strategie de organisatie verder te ontwikkelen. Je stimuleert en enthousiasmeert, maar geeft ook sturing en richting aan het team. Je bent een leider met het hart op de juiste plaats, maar hebt ook oog voor een efficiënte bedrijfsvoering en financiën. Met beperkte middelen weet je tot maximaal haalbare prestaties te komen. Daarnaast werk je aan een netwerk van organisaties die behulpzaam kunnen zijn bij het beantwoorden van de hulpvragen van cliënten. Affiniteit met het inzetten van moderne techniek en oplossingen is een pre. Voor de Raad van Toezicht ben je een waardevolle sparringpartner die op een open en transparante wijze communiceert. Je bent verder een stevige, toegankelijke bestuurder die kansen benut en risico’s tijdig herkent.
AOP vraagt
Affiniteit met zorg- en/of maatschappelijke organisaties
Academisch werk- en denkniveau, ervaring met het ontwikkelen en uitvoeren van strategie
Kennis van verander- en managementtechnieken, governance, organisatie- personeels-, financieel- en kwaliteitsbeleid
Innovatief en vaardig in het benutten van digitale (communicatie) techniek en oplossingen
Daarnaast beschik je over uitstekende communicatieve vaardigheden, een goede van politiek- bestuurlijke antenne is je van nature gegeven. Je denkt en handelt naar de mogelijkheden in plaats van belemmeringen, neemt veel initiatief en stuurt op interne en externe samenwerking.
Aanbod
Een zeer relevante en verantwoordelijke positie binnen de dienstverlening aan Waterlanders in zwaar weer. Je team bestaat uit oplossingsgerichte en gepassioneerde professionals. Een Raad van Toezicht die met raad en daad de Stichting en haar medewerkers ondersteunt.
Primaire- en secundaire arbeidsvoorwaarden zijn in overeenstemming met de verantwoordelijkheid van de positie, maar ook passend bij het maatschappelijk karakter.
Geïnteresseerd
Ben je geïnteresseerd in deze functie? We verzoeken je snel te reageren door bij “solliciteer direct” je cv en motivatie te uploaden. Je kunt je inhoudelijke vragen stellen aan Henk van der Velde (06-5175 8677) die deze opdracht begeleidt.
Kandidaten die worden uitgenodigd wordt gevraagd een online persoonlijk profielmeting te maken.",-1,-1,https://indeed.nl/rc/clk?jk=6fd6d383ea3b44c8&from=vj&sjdu=9_32ntKvbhPITdPhY-DRRLTISAdMhVjZucTNXeS003WuCYGQMIgx_seFSAyyhvZ2lcoBRhoL7PVxXI0NSc8v7mHxzNSvxKm2ecga705a8hRH9dQ-AYwvcl1wwXuwRHqsCouVhaai1Gebc384drPz-jOQQexCEgevC4dcW6qLT4ShEBVs4UlC01H0-VvNv2bTzskK_GXyEDSJY-8qbL7IqA&spon=1&adid=319802587&mvj=0&vjfrom=vjs&pos=bottom&ad=-6NYlbfkN0BUi5skEC2JacOuA5S-guKlBVqGkEVnSMmX3xEoRIYszl3Fq1VGX9VWnpCdlCKicBD6G2YhYTnm3-x03nLnOzeAf0pJrxda0V94U2G_RFQcm-PQiW4v2-QOIC2ONbeKpyBEeivVeBU8Q62CCXSfMYOy5EjRVvpj-HxxMUvu64CWQCuIZOZgZK7gKMYCa-XTyQwujbCyku-YKSI2lB2GL-1PPxCbfOzzsR96p9tn8IQB_JEN2h1hCNCHAUe00ITZ9QaAv9bsux28cvC5A-uAygsjqHQCzViiwtSRFUL2Ttm4OswszIFvQ7RciGTBA1hBYEQTumlUkdWXDJu7CvK7FWEnHLJk-DLS5DVsakLVtpLFS7BVp13bQ82NtV74kd9mKP24ZgLfLqR683qtkxKvRJlhTe8zStv4DyXII2e6qfj-nL_iE7xP0lqGBHeYGHrvYU4wE6eppGpTAmT7p9F70CIY-n7js7g-7iUGJxdKNpSdLBoSrYnhyWu8AaBTANE2FmwzrVKGA_Em9LnhrTCJmIO4QKep2IgPPT_8cntm1Vzu2IQ7FRDBLMFu-7XzhkHz7NaGTT4_aEy9eoSYS0QKh8I_6MTbgORNoH6YJusziQn56CsZkxmNBpZ4MwJMsnwSCqdNZ1OzlNQiy1c51Bm2vu8aRBFmMNhlTS8=&astse=b10918f238295a06&assa=9706,https://nl.indeed.com/vacature-bekijken/pagead/clk?mo=r&ad=-6NYlbfkN0BUi5skEC2JacOuA5S-guKlBVqGkEVnSMmX3xEoRIYszl3Fq1VGX9VWnpCdlCKicBD6G2YhYTnm3-x03nLnOzeAf0pJrxda0V94U2G_RFQcm-PQiW4v2-QOIC2ONbeKpyBEeivVeBU8Q62CCXSfMYOy5EjRVvpj-HxxMUvu64CWQCuIZOZgZK7gKMYCa-XTyQwujbCyku-YKSI2lB2GL-1PPxCbfOzzsR96p9tn8IQB_JEN2h1hCNCHAUe00ITZ9QaAv9bsux28cvC5A-uAygsjqHQCzViiwtSRFUL2Ttm4OswszIFvQ7RciGTBA1hBYEQTumlUkdWXDJu7CvK7FWEnHLJk-DLS5DVsakLVtpLFS7BVp13bQ82NtV74kd9mKP24ZgLfLqR683qtkxKvRJlhTe8zStv4DyXII2e6qfj-nL_iE7xP0lqGBHeYGHrvYU4wE6eppGpTAmT7p9F70CIY-n7js7g-7iUGJxdKNpSdLBoSrYnhyWu8AaBTANE2FmwzrVKGA_Em9LnhrTCJmIO4QKep2IgPPT_8cntm1Vzu2IQ7FRDBLMFu-7XzhkHz7NaGTT4_aEy9eoSYS0QKh8I_6MTbgORNoH6YJusziQn56CsZkxmNBpZ4MwJMsnwSCqdNZ1OzlNQiy1c51Bm2vu8aRBFmMNhlTS8=&p=4&fvj=0&vjs=3,20 dagen geleden,20 dagen geleden,23/02/2021,en,Female
