,Search Keyword,Platform,Job ID,Job Title,Company Name,Location,Job Description,Rating,Employment Type,Company URL,Job URL,Job Age,Job Age Number,Collection Date,Language,Gender
71,publieke administratie,Indeed,p_a7ec5ab4abf1fb66,Docent Verpleegkunde / zorgprofessional (Amsterdam),Hogeschool Inholland, Amsterdam,"Jouw rol
Je bent docent - Het grootste gedeelte van je taken bestaat uit het verzorgen van verschillende onderwijsvormen zoals hoorcolleges, werkcolleges en digitale lesvormen in verschillende studiejaren waarbij interactie tussen docent en student belangrijk is. Daarbij hoort ook de voorbereiding van lessen, afstemming met collega’s en het nakijkwerk. De overige taken bestaan uit onderwijsontwikkeling, scholing, overlegvormen en administratie.

Je bent vakinhoudelijk expert - De vakgebieden waarin je les gaat geven hangen af van jouw expertise. Denk aan o.a. biomedische vakinhoud, psychiatrische vakinhoud, klinisch redeneren, patiëntenvoorlichting, verpleegkundige en/of communicatieve vaardigheden, stagebegeleiding of onderzoekend vermogen.

 Je bent collega en participeert in het “Center of Expertise” - Een belangrijke ontwikkeling binnen ons onderwijs is de unieke wisselwerking en samenwerking tussen onderwijs, onderzoek en beroepspraktijk aan maatschappelijke uitdagingen. Deze samenwerkingsvorm wordt vormgegeven binnen ‘Centers of Expertises’ (Leer- en Innovatie Netwerken). In deze samenwerkingsvormen werken docenten en studenten, lectoren, ondernemers en onderzoekers uit publieke en private instellingen intensief met elkaar samen. Wij zouden het fantastisch vinden als jij deze nieuwe ontwikkeling omarmt en hierin proactief participeert. Jouw verbinding met de beroepspraktijk verlies je dus niet. Sterker nog, je zult merken dat je juist veel meer zelf ook leert!

Hbo-docent zijn betekent méér dan lesgeven en voor de groep staan - Er zijn allerlei docentrollen waarin je je kunt ontwikkelen en specialiseren. Zo ben je naast docent ook coach of trainer, studieloopbaanbegeleider, afstudeerbegeleider, curriculum- of onderwijsontwikkelaar, toets ontwikkelaar en coördinator of onderzoeker. Samen met je team worden de rollen verdeeld en ondersteun je elkaar, want samen ontwikkelen we ons onderwijs. Onze studenten doen een belangrijk deel van hun ervaring op in het werkveld tijdens hun (afstudeer)stage. Tijdens deze trajecten heb je een coachende rol. Je onderhoudt dus ook de contacten met het werkveld.

Werken op afstand
Op dit moment werken wij nog regelmatig vanuit huis. Je gaat o.a. werken met Microsoft Teams, Moodle, en andere applicaties voor digitale communicatie. De hogeschool organiseert bijeenkomsten over digitale mogelijkheden om van en met elkaar te leren.

Geen ervaring als docent? Geen probleem!
Op dit moment ligt een mooi programma BN2020 klaar en is het lesmateriaal ontwikkeld. Het curriculum blijft wel in ontwikkeling gelijk met het werkveld. Innovatie wordt toegejuicht en je aandeel hierin wordt gewaardeerd. Er is ruimte om het lesmateriaal aan te passen aan je eigen stijl. Eenmaal in de les zul je er in het begin niet alleen voor staan. Je kunt rekenen op begeleiding van je collega-docenten.
Wie ben jij
Je hebt minimaal een afgeronde hbo-V opleiding en vier jaar relevante werkervaring op hbo niveau. Een afgeronde master (of er mee bezig zijn) is vereist om met name studenten te kunnen begeleiden in onderzoeksvaardigheden en kwaliteitsprojecten.
 Je beschikt over relevante praktijkervaring! We willen dat je op basis van je eigen ervaring in het werkveld (in verschillende zorgsituaties) gevoel hebt voor wat er van onze alumni verwacht wordt en dat je deze ook kan inzetten om jouw studenten te inspireren.
 Je hebt ervaring in/met één of meerdere van de volgende expertises: extramurale zorg, ouderenzorg, zorg voor mensen met een verstandelijke beperking, preventie in de zorg, zelfmanagement, blended learning, patiëntveiligheid, organisatie in de zorg, financiering in de zorg en/of ICT binnen de zorg.
 Je bent bekend met het beroepsprofiel BN2020 en de actuele ontwikkelingen binnen de gezondheidszorg.
 Je moet goed kunnen schakelen tussen zelfstandig kunnen werken en samenwerken. Als docent ben je solist: je staat alleen voor de groep. Als collega ben je teamlid en samen ontwikkel je het onderwijs.
 Onderwijs kent piekmomenten qua werk. Om deze piekmomenten goed aan te kunnen is planningsinzicht, flexibiliteit en goed prioriteiten kunnen stellen erg handig.

Geen onderwijsbevoegdheid? Geen probleem!
Om deze functie te kunnen uitvoeren heb je vooralsnog geen lesbevoegdheid nodig. Wij begeleiden en coachen onze docenten in hun eerste jaar o.a. door het aanbieden van een kennismakingstraject didactiek. Bij uitzicht op een vast dienstverband faciliteren we je in het tweede jaar van de aanstelling in tijd en middelen om de onderwijsbevoegdheid te halen.
Wat bieden wij
Het betreft een tijdelijk dienstverband van 12 maanden met uitzicht op een verlenging.
Een salaris van maximaal € 5.026,85 bruto per maand (schaal 11), afhankelijk van ervaring en opleidingsniveau en bij een volledige aanstelling (dit is bij ons een werkweek van 36 uur per week);
Een goed te bereiken werkplek in Amsterdam. Alle gemaakte reiskosten met openbaar vervoer worden 100% vergoed. Kies je voor eigen vervoer weet dan dat je hierin beperkt vergoed wordt.
Een uitbetaling van een vakantietoeslag van 8% in mei;
Een uitbetaling van een eindejaarsuitkering van 8,3% in december;
Een aantrekkelijke pensioenregeling bij ABP (Pensioenfonds voor overheid en onderwijs);
Een aanstelling van max 40 uur per week, maar weet dat alles vanaf 24 uur per week ook bespreekbaar is;
Een ruime verlofregeling van ongeveer 50 dagen bij een fulltime aanstelling, inclusief de verplichte vrije dagen en de nationale feestdagen. Dit aantal is gebaseerd op een volledige aanstelling en een gekozen werkweek van 40 uur per week.
Een prettige, informele werkomgeving met enthousiaste collega’s.
Alle reiskosten worden op basis van openbaar vervoer vergoed.
De ruimte en middelen voor professionele en persoonlijke ontwikkeling. Wij vinden het belangrijk dat je altijd bereid bent om te leren.
Sociale partners blijven inzetten op verhoging van de kwaliteit van het onderwijs en onderzoek, van de onderwijsorganisatie en van het personeel. Wij volgen de cao hbo. Een uitstekend pakket aan primaire en secundaire arbeidsvoorwaarden.
Jouw werkomgeving
Als team zijn we onderdeel van het cluster Nursing binnen het domein Gezondheid, Sport en Welzijn (GSW) van Hogeschool Inholland. Binnen het team ben je als nieuwe collega in goed gezelschap.
Ons motto is: we doen het samen! We delen de verantwoordelijkheid voor het onderwijs. Dat betekent dat we met en van elkaar leren. We benoemen dingen die goed gaan maar ook die minder goed gaan. En dan werken we daar samen aan. Want ook wij leren meer als we fouten durven maken. Samen ontwikkelen we het onderwijs.

Over Hogeschool Inholland
Als je komt werken bij Inholland, dan ervaar je dat studenten én collega's bij ons centraal staan. Onze cultuur is persoonlijk en dichtbij, dat betekent een leer-en werkomgeving waarin we elkaar bij naam kennen. Bij ons krijg je de ruimte om je zowel professioneel als persoonlijk te blijven ontwikkelen, in elke rol en op elk niveau. Om zo een inspirerend voorbeeld te zijn voor onze studenten (en zij voor ons) en relevant te blijven in een steeds veranderende wereld.

Op onze 8 locaties verspreid over de Randstad, van de kop van Noord-Holland tot de Drechtsteden, moedigen we onze studenten aan om door te groeien tot zelfverzekerde professionals die de samenleving duurzamer, gezonder en creatiever maken. Vanuit een veilige basis bereiden we hen voor op de banen van morgen. Dit doen we met een breed hbo-onderwijsaanbod en onderzoek, dat zo goed mogelijk aansluit op de ontwikkelingen in de praktijk en dat gericht is op verschillende interessegebieden: van gezondheidszorg tot economie en van techniek tot onderwijs.

 Onze docenten en collega's van de stafdiensten leggen de lat hoog, voor onze studenten, voor elkaar en voor zichzelf. In de steeds veranderende wereld heb je moed nodig om je jezelf kwetsbaar op te stellen en je mening te durven aanpassen. En lef te hebben om kritisch te blijven, dingen uit te proberen en je gevoel te volgen. Continu blijven zoeken, vallen, opstaan en doorgaan. Leren = durven!",-1.0,-1,https://indeed.nl/rc/clk?jk=a7ec5ab4abf1fb66&from=vj&mvj=0&vjfrom=vjs&pos=bottom&astse=fd8b43c2881d543a&assa=4017,https://nl.indeed.com/vacature-bekijken?jk=a7ec5ab4abf1fb66&fccid=b75000dcc110c92e&vjs=3,19 dagen geleden,19 dagen geleden,2021-01-24,en,Neutral
72,publieke administratie,Indeed,p_38d465803ac73766,Werkvoorbereider Bouw,BAM Construct UK, Schiphol,"Description
Building the present, creating the future
Wil jij betrokken zijn bij toonaangevende projecten op Schiphol en onderdeel uitmaken van een relatief nieuw en enthousiast team?! Dan is dit misschien wel dé dynamische rol waar je naar op zoek bent?
Jouw missie

Als Werkvoorbereider Bouw bij BAM Schiphol werk je aan complexe en integrale projecten op de 3e grootste luchthaven van Europa. Als Werkvoorbereider Bouw zit jouw uitdaging vooral in de aard en omvang van de projecten en om de verschillende stakeholders te ondersteunen in hun dagelijkse werk.

Je pakt op een enthousiaste manier de technische en administratief-organisatorische werkvoorbereiding voor onze projecten op, waarbij een kwalitatief optimale en tijdige projectuitvoering tegen minimale kosten het eindresultaat is. In jouw rol als werkvoorbereider ben je in staat om:
de meest effectieve en efficiënte werkmethoden en werkinstructies uit te werken;
gedetailleerde projectspecifieke planningen en werkvoorbereidingschema’s te maken en te bewaken;
je signaleert afwijkingen, werkt dit uit en communiceert dit binnen het uitvoeringsteam (meer- en minder werk);
je communiceert met onze co-makers over de hoeveelheden ten behoeve van bestellingen en verrekeningen.
Wat breng je mee?

Jij hebt een passie voor bouw en techniek en je vindt het mooi om onderdeel te zijn van verschillende projecten en de werkvoorbereiding te verzorgen. Daarbij ben je in staat de projectleiders, Uitvoerders en de monteurs te ondersteunen. Jij bent echt de spin in het web en zorgt ervoor dat alles soepel verloopt. Jij behoud het overzicht, weet steeds weer de juiste stappen te zetten zodat projecten goed kunnen worden opgeleverd. Je vindt het fijn om in een dynamische omgeving te werken en deinst niet terug van een beetje hectiek. Je zorgt ervoor dat de processen soepel verlopen en het publiek zo min mogelijk hinder ondervindt van de werkzaamheden die wij als BAM uitvoeren.

Daarnaast vind jij het plezierig om met diverse belanghebbenden zowel mondeling als schriftelijk te communiceren en past jouw communicatiestijl aan in situaties die daarom vragen. Wij verwachten minimaal:
Ervaring in een vergelijkbare rol;
In het bezit van een mbo opleiding niveau 4 richting Elektrotechniek, Installatietechniek, Bouwkunde, Werktuigbouwkunde of vergelijkbaar;
Communicatief vaardig;
Administratief sterk;
Teamplayer;
Goede beheersing van de Nederlandse taal.
Wat kun je van ons verwachten?

Werken bij BAM Bouw en Techniek Schiphol, is werken bij een organisatie om trots op te zijn. Onderdeel zijn van een groeiende organisatie met een team enthousiaste collega’s, maakt dat je met heel veel plezier je werk kan doen. Dagelijks zie je onze collega’s werken aan de realisatie van spraakmakende projecten in een omgeving die altijd doordraait. Om onze collega’s te helpen zich in de juiste richting te ontwikkelen en te bekwamen, biedt BAM Learning vakopleidingen en trainingen. Jouw ontwikkeling vinden wij erg belangrijk! Hier krijg je bij Bam Schiphol dan ook de ruimte voor.

Verder bieden wij:
Een passend en vooral goed salaris met goede secundaire arbeidsvoorwaarden (Bouw CAO);
Een laptop en Iphone;
43 vakantiedagen (vijfentwintig vakantiedagen en vijftien roostervrijdage en drie verzuimdagen per kalenderjaar);
De mogelijkheid je te blijven ontwikkelen binnen onze BAM learning;
Bedrijfsfitnesskorting van gemiddeld 40%;
Collectieve zorgverzekering;
Kortingen op bijvoorbeeld: Microsoft office, mobiele telefonie, privé verzekeringen (auto, woning, inboedel etc), de BAM Homestudios (woonwinkel en keukenapparatuur) en de HP store.
Gerichte (vak)opleidingen via de BAM Business School, om jezelf verder te ontwikkelen.
Jouw werkomgeving

Jouw werkomgeving
Wie zijn wij?

Bam Bouw en Techniek Schiphol is verantwoordelijk voor het beheer en onderhoud van onder andere Terminal 3 en Schiphol Plaza en werkt aan toonaangevende realisatieprojecten voor Schiphol. Daar zijn we ontzettend trots op! Schiphol groeit en groeit. Daarom is de luchthaven gestart om zich klaar te maken voor de toekomst. BAM werkt daar aan mee en heeft jouw hulp daarbij nodig! Maak kennis met Rob, Werkvoorbereider BAM Schiphol.

Het verder ontwikkelen en goed laten functioneren van een luchthaven brengt bijzondere verantwoordelijkheden met zich mee. We geven je graag een beeld van onze werkplek: Amsterdam Airport Schiphol heeft jaarlijks 68 miljoen passagiers, 1.752.498 ton vracht, 500 bedrijven op het luchthaventerrein en ongeveer 65.000 werknemers. Over complex gesproken!
Het recruitment proces

Heb je vragen of wil je meer weten? Neem gerust contact op met Patricia Chaudron - Corporate Recruiter via patricia.chaudron@bam.com of per telefoon via 06 - 55 25 00 93. (bellen/whatsapp)

Covid-19: Jouw gezondheid is belangrijk. Klik [hier] voor meer informatie over de BAM-richtlijnen voor Covid-19 en jouw sollicitatie.

Bij aanname wordt er altijd een screening bij de AIVD uitgevoerd. Deze screening neemt ongeveer 6 -8 weken in beslag. Positieve uitslag is een voorwaarde voor aanname.",-1.0,-1,https://indeed.nljavascript:void(0);,https://nl.indeed.com/vacature-bekijken?jk=38d465803ac73766&fccid=f30ab3109f24be96&vjs=3,19 dagen geleden,19 dagen geleden,2021-01-24,en,Neutral
73,publieke administratie,Indeed,p_b42cf6b76f9463cf,Adviseur Fiscale Compliance,EFK Belastingadviseurs, Alkmaar,"Vast contract
Alkmaar & thuiswerk
Geplaatst 2 jaar geleden
Uitgedaagd door de ambitie fiscaal ‘in control’ te komen en te blijven, investeren steeds meer publieke organisaties tijd en moeite in het verbeteren van fiscale beheersmaatregelen. Een veelheid aan redenen ligt aan deze ambitie ten grondslag, van de wens te komen tot Horizontaal Toezicht tot het voorkomen van een naheffing en van de belastingplicht voor de vennootschapsbelasting tot verregaande samenwerkingen met andere organisaties. Het team Fiscale Analyse & Control van EFK Belastingadviseurs helpt haar klanten met bovenstaande ambitie. Dit doen zij bevlogen in samenwerking met hun fiscale collega’s, met kennis en kunde en met een hart voor de publieke sector.

Ter uitbreiding en versterking van dit professionele en groeiende team zoeken wij een Adviseur fiscale Compliance, die wordt uitgedaagd door afwisselende werkzaamheden, onbekende en bekende gebieden en uitdagende klanten.

Jouw profiel als Adviseur fiscale Compliance

Hard skills:
Minimaal een HBO opleiding fiscale economie en/of fiscaal recht;
0-tot 6 jaar werkervaring in tax accounting en/of tax compliance of ervaring met de btw met de bereidheid tax accounting te leren;
Affiniteit met cijfers;
Sterke MS Excel capaciteiten;
Sterk analytisch vermogen.

Pré:
Ervaring in Tax audit;
Ervaring in de non-profit markt en dan met name overheid en woningcorporaties;
Ervaring met statistiek software;
Ervaring met gemeentelijke administraties.

Soft skills:
Zelfstandig, commercieel vaardig, cliëntgericht;
Betrokken bij mens en samenleving;
Je kunt uitstekend werken in teamverband;
Uitstekende communicatieve vaardigheden;
Aantoonbare interesse in andere werkvelden.

Jouw verantwoordelijkheden zullen onder andere zijn:
het doen van btw-onderzoek bij publieke organisaties;
het (her)inrichten van administraties;
trainingen geven aan medewerkers van klanten.

Naast deze activiteiten, verwachten wij dat je klaar bent om:
projectmatig te werken aan wisselende projecten;
fiscaal adviesvaardigheden op te bouwen (bijv., breed en analytisch nadenken, gesprekken met klanten begeleiden);
presentatievaardigheden op te bouwen;
commerciële vaardigheden op te bouwen (bijv. verkoop).

Ons kantoor

De adviseurs van EFK Belastingadviseurs leveren al jaren hoogwaardige fiscale advisering aan het gros van de Nederlandse gemeenten, provincies, waterschappen en woningcorporaties. Daarbij richt ons kantoor zich op alle fiscale aspecten van haar klanten. Wij adviseren onder meer op de volgende belastingmiddelen:

Omzetbelasting;
Vennootschapsbelasting;
Overdrachtsbelasting;
Loonbelasting en sociale heffingen.

EFK Belastingadviseurs is binnen haar marktsegment één van de grotere spelers in Nederland. Wij geloven niet in grote hiërarchische organisatiemodellen, maar gunnen iedere medewerker de ruimte direct te werken met en voor klanten. De cultuur is open, informeel en professioneel. Door de informele sfeer en open communicatiestructuur krijg je een grote mate van zelfstandigheid in de uitvoering van werkzaamheden. Als je niet bang bent voor het diepe, een steile leercurve ambieert en baas wilt zijn over je eigen agenda, is EFK Belastingadviseurs ‘the place to be’.

Ons aanbod

Werken bij EFK Belastingadviseurs is jouw talent ontwikkelen, de ruimte krijgen en vooral vakinhoudelijk professioneel en vooruitstrevend opereren. Vanaf dag één werk je rechtstreeks voor klanten, krijg je verantwoordelijkheid en ruimte voor eigen initiatief en ontwikkeling. Dat zijn geen loze woorden, maar is puur praktijk. Adviseurs kiezen specifiek voor ons kantoor door de mogelijkheden van het combineren van privé en werk. Uiteraard bieden wij jou daarnaast een stuk zekerheid door marktconforme (primaire en secundaire) arbeidsvoorwaarden. Ook medewerkers van de Belastingdienst die zich herkennen in de omschrijving nodigen wij uit te reageren.

Is jouw interesse gewekt? Of zou jij graag even doorpraten naar aanleiding van bovenstaande? Dat mag altijd. Jij kunt bellen of e-mailen met Henk Roosendaal via 072 535 05 25 / hroosendaal@efkbelastingadviseurs.nl. Direct solliciteren via onze website kan natuurlijk ook. Wij zien jouw reactie en/of sollicitatie graag tegemoet.",-1.0,-1,https://indeed.nljavascript:void(0);,https://nl.indeed.com/vacature-bekijken?jk=b42cf6b76f9463cf&fccid=87792f98ef21299e&vjs=3,19 dagen geleden,19 dagen geleden,2021-01-24,en,Neutral
74,publieke administratie,Indeed,p_013029bd7525ce68,HR Manager,International Documentary Film festival Amsterdam IDFA, Amsterdam Centrum,"BedrijfsomschrijvingIDFA is de afgelopen periode van een filmfestival uitgegroeid tot een internationaal documentaire-instituut dat zich richt op publiek, professionals en scholieren en dat, naast urgentie en toegankelijkheid, selecteert op artistieke kwaliteit. Een instituut waar inclusie en gendergelijkheid belangrijke uitgangspunten zijn en waar in alle geledingen extra aandacht is voor talentontwikkeling, nieuwe media en diversiteit. De organisatie is gevestigd in Amsterdam en bestaat door het jaar heen uit 35 medewerkers; in het najaar uit 80 medewerkers en 600 vrijwilligers. IDFA heeft een open, informele en op samenwerking gerichte cultuur. Wij werken vanuit een passie voor documentaires en maatschappelijke betrokkenheid. Bij IDFA geloven we in de kracht van een divers team. VacaturetekstBen je een ervaren HR-professional? Ben je bekend met werken in de culturele sector? Heb je zin om aan de slag te gaan met een internationaal team en heb je goede ideeën over diversiteit en inclusie? Ben je beschikbaar rond 1 april? Dan nodigen we je van harte uit om bij IDFA te solliciteren als HR manager!Kenmerkend is het internationale karakter van het festival en het team. Als HR manager bij IDFA ben je een groot deel van het jaar bezig met het samenstellen en wegwijs maken van het tijdelijke team dat in het najaar de festivalproductie uitvoert. De functie valt onder de algemeen directeur. Er wordt nauw samengewerkt met de hoofden van afdelingen en de financial controller. Thema’s die bij IDFA de komende jaren op HR gebied spelen zijn diversiteit en inclusie, het ontwikkelingsbeleid, de fair practice code, het verder verbeteren en expliciet maken van de organisatiecultuur en het automatiseren van administratieve HR processen.De functie kent onder andere de volgende taken & verantwoordelijkheden:  Het ontwikkelen van strategisch personeelsbeleid en verzuimbeleid en het adviseren van directie en hoofden over de uitvoering hiervan; Het jaarlijks opstellen van een jaarplan en personeelsbegroting en het beheren van een deelbudget;Het ontwikkelen en bijhouden van verschillende HR-instrumenten, zoals het generiek functiehuis en gespreksformats;Het organiseren van werving- & selectieprocedures, zowel voor het jaarlijkse tijdelijke team als bij incidentele vacaturesHet bijhouden van de personeelsadministratie en -dossiers en het maandelijks doorgeven van salarismutaties aan de externe salarisadministrateur.De ideale kandidaat:   Heeft een relevante opleiding afgerond op tenminste HBO niveau en minimaal 5 jaar werkervaring, bij voorkeur in een culturele organisatie;Heeft een visie op het bevorderen van de diversiteit en inclusie op de werkvloer;Is gespreksvaardig, integer, invoelend, onderhandelingsvaardig en betrokken;Spreekt en schrijft goed Nederlands en Engels (de interne communicatie is in het Engels); Voelt zich thuis in de bij IDFA geldende basiscompetenties: creatief, nieuwsgierig, flexibel, stressbestendig, communicatief en goed in samenwerken. IDFA biedt:   Een werkplek binnen een gezellig kantoor met 35-80 collega’s in het hart van Amsterdam (gedurende de lockdown maatregelen wordt er thuisgewerkt en biedt IDFA ondersteuning bij de inrichting van een thuiswerkplek); Een aanstelling voor een jaar vanaf 1 april 2021 (in overleg), voor 0,8-1,0 fte, met zicht op verlenging; Een passend salaris in ons generiek functiehuis (indicatie: € 3.134 - € 4.927 bruto per maand bij fulltime, exclusief 8% vakantiegeld) De salarisschaal kent 10 periodieken; inschaling bij aanvang geschiedt op basis van ervaring.Goede secundaire arbeidsvoorwaarden, waaronder 25 vakantiedagen per jaar bij fulltime, gratis gezonde lunches op kantoor, internetvergoeding bij thuiswerken, pensioenopbouw, woon-werk reiskostenvergoeding, een compensatieregeling voor overwerk en vrijkaarten voor IDFA.Solliciteren:  Mail, uiterlijk zondag 7 februari 2021, een brief met CV (beiden als pdf bijlagen met als titel voornaam achternaam motivatie/cv) aan Annabet Langkamp. Vermeld hierbij dat het gaat om de vacature van HR manager. Uiterlijk 12 februari krijg je een reactie. Een eerste ronde (online) sollicitatiegesprekken vindt plaats op 15 en 17 februari 2021.  Er wordt geen prijs gesteld op acquisitie naar aanleiding van deze advertentie. Contractduur 12 maandenParttime uren: 32-38 per weekDeadline sollicitaties: 7-2-2021Verwachte startdatum: 1-4-2021Soort dienstverband: Fulltime, Parttime, Bepaalde tijdSalaris: Tot €4.927,00 per maandAanvullende betalingen:VakantiegeldArbeidsvoorwaarden:LunchkortingPensioenReiskostenvergoedingWerk vanuit huisWerkschema:ma-vrMaatregelen tegen het coronavirus:Gedurende de lockdown maatregelen wordt er zoveel mogelijk vanuit huis gewerkt. IDFA ondersteunt medewerkers met het inrichten van een thuiswerkplek en vergoed een deel van de kosten voor het gebruik van internet thuis.Thuiswerken:Ja",-1.0,-1,https://indeed.nljavascript:void(0);,https://nl.indeed.com/vacature-bekijken/company/International-Documentary-Film-festival-Amsterdam-(IDFA)/jobs/Human-Resources-Manager-013029bd7525ce68?fccid=d1922cbf46e60da3&vjs=3,19 dagen geleden,19 dagen geleden,2021-01-24,en,Neutral
