,Search Keyword,Platform,Job ID,Job Title,Company Name,Location,Job Description,Rating,Employment Type,Company URL,Job URL,Job Age,Job Age Number,Collection Date,Language,Gender
0,accommodation,Indeed,pj_570803e5a3f1f71f,Replenisher,Eurojob BV, Amsterdam,"Replenisher (Amsterdam area)Amsterdam area, North Holland, The NetherlandsFull-time jobEurojob BV is a Dutch international recruitment and employment agency. With more than a thousand employees, Eurojob is one of the biggest players in this rapidly growing segment of the Dutch flex market. With years of experience and cooperation with the global companies, We know exactly how to discover the potential of each of our employees. We are focused on development and long-term co-operation while providing all European standards. We recruit our employees in the European Union area, especially in Poland, Slovakia, Latvia, Estonia, Romania, Czech Republic and Hungary.Currently, for our clients, ones of the biggest supermarkets chains in the Netherlands, we are looking for supermarket’s employees - ReplenisherAre you ready for work as a Replenisher in Amsterdam area ?Do you work carefully and accurately?Do you want to work at night shifts?Do you want to work for a longer period in a challenging working environment?Do you want to work in area of the most popular city in Europe?If the answer to the above questions is ‘YES’, then we are looking for you!What we can offer: legal employment on a Dutch contract with full social packagecoordinator’s help during the whole employment perioda gross salary of €11,97 per hour incl. ADV allowance (8,1% for 22y+)additional 8% Holiday allowance (+€0.88 for every hour worked)shift allowance of +50% when working after 22:00 till 06.00 (Monday – Saturday)allowances for working in Sunday (+100%)Monday – Saturday night and are additionally charged at Dutch rates - up to €17.50 per hourholiday allowance 8,33% added to every paymentmonthly paymentsaccommodation and transport to workNL insurancereimbursement for commuting (in the case of self-car travel)possibility to get promotion to team leader position and extension of contractYour responsibilities: stock replenishment and rotationrevalue the expiration date productssorting empty boxes on the stuffed goodssegregation and general tidyingcustomer serviceYou are a good match, if you: are more than 18 years oldare a fast learnerfeel good working at night shiftsknow very well English language in speech and writinghave a good physical condition and ability to work in a good speedhave a driving license (not necessary, but would be an asset)Job Types: Full-time, Temporary",-1.0,-1,https://indeed.nljavascript:void(0);,https://nl.indeed.com/vacature-bekijken/pagead/clk?mo=r&ad=-6NYlbfkN0CgejQQeBHOr-YKMfyIs1OeaBOhJXjS9cxbBWRyfDEYUn0DCCkkeGQInD4FqDiFo7lwUy3VCaS0RxaEQFciop2tpNzMfVF62J6yI8vw23fE74w2IUAFeZt1Osig9-DgXq57BGtuUJfzzCabzO0Jdd2dqkcYZc1xFw4DYx7GEaGcoJq81VAIBy4oJ0XCsReFAYSPl73sVLPp-JYCaAv3qRNEg5Idw9rIaqh3UXQjAyA2_h4bXLK59151GLHY6hukTkuKZNhwzwxCxMLqLF47bO3ubqKj218sxMRoODfWPGr4xrYQHbE2TPnp3bEsIIo5jVOeKqbXt3U4xKexdhW7hOpxPfXBcQ0hUukWjZI6SmyO_-6Q69KGyv56E9bMLWoER85lBAWBtYb2m4XWBKp_2E0lUT_w2b7vtBasOMyZx9syZblU6WNb4Dx7B-rYbYV4yTs=&p=0&fvj=1&vjs=3,Meer dan 30 dagen geleden,Meer dan 30 dagen geleden,2021-01-20,en,Female
1,accommodation,Indeed,p_7674c23f38f94dcf,Dutch Speaking Customer Service Representative Travel & Accommodation,Majorel Amsterdam, Amsterdam Westpoort,"Could this be you? We are looking for Dutch-speaking Customer Service Specialists to join our Customer Support team. You will be working for our client, one of the biggest online travel & accommodation providers worldwide! This job is based in our Majorel Amsterdam office; only 1 minute walk from Amsterdam Sloterdijk station. We offer you full training to make sure you get all the expertise you need to develop in our team.Whether you are already an experienced professional or just starting your career, Majorel offers you a wide range of career prospects, interesting responsibilities, and a motivating work environment.As a member of our customer service team, you will be supporting Dutch speakers across the globe, you will need to be an explorer at heart. Someone with strong technical abilities who loves travel and knows all about the excitement of reaching a new destination and things not going quite right.You'll also need to be compassionate and patient - helping others isn't always easy- but you love it !, So you roll up your sleeves and do whatever you can. However, it's not all hard work, you'll be in a vibrant office, surrounded by vibrant people from all over the world and at Majorel Amsterdam, colleagues become friends in no time.See below what we offer, what responsibilities you will have, and what the requirements are. Apply directly, we will get in touch with you!What we offer: A welcoming and inclusive environment;Providing exceptional customer service in a non-scripted world;An organization ready to help you develop and grow;Flexible working hours from Monday-Saturday between 8:00 am and 6:00 pm;Full-time (3 weeks) paid training currently done from home;Supportive team and friendly colleagues;Possibility to gain working experience and career opportunities;A gross monthly salary of € 2,149 (based on a full-time workweek);Premium pay for off-hours, 8% holiday pay and 25 days paid holidays per year;Modern working environment at an attractive location in Amsterdam with good public transport connection 1-minute walk from Amsterdam Sloterdijk;A multinational environment, different nationalities and cultures to work every day;Dynamic and fast-paced work environment;Travel allowanceContribution to your health insurance and pension.Duties and responsibilities: Handling incoming phone calls and emails from the website users;Acting as an intermediary between the customers and accommodations;Managing reservations, special requests, and complaints and finding solutions to website users inquiries.Requirements for candidates: Excellent Dutch and English language skills (verbally and written);Technical know-how / strong tech abilitiesYou bring a work experience background in for example a call center or help desk environment. We are also open for any type of -customer service- oriented work experience: (eg Hotel, Catering, Restaurant, Retail, Reception);Strong communication and administration skills;Strong in multitasking;You love to help people;Customer-focused mentality & approach;Attentiveness;Positive attitude.How to apply: If you think this job is you and you are excited to join, please send your resume with your motivation letter via this link to apply at the bottom on this page.Majorel is collecting and processing personal information for the recruitment process in accordance to GDPR.About us: We're Majorel. We design, deliver and differentiate customer experience on behalf of some of the world's most respected brands.Recognizing a very particular kind of drive in each other, our parent companies Bertelsmann and Saham have entered into a long-term partnership to create a new global leader in customer engagement.We are relentless, resourceful, resilient and agile. It's the only way to deliver the total reliability and digital transformation necessary in our constantly changing world.We serve customers across the world through our 48,000 employees based in 26 countries in Europe, the Middle East, Africa, Americas and Asia in 40+ languages.We support our customers at any time, through every device and in the manner they expect of their brands. We speak their language wherever they are and whatever their culture.Our mission:We create amazing customer experiences that people value and we are proud of.By combining talent, data, and technology.We deliver real impact for our partners.We are driven to go further.Benefits:Work from home opportunitiesContract length: 7 monthsApplication deadline: 01/02/2021Job Types: Full-time, ContractSalary: €2,149.00 per monthWork Remotely:Temporarily due to COVID-19",-1.0,-1,https://indeed.nljavascript:void(0);,https://nl.indeed.com/vacature-bekijken/company/Majorel/jobs/Dutch-Speaking-Customer-Service-Representative-Travel-Accommodation-7674c23f38f94dcf?fccid=afe85deef9b97f13&vjs=3,Meer dan 30 dagen geleden,Meer dan 30 dagen geleden,2021-01-20,en,Female
2,accommodation,Indeed,p_431b54b5b414d39d,Guest Services Agent,Trade in Services BV, Amsterdam,"Job Category Rooms and Guest Services Operations
Location Amsterdam, Barcelona and Istanbul
Brand A 5-star plus hotel chain part of the Marriott International brand
Schedule Full-time
Relocation? Yes (strict conditions)
Position Type Non-Management/Hourly
Payrollmen is looking for energetic, professional Guest Services Agents with exceptional guest service experience.
General description

Guest Services Agent Always wanted to work in one of the largest hotel in the center of Amsterdam, Barcelona or Istanbul? Payrollmen has exclusively been asked to start the preselection for job openings in the second quarter of 2021.

Position Purpose:

Greet and register guests, provides prompt and courteous service, and closes out guest accounts upon completion of stay to meet high standards of quality.

Essential Functions:

Communicate effectively both verbally and in writing to provide clear direction to staff. Assign and instruct guest service representatives in details of work. Observe performance and encourage improvement.

Greet guests immediately with a friendly and sincere welcome. Use a positive and clear speaking voice, listen to and understand requests, respond with appropriate actions and provide accurate information such as outlet hours and local attractions.

Promptly complete the registration process by inputting and retrieving information from a computer system, confirming pertinent information including number of guests and room rate. Promote marketing programs. Make appropriate selection of rooms based on guest needs. Code electronic keys. Nonverbally confirm the room number and rate. Provide welcome folders containing keys, certificates, coupons and refreshment center keys as appropriate. Close out guest accounts at time of check out. In the event of dissatisfaction, negotiate compromise, which may include authorizing revenue allowances.

Verify and imprint credit cards for authorization using electronic acceptance methods. Handle cash, make change and balance an assigned house bank. Accept and record vouchers, travelers checks and other forms of payment. Perform accurate moderately complex arithmetic functions using a calculator. Post charges to guest rooms and house accounts using the computer.

Promptly answer the telephone using positive and clear English language. Input messages into the computer. Retrieve messages and communicate the content to the guest. Retrieve mail, small packages and facsimiles for customers as requested.

Remain calm and alert, especially during emergency situations and/or heavy hotel activity, serving as a role model for guest service representatives and other employees. Resolve customer complications and complaints by conducting thorough research of the situation and identifying the most effective solutions. Make decisions and take action based on previous experience and good judgment, sometimes revising procedures to accommodate unusual situation. Authorize revenue allowances to remedy problems only after other alternative solutions have been offered.

Job Requirements:

Specific Job Knowledge, Skill and Ability:

The individual must possess the following knowledge, skills and abilities and able to explain and demonstrate that he or she can perform the essential functions of the job, with or without reasonable accommodation.

Ability to effectively deal with internal and external customers, some of whom will require high levels of patience, tact and diplomacy to defuse anger and collect accurate information and resolve conflicts.
Basic mathematical skills and considerable skill in the use of a calculator to prepare moderately complex mathematical calculations without error.
Ability to listen effectively and to speak English clearly.
Ability to access and accurately input information using a moderately complex computer system.
Ability to stand, walk and continuously perform behind the front desk.
Hearing and visual ability to observe and detect signs of emergency situations.
Ability to communicate verbally and in writing and prepare complex reports of room availability and revenues generated.
Ability to analyze and make judgments.

Payrollmen is an equal opportunity recruiter committed to hiring a diverse workforce and sustaining an inclusive culture. Payrollmen does not discriminate on the basis of disability, veteran status or any other basis protected under federal, state or local laws.",-1.0,-1,https://indeed.nl/rc/clk?jk=431b54b5b414d39d&from=vj&mvj=0&vjfrom=vjs&pos=bottom&astse=a9e029bc12f80ca7&assa=6537,https://nl.indeed.com/vacature-bekijken?jk=431b54b5b414d39d&fccid=f7923d5d5b6905f0&vjs=3,Meer dan 30 dagen geleden,Meer dan 30 dagen geleden,2021-01-20,en,Female
3,accommodation,Indeed,p_f236ca3c0433a35e,Executive Assistant to the IMT (32-40 h/w),War Child, Amsterdam Oost,"‘discreet, proactive and well organised, with talent for balancing multiple priorities and managing relations ’
Your Challenge
As Executive Assistant you provide office administration and secretarial and organizational support to the members of the International Management Team (IMT) and in particular to the Managing Director (MD), the Director of International Programmes (IPD) and the Director of Shared Operations (DSO). The activities are of a confidential nature.
Your responsibilities
Coordinate and arrange meetings for the supervisory board, the IMT, Shared Operations and International Programmes
Manage and keep track of IMT members calendars, remind members of scheduled meetings, establish priorities and update the calendars
Provide organizational support by organizing a variety of meetings and arrange the necessary facilities/resources
Keep track of the follow-up to decisions and actions. Provide office administration and procedural support to help carry out decisions. Handle the preparations and supply the required information
Serve as the point of contact for the members of IMT, of the MD, DSO and IPD both within the organisation and elsewhere
Draft and process correspondence and other material documents based on broad instructions. Organize and oversee the board’s records
Keep minutes of meetings, write reports and/or summaries and take appropriate action to realize the progress of the arrangements made
Organize incoming postal mail, emails and other documents (hardcopy and electronic) by their importance to the IMT’s decision making processes or consultations. Deal with them appropriately
Facilitate and organize the meetings, conferences, travel and overnight accommodation etc. of the IMT and where needed of the supervisory board
Advise the IMT on process related and organizational matters
Identify problems in work processes as they arise. Put forward suggestions for improvements and take appropriate action, subject to prior approval from the MD, DSO and IPD
Work together with the Business Support Team and serve as a backup for the Travel Officer when needed.
Your Profile
HBO degree or higher
Minimum 5 years of work experience as Executive Assistant or similar role
Solid experience in administration with excellent organisational skills and attention to details
Strong command of Windows Office at an advanced level, knowledge of Unit4 is an added benefit
Fluency in speaking and writing in English and Dutch
Capability to nurture contacts at various levels
Experience in balancing complex schedules, meetings logistics and priorities
Fully support War Child’s mandate and mission
Available 32-40 hours per week, starting ASAP
EU resident and/or in possession of EU working permit.
Our offer
Salary range from €2734 to €3399 gross per month, based on 40 hours per week (the exact step determined by the years of your relevant working experience)
26 vacation days (based on 40 hours per week), plus 2 additional free days
A contributory pension scheme
Laptop to work from any location and mobile phone contribution of €25 per month
Possibility to follow (online) training and/or courses
Pleasant working conditions, good atmosphere, great colleagues and of course the meaningful purpose of our work!
Our organisation
War Child is a dynamic organization. We try to keep an informal ambiance within our office and in our remote work, with a lot of room for creativity, inspiration and self-initiative from employees. We practice what we preach: dynamic, innovative, integrity focused, and a drive to reach the highest possible results against the lowest possible costs. War Child Holland offers a challenging job in an inspiring work environment.
How to Apply
Interested and qualified candidates are invited to apply by no later than 24 January 2021. Make sure to upload your English CV (maximum of two pages) and cover letter
Please mention where you found this vacancy. Applications are considered on a rolling basis.
Is this not your dream job? Support War Child by sharing this job with your network!
The safety of children is essential to War Child. War Child does not tolerate or accept any form of abuse. This subject is addressed in our recruitment and selection procedures. Moreover, the accepted candidates will be required to state their commitment/ intent to be aware, consider and adhere to the minimum standards applicable in development and humanitarian settings, such as humanitarian values and principles, Sphere Humanitarian Charter, Standards in the Humanitarian Standards Partnership, Core Humanitarian Standard, International Humanitarian Law, Code of Conduct for the International Red Cross and Red Crescent Movement and Non-Governmental Organizations (NGOs) in Disaster Relief and IASC Six Core Principles Relating to Sexual Exploitation and Abuse.
Disclaimer
Only applications received via our website are processed.
If we appoint a suitable candidate before the given closing date, we reserve the right to remove the vacancy from our website before that date. In such a case, any responses received after that time are not processed.
It could be that during our selection process the closing date for the vacancy is extended. If so, and you have not yet heard from us, your application will remain live.",-1.0,-1,https://indeed.nl/rc/clk?jk=f236ca3c0433a35e&from=vj&mvj=0&vjfrom=vjs&pos=bottom&astse=f4bf36bcab3982ab&assa=7837,https://nl.indeed.com/vacature-bekijken?jk=f236ca3c0433a35e&fccid=cd951fa0b362fd47&vjs=3,Meer dan 30 dagen geleden,Meer dan 30 dagen geleden,2021-01-20,en,Female
4,accommodation,Indeed,pj_d7238843d8cfa307,Warehouse Employee,Actief Werkt, Aalsmeer,"Are you interested to work as a part-time Warehouse employee in Aalsmeer?

The work takes place in a flower auction warehouse!

Job positions:

Production work.Order-picking.Voice picking.Driving electric cart with flowers.

In this job you will work together with colleagues in a team!

Working days and hours:

Monday till Friday from 6:00 until 10.00-13.30.
You can also work 3 days a week (Monday and Friday are manditory working days)
Wat vragen wij van je:

Requirements:

You can communicate well in English or Dutch.You are at least 165 cm tall due to safety requirements.You are able to perform physical work.You have your own accommodation and live in the surroundings of Aalsmeer.We don't offer accommodation!You have your own transportation.Motivated and active attitude.
Wat wij jou bieden:

We offer:

The salary we offer:
After 8 weeks you will receive €11,66 bruto/hour.(22+)Weekly payment of your salary!Also, 8,33% brutto holiday allowance and vacation days.Travel allowance between 10,1 - 50 km/day.Bonus: every 3 months you get a special plant/flowers as a gift.

Interested?

Apply online or send an email with your CV to hrbloemenveiling@actiefwerkt.nl.
After we have received your application we will invite you for a intake interview and a tour to show you the workplace!
Questions call 06-12535283.",-1.0,-1,https://indeed.nl/rc/clk?jk=d7238843d8cfa307&from=vj&sjdu=vTIXY0QzJd69etEjxEC_16MiCve1jX1R4i4TwKHoYbkoTZUY9dv9x__BhgPknN97qSp02hcBpdozQhsCWX8rPQ&spon=1&adid=310734306&mvj=0&vjfrom=vjs&pos=bottom&ad=-6NYlbfkN0DNxxK6OC0U3H7iZ8H5lM8JmgmA2PMnm5Le5v0Ys-wf1RijetKAh-VnhzQEBIF5KS_MiZCcoGayzn9FLqjCIY8neBG7uxGZg8SEYLNxW2Sz3tMirzvGYJPiGn1MsVUo6Jprzr4XLK5y8NWI_pdPzB45z9ML_b15n-n_A1b_kidu2H5vOcw12vASNngTbS8cUU9-oR6oThptAAS6FCFgMysLg-pm85uINiWS13dY40cLhQr27hCgxeATBCz8dHgKy2asNKMzOg_bH5zqqBXVGcOaroB1mesiHUxa6UEz7GPWL7uKC-IJDMi-onICyGiAdz62Lpew2X_FhjaNd0OmvwaRtTA5cDRKPshBSSv3d5z_F6hrbOSWZ_mpYHC9uoBPpuKqAF1AX2rgOM5yydF1EecFiQTIFO5vxj9U7-ehTzq1LQdO2pX6HBtVYROEbJW1ZU8KxsTy7J77sVxeA1d6fss_Nva2DCXnOgdIc0GNjwG4laDY8OaKnKQ4BkOdM8aJIs342k20WmyZRx4qOr_D7OgTSNudXZQAQYJxNE-jcRvwsaoJjL55cibkeZpeFmX_9pZP_8Kbns6ABbdpCqdlh7HBJ7nov-55DGd2BxYKn8aoxYlUNqDqmvxaHrtv9qi4aSMpvFcJ9dDmSUMPKmWDIHbrHArxBLvTFGYwD-274INkZsusPR11mVBwybEhkGHJDMk=&astse=e4769c8aba40fa86&assa=9188,https://nl.indeed.com/vacature-bekijken/pagead/clk?mo=r&ad=-6NYlbfkN0DNxxK6OC0U3H7iZ8H5lM8JmgmA2PMnm5Le5v0Ys-wf1RijetKAh-VnhzQEBIF5KS_MiZCcoGayzn9FLqjCIY8neBG7uxGZg8SEYLNxW2Sz3tMirzvGYJPiGn1MsVUo6Jprzr4XLK5y8NWI_pdPzB45z9ML_b15n-n_A1b_kidu2H5vOcw12vASNngTbS8cUU9-oR6oThptAAS6FCFgMysLg-pm85uINiWS13dY40cLhQr27hCgxeATBCz8dHgKy2asNKMzOg_bH5zqqBXVGcOaroB1mesiHUxa6UEz7GPWL7uKC-IJDMi-onICyGiAdz62Lpew2X_FhjaNd0OmvwaRtTA5cDRKPshBSSv3d5z_F6hrbOSWZ_mpYHC9uoBPpuKqAF1AX2rgOM5yydF1EecFiQTIFO5vxj9U7-ehTzq1LQdO2pX6HBtVYROEbJW1ZU8KxsTy7J77sVxeA1d6fss_Nva2DCXnOgdIc0GNjwG4laDY8OaKnKQ4BkOdM8aJIs342k20WmyZRx4qOr_D7OgTSNudXZQAQYJxNE-jcRvwsaoJjL55cibkeZpeFmX_9pZP_8Kbns6ABbdpCqdlh7HBJ7nov-55DGd2BxYKn8aoxYlUNqDqmvxaHrtv9qi4aSMpvFcJ9dDmSUMPKmWDIHbrHArxBLvTFGYwD-274INkZsusPR11mVBwybEhkGHJDMk=&p=4&fvj=1&vjs=3,Meer dan 30 dagen geleden,Meer dan 30 dagen geleden,2021-01-20,en,Female
