,Search Keyword,Platform,Job ID,Job Title,Company Name,Location,Job Description,Rating,Employment Type,Company URL,Job URL,Job Age,Job Age Number,Collection Date,Language,Gender
55,social worker,Indeed,p_dbdc1f3843e01c5d,Dialyseverpleegkundige,OLVG, Amsterdam,"Over de functie
Hemodialyse, peritoneaal dialyse, het dialyse vak kent voor jou geen geheimen. Je bent een échte specialist en bent dan ook verantwoordelijk voor het verlenen van hoog complexe (technische) zorg zowel binnen ons dialysecentrum als op de IC en CCU voor het uitvoeren van acute dialyse behandelingen. Je hebt zeer nauw contact met onze patiënten die soms al vele jaren verbonden zijn met OLVG. Het geeft je energie om onze patiënten te helpen bij hun levensvragen en uitdagingen.
Dit past helemaal bij jou:
gezellig en zorgzaam met je collega’s en patiënten;
het geven van instructie en opleiding aan bijvoorbeeld cursisten, vakgenoten en coassistenten;
het continu willen leren en verbeteren.
Werkomgeving
Binnen het Dialysecentrum, locatie Oost en West, van OLVG versterk je een professioneel en ervaren team bestaande uit internisten/nefrologen, dialyseverpleegkundigen, diëtisten, technici en social worker. Er is ruimte voor zelfontplooiing en verpleegkundig leiderschap wordt bij OLVG aangemoedigd. Je collega’s zijn vakspecialisten die zeer betrokken zijn bij de patiënten maar ook bij jou als collega. Het Dialysecentrum beschikt over moderne afdelingen met bijbehorende faciliteiten.

Wij vinden het belangrijk dat jij je snel thuis voelt. We zijn er voor elkaar. Zo vertelt Sylvia, dialyseverpleegkundige en teamleider: “het dialysecentrum van OLVG is als een dorp in een stad.”

Haal ook het beste uit jezelf en laat je inspireren door onze verpleegkundige visie.
Functie-eisen
We verleggen de bekende weg als het bijdraagt aan het resultaat. En bedenken het liefst hoe het nóg beter kan. Op eigen wijze en met elkaar. Daarom rekenen we op jouw gedrevenheid en ervaring. Je bent een sociale teamspeler die op een positieve manier feedback kan geven en ontvangen en je hebt natuurlijk hart voor onze patiënten.
Dit neem je ook mee:
een mbo-v of hbo-v opleiding aangevuld met de specialisatie dialyseverpleegkundige
een BIG registratie
de bereidheid om alle diensten conform het dienstrooster te werken.
Wij bieden
Werken bij OLVG betekent werken in hét stadsziekenhuis van Amsterdam. Een werkomgeving waar jij je optimaal kunt ontwikkelen. Want jouw wensen en ideeën doen ertoe. Zo doen we dat bij OLVG.

Daarom bieden we jou:
minimaal € 2.526,- en maximaal €3.774,- bruto per maand (fulltime) in FWG-schaal 50 cao ziekenhuizen
dienstverband voor onbepaalde tijd
eindejaarsuitkering van ruim 8%
vakantiegeld van ruim 8%
144 uur vakantieverlof
goede reiskostenregeling
persoonlijk levensfasebudget van 57 uur verlof en de ruimte om te werken aan jouw eigen ontwikkelingswensen
pensioenregeling bij PFZW
voordeel op jouw ziektekostenpremie met onze collectieve ziektekostenverzekering. Kies uit IZZ of Zilveren Kruis Achmea
kortingen op verzekeringen en financiële diensten van Centraal Beheer Achmea
korting bij diverse lokale ondernemers, zoals eettentjes, cafés en sportcentra
onbeperkt toegang tot e-learnings en ons vitaliteitsprogramma
de keuze in arbeidsvoorwaarden die bij jou passen. Zie ons OLVG Meerkeuzesysteem Arbeidsvoorwaarden.
Deze arbeidsvoorwaarden zijn op basis van een fulltime dienstverband (36 uur per week).",-1,-1,https://indeed.nl/rc/clk?jk=dbdc1f3843e01c5d&from=vj&mvj=0&vjfrom=vjs&pos=bottom&astse=a3f4b53cf3b6f00a&assa=2667,https://nl.indeed.com/vacature-bekijken?jk=dbdc1f3843e01c5d&fccid=938fc08397482d6e&vjs=3,Meer dan 30 dagen geleden,Meer dan 30 dagen geleden,23/02/2021,en,Female
56,social worker,Indeed,p_9150becd8759e034,Begeleider of verpleegkundige voor een acute opname-afdeling in de psychiatrie,GGZ inGeest, Amsterdam,"Afdeling HIC Amsterdam
Werken op de High and Intensive Care in de psychiatrie is topsport! Wil jij met ons team mee naar de eredivisie? Wij zoeken een verpleegkundige of begeleider om ons team te versterken. Hoge zorgintensiteit, korte opnames en werken in een hecht team waar ruimte is voor eigen initiatief. Past dit bij jou? Lees dan verder!


De afdeling High and Intensive Care, gevestigd in De Nieuwe Valerius Amsterdam, is een acute opname-afdeling met 20 bedden. Je krijgt op de afdeling Intensive Care te maken met patiënten van diverse culturele achtergronden. Veelvoorkomende psychiatrische ziektebeelden zijn depressie en psychose. De opnames zijn vrijwel altijd gedwongen en deze categorie patiënten kunnen onvoorspelbaar zijn. Er is een hoge turnover van cliënten, we streven ernaar om de opname zo kort mogelijk te houden (ongeveer 3 weken).

Onze ambitie is om een leefklimaat te creëren, waardoor de patiënt in crisis zich veilig en gesteund voelt. Centraal voor ons team staat het terugdringen van dwang en drang met de aandacht gericht op het herwinnen van de eigen regie van de patiënt en herstelgerichte zorg. Als verpleegkundige of begeleider op onze afdeling lever je een belangrijke bijdrage aan het verder professionaliseren van de zorg. Nieuwe initiatieven worden aangemoedigd. Heb je een goed idee ter verbetering van de afdeling? Dan krijg je de tijd en middelen om dit uit te voeren. In november 2017 hebben we succesvol de certificering High and Intensive Care (HIC) verkregen.


Daarom past deze functie bij jou wanneer je volgende punten herkent:

Je voelt je als een vis in het water op een crisisafdeling;

Je kunt omgaan met onverwachte omstandigheden;

Je kunt out of the box denken als het gaat om begeleiding van patiënten in crisissituaties.

Je bent van harte welkom om mee te lopen op de afdeling. Hiervoor kun je contact opnemen met Fedde Makker 06-20680365 of Faizel Joemrati 06-11452552.
Functieomschrijving
Je begeleidt de groep opgenomen patiënten in hun leefsituatie en ben je persoonlijk begeleider van een aantal toegewezen patiënten. Samen met de cliënt en het team stel je een begeleidingsplan op welke je uitvoert en evalueert. Per dienst werk je samen met vijf verpleegkundigen/begeleiders op de afdeling. Je krijgt de mogelijkheid om te werken aan projecten en om diverse taken op je te nemen. Een voorbeeld hiervan is onze samenwerking met de politie. Je gaat dan samen met de politie naar een verward persoon op straat of op huisbezoek. Ook is het mogelijk om samen met een collega uit een F-ACT team op huisbezoek te gaan. Er zijn voldoende mogelijkheden om jezelf verder te ontwikkelen, bijvoorbeeld de training de-escalatie, effectieve gespreksvoering en psychopathologie.
De Nieuwe Valerius is een moderne kliniek met meerdere faciliteiten, waaronder een sportzaal, keuken en activiteitenprogramma. Het team is multidisciplinair, bestaande uit een psychiater, psycholoog, verpleegkundigen, geestelijk verzorger, maatschappelijk werker, activiteitenbegeleider, diëtist, bewegingsagoog, begeleiders en een ervaringsdeskundige. Ons team heeft een open leerklimaat waar veel aandacht is voor feedback en nabespreking. We kunnen op elkaar bouwen en er is ruimte voor plezier en ontspanning.
Functie-eisen
Om te werken als verpleegkundige vragen wij:

Je hebt een verpleegkundig diploma MBO-4 of een HBO-V diploma;
Je hebt een BIG registratie.
Om te werken als begeleider vragen wij:
Een afgeronde diploma MBO-4 binnen de zorg of een HBO-SPH diploma.
Voor beide functie geldt:
Je hebt ervaring met het begeleiden van patiënten in crisissituaties;
Je kunt de-escalerend optreden;
Je kunt alle typen diensten draaien: dag-, avond- en nachtdiensten.
Spreekt het werk je aan? Dan nodig we je uit om te solliciteren! Samen bespreken we welke mogelijkheden er zijn!
Arbeidsvoorwaarden
Wij bieden een verantwoordelijke en uitdagende functie. Daarbij hoort natuurlijk een goed pakket aan arbeidsvoorwaarden conform CAO GGZ:

De inschaling is in FWG 40 of FWG 45 (maximaal € 3.326,-). Er zijn doorgroeimogelijkheden naar de functie van coördinerend begeleider/verpleegkundige in FWG 50.

Je krijgt een dienstverband voor één jaar, met uitzicht op een vast dienstverband.

D e functie is voor 24 – 36 uur p/w. Wil je parttime of fulltime werken? Het kan allebei; contracturen stellen we in overleg met jou vast.

Daarnaast bieden wij:
Goede secundaire voorwaarden waaronder een meerkeuzesysteem arbeidsvoorwaarden, een vaste eindejaarsuitkering van 8,33%, een fietsregeling, korting op één van de collectieve ziektekostenverzekeringen én je krijgt gratis een abonnement op Cultuur Werkt! Diverse mogelijkheden voor bij- en nascholing. Waaronder gratis online trainingen via GoodHabitz. Met BedrijfsFitnessOnline kun je met veel korting sporten bij geselecteerde sportscholen.
Informatie over de vacature
Faizel Joemrati, psycholoog

06-11452552
Solliciteren?
Heb je interesse en voldoe je aan de gestelde functie-eisen? Reageer dan voor 9 maart 2021 via de knop 'Solliciteer direct'. Deze vacature kan voortijdig gesloten worden op het moment dat we voldoende reacties hebben ontvangen. Wacht daarom niet te lang met reageren. Wij nodigen mensen met een afstand tot de arbeidsmarkt uit om te solliciteren. Het inwinnen van referenties en het controleren van diploma's maakt onderdeel uit van de sollicitatieprocedure. Om in aanmerking te komen voor deze functie is een positieve verklaring omtrent gedrag (VOG) vereist. De vacature wordt gelijktijdig intern en extern uitgezet, bij gelijke geschiktheid hebben interne kandidaten de voorkeur.",-1,-1,https://indeed.nl/rc/clk?jk=9150becd8759e034&from=vj&mvj=0&vjfrom=vjs&pos=bottom&astse=2798fe2df48bf240&assa=8349,https://nl.indeed.com/vacature-bekijken?jk=9150becd8759e034&fccid=a95fdc436fa6ffc9&vjs=3,Meer dan 30 dagen geleden,Meer dan 30 dagen geleden,23/02/2021,en,Female
57,social worker,Indeed,p_7231679c6f5e3409,Verpleegkundigen nachtdienstVerpleegkundigen nachtdienst,Reade, Amsterdam,"Aantal uren per week
36,00
Opleidingsniveau
MBO
Datum sollicitatiegesprek
Contracttype
Bepaalde tijd
Niet langer racen tegen de klok? Word verpleegkundige bij Reade!
""Mensen die bij ons komen, hebben meestal maar één vraag: Kan ik mijn leven nog leiden zoals ik dat zelf wil? Ze zijn getroffen door een beroerte, een spierziekte of hebben een dwarslaesie opgelopen. Normale dagelijkse dingen zijn opeens niet meer vanzelfsprekend. Vaak is hun leven volledig ingestort. En dat raakt mij enorm. Daarom werk ik als verpleegkundige in de revalidatiezorg. Ik doe er alles aan om hen weer grip te geven op hun leven. Dat gaat veel verder dan het oplossen van maar één probleem. Een leven leiden zoals je zelf wilt."" - Tim, verpleegkundige.

Als verpleegkundige speel je een cruciale rol in het revalidatieproces. Je werkt nauw samen met revalidatieartsen, psychologen, fysiotherapeuten, ergotherapeuten, social worker en nog heel veel andere disciplines. Samen zorg je er voor dat cliënten stap voor stap weer grip krijgen op hun leven. Tijdens de nachtdiensten houd je toezicht en signaleer je gezondheidsproblemen en veranderingen in de situatie van de revalidanten. Wanneer nodig, verricht je verpleegtechnische handelingen. Je legt alles vast in rapportages en informeert de collega’s van de dagdienst hierover. Er kunnen diverse controles verbonden zijn aan een nachtdienst, zoals bestelling van medicatie en het onderhoud van verpleegkundig materiaal. Je wordt ondersteund door je collega. Samen zorgen jullie voor een rustige en veilige nacht.

Deze bijzondere positie heeft natuurlijk ook bijzondere arbeidsvoorwaarden:
Zo kun je doorgroeien van verpleegkundige (FWG 45) naar gespecialiseerd verpleegkundige (FWG 50) , regieverpleegkundige (FWG 50), senior regieverpleegkundige (FWG 55) en verpleegkundig specialist (FWG 55).
Afhankelijk van je ervaring bedraag het bruto maandsalaris maximaal € 3.225,- (FWG 45).
Reade biedt verschillende opleidingsmogelijkheden via onze eigen Reade Academy en het Skillslab. En dat is nog niet alles. Ook een persoonlijk ontwikkelingsbudget wordt binnenkort werkelijkheid.
Je kunt lid worden van de Verpleegkundige Adviesraad (VAR).
Je komt te werken op een prachtige locatie in hartje Amsterdam, direct aan het Vondelpark, met een parkeergarage recht onder het gebouw.
Reade werkt momenteel aan veel innovatieve ontwikkelingen, waar zelfroostering en het innovatieplatform voorbeelden van zijn. Zo krijg je als verpleegkundige meer de regie op je eigen agenda én werkplezier.
Tot slot bieden wij jou de kans om jouw kennis als verpleegkundige op internationaal niveau of bijvoorbeeld als Trainer binnen Reade delen.
Maar misschien wel het allerleukste: je gaat samenwerken met ons!
Heb jij een MBO of HBO verpleegkundige opleiding afgerond? Stuur dan je motivatie in twee zinnen (we willen liever dat je het vertelt) en je CV in via de onderstaande sollicitatiebutton. Dan nodigen wij jou persoonlijk uit voor een speeddate met ons.

Wij kijken er naar uit om jou te ontmoeten!",-1,-1,https://indeed.nl/rc/clk?jk=7231679c6f5e3409&from=vj&mvj=0&vjfrom=vjs&pos=bottom&astse=4eefc39547afd448&assa=1198,https://nl.indeed.com/vacature-bekijken?jk=7231679c6f5e3409&fccid=d96396e06409b5aa&vjs=3,Meer dan 30 dagen geleden,Meer dan 30 dagen geleden,23/02/2021,en,Female
58,social worker,Indeed,p_bcfcb094bb82480b,(Master) Psycholoog Forensisch Jeugdteam,Inforsa, Amsterdam,"Het Forensisch Jeugdteam maakt onderdeel uit van de Forensisch Ambulante Zorg (FAZ) van Inforsa.
De doelgroep waar het FJT zorg aan biedt vertoont ontwrichtend gedrag waardoor zij bekend zijn bij onder andere politie en justitie. Er is naast gedragsproblematiek veelal sprake van psychiatrische en/of verslavingsproblematiek en er kan sprake zijn van een verstandelijke beperking.

Ben jij een master-psycholoog met de juiste mindset of zelfs met forensische ervaring? Dan gaan we graag met je in gesprek!
Organisatie: Inforsa
Geplaatst op: 11 februari 2021
Sluitingsdatum: 28 februari 2021
Vacaturenummer: 21155
Min. aantal uren: 24
Max. aantal uren: 36
Locatie: Amsterdam, Baarsjesweg
Opleiding: WO
Contracttype: Regulier contract
Recruiter: Sebastiaan Honders
Waar hebben we jouw talent voor nodig?
Als masterpsycholoog maak je onderdeel uit van een multidisciplinair team met verschillende disciplines, zoals een psychiater, klinisch/GZ-psychologen, orthopedagogen, verpleegkundige, social worker, systeemtherapeut, jobcoach en sociaal werkers.

Als masterpsycholoog houd je je, naast het geven van behandeling, bezig met het afnemen van intakes, risicotaxatie en delictanalyse, psychologisch onderzoek en het opstellen van terugvalpreventie- en signaleringsplannen. Ook neem je deel aan multidisciplinair behandeloverleg, intervisie en deskundigheidsbevordering.

Mede vanwege het uitvoeren en uitwerken van intakegesprekken, is een aantekening psychodiagnostiek vereist. Daarnaast ben je werkzaam als behandelaar, zowel op locatie als bij de cliënt, waarbij je bij voorkeur beschikt over een afgeronde basiscursus CGT (inleidend als verdiepend). Als psycholoog ontvang je supervisie van een psychotherapeut/ klinisch psycholoog. Daarnaast ontvang je hiërarchisch leiding van de manager bedrijfsvoering.
Wie ben jij?
Je bent afgestudeerd psycholoog.
Je hebt je aantekening psychodiagnostiek.
Je hebt affiniteit met de forensische doelgroep.
Je bent in staat samen te werken in grotere verbanden en bent bereid tot overleg. Je hebt overtuigingskracht, gevoel voor humor, je bent besluitvaardig, flexibel en stressbestendig.
Het is een pre als je de CGT basiscursus hebt afgerond.
Een verklaring omtrent gedrag is een vereiste voor aanstelling.
Wat krijg je van ons?
Wij bieden een interessante en afwisselende baan in een dynamische werkomgeving. Het betreft een aanstelling voor bepaalde tijd voor de duur van een jaar met de mogelijkheid tot verlenging.
De arbeidsvoorwaarden zijn overeenkomstig de CAO GGz. De functie is ingeschaald in FWG 60.
Arkin beschikt over uitstekende primaire en secundaire arbeidsvoorwaarden.
Wie zijn wij?
Inforsa is één van de merken van Arkin. De Forensisch Ambulante Zorg (FAZ) van Inforsa in Amsterdam bestaat uit twee Forensische FACT teams, een outreachend werkend Forensisch Jeugdteam en de Forensische Polikliniek. Daarnaast is de FAZ actief met forensische (FACT) teams in de Gooi & Vechtstreek, Amersfoort en Utrecht. De FAZ behandelt cliënten met een forensische titel of met vergelijkbare risico’s en problematiek, met als doel de kans op recidive te voorkomen. De FAZ is een veelgevraagde zorgaanbieder, die een onmisbare bijdrage levert aan het behandelen en begeleiden van forensische en ontwrichtende cliënten, Top 600 en ‘treiter aanpak’. Daartoe wordt intensief samengewerkt met gemeentelijke instanties, reclasseringsorganisaties, collega GGZ aanbieders en Dienst Justitiële inrichtingen (DJI).

Het Forensisch Jeugdteam (FJT) van Inforsa biedt in samenwerking met de afdeling Jeugd & gezin van Arkin, ambulante specialistische behandelingen voor jongeren/jongvolwassenen van 15 tot en met 23 jaar. Het FJT maakt onderdeel uit van de Forensisch Ambulante Zorg (FAZ) van Inforsa. De doelgroep waar het FJT zorg aan biedt vertoont ontwrichtend gedrag waardoor zij bekend zijn bij politie, justitie en gemeentelijke aanpakken. Er is naast gedragsproblematiek veelal sprake van psychiatrische en/of verslavingsproblematiek en er kan sprake zijn van een verstandelijke beperking. Het Forensisch Jeugdteam voegt multidisciplinair in bij de cliënt en zijn systeem door middel van een intensieve outreachende werkwijze.

Het FJT onderscheidt zich ten opzichte van andere jeugdaanbieders vanwege de combinatie van deze outreachende zorg met poliklinische behandelingen. Onze cliënten met een forensische titel hebben hoog intensieve outreachende zorg nodig en hebben problemen op diverse levensgebieden: schulden, dakloosheid, grensoverschrijdend gedrag voortkomend uit ernstige verslavings,- en psychiatrische problematiek al dan niet in combinatie met een verstandelijke beperking. Door de stedelijk ketenaanpak worden cliënten gestabiliseerd en behandeld. Het Forensisch Jeugdteam is een gecertificeerd Forensisch FACT team door het CCAF.
Wil je meer weten?
Ben je een enthousiaste, ervaren professional die wil werken in een organisatie die volop in beweging is, dan nodigen wij je graag uit te solliciteren. Voor meer informatie en vragen over deze vacature kun je contact opnemen met Jitske Straus, wnd. manager bedrijfsvoering van Inforsa, telefoonnummer 06-21160773.

Selectieprocedure
Binnen twee weken na ontvangst van je sollicitatiebrief en CV ontvang je een reactie.

Deze vacature is gelijktijdig in- en extern gepubliceerd, interne kandidaten hebben voorrang in de procedure.",-1,-1,https://indeed.nl/rc/clk?jk=bcfcb094bb82480b&from=vj&mvj=0&vjfrom=vjs&pos=bottom&astse=ff3fa6d67159934e&assa=2556,https://nl.indeed.com/vacature-bekijken?jk=bcfcb094bb82480b&fccid=1e98ad7130230bba&vjs=3,Meer dan 30 dagen geleden,Meer dan 30 dagen geleden,23/02/2021,en,Female
59,social worker,Indeed,pj_e6077579cef5a8e7,Neonatologieverpleegkundige Nachtdiensten,OLVG, Amsterdam,"Over de functie
Als neonatologieverpleegkundige werk je binnen een uitdagende en multidisciplinaire afdeling. Jouw collega’s zijn enthousiaste specialisten met een passie voor het vak, die betrokken zijn bij de patiënten, maar ook bij jou als collega.

Je ondersteunt ouders in hun ouderrol en begeleidt het volledige zorgproces, van opname tot ontslag. Naast het verlenen van zorg, heb je ook oog voor de techniek rondom het zorgproces. Op de afdeling zijn veel acute opnames, wat vraagt om deskundigheid, goede samenwerking en flexibiliteit binnen het team.

Het team bestaat uit (gespecialiseerd) verpleegkundigen, kinderartsen, gynaecologen, verloskundigen, kinderfysiotherapeuten, lactatiekundigen, pre verbale logopedisten, kinderpsychologen en medisch social worker.
Werkomgeving
OLVG heeft op beide hoofdlocaties een Neonatologie-afdeling. Er zijn zowel overeenkomsten als verschillen tussen de afdelingen.

Overeen komt dat op beide locaties high care post IC-zorg wordt geleverd in samenwerking met onder andere het Amsterdam UMC. Ook wordt op beide locaties gewerkt vanuit de basisprincipes van Family Centered Care. De complexiteit van de ziektebeelden binnen onze multiculturele patiëntenpopulatie loopt zeer uiteen en de behandelingen zijn vaak multidisciplinair.

Het Toorop Paviljoen is het Moeder-Kindcentrum van locatie West en biedt ruimte aan 12 neonaten vanaf de leeftijd van 30 weken zwangerschapsduur met gemiddeld 4-6 post ic kinderen in een open unit (ruime zaal). Er is een nauwe samenwerking met de kraamsuites en de kinderafdeling waar we de mogelijkheid tot inroomen kunnen bieden bij kinderen die medium care zorg nodig hebben.

Het Anna Paviljoen is het Moeder – Kindcentrum van locatie Oost. Er zijn verschillende soorten moderne zorgsuites waar ouders of een van de ouders bij elkaar kunnen blijven gedurende het gehele zorgproces (Family Integrated Care model). Hierdoor wordt optimale hechting tussen kind en ouders bevorderd. In de suites kunnen alle behandel en zorgsituaties integraal plaatsvinden. Het Annapaviljoen biedt ruimte aan 10 neonaten met gemiddeld 5 post ic plekken. De post ic plekken zijn voor pasgeborene met een leeftijd vanaf 30 weken zwangerschapsduur.

Haal ook het beste uit jezelf en laat je inspireren door onze verpleegkundige visie.
Functie-eisen
Om in onze teams te passen werk je secuur en kwaliteitsgericht. Je bent integer en hebt veel inlevingsvermogen. Je bent goed in samenwerken en vindt innovatie meer dan alleen interessant. Verder ben je:
BIG-geregistreerd verpleegkundige met afgeronde specialisatie tot Neonatologieverpleegkundige
verantwoordelijk en gedreven om altijd de beste zorg te leveren door het werken volgens Evidence Based Practice
Wij bieden
Werken bij OLVG betekent een werkomgeving waar jij je optimaal kunt ontwikkelen. Want jouw wensen en ideeën doen ertoe. Zo doen we dat bij OLVG. Daarom bieden we jou:
minimaal € 2.882,- en maximaal €4.227,- bruto per maand (fulltime) in FWG-schaal 55 cao ziekenhuizen
dienstverband voor onbepaalde tijd
eindejaarsuitkering van ruim 8%
vakantiegeld van ruim 8%
144 uur vakantieverlof
goede reiskostenregeling
persoonlijk levensfasebudget van 57 uur verlof per jaar en de ruimte om te werken aan jouw eigen ontwikkelingswensen
pensioenregeling bij PFZW
voordeel op jouw ziektekostenpremie met onze collectieve ziektekostenverzekering. Kies uit IZZ of Zilveren Kruis Achmea
kortingen op verzekeringen en financiële diensten van Centraal Beheer Achmea
korting bij diverse lokale ondernemers, zoals eettentjes, cafés en sportcentra
onbeperkt toegang tot e-learnings en ons vitaliteitsprogramma
de keuze in arbeidsvoorwaarden die bij jou passen. Zie ons OLVG Meerkeuzesysteem Arbeidsvoorwaarden.
Deze arbeidsvoorwaarden zijn op basis van een fulltime dienstverband (36 uur per week).",-1,-1,https://indeed.nl/rc/clk?jk=e6077579cef5a8e7&from=vj&sjdu=A3Tk-YpbHEJGjqL7iunEd47lrWdEsChYsrezy26dPT8GoYwEQczSIQlFe-ase3Xz7UB-YqqL1wKX6X9N4S6mzj6URJVXNMDH6dWvco9NMKmOal-wzy31zmtSwnaJpWYR&spon=1&adid=358603299&mvj=0&vjfrom=vjs&pos=bottom&ad=-6NYlbfkN0A7HQ9gPNHJwXMTVbT1eE4LcCH7-gnZVDdOHxXcDkEoGWyBLllu1_77-8nsY9hhBHVEHxYEmDToyiygDmgvKy4HvtGfUsY2B7D71BvjJs6teRwUt9d5iIfljYS1_cCkjztDeu_lbLZoKtDHmHY01Tray8ZcF4bdIn6Vxqn0uMZUSCb7U_S91K0ddVU_-OV_HQnQmtwsI2pR3YpLKc6Y5KT4itv5HyFc5vvDTy0-hFsTS0kpudPQKeo_ikqOLFWOShcuhsypFQs6Amsewko4pMiGMf1wUR3BLSQdFaphoTkbyjojVhNEdx9t39mBzRbgTAXPnEsyC91UI2BukO5LyB41wbOv2HFh6Cj7ToK4JERmQ5pSNt3Y8halQKQ78I8YiIxUTSXy0GdxTCaTkRf90Dwz-6sh3mEx_b2nKP6umW8RqmL_qknpu3Kmf-6in7ferFF-nZsSNrvalN_bbL2L0B1BUywj5PvwDSW3UlaX6d5Pdj9kSSzwqLqhjiLoZuaeEkUd1x9pew6BPJtMk03IoQnSGHnyIWI-AsynOyvGDdysL0b5Ct3vf6U7mcEH7jnLHQSEsSQ5_YYEnoQue0zqC0rLjQBr1FXHq5xHXA3DlOwojZxrfTUlWj3t4CCeoddwoNihexMNwc-6T8d0kiZLI03AuMgMJ2ekp727u4QUbvH0jTY566ur5vIgnP4DWQ71GyWfPjOk1saarb2VMNzuJY82JuiRP-EXmnBTuBMOUK5aIBfkvQcSBK-C&astse=19dca4692ab720b3&assa=4164,https://nl.indeed.com/vacature-bekijken/pagead/clk?mo=r&ad=-6NYlbfkN0A7HQ9gPNHJwXMTVbT1eE4LcCH7-gnZVDdOHxXcDkEoGWyBLllu1_77-8nsY9hhBHVEHxYEmDToyiygDmgvKy4HvtGfUsY2B7D71BvjJs6teRwUt9d5iIfljYS1_cCkjztDeu_lbLZoKtDHmHY01Tray8ZcF4bdIn6Vxqn0uMZUSCb7U_S91K0ddVU_-OV_HQnQmtwsI2pR3YpLKc6Y5KT4itv5HyFc5vvDTy0-hFsTS0kpudPQKeo_ikqOLFWOShcuhsypFQs6Amsewko4pMiGMf1wUR3BLSQdFaphoTkbyjojVhNEdx9t39mBzRbgTAXPnEsyC91UI2BukO5LyB41wbOv2HFh6Cj7ToK4JERmQ5pSNt3Y8halQKQ78I8YiIxUTSXy0GdxTCaTkRf90Dwz-6sh3mEx_b2nKP6umW8RqmL_qknpu3Kmf-6in7ferFF-nZsSNrvalN_bbL2L0B1BUywj5PvwDSW3UlaX6d5Pdj9kSSzwqLqhjiLoZuaeEkUd1x9pew6BPJtMk03IoQnSGHnyIWI-AsynOyvGDdysL0b5Ct3vf6U7mcEH7jnLHQSEsSQ5_YYEnoQue0zqC0rLjQBr1FXHq5xHXA3DlOwojZxrfTUlWj3t4CCeoddwoNihexMNwc-6T8d0kiZLI03AuMgMJ2ekp727u4QUbvH0jTY566ur5vIgnP4DWQ71GyWfPjOk1saarb2VMNzuJY82JuiRP-EXmnBTuBMOUK5aIBfkvQcSBK-C&p=5&fvj=0&vjs=3,Meer dan 30 dagen geleden,Meer dan 30 dagen geleden,23/02/2021,en,Female
