,Search Keyword,Platform,Job ID,Job Title,Company Name,Location,Job Description,Rating,Employment Type,Company URL,Job URL,Job Age,Job Age Number,Collection Date,Language,Gender
11,accommodation,Indeed,p_c73a892c4257b1d1,Apprenticeship Program Opportunities,Microsoft, Schiphol,"Power Platform Apprenticeship Program
We believe that work should be a place for exploration, creativity, innovation, and professional growth. It’s all about getting inspired and motivated to achieve extraordinary things that will leave a lasting impact.
This Apprenticeship Program offers a unique learning and work experience, helping you accelerate your learning curve and preparing for future career. During this Apprenticeship at Microsoft the Netherlands, you will be learning from the finest in the business and experience an inspiring program helping you develop your professional skills and get ahead in a working environment.

Microsoft Power Platform
Microsoft Power Platform is an exciting area of growth and innovation in Microsoft’s business. The business applications industry is going through a major transformation. Our low code platform is at the heart of this business transformation, helping companies solve today’s most challenging business problems with ease and accelerate innovation.
This Apprenticeship Program will have a focus on helping customers to take advantage of the Microsoft Power Platform. Apprentices will learn about the Power Platform capabilities and fill in an active role in our go to market strategy and activities. Within this Apprenticeship Program we are looking for Sales, Marketing and Technical focused young talent shaping the success for our customers together. A great way to work alongside different Microsoft teams and learn together.

Program Highlights:
Skill Development: The Program offers you a unique combination of learning and working experience with the ability to develop your skills in different areas.
Technical Skills: Boost your Cloud skills thru in-depth learning, e-learning, hands-on sessions and labs, delivered to you by experts and community leaders. Get not only certified for the Microsoft Power Platform, but also get access to other online courses to get certified in Microsoft Cloud Technology (Azure, Dynamics 365 and Microsoft 365).
Digital Selling Skills: Develop your Digital Sales Skills by learning about how to increase customer engagement and maintain momentum with customers in a hybrid selling environment. Learn amongst others about Digital Selling, Active Listening, Storytelling and Design Thinking.
Modern Marketing: Build the capabilities and people skills you need as a modern marketer to continuously adapt and evolve in today's changing environment. Courses we offer will help you apply key marketing capabilities to your role. Learn amongst others about Storytelling, Data and Insights, Inclusive Marketing and Leadership.
Soft and Professional Skills: Develop your soft and professional skills thru available online training and on the job coaching.
Work in a fast-paced, collaborative and dynamic teaming environment with Marketing Professionals, Solution Professionals, (Inside) Sales Representatives and Consumption Managers to effectively manage opportunities and pipeline through the sales cycle.
Apprentice and MS Community: You will be invited to networking sessions, social activities, yammer group, Microsoft Teams, etc. which will give you the opportunity to learn from and connect with other apprentices, our leaders, business professionals and Aspires, in order to expedite your learning.
Mentorship: You will be assigned to a professional as mentor who can help you with career advice and share business insights and new perspectives to widen your horizon.
Responsibilities
Typical roles within the Apprenticeship Program are:

Product Marketing Manager
During this Apprenticeship you, will be representing our Power Platform products and services and presenting them to the world. With the knowledge of our latest technology, you will have to find its value proposition, design different creative marketing strategies, tell individuals and organizations how our technologies can benefit them – perhaps even change their lives. In this role you will work in the marketing organization closely with other product marketers and central marketing organization. We are looking for candidates who are passionate in technology, creative, interested in (digital) marketing and bring positive energy!

Customer Success Manager
The program provides university students a life-time rewarding experience to work on real and impactful projects, during this Apprenticeship, you will work alongside our customer success team and the Microsoft teams. With your technical knowledge and background, you will help to give technical presentations, build demonstrations, workshops, architecture design sessions, proofs of concepts, and pilots to explain, demonstrate, and prove to our customers the capabilities of Power Platform products and services, and how we can make their businesses more successful. We are looking for students from diverse backgrounds who are passionate in technology, agile and with the courage to break-through and make a difference to the society with a growth mind-set.

Business Development Manager
As a sales / business development manager you identify our customers’ pain points and solve them through the latest software and services solutions. You will be our customers’ trusted consultant, thoroughly evaluating the health of their IT platforms and development environments, diagnosing areas for improvement and help envision their future. You will be accountable for identifying growth opportunities and developing go to market plans to grow our business. Your solutions drive measurable value, helping customers run their businesses more efficiently and giving them a competitive edge in their marketplace. In this role you will work closely in the sales team, account executives and solution sales.
Qualifications
The program provides university students a life-time rewarding experience to work on real and impactful projects, facilitate the development of world-changing solution, network and collaborate with the brightest in the field of Marketing, Sales and Consumer-facing Technology within Microsoft. We are looking for students from diverse backgrounds who are passionate in technology, agile and with the courage to break-through and make a difference to the society with a growth mind-set.
Current university students from a recognized university degree
Available for minimum consecutive 5 months apprenticeships starting 2021.
Proven passion in technology
Interested in gaining experience in the craft of marketing, sales or business development.
For the technical roles experience in hands-on development is required.
Experience with Microsoft solutions will be a plus
Excellent communication and presentation skills.

Microsoft is an equal opportunity employer. All qualified applicants will receive consideration for employment without regard to age, ancestry, color, family or medical care leave, gender identity or expression, genetic information, marital status, medical condition, national origin, physical or mental disability, political affiliation, protected veteran status, race, religion, sex (including pregnancy), sexual orientation, or any other characteristic protected by applicable laws, regulations and ordinances. We also consider qualified applicants regardless of criminal histories, consistent with legal requirements. If you need assistance and/or a reasonable accommodation due to a disability during the application or the recruiting process, please send a request via the Accommodation request form.

Benefits/perks listed below may vary depending on the nature of your employment with Microsoft and the country where you work.",-1.0,-1,https://indeed.nl/rc/clk?jk=c73a892c4257b1d1&from=vj&mvj=0&vjfrom=vjs&pos=bottom&astse=86fa62877970e08d&assa=8420,https://nl.indeed.com/vacature-bekijken?jk=c73a892c4257b1d1&fccid=734cb5a01ee60f80&vjs=3,Meer dan 30 dagen geleden,Meer dan 30 dagen geleden,2021-01-20,en,Female
12,accommodation,Indeed,p_aa9fad5dfe5f84d3,EMEA Finance Analyst (Entry Level),Palo Alto Networks, AmsterdamDuivendrecht,"Company Description

Our Mission
At Palo Alto Networks®, everything starts and ends with our mission:
Being the cybersecurity partner of choice, protecting our digital way of life.
We have the vision of a world where each day is safer and more secure than the one before. These aren’t easy goals to accomplish — but we’re not here for easy. We’re here for better. We are a company built on the foundation of challenging and disrupting the way things are done, and we’re looking for innovators who are as committed to shaping the future of cybersecurity as we are.

Job Description

Your Career
Palo Alto Networks is looking for a motivated finance professional to join our EMEA Sales Finance team as Financial Analyst. This is an entry level position suitable for individuals who are early in their career with a minimum of 2 years of professional accounting experience.
We are looking for someone with an analytical mind, strong finance skills, who is a self-starter, a great communicator, and can adapt to a dynamic fast-paced environment.
Your Impact
Month-end close, forecasting and planning processes, utilizing internal financial forecast models, systems, and tools
Deliver monthly/quarterly quantitative and qualitative analysis of the financial results including variances to plan or to forecast, focusing on continuous improvement of efficiency & accuracy
Provide insightful and actionable data driven recommendations for decision making
Collaborate cross-functionally (e.g. HR, recruitment, accounting, sales operations) to continually improve alignment, consistency, processes, and procedures
Develop executive reports to communicate key trends, risks and opportunities
Participate in improving forecasting and reporting quality and reliability
Assist in preparing and developing 3 year business plan

Qualifications

Your Experience
Your Experience
At least 2 years of general accounting experience
Bachelor’s in Economics, Finance, Business Studies, Business Administration, or related subjects required. Master’s degree preferred
Fluency in English is a must, any additional languages will be considered a plus
Advanced Microsoft Excel skills with the ability to analyze large amounts of data and maintain complex financial models
Strong business and analytical skills
Deadline-driven, organized, and willingness to adapt to the rapid business and organizational demands that result from a high-growth environment
Strong relationship building, communication, and presentation skills
Quick learner and an independent, proactive working style
Ability to translate ideas into actions
Experience with and/or a willingness to master various financial systems, including SAP, BPC, Tableau, and other BI tools
Additional Information

The Team
You have a passion for numbers, our organization has a real passion for cybersecurity. You’re looking for a career with a more fulfilling mission. We have open positions to top talent seeking a financial challenge. Our finance department deals with numbers daily, supporting infrastructure, dealing in automation, building elegant models and solutions to empower our business lines and solutions. If you’re seeking a financial challenge but with a worldwide impact – this is it.
Our Commitment
We’re trailblazers that dream big, take risks, and challenge cybersecurity’s status quo. It’s simple: we can’t accomplish our mission without diverse teams innovating, together.
We are committed to providing reasonable accommodations for all qualified individuals with a disability. If you require assistance or accommodation due to a disability or special need, please contact us at accommodations@paloaltonetworks.com.
Palo Alto Networks is an equal opportunity employer. We celebrate diversity in our workplace, and all qualified applicants will receive consideration for employment without regard to age, ancestry, color, family or medical care leave, gender identity or expression, genetic information, marital status, medical condition, national origin, physical or mental disability, political affiliation, protected veteran status, race, religion, sex (including pregnancy), sexual orientation, or other legally protected characteristics.
All your information will be kept confidential according to EEO guidelines.",-1.0,-1,https://indeed.nl/rc/clk?jk=aa9fad5dfe5f84d3&from=vj&mvj=0&vjfrom=vjs&pos=bottom&astse=6e8e52de8ab7145e&assa=59,https://nl.indeed.com/vacature-bekijken?jk=aa9fad5dfe5f84d3&fccid=0562f887e2bed9ea&vjs=3,Meer dan 30 dagen geleden,Meer dan 30 dagen geleden,2021-01-20,en,Female
13,accommodation,Indeed,p_672ee8743c9591bf,Modern Service Management Professional,Microsoft, Schiphol,"Are you passionate about IT Service Management and the cloud? Do you love Microsoft technology, and have a passion for helping customers regarding process and optimization? Do you want to be part of an international team that has enabling solutions around cloud automation, governance and operations? If so, you might have found your dream job posting…

The face of business is continuously changing with Digital Transformation, AI, DevOps, blockchain etc. The IT Service Management principles of the past have evolved and so has our practice. Our new name – Modern Service Management – represents the shift from Customer Guidance to Customer Enablement and growing interest in turnkey solutions tailored for our customers’ environments that help them realize the value of their transformation journey. Our changed name also enhances our alignment to Microsoft's full technology portfolio and Microsoft’s overall Digital Transformation messaging.
How MSM helps
A lot of customers are not successful in or dissatisfied with their IT transformation. Usually not because of the technology falling short, but because of failure to adapt their people responsibilities, process flows and governance models. MSM addresses those components for cloud and other leading-edge transformations (Security, AI, etc.).

Our services remove operational blockers, accelerate cloud adoption and make the customer IT team a Microsoft advocate by enabling them to effectively plan, operate and control their modernized IT Services. This is a competitive differentiator from other cloud providers as we focus on upskilling our customers' IT organizations so they understand how their roles will change within the new cloud paradigm.
Responsibilities
As a Microsoft IT Service Management professional - or “Modern Service Management customer engineer” - you will be part of a Western Europe team of MSM professionals who sit in the Culture and Cloud Transformation Experience group. The work you do for customers is closely aligned with cloud success account managers, cloud solution architects and technical customer engineers and can range from shorter engagements – 1 to 2 week standard services – to longer custom ones. Your main goal will be to enable our customers to achieve business value through accelerated Cloud adoption, Digital transformation and productive use of Microsoft services and technologies aligned to our Cloud Strategy.
This is by nature a very independent role where you work and constantly learn in a in larger geographically dispersed team. Traits are: hold your own at the customer, seek out new initiatives, build on other people’s work, be creative and have fun.
Key Accountabilities
Success for an MSM customer engineer is measured by: overall customer satisfaction on the delivered service and how it was delivered; how you helped raise internal awareness of our MSM services but also if you spotted or even created opportunities to help customers do more with our MSM services. As with any Customer Engineering role, achievement of the expected utilization target is key to success.
Qualifications
Essential Experience
Demonstrated hands-on IT Service Management experience across several disciplines will be expected, with exposure and experience of transitioning IT services to cloud service providers an advantage.
Certification in ITIL® v2 Service Manager or ITIL® v3/4 Expert is a prerequisite. Or, ITIL® v3/4 Foundations with proven experience.
Technical/Functional Skills
Your background is preferably one with a technical focus and you have awareness of systems management technologies. Within your previous operations process experience you should be familiar with some of the following: Six Sigma methods, IT Governance frameworks such as Cobit, IT standards like BS15000 and ISO20000, SCRUM, Agile, SAFe, Lean IT.
Personal Attributes/Interpersonal Skills
Consulting mindset,
As communication is a key attribute of this role, you will need to be proficient in facilitating, presenting, consulting and as a matter of fact have excellent verbal and writing.
The ability to communicate at all levels of an organization from work floor, line management through to the CIO is critical to the success of the role. You need to be confident in articulating abstract concepts and argue these both verbally and in formal written documents.
Exceptional planning skills and well-organized.

If you think this job is for you, please go to https://aka.ms/caf and read up on Governance and Operations to get a feel for how we try to make our cloud practical for our customers. If this did not scare you, you just have prepared for your first interview.

Microsoft is an equal opportunity employer. All qualified applicants will receive consideration for employment without regard to age, ancestry, color, family or medical care leave, gender identity or expression, genetic information, marital status, medical condition, national origin, physical or mental disability, political affiliation, protected veteran status, race, religion, sex (including pregnancy), sexual orientation, or any other characteristic protected by applicable laws, regulations and ordinances. We also consider qualified applicants regardless of criminal histories, consistent with legal requirements. If you need assistance and/or a reasonable accommodation due to a disability during the application or the recruiting process, please send a request via the Accommodation request form.

Benefits/perks listed below may vary depending on the nature of your employment with Microsoft and the country where you work.",-1.0,-1,https://indeed.nl/rc/clk?jk=672ee8743c9591bf&from=vj&mvj=0&vjfrom=vjs&pos=bottom&astse=68e30b54d0c431ef&assa=1361,https://nl.indeed.com/vacature-bekijken?jk=672ee8743c9591bf&fccid=734cb5a01ee60f80&vjs=3,Meer dan 30 dagen geleden,Meer dan 30 dagen geleden,2021-01-20,en,Female
14,accommodation,Indeed,p_4a71fdfef373c7e0,Study Start-Up Assistant,CATO SMS, Schiphol,"CATO SMS is a full-service contract research and development organization with international resources dedicated to helping pharmaceutical and biotechnology companies efficiently and expeditiously navigate the regulatory approval process in order to bring new drugs, biologics, and medical devices to the people who need them. CATO SMS is a non-laboratory environment.
We are currently recruiting for a Study Start-up Assistant to join our team in the Cologne, Germany or Schiphol, the Netherlands location . The Study Start-Up Assistant provides administrative support to all activities of the Study Start-up department within CATO SMS’ Clinical Trial Operations. This includes tasks related to site selection and feasibilities, site contracting, and submissions.
 Responsibilities:
Assist in the preparation of Clinical Trial Application documents for submission to competent authorities, ethics committees or any other authoritative body e.g., by creating documents, compiling packages, completing trackers, adapting templates, and following-up with authoritative bodies
Support Feasibilities, e.g. by supporting the creation of a potential site list, preparation of Confidentiality Agreements, outreach to sites, and collecting and tracking feasibility responses
Support Site Contracting, e,g. by tracking progress, sending reminders, performing quality checks, arranging signatures.
Support Study Start-up by filing and tracking documents, as well as tracking of departmental metrics and KPI
Support in the preparation of study-related presentation materials
Qualifications:
Life science, healthcare and/or business degree
Basic knowledge of ICH-GCP, privacy legislation (GDPR and/or HIPPA), regulations (CTR/CTD and/or CFR), and/or applicable local regulatory requirements
At least 1 year of experience in clinical trials
Skills:
Strong written and verbal communication skills including good command of English language
Representative, outgoing and client focused
Process orientated
Ability to work in a fast-paced challenging environment of a growing company
Administrative excellence with attention to detail and accuracy
Proficiency with various computer applications such as Word, Excel, and PowerPoint required

Equal Employment Opportunity and Affirmative Action
Cato Research LLC is committed to Equal Employment Opportunity and Affirmative Action. We recruit, hire, train and promote qualified persons in all job titles and ensure that all other personnel actions are administered without regard to race, religion, color, national origin, citizenship, sex, sexual orientation, gender identity, age, marital status, military and/or veteran status, or disability. Furthermore, to the extent required by applicable laws and/or Executive Orders, we take affirmative action to ensure that minority group individuals, females, disabled veterans, recently separated veterans, other protected veterans, Armed Forces service medal veterans, and qualified disabled persons are introduced into our workforce and considered for promotional opportunities. Cato Research, LLC is committed to providing reasonable accommodations to employees and applicants with disabilities to the full extent required by the Americans with Disabilities Act - ADA. If you feel you need a reasonable accommodation pursuant to the ADA, you are encouraged to contact us at 919.361.2286.",-1.0,-1,https://indeed.nljavascript:void(0);,https://nl.indeed.com/vacature-bekijken?jk=4a71fdfef373c7e0&fccid=5fd8303895d83506&vjs=3,Meer dan 30 dagen geleden,Meer dan 30 dagen geleden,2021-01-20,en,Female
15,accommodation,Indeed,pj_68fdfd2b272e0e56,Warehouse Employee,Actief Werkt, Aalsmeer,"Are you interested to work as a part-time Warehouse employee in Aalsmeer?

The work takes place in a flower auction warehouse!

Job positions:

Production work.Order-picking.Voice picking.Driving electric cart with flowers.

In this job you will work together with colleagues in a team!

Working days and hours:

Monday till Friday from 6:00 until 10.00-13.30.
You can also work 3 days a week (Monday and Friday are manditory working days)
Wat vragen wij van je:

Requirements:

You can communicate well in English or Dutch.You are at least 165 cm tall due to safety requirements.You are able to perform physical work.You have your own accommodation and live in the surroundings of Aalsmeer.We don't offer accommodation!You have your own transportation.Motivated and active attitude.
Wat wij jou bieden:

We offer:

The salary we offer:
After 8 weeks you will receive €11,66 bruto/hour.(22+)Weekly payment of your salary!Also, 8,33% brutto holiday allowance and vacation days.Travel allowance between 10,1 - 50 km/day.Bonus: every 3 months you get a special plant/flowers as a gift.

Interested?

Apply online or send an email with your CV to hrbloemenveiling@actiefwerkt.nl.
After we have received your application we will invite you for a intake interview and a tour to show you the workplace!
Questions call 06-12535283.",-1.0,-1,https://indeed.nl/rc/clk?jk=68fdfd2b272e0e56&from=vj&sjdu=vTIXY0QzJd69etEjxEC_16MiCve1jX1R4i4TwKHoYbm3_737gaBUSguDzxpggSxiGl1j41BWyG4UVrAJI_v2KQ&spon=1&adid=310734306&mvj=0&vjfrom=vjs&pos=bottom&ad=-6NYlbfkN0DNxxK6OC0U3H7iZ8H5lM8JmgmA2PMnm5Le5v0Ys-wf1RijetKAh-VnhzQEBIF5KS-2TARvHQvP2v8HhBjK8MAYplM8Q4KR0UOm9yjPSlQySJGoYoA3vZGcy2hHhBaA0nTSyBklqEmIwP0COhw46Yb0lwFeNqr0DUKy7zfSp9YtmzVehIKlD54wMBoMEXP5ax93zmgyVeT8J2pxAGSnHWwND1qW2QgpOmAzrPlUSbe93vEZybV8uOcTTy2TMM3CUNtb6P3CvjEmHaog_06A-jtEy6_XRFi0KpZS3i5yJyi4EVOay5yOp09EgO4f337mEivDvP_yMb9nBSHh1iVG7Qp4jsLFuPvOpP1DrS_mql1ZzBJqqp9g6YRlBMhsTbHmIVap2LTJobleO_q7Qds3iqOUBHBR4sw5L2vScaMHPhjQqdhf8q5vXjxzo3OIsQgkeHSCuOAaf7J1KCb9isMj86JazlOY_Hd89AsYFj5y-bEdjmtu3JUX0HEWVr4G-7l7oNv9L-87qI207j9UKVYXF94tWi7-NabzX7YbumCTCqNZbwawy7xZCzCAY55cZ5xZ-uh9KXGPKi0w-7OZQiCzgCvgzUcpCsSk7xYSoyq4K1YjqhMZCUhP5s5iwmkZ8r5Xg2G5kX29Absbq4GKubO3Aw-oZIalkvIJS_mP7xkfLXhgNPbK9uzHlevjzU6YIJ5vrPo=&astse=4fe678a53c255d46&assa=985,https://nl.indeed.com/vacature-bekijken/pagead/clk?mo=r&ad=-6NYlbfkN0DNxxK6OC0U3H7iZ8H5lM8JmgmA2PMnm5Le5v0Ys-wf1RijetKAh-VnhzQEBIF5KS-2TARvHQvP2v8HhBjK8MAYplM8Q4KR0UOm9yjPSlQySJGoYoA3vZGcy2hHhBaA0nTSyBklqEmIwP0COhw46Yb0lwFeNqr0DUKy7zfSp9YtmzVehIKlD54wMBoMEXP5ax93zmgyVeT8J2pxAGSnHWwND1qW2QgpOmAzrPlUSbe93vEZybV8uOcTTy2TMM3CUNtb6P3CvjEmHaog_06A-jtEy6_XRFi0KpZS3i5yJyi4EVOay5yOp09EgO4f337mEivDvP_yMb9nBSHh1iVG7Qp4jsLFuPvOpP1DrS_mql1ZzBJqqp9g6YRlBMhsTbHmIVap2LTJobleO_q7Qds3iqOUBHBR4sw5L2vScaMHPhjQqdhf8q5vXjxzo3OIsQgkeHSCuOAaf7J1KCb9isMj86JazlOY_Hd89AsYFj5y-bEdjmtu3JUX0HEWVr4G-7l7oNv9L-87qI207j9UKVYXF94tWi7-NabzX7YbumCTCqNZbwawy7xZCzCAY55cZ5xZ-uh9KXGPKi0w-7OZQiCzgCvgzUcpCsSk7xYSoyq4K1YjqhMZCUhP5s5iwmkZ8r5Xg2G5kX29Absbq4GKubO3Aw-oZIalkvIJS_mP7xkfLXhgNPbK9uzHlevjzU6YIJ5vrPo=&p=1&fvj=1&vjs=3,Meer dan 30 dagen geleden,Meer dan 30 dagen geleden,2021-01-23,en,Female
