,Search Keyword,Platform,Job ID,Job Title,Company Name,Location,Job Description,Rating,Employment Type,Company URL,Job URL,Job Age,Job Age Number,Collection Date,Language,Gender
83,social worker,Indeed,p_76e428951985e3b2,Psychiater,Parnassia, Zaandam,"Psychiater
Ook nu in coronatijd werven wij door: Parnassia zoekt voor de Crisisdienst Noord-Holland een psychiater.
Dit ga je doen
Ben jij een gedreven psychiater met een optimistische instelling?

De Acute Keten bestaat naast de Crisisdienst uit IBT, Acute Dagbehandeling en de Open Opnamekliniek Ilpendamstraat (23 bedden).

Je komt te werken in een multidisciplinair, hecht team van enthousiaste collega’s, die er belang aan hechten om volop in ontwikkeling te zijn en te blijven.

Verantwoordelijkheden:
Je verricht het psychiatrisch onderzoek, in aansluiting op de intake door de verpleegkundige of maatschappelijk werker, en draagt zorg voor de juiste diagnostiek en behandeling
Je geeft supervisie en werkbegeleiding aan de AIOS, ANIOS, HAIO en verpleegkundigen
Je draagt bij aan deskundigheidsbevordering, zowel intern als aan externe collega’s en instanties
Je bent mede verantwoordelijk voor het verbeteren en ontwikkelen van de kwaliteit en inhoud van het zorg- en behandelaanbod
Als je opteert voor de functie manager zorg geef je mede vorm en sturing aan verdere ontwikkelingen, het kwaliteitsbeleid en het implementeren van innovaties binnen de gehele Acute Keten
Deze functie is te combineren met andere vacatures binnen Parnassia Noord-Holland.
Dit ben jij
Je hebt een afgeronde opleiding tot psychiater en bent als zodanig BIG geregistreerd
Je hebt de volgende eigenschappen: tact, stressbestendigheid, optimisme, inlevings- en doorzettingsvermogen, ondernemend
Je kunt een team meenemen in een veranderingsproces
Om in aanmerking te komen voor deze functie is een positieve Verklaring Omtrent Gedrag (VOG) vereist.
Het natrekken van referenties, integriteitscontrole via het Waarschuwingsregister Zorg & Welzijn en het controleren van diploma’s maken onderdeel uit van de sollicitatieprocedure.
Wij bieden
Wij bieden onze collega’s gevarieerd en zinvol werk in een professionele en prettige werkomgeving. Daarbij hoort natuurlijk een goed pakket aan arbeidsvoorwaarden conform cao GGZ. Klik hier voor meer informatie over onze arbeidsvoorwaarden.

Het betreft een functie voor 24-36 uur per week. Je krijgt een contract voor onbepaalde tijd. Het salaris bedraagt minimaal € 5318,- en maximaal € 9294,- (FWG AMS) bruto per maand op basis van een werkweek van 36 uur.
Werken bij Parnassia Groep
Parnassia is gevestigd in de regio's Haaglanden en Noord-Holland. Wij behandelen en begeleiden volwassenen met ernstige psychiatrische aandoeningen (EPA) en ouderen met psychiatrische problemen of dementie.

Parnassia is onderdeel van Parnassia Groep, een werkgever in de geestelijke gezondheidszorg die streeft naar een inclusieve cultuur met gelijke kansen voor iedereen. We maken geen onderscheid op gebied van geslacht, geloof, sociale achtergrond, geaardheid of etniciteit. Wij vinden het belangrijk om van en mét elkaar te leren, dat iedereen zichzelf kan zijn en een ieder zich gewaardeerd voelt. Bij ons kun je bijdragen aan tal van specialisaties, wetenschappelijke onderzoeken en via onze eigen Parnassia Groep Academie gebruik maken van (geaccrediteerde) opleidingsmogelijkheden. Alleen in een werkomgeving waarin we openstaan voor verschillen, halen we het beste uit onszelf, kunnen we creatieve en innovatieve oplossingen bieden voor onze patiënten en succesvol zijn.
Interesse?
Voor meer informatie over de vacature kun je contact opnemen met Marieke van de Ven-Dijkman, psychiater en directeur zorg Volwassenen Parnassia Noord-Holland, via 06-53331127 of met Martijn Heijdra, manager bedrijfsvoering Acute Keten Noord-Holland, via 06-22006904.",-1,-1,https://indeed.nl/rc/clk?jk=76e428951985e3b2&from=vj&mvj=0&vjfrom=vjs&pos=bottom&astse=55e97d8cdb251909&assa=1619,https://nl.indeed.com/vacature-bekijken?jk=76e428951985e3b2&fccid=cfda046816edda9e&vjs=3,Meer dan 30 dagen geleden,Meer dan 30 dagen geleden,23/02/2021,en,Female
84,social worker,Indeed,p_e0b079df231fd4b8,Psychiater ZZP Kind- en jeugdteam,BKV, Heemskerk,"Spreekt dit jou aan?
Door jouw manier van benaderen ben jij dé onmisbare schakel in de behandeling van complexe traumasymptomen bij kinderen. Zzp-opdracht voor 8 uur, gecombineerde opdracht is mogelijk.
Jouw nieuwe baan
Jij weet als geen ander: elk kind is anders en ontwikkelt zich ook anders. Net zoals dat jij weet dat er soms situaties zijn waarbij ouders en kind gespecialiseerde hulp nodig hebben. Denk aan psychologische, sociale en / of medische interventies. Jij sluit aan bij de hulpvraag van het kind en zijn ouders.
In de behandeling van kinderen met complexe traumasymptomen ben jij dé onmisbare schakel. Zo ook bij de uitvoering van wetenschappelijk trauma gerelateerd onderzoek. Voor het bepalen van de juiste aanpak is jouw inzet van gespecialiseerde diagnostiek van groot belang.
De behandelingen waar de cliënten op kunnen rekenen zijn evidence based. Denk aan EMDR en traumagerichte cognitieve gedragstherapie (TGCGT).
Andere werkzaamheden zijn onder meer:

farmacotherapie;
psychotherapie;
diagnostisch onderzoek;
crisisbeoordelingen;
consultatie aan medisch specialisten en huisartsen.
Jouw nieuwe werkplek
Jij werkt in Hoofddorp bij een organisatie die kinderen jongeren en familie begeleidt bij complexe problematiek en zich kenmerkt door de combinatie van opvoedhulp en jeugd-ggz. Speerpunt is het recht op maximale ontwikkelingsmogelijkheden voor kinderen en jongeren.
Op deze locatie werken meer dan 15 collega’s. Onder meer psychiaters, teamleider, secretariaat, een klinisch psycholoog (in opleiding). Maar ook GZ-psychologen (in opleiding), een arts, systeemtherapeut, maatschappelijk werker en ambulant behandelaren.
Dit open en betrokken team houdt van aanpakken en respecteert elkaar. De sfeer binnen het team is laagdrempelig maar ook ontwikkelend en iedereen is oprecht geïnteresseerd in elkaar. Een doorsnee dag bestaat hier niet. Maar over het algemeen valt te zeggen dat de teamleden de cliënten zien en hebben ze via beeldbellen, face to face of via een online platform contacten.
Met je collega’s heb je multidisciplinair overleg en intervisie. Maar ook is er intervisie en contact met scholen en verwijzers. Soms heb je crisisgevallen.
Wat breng je mee?
Als BIG-geregistreerde psychiater hebt jij eerder gewerkt met getraumatiseerde jongeren, kinderen en hun familie. Jouw collega’s vinden je makkelijk in de omgang en merken dat jij een positieve bijdrage aan het team levert.
In overleggen neem jij bijvoorbeeld graag de leiding en je bent een actief en inspirerend persoon. Kortom: jij neemt graag het voortouw en weet je collega’s te inspireren.
Arbeidsvoorwaarden
Deze zzp-opdracht staat uit voor minimaal 8 uur in de week. Het is mogelijk om deze opdracht te combineren met de zzp-opdracht die BKV voor de locatie in Heemskerk heeft uit staan. In dat geval werk je 16 uur in de week. Voor meer informatie over bijvoorbeeld je uurtarief neem je contact op met Eveline van BKV.
Verdere informatie
Is deze vacature niet helemaal wat je zoekt? Geef je baanwensen door via de job alert, dan ontvang je passende
vacatures. Voor uitgebreide informatie kun je contact opnemen met Senior Consultant Healthcare Eveline van den Bos via + 31 888 – 22 55 88. Zij is telefonisch en via WhatsApp bereikbaar via +31 6 – 34 55 47 52 of per mail via Eveline@bkv.jobs",-1,-1,https://indeed.nl/rc/clk?jk=e0b079df231fd4b8&from=vj&mvj=0&vjfrom=vjs&pos=bottom&astse=89b57ef2aaf79b0c&assa=2992,https://nl.indeed.com/vacature-bekijken?jk=e0b079df231fd4b8&fccid=9cf283ce88e44a34&vjs=3,Meer dan 30 dagen geleden,Meer dan 30 dagen geleden,23/02/2021,en,Female
85,social worker,Indeed,p_1f9e0e106fec8156,Casemanager dementie,Derec, Amsterdam,"Voor een fijne organisatie in Amsterdam zijn wij op zoek naar een gediplomeerd casemanager dementie, vanaf half maart t/m half augustus 2021. Het gaat om een parttime functie van ongeveer 18-20 uur per week. Als casemanager dementie speel jij een belangrijke rol bij de continuïteit en coördinatie van zorg rondom de cliënten, met als doel dat zij zo lang mogelijk op een prettige en veilige manier thuis kunnen blijven wonen. Ben jij de casemanager die wij zoeken? Reageer dan snel!
Hier ga je aan de slag
Deze Amsterdamse zorgorganisatie biedt verschillende soorten zorg, zowel intra- als extramuraal. Er is veel structuur, begeleiding en ondersteuning waardoor de cliënten altijd weten waar zij aan toe zijn. Samen met jouw collega's kennen jullie de bewoners/cliënten door en door, waardoor zorg op maat geboden kan worden. Je bent hierdoor een groot onderdeel van het leven van alle cliënten. Zo maken jullie het verschil voor de bewoners, zeker in deze onzekere en bizarre tijd! Naast de verzorgers en verpleegkundigen, lopen er hier ook behandelaren zoals specialisten ouderengeneeskunde, fysiotherapeuten, ergotherapeuten, psychologen en ander maatschappelijke werkers rond.
Dit ga je doen
Je stelt een zorgdiagnose op en maakt een multidisciplinair zorgleefplan;
Je kan voorlichting geven over het onderwerp 'dementie';
Je werkt multidisciplinair;
Je coördineert en evalueert de hulpverlening rondom de cliënt;
Je werkt mee aan beleid en ontwikkeling rondom dementie zorg;
Je begeleidt de cliënt en zijn omgeving.

Wat we van jou verwachten
Je hebt het diploma hbo casemanagement dementie;
Je hebt ervaring in de extramurale ouderenzorg en kennis van dementie;
Je kent de sociale kaart van Amsterdam;
Je bent in staat schijnbaar tegengestelde belangen op elkaar af te stemmen;
Je houdt het overzicht op complexe zorgsituaties en hakt knopen door.
Dit bieden wij
Mijn werk draait om jou. Daarom houd ik het persoonlijk en zorgen wij bij Derec goed voor je. We vinden altijd een balans tussen jouw wensen en die van je nieuwe werkgever.

Is je interesse gewekt? De organisatie doet je graag een goed aanbod.

Zij bieden jou:

Uitstekende arbeidsvoorwaarde;
Reiskostenvergoeding;
Een afwisselende en super leuke functie;
Persoonlijk opleidingsbudget;
Uren en dagen in overleg met jou;
Een hecht, warm en collegiaal team;
Flexibiliteit of vastigheid, afhankelijk van jouw eigen wensen.

Voor meer informatie over deze vacature kun je contact opnemen met mij, Gijs Oosterveld, op 06-12631989 of via Gijs@derec.nl. Ook wij houden ons aan de maatregelen, daarom vinden de kennismakingen plaats via videobellen.",-1,-1,https://indeed.nl/rc/clk?jk=1f9e0e106fec8156&from=vj&mvj=0&vjfrom=vjs&pos=bottom&astse=6cfa2241e2fda103&assa=4537,https://nl.indeed.com/vacature-bekijken?jk=1f9e0e106fec8156&fccid=9cf65a9e1f528f3f&vjs=3,Meer dan 30 dagen geleden,Meer dan 30 dagen geleden,23/02/2021,en,Female
86,social worker,Indeed,p_2df0812fcab94635,Verpleegkundig Specialist FACT team Gooi en Vechtstreek,Jellinek, Hilversum,"Werken bij dé expert in verslavingszorg, Jellinek, én bij jou in de buurt? Dit is jouw kans om ons FACT-team in de Gooi- en Vechtstreek te kunnen versterken!
Organisatie: Jellinek
Geplaatst op: 4 januari 2021
Sluitingsdatum: 1 maart 2021
Vacaturenummer: 21013
Min. aantal uren: 24
Max. aantal uren: 32
Locatie: Hilversum
Opleiding: HBO
Contracttype: Regulier contract
Recruiter: Evelien van der Laan
Waar hebben we jouw talent voor nodig?
De zorg vanuit de FACT teams is ambulant en outreachend en wordt gegeven door een vast zorgteam dat ook bij eventuele opnames blijft coördineren. Het behandelaanbod binnen de FACT teams werkt zo veel mogelijk volgens de CRA methodiek (community reinforcement approach) en herstelgericht werken. De multidisciplinaire teams bestaan onder andere uit psychiaters, (GZ)psychologen, social worker, sociaal psychiatrisch verpleegkundigen, ambulant verpleegkundigen/werkenden en trajectbegeleiders.

We werken vanuit een herstelvisie. Vanuit medisch perspectief gaat het om de afname van klachten en symptomen. Vanuit cliëntperspectief gaat het om unieke persoonlijke processen waarin cliënten proberen de draad weer op te pakken, de regie te hervinden en hun leven opnieuw inhoud en richting te geven. Hierbij gaan we uit van mogelijkheden van de cliënt met respect voor de beperkingen.
Wat zijn je werkzaamheden als Verpleegkundig Specialist bij ons in het team?

In het diagnostisch proces verricht je intakes en/ of (neuro)psychologisch onderzoek;
Je levert een bijdrage aan het multidisciplinair behandelplan en de indicatiestelling voor voortgezette behandeling;
Je voert behandelingen uit, gericht op verslaving, co-morbiditeit en herstel door middel van oa CGT en EMDR;
Je bent actief in het mee ontwikkelen van nieuw behandelaanbod en ondersteunt je team in deskundigheidsbevordering;
Je wordt ingezet voor teamoverstijgende werkzaamheden.
Wie ben jij?
Je bent een BIG geregistreerd met diploma Verpleegkundig Specialist GGZ;
Je hebt affiniteit met cliënten met verslaving, de EPA doelgroep en daaraan gerelateerde problematiek;
Je bent in staat het regiebehandelaarschap uit te voeren;
Je hebt ervaring met farmacologische behandeling passend bij de doelgroep;
Je hebt ervaring met (neuro)psychologisch onderzoek;
Je bent zelfstandig en assertief en voelt je goed bij de dynamiek van het ambulante werkveld;
Jij gelooft herstel, je denkt in oplossingen en mogelijkheden.

Het overleggen van een Verklaring Omtrent Gedrag maakt onderdeel uit van de aanstellingsprocedure.
Wat krijg je van ons?
Leuke locatie in Hilversum en gemotiveerd team.
Je krijgt de beschikking over een lease auto voor het bezoeken van cliënten in de gehele regio Gooi & Vechtstreek. Deze auto deel je met je team.
Het betreft een arbeidsovereenkomst van 24 tot 32 uur per week. Een contract voor onbepaalde tijd is altijd bespreekbaar.
Arbeidsvoorwaarden en salariëring zijn volgens de CAO GGZ, schaal 65 (maximaal €5439,-)
Eindejaarsuitkering van 8,33%, 8% vakantiegeld en je bouwt een goed pensioen op bij Pensioenfonds Zorg en Welzijn.
Een breed (intern) scholings- en trainingsaanbod en wij denken graag mee met jouw loopbaanwensen.
Jellinek/Arkin kent aantrekkelijke aanvullende arbeidsvoorwaarden zoals vergoeding van OV, vitaliteitsbudget, collectieve regelingen zoals een zorgverzekering en een fietsplan.

Je krijgt toegang tot Nrgize een platform met allerlei (deels gratis) sportieve activiteiten: van boksclinics tot windsurfen, daarnaast krijg je onbeperkt toegang tot het online trainingsaanbod van 'Good Habitz'.
Wie zijn wij?
Jellinek is dé expert op het gebied van verslaving in Nederland. Verslaving kan iedereen treffen!
Wij behandelen dan ook een zeer diverse cliëntengroep, voor zowel gedragsverslaving als middelenafhankelijkheid. Onze behandelingen zijn licht als het kan, intensief als het moet, maar altijd effectief en innovatief. Dit zie je terug in de werkwijze en cultuur bij Jellinek.
De FACT teams werken met de doelgroep van cliënten met chronische, complexe psychiatrische en verslavingsproblematiek (EPA). Er is sprake van ernstige psychosociale problematiek en uitval op sociaal maatschappelijk functioneren. Deze cliënten zijn over het algemeen zorgmijdend en kennen vaak een lange geschiedenis van hulpverleningscontacten en uitval uit de reguliere behandelingen.
Jellinek is een onderdeel van Arkin. Arkin is een overkoepelende stichting die 12 merken omvat die psychiatrische- en verslavingszorg bieden. Arkin is ook een opleidingsinstituut en verricht wetenschappelijk onderzoek.
Wil je meer weten?
Voor meer informatie kun je contact opnemen met Carlijn de Vries (manager behandelzaken), telefoon 06-10350926 of Franca Hasenbos (manager bedrijfsvoering), telefoon 06 – 11911673.",-1,-1,https://indeed.nl/rc/clk?jk=2df0812fcab94635&from=vj&mvj=0&vjfrom=vjs&pos=bottom&astse=8045c53d3685da59&assa=5763,https://nl.indeed.com/vacature-bekijken?jk=2df0812fcab94635&fccid=e08860f1fb3c1279&vjs=3,Meer dan 30 dagen geleden,Meer dan 30 dagen geleden,23/02/2021,en,Female
87,social worker,Indeed,p_fd0b64f256867776,Master-psycholoog / Orthopedagoog,Inforsa, Amsterdam,"Wij behandelen vanuit verantwoordelijkheid, vertrouwen en verbinding. Samen met de cliënt zorgen we voor een veilige terugkeer naar de maatschappij. Bij ons is er genoeg ruimte om je eigen expertise te ontwikkelen en toe te passen. Wat ons kenmerkt is een energiek en veilig opleidingsklimaat. Kom jij ons team versterken?
Organisatie: Inforsa
Geplaatst op: 15 februari 2021
Sluitingsdatum: 15 maart 2021
Vacaturenummer: 21160
Min. aantal uren: 32
Max. aantal uren: 36
Locatie: Amsterdam, Duivendrechtsekade
Opleiding: WO
Contracttype: Regulier contract
Recruiter: Sebastiaan Honders
Waar hebben we jouw talent voor nodig?
Bij de Hoog Intensieve Beveiligde Zorg (HIBZ) werk je met cliënten met een psychotische kwetsbaarheid, bij wie een ontregeling heeft geleid tot grensoverschrijdend gedrag met een strafrechtelijke veroordeling tot gevolg.Hier werk je met cliënten die gedrag vertonen dat tot ontwrichting leidt in de maatschappij of elders in de zorg. De HIBZ is bedoeld om met een korte opname het gedrag te stabiliseren.

Onder regie-behandelaarschap van een psychiater en met reguliere werkbegeleiding van een GZ-Psycholoog heb je een belangrijke rol in het behandeltraject van de cliënten. Je volgt het traject van jouw cliënten, je betrekt andere disciplines en naastbetrokkenen daarbij en stemt acties op elkaar af. Zelf bied je korte behandeltrajecten en met de psychiater verzorg je spreekuren. Ook coördineer je de uitstroom van de cliënten naar een andere behandel- of verblijfsomgeving.

Je bent deel van het multidisciplinaire behandelteam bestaande uit verpleegkundigen, sociotherapeuten, maatschappelijk werker, psychiater, arts-assistent en de manager bedrijfsvoering, Je deelt jouw expertise met het team, bijvoorbeeld in casuïstiekbesprekingen en/of intervisies. Daarnaast ben je onderdeel van de vakgroep psychologen wat maakt dat jij naast jouw werkzaamheden op de afdeling nog een aantal behandelcontacten (CGT/EMDR) hebt lopen, incl. een diagnostiek casus (delictanalyse of psychologisch onderzoek).
Wie ben jij?
Je bent afgestudeerd psycholoog/orthopedagoog, met een basisaantekening diagnostiek;
Je hebt bij voorkeur 2 jaar ervaring als psycholoog/orthopedagoog opgedaan na jouw academische opleiding. Je hebt affiniteit met de forensische doelgroep en bij voorkeur ervaring met de behandeling van psychose, verslaving en trauma;
Je staat sterk in je schoenen en hebt de nodige levenservaring;
Je hebt goede communicatieve vaardigheden en o.a. vanuit kennis over teamdynamieken;
weet je een positieve bijdrage aan het behandelklimaat te leveren;
Je bent flexibel, neemt verantwoordelijkheid en kunt goed samenwerken;
Je hebt een goed organisatorisch vermogen en denkt graag vooruit;
Je kunt goed relativeren, bijvoorbeeld met humor, en bent stressbestendig.

Het overleggen van een Verklaring Omtrent Gedrag maakt onderdeel uit van de aanstellingsprocedure.
Wat krijg je van ons?
Het betreft een jaarcontract met verlengingsmogelijkheden;
Arbeidsvoorwaarden en salariëring zijn volgens de CAO GGZ en schaal 60;
Arkin kent aantrekkelijke aanvullende arbeidsvoorwaarden. Natuurlijk een uitstekende OV-regeling en collectieve regelingen zoals een zorgverzekering en een fietsplan. Maar ook toegang tot een vitaliteitsplatform, vanwaar je allerlei sportieve activiteiten kunt ondernemen zoals boksclinics of windsurfen;
Arkin zal investeren in jouw ontwikkeling: 12 merken, 1 loopbaan. Onze kliniek heeft een actief opleidingsklimaat op het gebied van trauma, verslaving, psychose;
Je kunt bij Arkin je VGCt registratie behalen of in opleiding tot EMDR-therapeut.
De locatie Duivendrechtse Kade beschikt over een eigen parkeerterrein voor medewerkers.
Wie zijn wij?
Inforsa biedt behandeling, begeleiding en reclasseringsprogramma’s voor volwassenen met complexe meervoudige problemen op psychiatrisch en forensisch gebied.

De Hoog Intensieve Beveiligde Zorg (HIBZ) is onderdeel van onze Forensisch Psychiatrische Kliniek (FPK) te Amsterdam. De FPK bestaat uit 7 afdelingen met in totaal ca 150 fte. In de kliniek verblijven cliënten met psychiatrische problemen. Wij nemen cliënten op uit het hele land. De cliënten verschillen op gebied van psychiatrische problematiek, de ernst van het delict, de culturele achtergrond en het juridisch opnamekader. De FPK is gespecialiseerd in de behandeling van forensische cliënten met een psychotische stoornis. Daarnaast hebben onze cliënten vaak een verslaving, persoonlijkheidsstoornis, traumatische ervaringen, autisme of een licht verstandelijke beperking. Onze werkwijze en huisvesting zijn afgestemd op een veilige behandeling en begeleiding van onze cliënten.

De HIBZ is sinds 2019 onderdeel van de FPK. Deze afdeling voor hoog intensieve en beveiligde zorg neemt cliënten op met ontwrichtend gedrag. Hier wordt met de Forensic High and Intensive Care (FHIC) methode behandeld. De afdeling dient als verlengstuk van de crisisketen en neemt cliënten op vanuit Arkin, InGeest en het AMC. De cliënten op de HIBZ hebben geen justitiële maatregel.

Inforsa is onderdeel van Arkin. Arkin is een overkoepelende stichting die 12 merken omvat die psychiatrische- en verslavingszorg bieden in de regio's Amsterdam en Utrecht. Arkin is ook opleidingsinstituut en verricht wetenschappelijk onderzoek.
Wil je meer weten?
Bij vragen over deze vacature kun je contact opnemen met Claire Steenbergen (Manager Bedrijfsvoering I), telefoon 0650528789 of 0205901035.",-1,-1,https://indeed.nl/rc/clk?jk=fd0b64f256867776&from=vj&mvj=0&vjfrom=vjs&pos=bottom&astse=82c347a79e28137c&assa=6992,https://nl.indeed.com/vacature-bekijken?jk=fd0b64f256867776&fccid=1e98ad7130230bba&vjs=3,Meer dan 30 dagen geleden,Meer dan 30 dagen geleden,23/02/2021,en,Female
88,social worker,Indeed,p_f91429f85d7fe594,Psychiater kind en jeugd,Spijtenburg, Hoofddorp,"Wat ga je doen?

Heb jij als psychiater al eerder gewerkt met getraumatiseerde kinderen, jongeren en hun gezinnen? Werk je graag in een multidisciplinair team en wil je werken volgens flexibele werktijden? Dan is deze psychiater vacature iets voor jou!
Je bent een onmisbare schakel in de behandeling van complexe traumasymtomen bij kinderen en bij het uitvoeren van wetenschappelijk traumagerelateerd onderzoek.
Je geeft evidence based behandelingen, zoals traumagerichte cognitieve gedragstherapie (TGCGT) en EMDR.
Je doet diagnostisch onderzoek, farmacotherapie, psychotherapie, crisisbeoordelingen en consultatie aan huisartsen en medisch specialisten.
Waar ga je werken?

Als psychiater kind en jeugd ga je aan de slag bij een organisatie in de geestelijke gezondheidszorg. De organisatie ondersteunt en begeleidt kinderen, jongeren en hun gezinnen bij complexe problematiek.
Je gaat werken op een van de twee locaties: Hoofddorp of Heemskerk. Locatie Hoofddorp bestaat uit 16 medewerkers waaronder twee psychiaters, drie secretariaat medewerkers, een teamleider, een klinisch psycholoog, en een in opleiding, GZ psychologen, waarvan ook een in opleiding, orthopedagogen, een systeemtherapeut, ambulant behandelaren, een maatschappelijk werker en een arts. Op de locatie Heemskerk bestaan de teams uit ambulant hulpverleners, orthopedagogen, basis-, GZ- en klinisch psycholoog en kinder- en jeugdpsychiater. Op de locatie Heemskerk werk je (op de vrijdag) 4 uur in het kind en jongerenteam en 4 uur in de crisisdienst.
Alle collega's hebben het gezamelijke doel om de cliënten de beste behandeling te bieden. Het team is volop in ontwikkeling als het gaat om het bieden van kwalitatieve, integrale jeugdzorg. Er is aandacht voor optimalisering van primaire processen, ondersteunende overlegstructuren, in- en externe samenwerking, en deskundigheidsbevordering.

Wie ben jij als psychiater?
Je bent in het bezit van een BIG-registratie als psychiater.
Je hebt ervaring met getraumatiseerde kinderen, jongeren en hun gezinnen.
Je bent gemakkelijk in de omgang en je levert een positieve bijdrage aan je team.
Je bent actief, inspirerend en neemt graag de leiding in bijvoorbeeld multidisciplinaire overleggen.
Je neemt graag het voortouw en beschikt over kwaliteiten om je collega’s te inspireren.
Wat krijg je?
Je krijgt een contract voor een periode van 3 maanden aangeboden met de mogelijkheid op een vast contract. Het is ook mogelijk om op zzp-basis aan de slag te gaan.
De werkzaamheden bedragen minimaal 8 uur per week (bij voorkeur op de vrijdag).
Je salaris bedraagt minimaal € 5163,- en maximaal € 9023,- op basis van een 36-urige werkweek.
De werktijden zijn flexibel.
Je ontvangt arbeidsvoorwaarden conform CAO GGZ Medisch Specialisten.
Je krijgt een persoonlijk opleidingsbudget.
Hoe ziet de procedure er uit?

Ben jij de psychiater kind en jeugd die wij zoeken? Voor meer informatie kun je contact opnemen met Ron Broere, 076 - 2063 333, 06 3005 9223 of per e-mail r.broere@spijtenburg.nl.
Wie is Spijtenburg?

Wij zijn gedreven door het duurzaam verder helpen van mensen en organisaties bij hun échte vraag. Door te luisteren, nieuwsgierig te zijn en door te vragen, maken we voor kandidaten of opdrachtgevers het verschil! Je kunt bij ons terecht voor werving en selectie, interim management/ZZP, detachering én advies. Wil je meer weten? Bekijk dan onze over ons pagina!",-1,-1,https://indeed.nljavascript:void(0);,https://nl.indeed.com/vacature-bekijken?jk=f91429f85d7fe594&fccid=489a018b01ef6e88&vjs=3,Meer dan 30 dagen geleden,Meer dan 30 dagen geleden,23/02/2021,en,Female
