,Search Keyword,Platform,Job ID,Job Title,Company Name,Location,Job Description,Rating,Employment Type,Company URL,Job URL,Job Age,Job Age Number,Collection Date,Language,Gender
25,social worker,Indeed,p_1342189800074fe1,Groepsbegeleider Maatschappelijke Opvang / Flexpool,Leger des Heils, Haarlem,"Lijkt het jou leuk om vanuit onze Flexpool te worden ingezet op een Maatschappelijke Opvanglocatie in het centrum van Haarlem? Solliciteer en maak het verschil! Als Flexpoolmedewerker (functienaam: Sociaal Pedagogisch Werker 2) word je ingezet op verschillende afdelingen in de regio. Je voert werkzaamheden uit zoals dat op de betreffende afdeling is besproken. Je bied dagelijkse ondersteuning aan de deelnemers, met als doel hen zo zelfstandig mogelijk deel te laten nemen aan de maatschappij. Je werkt regelmatig zelfstandig en bent verantwoordelijk voor de dagelijkse gang van zaken op de groep.

Op dit moment zijn we op zoek naar medewerkers die wij kunnen inzetten op een nieuwe Maatschappelijke Opvanglocatie in het centrum van Haarlem. Deze opvang wordt geopend in verband met de maatregelen rondom het Coronavirus. Het doel van deze opvang is om alle daklozen in Haarlem 24 uur per dag onderdak te kunnen bieden. De opvanglocatie zal in eerste instantie tijdelijk worden geopend. Als de locatie sluit, zul je worden opgenomen in de reguliere Flexpool.

Je krijgt een contract voor 8 uur per week, er is dus geen sprake van een contract op oproepbasis. Regelmatig zijn er meer diensten beschikbaar, daar kun je jezelf voor inschrijven. Je hebt dus zelf in de hand hoeveel uur je werkt! Deze functie is daarom ook aan te raden als bijbaan naast je studie. Het is de ideale mogelijkheid om vrijblijvend ervaring op te doen en eventueel later door te groeien naar een vast plekje op een afdeling. Wij vinden de ontwikkeling van onze medewerkers heel belangrijk. We zullen je dan ook stimuleren om te blijven leren. Dit kan bijvoorbeeld door de trainingen die wij aanbieden via onze Leger des Heils Academie. De eerste drie jaar dat je bij ons werkt, nemen we jou mee in een traject waarin jouw deskundigheid nog meer zal worden bevorderd. We zullen je uitdagen om nieuwe dingen te proberen. Een foutje? Die mag je gewoon maken. Wij voorzien graag in de tools om er vervolgens van te leren. Leren op je werkplek: zodat jij én wij er beter van worden.

Primaire arbeidsvoorwaarden:
Arbeidsvoorwaarden volgens CAO Sociaal Werk, schaal 6. Het bijbehorende salaris is minimaal € 2.291,- en maximaal € 3.279,- bruto per maand bij een fulltime dienstverband. De inschaling is afhankelijk van opleiding, ervaring en leeftijd.

Secundaire arbeidsvoorwaarden:
Opname pensioenfonds PFZW
Mogelijkheid tot deelname aan het meerkeuze systeem arbeidsvoorwaarden
170 uur Verlofuren per jaar bij fulltime dienstverband
Opbouw van een Individueel Keuze Budget, bestaande uit 8 % vakantietoeslag, eindejaarsuitkering van 8,3 % en € 10,- per maand tegemoetkoming in de zorgkosten
Duur:
Aanstelling is voor de duur van 12 maanden. Daarna behoort voortzetting van het contract tot de mogelijkheden. Het Leger des Heils is er voor de meest kwetsbaren in de samenleving: de mensen zonder helper. Vanuit een christelijke motivatie verlenen wij hulp aan kwetsbare mannen, vrouwen en kinderen die ondersteuning nodig hebben op het gebied van (geestelijke) gezondheid, (beschermd) wonen, financiën, werk en opvoeding. Per jaar staan er meer dan 7.000 professionals en 12.000 vrijwilligers van het Leger des Heils klaar voor ongeveer 75.000 mensen. Meer informatie over ons werk vind je op: www.legerdesheils.nl.

Afdelingsinformatie:
De Flexpool ondersteunt de afdelingen bij het opvullen van gaten in de roosters, op korte en (middel)lange termijn. Hierdoor kunnen alle diensten binnen de organisatie op een verantwoorde manier worden gedraaid. De Flexpool wordt ingezet in geval van ziekte, piekbelasting of acute situaties waar de inzet van vervangende medewerkers vereist is.
Je hebt een MBO4 diploma SPW, MMZ of daaraan gelijk. Een propedeuse Social Work voldoet ook
Je bent inzetbaar op onregelmatige werktijden, ook in de nacht en in de weekenden
Je bent flexibel en kunt diensten op verschillende locaties draaien
Je bent in staat om bij een indiensttreding een Verklaring Omtrent Gedrag te overleggen
Jij hebt een positief christelijke geloofsovertuiging en kan daarom onze doelstelling van de Stichting Leger des Heils Welzijns- en Gezondheidszorg onderschrijven. Wil je hier meer over lezen? Kijk dan op www.legerdesheils.nl/identiteit
Solliciteer uiterlijk maandag 8 maart via de solliciteerbutton op onze website.

Bij het invullen van je sollicitatie zal worden gevraagd naar je christelijke levensovertuiging, en hoe je deze vorm geeft in het dagelijks leven. We verzoeken je alleen te reageren indien je voldoet aan de opleidingseisen en een christelijke levensovertuiging hebt. Indien je niet aan deze beide voorwaarden voldoet, zullen we de procedure niet met jou ingaan.

Na de sluitingsdatum verdwijnt de vacature van de website. Wil je de tekst graag bewaren, dan adviseren wij om deze tijdig op te slaan.

Conform het wervings- en selectiebeleid van de Stichting Leger des Heils Welzijns- en Gezondheidszorg hebben interne kandidaten bij gelijke kwaliteiten altijd voorrang.

Contactpersoon en informatie:
Heb je nog vragen over deze vacature? Voel je vrij om contact met ons op te nemen:
Functie-inhoud: Trudie de Koe (afdelingsmanager) - 06 10103652
Algemeen: Hannah van der Burg (recruiter) - 06 15397439.

Acquisitie naar aanleiding van deze vacature wordt niet op prijs gesteld.",-1,-1,https://indeed.nl/rc/clk?jk=1342189800074fe1&from=vj&mvj=0&vjfrom=vjs&pos=bottom&astse=02dc09789a694d30&assa=9453,https://nl.indeed.com/vacature-bekijken?jk=1342189800074fe1&fccid=1478f375b56b55d4&vjs=3,10 dagen geleden,10 dagen geleden,23/02/2021,en,Female
26,social worker,Indeed,p_12d69b8b184e389c,Maatschappelijk werker in de wijk,WIJ Heemstede, Heemstede,"WIJ Heemstede zoekt per direct voor 24 uur per week een: Maatschappelijk werker in de wijkBen jij die enthousiaste verbinder en out-of-the-box denker, die ons team Sociaal Werk / Maatschappelijk werk team komt versterken?Je werkt met je achtergrond als maatschappelijk werker welzijnsbreed vanuit WIJ Heemstede. Je gaat open het gesprek aan, in de buurt en aan de keukentafel, met inwoners (18+) van de gemeente Heemstede. Je gaat uit van de eigen kracht van iemand, samenredzaamheid en (opbouw) netwerk. Waar nodig schaal je op of verder af. Ook ben je onderdeel van het loket wonen, zorg en welzijn van de gemeente Heemstede. Je maakt hier deel uit van het team professionals met een diverse achtergrond. Je draait geen loketdienst, maar signaleert vanuit casuïstiek en in overleg met collega’s op preventie en vroegondersteuning. Je ziet kansen in verbindingen en participatie en handelt hier naar.Je maakt onderdeel uit van het nieuw op te starten team Vroeg Eropaf. Je helpt inwoners in een vroeg stadium met een betalingsachterstand.Wat ga je doen?- Verbinding leggen tussen zorg en welzijn en het netwerk hierin onderhouden.- Je signaleert problemen en vragen in een vroeg stadium in wijken en in buurten.Je handelt hierin pro actief en oplossingsgericht.- Je bent veel zichtbaar in wijken en buurten voor inwoners.- Hulpverlener in Vroeg Eropaf.- Welzijn op Recept opzetten i.s.m. de gemeente Heemstede.Wat vragen we?- Je hebt oog voor nieuwe mogelijkheden.- Je hebt een wijkgerichte visie.- Je kunt welzijnsbreed opereren. Je hebt kennis en inzicht in relevante ontwikkelingen ophet gebied van welzijn.- Knowhow doelgroep kwetsbaren en ouderen.- Je denkt in oplossingen en kunt improviseren.- Je kunt zeer zelfstandig werken, maar ook in teamverband werken.- Je hebt een afgeronde, relevante HBO opleiding.Wat biedt WIJ Heemstede?Een tijdelijke arbeidsovereenkomst voor 7 maanden voor 24 uur per week met uitzicht op een verlenging bij goed functioneren.Arbeidsvoorwaarden conform de CAO Sociaal Werk, salarisschaal 8 (minimaal € 2.712,- maximaal € 3.864- bruto bij een fulltime dienstverband van 36 uur per week).Interesse?Mail je sollicitatiebrief en CV. Voor inhoudelijke vragen over de vacature kun je contact opnemen met Marlies Lolkema, Manager Sociaal Werk.Contactgegevens; 06-13386419.Overige informatieJe hebt de mogelijkheid om te reageren t/m zondag 7 maart 2021.In de weken van 8 en 15 maart vinden de eerste gespreksronden plaats.WIJ Heemstede is een brede welzijnsorganisatie. Met 45 medewerkers en 200 vrijwilligers bieden we een basisvoorziening met veel diversiteit aan kennis en kunde op het gebied van sociaal werk. We gaan uit van de talenten en mogelijkheden van mensen. We vinden het belangrijk dat ieder mens naar vermogen kan deelnemen aan de samenleving. Soms heeft iemand daarbij den steuntje in de rug nodig. WIJ Heemstede biedt die steun.Contractduur 7 maandenParttime uren: 24 per weekDeadline sollicitaties: 7-3-2021Verwachte startdatum: 1-3-2021Soort dienstverband: Parttime, Bepaalde tijdSalaris: €2.712,00 - €3.864,00 per maandWerkschema:Dagdienstma-vrThuiswerken:Nee",-1,-1,https://indeed.nljavascript:void(0);,https://nl.indeed.com/vacature-bekijken/company/WIJ-Heemstede/jobs/Maatschappelijk-Werker-De-Wijk-12d69b8b184e389c?fccid=62e538b0091aa85c&vjs=3,10 dagen geleden,10 dagen geleden,23/02/2021,en,Female
27,social worker,Indeed,p_68c5c332f60d9feb,stagiair maatschappelijk werk,Stichting Dynamo, Amsterdam,"Ben jij op zoek naar een stageplek bij het maatschappelijk werk voor het 3e schooljaar?
Dynamo heeft vanaf februari 2021 diverse vacatures voor stagiairs Maatschappelijk werk en dienstverlening in Amsterdam Oost.
Dynamo: Als het aan Dynamo ligt doen zoveel mogelijk mensen mee aan de samenleving.
Actief, zelfstandig, op eigen kracht. Dynamo beweegt tot meedoen.
Dynamo biedt een compleet aanbod van welzijnswerk en maatschappelijke dienstverlening voor buurtbewoners van 0 tot 100 jaar. In 2021 gaat Dynamo starten met de nieuwe Buurtteams. Als stagiair ga je werken in een Buurtteam, dit zijn multidisciplinair samengestelde teams die gebiedsgericht en integraal werken.
Jij : Je werkt samen met collega’s aan het vergroten van de zelfredzaamheid en participatie van cliënten. Tijdens en ook nog na je inwerkperiode zal je meelopen met collega’s uit diverse disciplines. Naarmate je stage vordert zal je steeds meer dingen zelfstandig op gaan pakken, waarbij jouw collega’s natuurlijk altijd klaar staan om mee te denken en advies te geven als je daar behoefte aan hebt.
Je takenpakket zal bestaan uit: het meedraaien in de buurtpunten (inloop voor informatie en advies) en het leggen van individuele contacten en deze onderhouden. Je leert de hulpvraag signaleren, inventariseren en onderzoeken, een plan van aanpak maken en uitvoeren. Je zal voorlichting, informatie en advies geven. Ook kan je ervaring opdoen in het groepswerk en participeren met overleggen en wijktafels.
Wij: zijn een team van social worker, cliëntondersteuners, ambulant begeleiders, sociaal raadslieden en participatiemedewerkers. We werken samen met verschillende partners in de wijken, zoals huisartsen, ggz, woningbouwcorporaties, politie, bewonersinitiatieven, vrijwilligers, thuiszorg enz. Dit alles natuurlijk met in acht neming van de huidige corona-maatregelen.
Wat zoeken wij?
Een derdejaars HBO student van de opleiding Maatschappelijk Werk en Dienstverlening/Social Work, deeltijd of voltijd. Die zich herkent in eigenschappen als: energiek, flexibel, communicatief vaardig, zelfstandig, transparant, open, leergierig, met zelfreflectie en humor
Wij bieden:
Een leerzame stage, ruime mogelijkheid om ervaring op te doen, regelmatige begeleiding en een stagevergoeding. Dynamo werkt al lang samen met Hogeschool van Amsterdam. Veel stagiaires hebben het vak geleerd bij ons.
Informatie
Heb je interesse? Stuur dan een e-mail met je CV en motivatie naar
Emma Louwinger elouwinger@dynamo-amsterdam.nl
en/of
Wilma van der Camp wcamp@dynamo-amsterdam.nl",-1,-1,https://indeed.nl/rc/clk?jk=68c5c332f60d9feb&from=vj&mvj=0&vjfrom=vjs&pos=bottom&astse=b5b424493bfa9a90&assa=4761,https://nl.indeed.com/vacature-bekijken?jk=68c5c332f60d9feb&fccid=695642c11628d87f&vjs=3,10 dagen geleden,10 dagen geleden,23/02/2021,en,Female
28,social worker,Indeed,p_cf181e8f30151efe,Logopedist,ViVa Zorggroep, Heemskerk,"Logopedist24 uur per week - aanvang per direct is mogelijkHeemskerkDe afdeling gespecialiseerde teams bestaan uit de volgende specialisten: eerste geneeskundige, specialisten ouderengeneeskunde, basisartsen in opleiding, fysiotherapeuten, ergotherapeuten, (GZ)psychologen, logopedisten, social worker, geestelijk verzorgers, diëtisten, vaktherapeuten en gespecialiseerde verpleegkundigen/verzorgenden. De doelgroep is voornamelijk ouderen. De medewerkers zijn per vakgroep georganiseerd in teams; de teams worden aangestuurd door een teamcoach.Je uitdagingIn verband met een verhuizing van één van onze collega’s zijn wij op zoek naar een zelfstandige, enthousiaste logopedist voor 24 uur per week. Het werkgebied van de afdeling logopedie omvat zowel eerstelijnszorg als zorg aan ouderen in onze verpleeg- en verzorgingshuizen. Jouw werkgebied is Heemskerk en omgeving.Je kunt goed omgaan met ouderen met complexe, neurologische problematiek en vindt het fijn om door middel van jouw behandeling hun kwaliteit van leven te vergroten. Je werkzaamheden bestaan uit het behandelen, onderzoeken en begeleiden van cliënten met slik-, stem-, spraak-, taal- en gehoorstoornissen. Daarnaast behoren het geven van informatie, adviezen en lessen aan verschillende groepen tot je taken.Wij werken in een kleine, dynamische vakgroep waarin naast professionaliteit ook een fijne werksfeer van groot belang is, dus we hopen dat jij hierop een prettige aanvulling zult zijn.Wie zoeken wij?Een afgeronde Hbo-opleiding richting logopedie;Je staat ingeschreven in het Kwaliteitsregister Paramedici en bij voorkeur ook in het Register Afasie;Je hebt affiniteit met het werken met ouderen, goede contactuele eigenschappen en het vermogen om multidisciplinair samen te werken;Voor deze veelzijdige functie zoeken wij een zelfstandige en flexibele collega;Je bent in bezit van een rijbewijs of bereid deze te halen.Wat bieden wij?Werken bij ViVa! Zorggroep betekent werken in een inspirerende werkomgeving waarin ontwikkeling en ontplooiing worden gestimuleerd.Salaris en arbeidsvoorwaarden volgens de CAO VVT (FWG 55);Flexibele werkdagen en –tijden zijn mogelijk, bij voorkeur in overleg vanwege bezetting;Deels de mogelijkheid voor thuiswerken (vanwege telelogopedie);Interessante scholingsmogelijkheden voor persoonlijke en professionele ontwikkeling;Een dienstverband in eerste instantie voor de duur van een jaar, met de intentie tot verlenging;Goede secundaire arbeidsvoorwaarden zoals eindejaarsuitkering, goed pensioen en meer.Aan de slag bij ViVa! Zorggroep?Voor informatie over de functie kun je contact opnemen met de afdeling planning, tel. 088 9957420 en vragen naar Inger Voorberg of Saskia Dibbets, beide logopedist.We zien jouw reactie graag tegemoet!Interesse?Upload dan jouw motivatie en CV door rechts op de button ‘Solliciteren’ te klikken.Parttime uren: 24 per weekSoort dienstverband: Parttime, Bepaalde tijdSalaris: €2.900,00 - €4.100,00 per maandAanvullende betalingen:13e maandOveruren uitbetaaldVakantiegeldArbeidsvoorwaarden:Budget voor professionele ontwikkelingExtra vakantiedagenFietsplanFlexibele werkurenKerstpakketPensioenReiskostenvergoedingZorgverzekeringThuiswerken:NeeVoorzorgsmaatregelen tegen het coronavirus:Op afstand solliciterenPersoonlijke beschermingsmiddelen worden uitgedeeld/zijn verplichtEr zijn ontsmettings-, desinfecteer- of schoonmaakprocedures van kracht",-1,-1,https://indeed.nl/rc/clk?jk=cf181e8f30151efe&from=vj&mvj=0&vjfrom=vjs&pos=bottom&astse=9c85219c2c81784d&assa=6145,https://nl.indeed.com/vacature-bekijken/company/ViVa!-Zorggroep/jobs/Logopedist-cf181e8f30151efe?fccid=cd18de5028517640&vjs=3,10 dagen geleden,10 dagen geleden,23/02/2021,en,Female
29,social worker,Indeed,p_7643a471405a196c,Groepsbehandelaar,Jellinek, Amsterdam,"Groepsbehandelaar Dagbehandeling Verslavingszorg Werken op dagbehandeling van Jellinek Amsterdam betekent dat je verantwoordelijk bent voor je eigen groep cliënten die werkt aan hun verslaving! Je organiseert, begeleidt en coördineert de behandelactiviteiten! Zoek jij dit in een baan? Kom bij ons werken!Waar hebben we jouw talent voor nodig?Als groepsbegeleider op de dagbehandeling begeleidt, coördineer je een groep cliënten die een behandelprogramma volgt van 3 dagen in de week van 6 of 12 weken. Vanwege corona worden de meeste behandelingen online gegeven. Zelf geef je ook modules in het behandelprogramma, enkele voorbeelden daarvan zijn structuur en analyse motivatie modulen. Daarnaast zorg jij voor de dag- openingen en afsluiting. Bij deze activiteiten ga je uit van gedragstherapeutische principes. Jij bent ook het eerste aanspreekpunt voor cliënten voor alle zaken. Verder bespreken jullie de cliënten in een multidisciplinair team.‘’Het leuke aan het werken op dagbehandeling is dat je verantwoordelijk bent voor je eigen groep cliënten en ze echt leert kennen en hen helpt met hun verslaving.’’– Groepsbegeleider Dagbehandeling –Binnen dagbehandeling vinden wij aanspreken en confronteren met gedrag belangrijk en heb jij een rol in het begeleiden van groepsdynamiek. Je bent verantwoordelijk voor je eigen groep, maar werkt wel samen in teamverband met 5 andere collega’s.*Wie ben jij?*Je bent een ervaren SPH/Social Worker, Maatschappelijk Werker, GGZ-agoog of BIG geregistreerde hbo-verpleegkundige.In bezit van het diploma Cognitief gedragstherapeutische werken (CGW) of bereidt om deze te behalen.Je hebt ervaring en affiniteit met de verslavingszorg.Je weet te werken volgens CGT-methode.Bevlogen, oplossingsgericht, zorgvuldig en georganiseerd werken. Precies deze competenties omschrijven jou.Jij kan goed inspelen op de groepsdynamiek en iedereen meekrijgen in de behandeling.Als professional heb jij de kwaliteit om samen met het team verder te bouwen en kun je reflecteren op je handelen.Het overleggen van een Verklaring Omtrent Gedrag (VOG) maakt onderdeel uit van de aanstellingsprocedure.Wat krijg je van ons?Wij bieden een jaarcontract voor 24 uur gaat om de dagen dinsdag, donderdag en vrijdag. Uiteraard is de intentie om dit te verlengen/om te zetten naar een vast contract.Arbeidsvoorwaarden en salariëring zijn volgens de CAO GGZ, FWG schaal 50 Groepswerker II (maximaal €3678,-).Eindejaarsuitkering van 8,33% , 8% vakantiegeld en je bouwt een goed pensioen op bij Pensioenfonds Zorg en Welzijn.Arkin kent aantrekkelijke aanvullende arbeidsvoorwaarden, zoals een uitstekende ov-regeling woon-werkverkeer, collectieve regelingen zoals een zorgverzekering en een fietsplan.Je werklocatie is op de Jacob Obrechtstraat in Amsterdam.Arkin/Jellinek wil investeren in jouw (professionele) ontwikkeling. Daarom zal jou een breed (intern) scholings- en trainingsaanbod worden aangeboden zodat jij vanuit jouw ambities kunt blijven groeien.Je krijgt toegang tot Nrgize: een platform met allerlei (deels gratis) sportieve activiteiten: van boksclinics, bootcamps tot windsurfen.*Wie zijn wij?*Jellinek is de expert op het gebied van verslaving in Nederland.Verslaving kan iedereen treffen!Wij behandelen dan ook een zeer diverse cliëntengroep, voor zowel gedragsverslaving als middelenafhankelijkheid. Onze behandelingen zijn licht als het kan, intensief als het moet, maar altijd effectief en innovatief. Dit zie je terug in de werkwijze en cultuur bij Jellinek.Jellinek is een onderdeel van Arkin. Arkin is een overkoepelende stichting die 12 merken omvat die psychiatrische- en verslavingszorg bieden.*Wil je meer weten?*Neem contact op met Liane Wouters, Manager bedrijfsvoering via 0625519683.Parttime uren: 24 per weekSoort dienstverband: Parttime, Bepaalde tijdSalaris: €3.678,00 per maandAanvullende betalingen:13e maandVakantiegeldArbeidsvoorwaarden:GezondheidsprogrammaKerstpakketPensioenReiskostenvergoedingWerkschema:DagdienstThuiswerken:Tijdelijk vanwege COVID-19",-1,-1,https://indeed.nl/rc/clk?jk=7643a471405a196c&from=vj&mvj=0&vjfrom=vjs&pos=bottom&astse=3d37098f94fc3f4e&assa=7601,https://nl.indeed.com/vacature-bekijken/company/Arkin/jobs/Groepsbehandelaar-7643a471405a196c?fccid=b99389c90432dc33&vjs=3,10 dagen geleden,10 dagen geleden,23/02/2021,en,Female
30,social worker,Indeed,p_b528d013b56eb3ae,Helpende Revalidatie,Kennemerhart, Haarlem,"Wil jij werken aan het herstel van oudere cliënten? En doe jij dat het liefst in een modern revalidatiecentrum met kleinschalige revalidatiegroepen, waar liefdevolle zorg voor cliënten op de eerste plaats staat? Dan hebben wij de perfecte baan voor jou.

Jouw werk

Als helpende revalidatie werk jij intensief samen met jouw cliënten aan hun herstel. Je speelt een cruciale rol in het revalidatieproces. Jij weet als geen ander hoe je een cliënt kan motiveren en mede door jouw inzet, zie je dat de cliënt vooruitgang boekt. Deze vooruitgang hou jij bij, zodat je samen met jouw collega’s goed zicht houdt op de voortgang van de revalidatiedoelen. Je werkt in multidisciplinair verband met revalidatieartsen, psychologen, fysiotherapeuten, ergotherapeuten, social worker en nog heel veel andere disciplines. Samen zorg je er voor dat cliënten stap voor stap weer grip krijgen op hun leven. Iedereen is, dankzij zijn eigen expertise, een waardevolle toevoeging aan het hersteltraject van de cliënt. Deze kennis bundel je tijdens het Multidisciplinair Overleg (MDO) waarin je de cliënten bespreekt.

Kennemerhart biedt alle vormen van revalidatie en heeft drie revalidatielocaties. Of het gaat om revalidatie na een operatie, na een CVA of revalidatie omdat de cliënt aan zijn/haar conditie wilt of moet werken. In iedere locatie hebben we verschillende specialisaties. De revalidatielocaties beschikken over moderne afdelingen voor geriatrische revalidatie. In Haarlem-Noord is dat Zorgcentrum Schoterhof, in Haarlem-Centrum de Janskliniek en in Bentveld afdeling De Zandhoeve in woonzorgcentrum A.G. Bodaan. De revalidatie van Kennemerhart werkt volgens de laatste inzichten met een gespecialiseerd team.

Dit ben jij

Collegialiteit en een prettige werkomgeving vind je belangrijk. Wisselende diensten zijn voor jou geen probleem. Omdat je kwaliteit belangrijk vindt, heb je geen moeite om feedback geven en te krijgen en kun je goed uitleggen wat je bedoelt. Bovendien kun je reflecteren op je eigen handelen. Samen met je collega’s vind je het fijn om ervoor te zorgen dat het goed gaat met jouw cliënten. Verder voldoe je aan de volgende criteria:
Je hebt een mbo-2 diploma Helpende;Je hebt werkervaring in de ouderenzorg;Je beheerst de Nederlandse taal goed.

Arbeidsvoorwaarden

Kennemerhart vindt het belangrijk dat je plezier hebt in je werk. Daarom investeren we graag in jouw persoonlijke ontwikkeling en zorgen we voor goede arbeidsomstandigheden. Je hebt alle ruimte om jouw werk op jouw manier vorm te geven. Zo draag je samen met je collega’s bij aan de vernieuwing van Kennemerhart. Jouw uren kunnen overdag of ‘s avonds zijn en bepaal je in overleg. Verder kun jij rekenen op:
Een salaris, afgestemd op jouw ervaring en in salarisschaal FWG 25, conform CAO VVT;8% vakantietoeslag;8,33% eindejaarsuitkering;Een kerst- en een pinksteruitkering;Vergoeding van je reiskosten, conform CAO VVT;Pensioenopbouw bij pensioenfonds Zorg en Welzijn.

Om een veilige woon- en werkomgeving voor onze cliënten en medewerkers te waarborgen is voor alle medewerkers en vrijwilligers die bij Kennemerhart komen werken, een Verklaring Omtrent Gedrag (VOG) vereist.",-1,-1,https://indeed.nl/rc/clk?jk=b528d013b56eb3ae&from=vj&mvj=0&vjfrom=vjs&pos=bottom&astse=67535e18231f895e&assa=17,https://nl.indeed.com/vacature-bekijken?jk=b528d013b56eb3ae&fccid=db13f77e098fcfec&vjs=3,10 dagen geleden,10 dagen geleden,23/02/2021,en,Female
