,Search Keyword,Platform,Job ID,Job Title,Company Name,Location,Job Description,Rating,Employment Type,Company URL,Job URL,Job Age,Job Age Number,Collection Date,Language,Gender
0,publieke administratie,Indeed,pj_80cab63714d029fe,Bemonstering tester GGD GHOR,Unique, Alkmaar,"GGD GHOR heeft verschillende testlocaties door het land waar mensen langs kunnen komen om getest te worden op het virus. Als bemonsteraar / tester ga jij, na onze interne opleiding, monsters afnemen bij mensen die getest worden op het COVID-19 virus. Je wordt goed voorzien van beschermende middelen tijdens het testen, ook leren wij je hier op een veilige manier mee om te gaan. Jij wordt opgeroepen om op een testlocatie aan de slag te gaan. Dit kan zijn in jouw woonplaats, of ergens anders in het land. Je moet dus bereid zijn om te reizen. De testlocaties kunnen bestaan uit stadia, vliegvelden, of andere grote locaties die momenteel niet gebruikt kunnen worden. Als bemonsteraar werk je in duo’s. In jouw duo neemt één de test af en één handelt de administratie af en registreert het monster. Wij zoeken bemonsteraars door het hele land, waaronder: Alkmaar, Haarlem en Hoorn!

Jouw werkzaamheden:
Burgers in de teststraten ontvangen;

Testen afnemen bij burgers;

Empathisch en geruststellend te werk gaan;

Administratie nauwkeurig op orde maken;

Je registreert het afgenomen materiaal voor verzending naar het laboratorium;

Je verzorgt de logistiek binnen de teststraat.

GGD GHOR Nederland is dé belangenbehartiger voor de publieke gezondheid en veiligheid in Nederland. Als overkoepelende brancheorganisatie van de 25 Gemeentelijke Gezondheidsdiensten (GGD’en) en Geneeskundige Hulpverleningsorganisaties in de Regio (GHOR) werken zij mét en vóór hun leden aan het versterken van de publieke gezondheid en veiligheid in Nederland. Daarvoor bundelen zij de krachten van hun leden met hun 12.000 professionals.

Om de functie van bemonsteraar goed uit te voeren vragen wij het volgende:

In het bezit van eigen vervoer;

Minimaal 24 uur beschikbaar;

Minimaal mbo4 afgerond;

Bereid het land door te reizen om daar te komen waar jij nodig bent;

Daadkrachtig, communicatief vaardig en empathisch;

Werk je nauwkeurig;

Je kan zelfverzekerd handelen en tegelijkertijd iemand op zijn/haar gemak stellen.

Een medische achtergrond is gewenst (bijv. als verpleegkundige, doktersassistent, coassistent of in de zorg), maar niet noodzakelijk. Belangrijker is dat je stevig in je schoenen staat vanwege uiteenlopende casussen.

Herken jij jezelf hierin? Dan zoeken wij jou!

Het is naast een hele nuttige baan ook nog eens een interessante baan. Jij krijgt een uniek kijkje in de omstandigheden rond het coronavirus en bent op de hoogte van de laatste ontwikkelingen. Als bemonsteraar krijg jij:

Een salaris van €16,35 euro per uur;

Fulltime of parttime werk;

Flexibele werkmogelijkheden (tussen 08.00 uur en 21.30 uur);

Altijd reiskostenvergoeding;

Een tijdelijk dienstverband;

Werken in het weekend tegen toeslagen;

Jouw steentje bijdragen in deze onzekere tijden bij de verschillende lokale GGD's.",-1.0,-1,https://indeed.nl/rc/clk?jk=80cab63714d029fe&from=vj&sjdu=XS8FHEpkgQqaEtMQAY8jTr_jV3z6yf41TPEpIkACo-e25bi5xiZpUMCj_BFhjpw_pLy4r_CuG3WfmpwD9U9w-MCfj5ldubh3Ej7vHonW0M0IZDV_LQe_qCK4YFNmbfExX9gp79LeubDOygoUV2RPIhiQNGj38cAUgzINp2L7BII&spon=1&adid=361410206&mvj=0&vjfrom=vjs&pos=bottom&ad=-6NYlbfkN0CeoOz06cYfKf7YK_iwkWcmXENRgDeG06sW74aHmDAHOrOQzyYV8_El58wTLl87fPf4pVpObHkKrCH6pJd2nfHvyPyqTb3Nktz3pMIrRhaJ7WwMppf7iT4rRO8RLcUzOMm8pOy2LXEdPbBGEZ7VnQQCR5fSX1_2Tuq9UWCrRlo3L6QN-it_MYYLfz_EKeVUEZ4k8gBRq5wmeqbG8pTW9POsprxeIpqcS-VQYz2mhRIgMmSIW9-FVXnP-Hvj0OBSQLIcamMlPz8MMydzkrzZkh1OuLCNRHz_AZvWsH0S54b7ElhqGr7BWXVuVW6BgQBUqwRuO2GZayf3qThlfnLuXa0LiWfTzDslh9_2-X-KMvwjfoFZqT2Hw5ZoU2eB1Iz1joLKev4TxRt-lkFZ4OztmckStVBkHeFj2c8mquZ5KRmkWOuppiLa1cXmetRLnE8C8zXWc4FuYF2D7tmAix2cQwPUu5LowZuGQluMDrkD3gBzPi3t1MPd5o71qlWeSMhjnISrccgUP6VAlOHX__oXph-NqcCyVrpjANnTpRZf_si0DFelh0m2MEniqt2e5h0hKl1aCY4LuuJlnvxGXlpGkTfvpgcoYTvO5rqzlBg-mLeaf42fVt0FEfMTzGw_jTCp0UXnybYqzfP8TlUt0qI8RGOPI7C_1i6T6iT8yK3aix1uHA==&astse=2dfbd2c8ecf71edf&assa=1564,https://nl.indeed.com/vacature-bekijken/pagead/clk?mo=r&ad=-6NYlbfkN0CeoOz06cYfKf7YK_iwkWcmXENRgDeG06sW74aHmDAHOrOQzyYV8_El58wTLl87fPf4pVpObHkKrCH6pJd2nfHvyPyqTb3Nktz3pMIrRhaJ7WwMppf7iT4rRO8RLcUzOMm8pOy2LXEdPbBGEZ7VnQQCR5fSX1_2Tuq9UWCrRlo3L6QN-it_MYYLfz_EKeVUEZ4k8gBRq5wmeqbG8pTW9POsprxeIpqcS-VQYz2mhRIgMmSIW9-FVXnP-Hvj0OBSQLIcamMlPz8MMydzkrzZkh1OuLCNRHz_AZvWsH0S54b7ElhqGr7BWXVuVW6BgQBUqwRuO2GZayf3qThlfnLuXa0LiWfTzDslh9_2-X-KMvwjfoFZqT2Hw5ZoU2eB1Iz1joLKev4TxRt-lkFZ4OztmckStVBkHeFj2c8mquZ5KRmkWOuppiLa1cXmetRLnE8C8zXWc4FuYF2D7tmAix2cQwPUu5LowZuGQluMDrkD3gBzPi3t1MPd5o71qlWeSMhjnISrccgUP6VAlOHX__oXph-NqcCyVrpjANnTpRZf_si0DFelh0m2MEniqt2e5h0hKl1aCY4LuuJlnvxGXlpGkTfvpgcoYTvO5rqzlBg-mLeaf42fVt0FEfMTzGw_jTCp0UXnybYqzfP8TlUt0qI8RGOPI7C_1i6T6iT8yK3aix1uHA==&p=0&fvj=0&vjs=3,Meer dan 30 dagen geleden,Meer dan 30 dagen geleden,2021-01-24,en,Neutral
1,publieke administratie,Indeed,pj_53a9cd0f0bf1800f,Financieel Adviseur,JS Consultancy, Zaandam,"Financieel Adviseur
Algemene informatie

Voor een 100.000+ gemeente in de provincie Noord-Holland zijn wij op zoek naar een Financieel Adviseur.

Functie informatie

Bij afdeling financiën werken ruim 30 personen, deze zijn verdeeld in drie teams. Financiële transacties, financieel specialisten en de financieel adviseurs, waar de vacature is. Dit team bestaat uit 8 personen. De afdeling voorziet de organisatie van betrouwbare en actuele financiële (management) informatie, ter ondersteuning bij de besluitvorming. Er wordt veel samengewerkt binnen de afdeling en met andere afdelingen (zoals afdeling Personeel, Business Control en Strategie).

Als Financieel Adviseur adviseer je de lijn over de budgetten om daarmee gemeentelijke doelstellingen te realiseren. Je doet dit door ze te ondersteunen bij het opzetten van de begroting voor de verschillende Planning en Control documenten en het analyseren van financiële gegevens en informatie. Daarnaast adviseer je budgethouders over financiële verslagleggingsvoorschriften. Je bent de verbindende schakel bij de planning & control documenten voor de organisatieonderdelen die je ondersteunt.

Een aantal van je verantwoordelijkheden:

Je beoordeelt en adviseert over de impact van financiële wet- en regelgeving op de budgetten en investeringen van de sector openbare ruimte;
Je beheert een aantal balans- en / of exploitatieonderdelen (reserves, voorzieningen, kostenverdeling, indexatie, tarieven, etc.);
Je verwerkt investeringen en voert activabeheer tezamen met je collega’s;
Je adviseert, gevraagd en ongevraagd, over de werking van de ondersteunende processen en de inrichting van het rekeningschema, zodat de budgethouder zelfstandig kan sturen op de realisatie van de begroting.
Wat wij vragen
Je beschikt over een afgeronde HBO opleiding. Bij voorkeur aangevuld met relevante vakopleiding / trainingen;
Je hebt minimaal enkele jaren werkervaring in een soortgelijke functie bij een overheidsinstantie;
Je hebt kennis van de investeringsrichtlijnen zoals opgenomen in het Besluit Begroting en Verantwoording (BBV);
Je hebt inzicht in complexe financiële- en administratieve werkprocessen en kunt goed AO/IC denken;
Je bent communicatief zeer sterk, staat stevig in je schoenen en bent goed in staat om een gesprek te voeren met de lijn en hen te adviseren over de budgetten;
Je bent deskundig, je blijft pro actief op de hoogte van actuele ontwikkelingen binnen je vakgebied en stelt jezelf op als eigenaar van jouw portefeuille.
Wat wij bieden

Dit betreft een tijdelijke functie, per 1 februari voor circa 5 maanden. De gewenste inzet is 32 uur per week. Wij kunnen je inzetten op basis van een ZZP-constructie (uurtarief in overleg), of op basis van detachering (in loondienst bij JS Consultancy, inschaling schaal 11 conform CAO opdrachtgever).

JS Consultancy is de carrièrepartner van professionals en managers voor de publieke zaak. Bij ons werk je aan jezelf én aan oplossingen voor de belangrijkste uitdagingen in onze samenleving. Maatschappelijk resultaat. Samen met jou maken we het waar.

Sollicitatieprocedure

Ben jij dé kandidaat voor deze uitdaging? Dan ontvangen we graag uiterlijk maandag 25 januari je reactie! LET OP: zodra we voldoende passende kandidaten in beeld hebben, wordt deze vacature van de website verwijderd. Dus heb je interesse, reageer direct!

Voor meer informatie over deze vacature kun je contact opnemen met Rodrey Fuzzally (Recruiter) via RodreyFuzzally@jsconsultancy.nl",-1.0,-1,https://indeed.nl/rc/clk?jk=53a9cd0f0bf1800f&from=vj&sjdu=niBJIxMZ_gvzxZv94IdrEIqJUw63VYUMVxS9UpGn1EGBG1R2Kt8GiLp1ZDgvyyBR_uxgvX3kGU-gc34ucSmQ1mgk0OYyte0SB7FYjIsxcVd51vPSnmrNx0kSZvQ0h5H2B-4S4GZlP3mXDxGVcu-UYEnzNLhsCvPpIB_OnZjZkR0&spon=1&adid=318281475&mvj=0&vjfrom=vjs&pos=bottom&ad=-6NYlbfkN0Aa6Ww-RVKRPxGRPJwZH3TKpIbO4o8yWbOSeXjkKd6XYq1qPIonBAq8HZlPOpHx6zrUT9L4HPy2fRFgzFipSr2d9icRFu6Swu0VsiqERDss2JVtMiMHNsLjqteQzalPJ_4hgqXiSf34-8vDU6Bz_FQgWl4l-CaW3hwPMi76jgWR9SAMBzTrCbtZCCg9h6Zt9xW9UP6Q-wTTSZjrHyppoGXItHRLkFZ67MyTWkNDCFHUOH-o67-urqQhNfyPyZ2J1-vyZDrk_F5IIWjrOGAbtMtNPBQVlizDiPRAwpJBzinBZmrbrmyNGGbFyx-Pkih00nKIrh2t_3b4bK8jxCyTGCLNcX_Q97fc3RhjF4bvSBYcHdOZYBJ9wMyKUBti3BEk0gAPbbY77qK58mjvhH_2QdH_3F-ZF2mfHm7xGENXGmLjhwIPJ8jWh7nvdsA3W3FebOK2BglFVfudQ93tmiTGFxylQOoPQ6wY-xHyMj-KD5T58dscHb69NYl7irPRLrbOdTa_aU-gTb6avpOv2W51kZEb-uKrzl3lwwdv4D8wW_u29g2r7wPFHqCvI7l-qm2LDc8Pi0dTiOFnfWKMOvaG5S2nNSYix59odXxzZfPLovjz2KTcYfxoYlcEMMnTHu4AazYiXRsLpTI9jnuamN8pww9Tv8Owaqekv65Y1TpkKZH5NG2WSNQ1TVfe&astse=1a6c25e843e6d17f&assa=5995,https://nl.indeed.com/vacature-bekijken/pagead/clk?mo=r&ad=-6NYlbfkN0Aa6Ww-RVKRPxGRPJwZH3TKpIbO4o8yWbOSeXjkKd6XYq1qPIonBAq8HZlPOpHx6zrUT9L4HPy2fRFgzFipSr2d9icRFu6Swu0VsiqERDss2JVtMiMHNsLjqteQzalPJ_4hgqXiSf34-8vDU6Bz_FQgWl4l-CaW3hwPMi76jgWR9SAMBzTrCbtZCCg9h6Zt9xW9UP6Q-wTTSZjrHyppoGXItHRLkFZ67MyTWkNDCFHUOH-o67-urqQhNfyPyZ2J1-vyZDrk_F5IIWjrOGAbtMtNPBQVlizDiPRAwpJBzinBZmrbrmyNGGbFyx-Pkih00nKIrh2t_3b4bK8jxCyTGCLNcX_Q97fc3RhjF4bvSBYcHdOZYBJ9wMyKUBti3BEk0gAPbbY77qK58mjvhH_2QdH_3F-ZF2mfHm7xGENXGmLjhwIPJ8jWh7nvdsA3W3FebOK2BglFVfudQ93tmiTGFxylQOoPQ6wY-xHyMj-KD5T58dscHb69NYl7irPRLrbOdTa_aU-gTb6avpOv2W51kZEb-uKrzl3lwwdv4D8wW_u29g2r7wPFHqCvI7l-qm2LDc8Pi0dTiOFnfWKMOvaG5S2nNSYix59odXxzZfPLovjz2KTcYfxoYlcEMMnTHu4AazYiXRsLpTI9jnuamN8pww9Tv8Owaqekv65Y1TpkKZH5NG2WSNQ1TVfe&p=1&fvj=0&vjs=3,Meer dan 30 dagen geleden,Meer dan 30 dagen geleden,2021-01-24,en,Neutral
2,publieke administratie,Indeed,pj_55fed71876193c4c,Machine Operator,DeVriendenVanBeton, Amsterdam,"Categorie: Bouw, Machinebestuurders
Branche: Glas, Keramiek & Beton
Uren per week: 40 - 40
Ervaring: -
Opleidingsniveau: Middelbare school of vergelijkbare opleiding
Ben jij een ervaren Machine Operator die zelfstandig machines bedient en verantwoordelijkheid draagt voor de productielijnen? Voor een opdrachtgever in Amsterdam zoeken wij een Machine Operator die gaat voor kwaliteit! Klinkt dit goed? Lees dan snel verder en wij ontvangen graag jouw reactie!


Wat ga jij als Machine Operator doen?

Als Machine Operator ben je allround verantwoordelijk voor de productielijnen en machine van de bulkafdeling. Binnen deze afdelingen worden banden, stenen en tegels gemaakt. In deze rol bedien je zelfstandig de machines en maak je het productieproces eigen. Tevens ben je ook verantwoordelijk voor de inspectie van de prodcuten op kwaliten aan de sorteerband en pleeg je (preventief) onderhoud en draag je jouw steentje bij aan het optimaliseren van de technische productieprocessen. Je rapporteert aan de voorman. Verder ben je werkzaam in een 3 ploegendienst.


Hoofdwerkzaamheden:

Verantwoordelijk voor de bediening van complexe machines
Bedienen van heftruck en shovel volgens voorschrift
Waarschuwen bij (dreigende) storingen
Zorgdragen voor de administratie van relevante gegevens (Operational Excellence)
Zorgdragen voor een veilige, ordelijke en nette werkomgeving (volgens S5 principe)
Contact onderhouden met de plantmanager, productieleider, medewerkers van de technische dienst, kwaliteitsmedewerker en heftruckchauffeurs
Consequent controleren van de kwaliteit van de geproduceerde producten
Uitvoeren van onderhoud, zoals olie bijvullen, smeren en assisteren bij groot onderhoud

 Wie ben jij?
(V)mbo opleidings- of kennisniveau
Enige ervaring als Machine Operator in een productieomgeving
Woonachtig in de omgeving van Amsterdam
Bij voorkeur in bezit van een Heftruck & shovel-certificaat
Goed technisch inzicht
Verder ben je oplossingsgericht, stressbestendig en neem je altijd je verantwoordelijkheid

Wat bieden wij?
Fulltime functie (40 uur per week)
Een salaris tussen de €2235 en €2750 bruto per maand, conform cao Betonindustrie
25 vakantiedagen per jaar (o.b.v. 40 uur per week)
Bij goed functioneren, de mogelijkheid voor een vast contract
Goede arbeidsomstandigheden!

Waar kom je te werken?

Het bedrijf waarvoor je komt te werken is in Nederland marktleider in publieke bestrating. Bij het bedrijf heerst een fijne sfeer. Je wordt onderdeel van een grote, gezonde organisatie met een hoog saamhorigheidsgevoel. Daarnaast is er ook veel aandacht voor jouw ontwikkeling!


Ben je enthousiast geworden? Solliciteer via de button. We nemen dan zo snel mogelijk contact met je op! Tot snel!",-1.0,-1,https://indeed.nljavascript:void(0);,https://nl.indeed.com/vacature-bekijken/pagead/clk?mo=r&ad=-6NYlbfkN0BpC9SsnZm_BS7PLlHaRlsCm-AO3X_gwGGyWKasl-46VnPRbR3j-kTEOVONAzQalfhCt8t0hkcncSXUEecFiLobDcbDWrd7nApDUumsgs2LVY9_UO8-0SRPhES2NMQZo4MrxsDm8Nsffq7SSvp_FFDkUoCobHS0Kr8pGkmowiJOeVEu6BuUfF2P_zYJ8HG2wlpNTe1BYOTVnEuKPoLGn0hVCPW-Ica-BNgjYq7k3eOSKwk7cUUvaLDe43nBz0eunds4WowpdNNnf8VzYef5tJ3Z1h9PTYFMd9Tm0BLRFP8MLswCH3A4ISHonN-0IG3Vp2LnNfFa3Dmd54ByhWOkZNTBntgSWybHeMD98kcRQp5kGAkVxZgIw30CDBl1iJ5Ap-OhW-JKWiKIqfjMKsVTgmhnVrJNbPcUHoCHdnMpcQVdyi5_GukZ3LByzuygo18KCRFy3_k80glzVpA-rPbFwpC5ccwv_kWygSAtnoO_MoaiGi83F4nGNOmjtM0EkSaUdilxApd-F68ZxAGriv1uZRB2fEs3-2wibccxhrqxUXFB2uFTZ-QVu9uyVT6of1zcKc2hMUZOzSJKeHmu_3dAuCpFhZBOl4DaAYmW_eh0L6HMUmd3rew3cfGUkBgBithxXzyQY5uWcVFQJdsjJeCo-2DtsYfK61I67wR-jaGEF_6FMWCZOKib9_048fmhOkr9g2zXa3wvTkFJ_M2c-CRevCWz9OCBWY623ZzlkW-n8_w_MVHGL8p0-9DhkHplktnMSJfmChZNPI2nXtwPDmnPpgpQNX_WRWr4nNA=&p=2&fvj=0&vjs=3,Meer dan 30 dagen geleden,Meer dan 30 dagen geleden,2021-01-24,en,Neutral
3,publieke administratie,Indeed,pj_f836fc8f2bc9cce5,Medior Financieel Adviseur Regie & Consolidatie,JS Consultancy, Amsterdam,"Medior Financieel Adviseur Regie & Consolidatie
Algemene informatie

Voor de gemeente Amsterdam zijn wij op zoek naar een medior Financieel Adviseur Regie & Consolidatie.

Functie informatie

Amsterdam staat voor een grote opgave om de bruggen en kades in de stad te herstellen. Van de in totaal ongeveer 1800 bruggen en 600 kilometer kades, oevers en glooiingen van de gemeente richt het programma Bruggen en Kademuren zich op de 829 verkeersbruggen en de circa 205 km op diepere grondlagen gefundeerde kademuren. Dit zijn de bruggen en kademuren die belangrijk zijn voor het functioneren van de stad of waarbij de risico’s op constructieve gebreken hoog wordt ingeschat.

Bij de inrichting van programma bruggen en kademuren op programma-organisatieniveau is er behoefte aan medior adviseur regie en consolidatie ter ondersteuning van de manager programmabeheersing. Het betreft een uitvoerende, controlerende en adviserende rol op tactisch- en operationeel niveau.

Wat je o.a. gaat doen:
Vastleggen, verwerken en consolideren van financiële informatie naar programmaniveau en de rapportage (incl. dashboard) daarvan naar de manager programmabeheersing en gemeentelijk niveau;
Analyseren van de geconsolideerde keten- en onderliggende informatie van het programma t.b.v. advisering en sturing op programmamanagementniveau;
Opstellen van de geconsolideerde (programma)verantwoordingsinformatie.
Wat wij vragen
Je beschikt over hbo werk- en denkniveau;
Je hebt ervaring met financiële administratie, verslaglegging en rapportage in een multi-project/programma-omgeving;
Je bent bekend met de opzet en inrichting van financiële multi-project en programma administraties en de consolidatie en de optimalisering daarvan;
Je bent bekend met de gebruikelijke ERP en financiële programma en de onderliggende projecten gebruikte financiële programma- en projectmanagementapplicaties of bereid die op korte termijn eigen te maken.
Wat wij bieden

Dit betreft een tijdelijke functie, per 1 februari voor circa 6 maanden. De gewenste inzet is 36 uur per week. Wij kunnen je inzetten op basis van een ZZP-constructie (uurtarief in overleg), of op basis van detachering (in loondienst bij JS Consultancy, inschaling schaal 10 conform CAO opdrachtgever).

JS Consultancy is de carrièrepartner van professionals en managers voor de publieke zaak. Bij ons werk je aan jezelf én aan oplossingen voor de belangrijkste uitdagingen in onze samenleving. Maatschappelijk resultaat. Samen met jou maken we het waar.

Sollicitatieprocedure

Ben jij dé kandidaat voor deze uitdaging? Dan ontvangen we graag uiterlijk maandag 25 januari je reactie! LET OP: zodra we voldoende passende kandidaten in beeld hebben, wordt deze vacature van de website verwijderd. Dus heb je interesse, reageer direct!

Voor meer informatie over deze vacature kun je contact opnemen met Rodrey Fuzzally (Recruiter) via RodreyFuzzally@jsconsultancy.nl",-1.0,-1,https://indeed.nl/rc/clk?jk=f836fc8f2bc9cce5&from=vj&sjdu=niBJIxMZ_gvzxZv94IdrEIqJUw63VYUMVxS9UpGn1EE5delaheuKdl4PcsXmIW5lDhKOQ_4bKkSYrlrQdGgoLs8iXi4zvd_8JSo6A1hqyDlOWCov84MuEyhPvUwHgMi6EUcormCS_eTgm_a_RHxP01nd8BIKSWNZdFa_Keq1L3La9BrDjqMMORox-zkbA27fLDjqPykKDgGcK1bAWFDS6g&spon=1&adid=318281475&mvj=0&vjfrom=vjs&pos=bottom&ad=-6NYlbfkN0Aa6Ww-RVKRPxGRPJwZH3TKpIbO4o8yWbOSeXjkKd6XYq1qPIonBAq8HZlPOpHx6zr1FjMdJvDAsKyDycSgGrN8cLXY7PcnGhfVRdFO2fqE7poHf897eqzc7ZTZoRzi5s0EVvY7SHK1n5Uyy5zn6ZpGVNKU_gGw82pER_IL9gRQx9E0DI8r6AIRRiaQ6Mr9J7pbfC10h-7aAHTxktpQYqalNEg0rPesX7RCqaXi2U3sj3nEV5xpCtg6VMPnv-DD0L_qYDvBWc5CRENFtf32LVLsmoMR-V0dIaWQM-5qUQ3GOcJ0NWT5BJEUuhPjvZzhL30vZ9lM8cmanhY2LdPLxp2mbmW5yvdPLtGYlwGOkEj5-0fOW-cs_va6sJlCQj6SyyldZugXeQicfwgbsiaabFUONQpxqqkqThsGkYjveFiIYWAznOOlGxaG_SoeAWd_tnS1CE113zq5iM8KbflaRVZeFx4sQs4nrNUPrIkBvJErwzi-Z4ghT1cUORA1fIf4Y41h4EWf9i0d_adJupiXkzBCDWnT7veAcEmO7jcC195H30CtlFoaC9F-Rn3TFtzeSw2WC3zykNz9rCqpsm_BNkoNSdeN17-HdEmyqUIIH-DFVy0kQ9DNzKmn8TleFnU4XBKuRIb52UByJlZ0xe5lRRSZz30G9YqeQVcJLxGZ_uWYLNlQd2VFuQ-eipYR9nlVPAUE_2OvnOg6Zyehxk53UaD9GeNKHrKmWuYvAVnDmv2xL9Ch0qsFXv_HCd9oAysqdoI=&astse=a185cb8ad54504f6&assa=8551,https://nl.indeed.com/vacature-bekijken/pagead/clk?mo=r&ad=-6NYlbfkN0Aa6Ww-RVKRPxGRPJwZH3TKpIbO4o8yWbOSeXjkKd6XYq1qPIonBAq8HZlPOpHx6zr1FjMdJvDAsKyDycSgGrN8cLXY7PcnGhfVRdFO2fqE7poHf897eqzc7ZTZoRzi5s0EVvY7SHK1n5Uyy5zn6ZpGVNKU_gGw82pER_IL9gRQx9E0DI8r6AIRRiaQ6Mr9J7pbfC10h-7aAHTxktpQYqalNEg0rPesX7RCqaXi2U3sj3nEV5xpCtg6VMPnv-DD0L_qYDvBWc5CRENFtf32LVLsmoMR-V0dIaWQM-5qUQ3GOcJ0NWT5BJEUuhPjvZzhL30vZ9lM8cmanhY2LdPLxp2mbmW5yvdPLtGYlwGOkEj5-0fOW-cs_va6sJlCQj6SyyldZugXeQicfwgbsiaabFUONQpxqqkqThsGkYjveFiIYWAznOOlGxaG_SoeAWd_tnS1CE113zq5iM8KbflaRVZeFx4sQs4nrNUPrIkBvJErwzi-Z4ghT1cUORA1fIf4Y41h4EWf9i0d_adJupiXkzBCDWnT7veAcEmO7jcC195H30CtlFoaC9F-Rn3TFtzeSw2WC3zykNz9rCqpsm_BNkoNSdeN17-HdEmyqUIIH-DFVy0kQ9DNzKmn8TleFnU4XBKuRIb52UByJlZ0xe5lRRSZz30G9YqeQVcJLxGZ_uWYLNlQd2VFuQ-eipYR9nlVPAUE_2OvnOg6Zyehxk53UaD9GeNKHrKmWuYvAVnDmv2xL9Ch0qsFXv_HCd9oAysqdoI=&p=3&fvj=0&vjs=3,Meer dan 30 dagen geleden,Meer dan 30 dagen geleden,2021-01-24,en,Neutral
4,publieke administratie,Indeed,p_443a3fd25f9a8cd5,Producer,Medialane, Amsterdam,"MediaLane TV zoekt voor verschillende studio en/of locatie programma's per februari 2021:
Producers m/v
Je werkzaamheden bestaan uit:
Voorbereiden van studio programma en/of locatie onderdelenFacilitaire planning maken (studio / montage / audio etc)Plannen en uitnodigen van de crew t.b.v. opname dagenMaken van opnameschema’s en callsheetsFeedback geven aan Uitvoerend producent/ProductieleiderBudget verantwoordelijkDiverse administratieve en logistieke werkzaamheden
Functie eisen:
HBO opleidingAantoonbare werkervaring en liefst studio productieAffiniteit met entertainment / programma’sIn bezit van rijbewijs
Vaardigheden en persoonskenmerken:
Flexibele instelling en sociale persoonlijkheidZelfstandig, gedreven, goed georganiseerd en harde werker
Ben je enthousiast over bovenstaande vacature, voldoe je aan bovenstaand profiel en ben je vanaf februari t/m mei beschikbaar? Stuur je CV en motivatie dan via de link. Voor vragen bel je naar 020-238600 en vraag naar Frans Millenaar of Dorien Manshanden.
MediaLane, in 2014 opgericht door Iris van den Ende, is een Europees mediabedrijf met grote ambities.


We bouwen met veel energie aan prachtige tv-, theater- en liveproducties van hoogwaardige kwaliteit. Producties waarvan het publiek weet dat het kwalitatief top is. We willen een interessante en betrouwbare partner zijn voor de zenders, omroepen, theaters, venues, licentiehouders en merken. MediaLane streeft ernaar een veilige en creatieve omgeving te bieden voor de grootste talenten uit ons vak, zowel voor als achter de schermen.


Wij willen werken met mensen met de juiste ervaring, energie en de juiste ambitie om het bedrijf verder uit te bouwen. MediaLane wil bovenal een werkgever zijn waar de sfeer, de zorg voor en de ontwikkeling van haar medewerkers groot is, waar hard werken en altijd voor het beste willen gaan het motto is.
Acquisitie naar aanleiding van deze vacature wordt niet op prijs gesteld.",-1.0,-1,https://indeed.nl/rc/clk?jk=443a3fd25f9a8cd5&from=vj&mvj=0&vjfrom=vjs&pos=bottom&astse=ea1d5006ac285297&assa=1393,https://nl.indeed.com/vacature-bekijken?jk=443a3fd25f9a8cd5&fccid=b601fa8e546c6100&vjs=3,Meer dan 30 dagen geleden,Meer dan 30 dagen geleden,2021-01-24,en,Neutral
