,Search Keyword,Platform,Job ID,Job Title,Company Name,Location,Job Description,Rating,Employment Type,Company URL,Job URL,Job Age,Job Age Number,Collection Date,Language,Gender
27,publieke administratie,Indeed,p_b71433e989d6a4fe,Manager Fondsenwerving,Fashion For Good, Amsterdam,"Parttime (32-36 uur per week)


Part-time · Amsterdam
FUNCTIEOMSCHRIJVING

Het Fashion for Good Museum in Amsterdam zoekt een ambitieuze, doelgerichte en communicatief sterke Manager Fondsenwerving om onze fondsenwervingsstrategie naar een hoger niveau te tillen. Als Manager Fondsenwerving krijg je de bijzondere kans om mee te bouwen aan de strategie van het Fashion for Good Museum. Je gaat werken aan een brede basis van private en publieke fondsen. Met het werven van publieke en private fondsen draag je bij aan het bereiken van de doelstellingen van het museum. De geworven middelen worden ingezet voor tentoonstellingen, educatie en programmering. Je werkt nauw samen met de Directie en met de afdelingen Marketing en Communicatie, Tentoonstellingen en Programmering. Dit is een geweldige kans om mee te werken aan de volgende fase van ons museum, om onze strategie te verdiepen en uit te voeren en zo onze community verder te laten groeien, inspireren en activeren.
FUNCTIE-INHOUD EN TAKEN

De Manager Fondsenwerving heeft een strategische rol gericht op fondsenwerving bij publieke en private fondsen.

 Het signaleren van en meedenken over kansrijke projecten voor fondsenwerving op het gebied van tentoonstellingen, educatie, programmering en onderzoek.

Het opstellen van fondsaanvragen en verantwoordingen daarvan, in overleg met collega’s van de afdelingen Marketing en Communicatie, Tentoonstellingen en Programmering.

Het coördineren van het administratieve proces van fondsaanvragen.
Het onderhouden en uitbouwen van een waardevol eigen netwerk bij private en publieke fondsen.
Het bijhouden van actuele ontwikkelingen op het gebied van fondsenwerving en het informeren hierover.
Het leveren van rapportages en adviezen over fondsenwerving.

FUNCTIE-EISEN

Relevante opleiding HBO+ (bijvoorbeeld Marketing & Communicatie, Kunstbeleid & management of Kunstbeleid en Kunstbedrijf) of vergelijkbare kennis en ervaring.

Een sterk eigen netwerk op het gebied van publieke en private fondsen.

Minimaal 4 jaar relevante ervaring als fondsenwerver, bij voorkeur bij een culturele instelling.

Zeer goede sociale en communicatieve vaardigheden in woord en geschrift.

Kennis van de museumwereld en affiniteit met duurzaamheid en mode.


TALEN

Uitstekend Nederlands en Engels is vereist.


OVER HET FASHION FOR GOOD MUSEUM
De Stichting Fashion for Good, met ANBI-status, heeft in oktober 2018 haar deuren geopend als Experience en is een interactief duurzaam mode-museum aan het Rokin in Amsterdam. Het museum vertelt de verhalen achter de kleren die je draag en hoe je met de keuzes voor die kleren een positieve impact kan hebben op de mode-industrie. Fashion for Good gelooft dat die industrie kan én moet veranderen, en helpt om de juiste kennis hierover te verspreiden. Een must-visit voor iedereen die geïnteresseerd is in mode, duurzaamheid en innovatie.

Fashion for Good zet zich niet alleen in als changemaker met het museum, maar brengt ook de mode-industrie samen via hun Innovatieplatform. Dit platform brengt innovatieve oplossingen en internationale modelabels en fabrikanten samen om zo nieuwe technologieën en bedrijfsmodellen te stimuleren en op te schalen om zo de industrie te veranderen.

De organisatie wordt ondersteund door Laudes Foundation als initiator, corporate partners adidas, C&A, PVH Corp. en heeft ook steun ontvangen van AFK en de EU.

INCLUSIVITEIT

Bij Fashion for Good zijn we trots op onze Good Fashion community en richten we ons op samenwerkingen met een focus op het creëren van een positieve impact en het bouwen aan een wereldwijde positieve verandering. We hechten grote waarde aan het hebben van een divers team met verschillende standpunten en geloven dat we dingen anders moeten doen om innovatie te stimuleren en verandering te bewerkstelligen. We zijn een internationaal team, momenteel met 11 nationaliteiten, dat toegewijd is aan het creëren van een inclusieve omgeving waar iedereen welkom is om zichzelf te zijn en zijn best te doen. We selecteren alle kandidaten die bij ons solliciteren op basis van hun academische kwalificaties en professionele ervaring.

Acquisitie op basis van deze vacature wordt niet op prijs gesteld.",-1.0,-1,https://indeed.nl/rc/clk?jk=b71433e989d6a4fe&from=vj&mvj=0&vjfrom=vjs&pos=bottom&astse=919d08c77ef03893&assa=787,https://nl.indeed.com/vacature-bekijken?jk=b71433e989d6a4fe&fccid=0ad03719791cf791&vjs=3,2 dagen geleden,2 dagen geleden,2021-01-24,en,Neutral
28,publieke administratie,Indeed,p_8d2546e80f53d436,Allround Administrateur,YIP Uitzendgroep, Hoofddorp,"Voor een adviesbureau voor het publieke domein in Hoofddorp, zijn wij op zoek naar een allround administrateur (direct in dienst bij de klant). Ben jij op zoek naar een financiële functie binnen een professioneel bedrijf waar er veel aandacht is voor persoonlijke ontwikkeling? Lees snel verder!FUNCTIE OMSCHRIJVING: Als allround administrateur zorg jij ervoor dat de adviseurs zorgeloos hun werk kunnen doen. Op het kantoor in Hoofddorp ben jij samen met de controllers verantwoordelijk voor een groot aantal taken zoals de financiële-, salaris- en projectadministratie in AFAS, periode- en jaarafsluiting en operationeel beheer van financiële middelen. Je taken bestaan onder andere uit:Bijhouden van dagboeken, grootboekrekeningen en sub-grootboeken zoals debiteuren, crediteuren, voorraden en (vaste) activa;Verzorgen van de salarisadministratie;Controleren en bewaken van de kwaliteit van de uitvoering;Aanmaken en inrichten van projecten en controleren op juistheid en versturen van opdrachtbevestigingen.Aanmaken van balans en Winst&Verlies rekening;Controleren op een juiste verwerking van alle mutaties;Vaststellen en doorvoeren van noodzakelijke herstelboekingen;Begeleiden van de externe accountant bij de jaarlijkse controles (samen met de controller);Voeren van de debiteuren- en crediteurenadministratie;Maandelijkse voorbereiding en indienen van fiscale aangiften.FUNCTIE EISEN: Je hebt minimaal een afgeronde MBO4 opleiding en beschikt over HBO werk- en denkniveau;Minimaal 5 jaar werkervaring in een soortgelijke functie;Je heb kennis van MS Office en bij voorkeur ook AFAS ERP + Profit;Je bent een zelfstarter en analytisch scherp;Je bent een teamplayer en houdt van gezelligheid : ).OVER HET BEDRIJF: De opdrachtgever is gevestigd in Hoofddorp en adviseert opdrachtgevers in de publieke sector op het gebied van bedrijfsvoering, juridische zaken, sociaal domein en subsidies. Als Allround Administrateur krijg je bij aanvang een contract van 7 maanden met de intentie om te verlengen voor onbepaalde tijd. Je ontvangt een marktconform salaris en de beschikking over een laptop en een telefoonvergoeding. Je komt binnen een leuk team te werken met enthousiaste collega’s. Er is ruimte voor persoonlijke ontwikkeling en uitgebreide opleidingsmogelijkheden. Het betreft een fulltime functie voor 40 uur in de week (maandag t/m vrijdag). Onze opdrachtgever zoekt een nieuwe collega die zij voor langere tijd aan zich kunnen binden. Iemand die met trots voor het bedrijf komt te werken en ook houdt van gezelligheid binnen het team.Lijk het jou leuk om binnen deze mooie organisatie in Hoofddorp aan de slag te gaan als Administrateur? Solliciteer dan snel op deze vacature! Wil je meer informatie? Neem dan contact op met Lizanne, via 0252-527444 (bereikbaar op werkdagen tussen 13.00 en 18.00 uur).Deadline sollicitaties: 16-11-2020Soort dienstverband: Fulltime, Onbepaalde tijdSalaris: Vanaf €3.000,00 per maandAanvullende betalingen:VakantiegeldArbeidsvoorwaarden:Budget voor professionele ontwikkelingTelefoonplanVrijdagmiddagborrelErvaring:administratieve: 5 jaar (Aanbevolen)Thuiswerken:Tijdelijk vanwege COVID-19",-1.0,-1,https://indeed.nljavascript:void(0);,https://nl.indeed.com/vacature-bekijken/company/YIP-Uitzendgroep/jobs/Allround-Administrateur-8d2546e80f53d436?fccid=89dedfe00866055c&vjs=3,2 dagen geleden,2 dagen geleden,2021-01-24,en,Neutral
29,publieke administratie,Indeed,pj_3b9630d52d29b086,Backofficemedewerker Jeugd/ Wmo,Maandag, Alkmaar,"Over de functie
Zorg jij ervoor dat alle administratieve zaken op gebied van jeugd en wmo goed worden uitgevoerd? Dan is de functie Backofficemedewerker Jeugd en Wmo wellicht interessant voor jou!
Als Backofficemedewerker Jeugd en Wmo draag jij de zorg voor alle administratieve uitvoeringen van de Wmo en Jeugdwet. Je houdt van een dynamische werksfeer en afwisseling van je werkzaamheden. Zo ben je de ene dag bezig met het afhandelen van vragen van de zorgaanbieders en de andere dag houd je je bezig met het rapporteren en het verstrekken van voorzieningen.
De volgende taken vallen onder de functie Backofficemedewerker Jeugd/ Wmo:
Je doet controles en financiële verwerkingen van declaraties
Je bent verantwoordelijk voor het berichtenverkeer
Je verstrek en beëindigt voorzieningen
Verder heb je als Backofficemedewerker Jeugd/ Wmo goede communicatieve vaardigheden en werk je nauwkeurig. Daarnaast beschik je over een creatieve en flexibele instelling en kan je zowel effectief in teamverband werken als individueel.
Functie eisen
Om in aanmerking te komen voor deze functie, stellen wij de volgende eisen;
Ervaring in een soortgelijke functie binnen de gemeente
Kennis van Wmo en Jeugdwet
Kennis en ervaring in GWS/ Suite
Wat bieden wij jou?
Naast dat wij een aantal zaken van jou vragen, bieden wij jou de volgende secundaire arbeidsvoorwaarden;
Een marktconform salaris op basis van de betreffende CAO
Voldoe je aan alle bovenstaande eisen? Dan is een vast dienstverband bespreekbaar
Een reiskostenvergoeding op basis van €0,19 per kilometer
Een lease auto als dat van toepassing is
Pensioenregeling, vakantiedagen & vakantiegeld
Over het bedrijf
Met meer dan 3.000 professionals is Maandag® dé detacheerder van de publieke sector. Hoe dat komt? Professionals die bij Maandag® werken selecteren zichzelf. Samen met hen zien wij de maandag als een fris en nieuw begin. Het gevoel dat alles mogelijk is. Dat gevoel van ambitie en optimisme dragen we elke dag van de week uit. Want eigenlijk is het voor ons elke dag maandag. Professionals bij Maandag® houden van hun werk, net als wij. Daarom zijn we zo’n goed team. Snel, gedreven en heel positief. Verder biedt maandag flexibele zekerheid en staat persoonlijke en oprechte aandacht voorop. Wij geven om jouw ontwikkeling, op zowel persoonlijk als professioneel vlak. Daarom biedt maandag verschillende trainingen en colleges om jou te blijven ontwikkelen. We willen alles uit ons werk halen en zien werkgeluk als de sleutel voor succes. Jij toch ook?
Solliciteren
Herken jij jezelf in dit profiel? En lijkt werken bij Maandag® je een mooie stap? Solliciteer dan meteen. Wie weet ziet jouw maandag er binnenkort dan net zo tof uit als die van ons.",-1.0,-1,https://indeed.nl/rc/clk?jk=3b9630d52d29b086&from=vj&sjdu=QRZKyNPVaOyrfmf04760vwjEP3PFcYPHMsoS_mwjt6briDfnVPG03sxgkqXuDn58GsSeHahqLZf0LM3pXNMzPa9b795fE0nkFwY_JKWwzOP4wdUNG47IY4fdpQNXF97ooEvdh8Nkua9sdqRrfClB32gPxi2q5_GJPtDq2u4BHKo&spon=1&adid=344215064&mvj=0&vjfrom=vjs&pos=bottom&ad=-6NYlbfkN0CZ9PF5QT7Uxt51gcr9qQ0eA_Mg6vSsSHQ6E_ulOuzNR46EKvLMvSv-yJEdtuKfOq1VjqiIajlqm8cPPdYVJhG6yYMRB8x-5gntfRYpcCdVzEHYbhGVBVRH7LaENhZz_rKTSVfPih8hMIDkOh8vZsxWch-34uzP_1qUw3V9FsOfQR9aw-8Xay-SN0_dfRrRaR6-EUqlr9xiw0GDwmfab3tYORwBUC92j3o5ST2r1SZ_yEsvdXA7TJGNw8lULWfIdTBaSqtSldfBka90XnF8ofBwF24LIiHEIwEqCSTq084sxMlonHK_8rtywB6Vm8cZDvTFg-4Tr9uq9b9H_MhzQJ_7QcV_a4_LLJxn4-nlkGL4y57VMpXm6qBfub4ZUJkVExb1CzsIeM6PQEKKaMX7rj-H_wIeqE-DWlqmstp1_AJ7xxkHZh4u4PnyCwLuU5Co-0aZs-GqZvitioRYvQXTCs3s-XqrK3eIJDP1ki4lVToA-SreQu-YHPkp2LmeYnXGTzuKZcFRNbOsmoy75Y4EcVfP_89WqW8oj4Jt9FZQb8pu6wLslGZlDIh_cdPnrr6gJGVlyHi1FPexMR-cyLXt8tQbAppzgxhqRJwRxUPNGutkYZ_BPpB-w9Sq6jegGh7d7FCRQzgoEvIJ4dNI7NoqQII33g9phtrFFB94yKi3__vKr2AHE8wV227LpEq9t5wZFbQNyEiQOkMIimyasD_9GTL7&astse=d32b099b945b5979&assa=4685,https://nl.indeed.com/vacature-bekijken/pagead/clk?mo=r&ad=-6NYlbfkN0CZ9PF5QT7Uxt51gcr9qQ0eA_Mg6vSsSHQ6E_ulOuzNR46EKvLMvSv-yJEdtuKfOq1VjqiIajlqm8cPPdYVJhG6yYMRB8x-5gntfRYpcCdVzEHYbhGVBVRH7LaENhZz_rKTSVfPih8hMIDkOh8vZsxWch-34uzP_1qUw3V9FsOfQR9aw-8Xay-SN0_dfRrRaR6-EUqlr9xiw0GDwmfab3tYORwBUC92j3o5ST2r1SZ_yEsvdXA7TJGNw8lULWfIdTBaSqtSldfBka90XnF8ofBwF24LIiHEIwEqCSTq084sxMlonHK_8rtywB6Vm8cZDvTFg-4Tr9uq9b9H_MhzQJ_7QcV_a4_LLJxn4-nlkGL4y57VMpXm6qBfub4ZUJkVExb1CzsIeM6PQEKKaMX7rj-H_wIeqE-DWlqmstp1_AJ7xxkHZh4u4PnyCwLuU5Co-0aZs-GqZvitioRYvQXTCs3s-XqrK3eIJDP1ki4lVToA-SreQu-YHPkp2LmeYnXGTzuKZcFRNbOsmoy75Y4EcVfP_89WqW8oj4Jt9FZQb8pu6wLslGZlDIh_cdPnrr6gJGVlyHi1FPexMR-cyLXt8tQbAppzgxhqRJwRxUPNGutkYZ_BPpB-w9Sq6jegGh7d7FCRQzgoEvIJ4dNI7NoqQII33g9phtrFFB94yKi3__vKr2AHE8wV227LpEq9t5wZFbQNyEiQOkMIimyasD_9GTL7&p=13&fvj=0&vjs=3,2 dagen geleden,2 dagen geleden,2021-01-24,en,Neutral
30,publieke administratie,Indeed,pj_843e193d90686d33,Medewerker Projectbureau Duurzaamheid,BMC, Amsterdam Centrum,"Bedrijfsomschrijving

Bedrijfsinformatie
Al meer dan 34 jaar levert BMC oplossingen voor vraagstukken binnen de complexe context van de publieke sector. Met een ondernemende mentaliteit en nuchtere aanpak gaan we steeds voor maximaal maatschappelijk resultaat, in ideeën én uitvoeringskracht. We zetten onze expertise en innovatiekracht in om elke dag beter te worden, voor elkaar en onze opdrachtgevers. Voor inwoners, cliënten en leerlingen. We zijn op zoek naar nieuwe, betrokken collega’s die willen meewerken aan een effectieve en betrouwbare overheid.

Functieomschrijving

Wil jij via BMC een bijdrage leveren aan 1 van de meest toonaangevende woningcorporaties van Nederland?
Voor Ymere zijn wij doorlopend op zoek naar nieuwe collega's voor het projectbureau.
De urgentie van klimaatverandering is langzamerhand tot iedereen door gedrongen. Ook op het gebied van wonen kunnen we iets aan klimaatverandering doen en de CO2 uitstoot verminderen. Ymere streeft als woningcorporatie naar een voorraad van woningen welke in 2050 CO2 neutraal en betaalbaar voor haar huurders is.
Als tussentijds doel wil Ymere dat in 2025 80% van haar woningen in de labelcategorie ‘goed’ valt.
Ymere bereikt deze doelen niet alleen maar in samenwerking met de co-makers van gevel, daken en warmte en comfort. Ook de huurders van Ymere zijn een cruciale factor in het bereiken van deze duurzaamheidsdoelen. In 2019 is het projectbureau Duurzaamheid opgericht met al doel:
(ontwikkelen) 1e aanspreekpunt van de huurders
Huurders te verleiden om mee te werken aan de duurzaamheidsmaatregelen;
Faciliteren van de co-maker zodat zij efficiënt kunnen werken en de planningen kunnen realiseren
Wat ga je doen?
o Vragen beantwoorden via telefoon of mail of omtrent project Duurzaamheid naar bewoners of partijen
o Bevestigen aanwezigheid op datum werkzaamheden
o Interne project-werkzaamheden volgens planning uitvoeren over meerdere complexen tegelijkertijd
o Veel contact en samenwerking met comaker en afdelingen bij Ymere om Werkzaamheden volgens planning uit laten voeren. Administratie:
o Vastleggen in Project Administratie software (Gevelraster),
o Dossiervorming
o Diverse administratieve werkzaamheden

Huisbezoeken bij huurders afleggen met als resultaat:
§ Warme opnames
§ Ophalen van akkoordverklaringen
§ Bevestiging aanwezigheid (narooien) op installatiedatum
§ Vragen beantwoorden ter plaatse omtrent project Duurzaamheid naar bewoners of partijen

Functie-eisen

Wat kun jij?
Je bent in het bezit van een diploma op HBO niveau. Je kunt samenwerken met het team, andere partijen binnen de corporatie en de co-maker om een goed resultaat te halen. Daarnaast heb je ervaring met klantcontact en weerstand (mogelijk vanuit huurders). Administratief ben je sterk en je denkt er zeker aan alle systemen (Gevelraster; Tobias AX en kennissysteem) te raadplegen om te bekijken of er problemen bekend zijn aangaande je huurders.

Arbeidsvoorwaarden

Wij zijn op zoek naar kandidaten vanaf half januari, ter vervanging van huidige collega's. Deze functie is voor 32 uur per week en loopt t/m 1 juli 2021 met optie tot verlenging. De werkzaamheden van het projectbureau Duurzaamheid zijn nog in ontwikkeling. Werkzaamheden kunnen in de loop van 2020 aangepast worden. Ook de werktijden kunnen variëren, om bijvoorbeeld mensen te bereiken in de avonduren indien nodig. Daarnaast bevat het projectbureau ook andere projecten, zoals Loden Leidingen of Asbest, waar je ook op ingezet kan worden. Wij bieden een salaris conform de CAO Woondiensten, inschaling schaal F (max. 2444,69 per maand op basis van 32 uur).
Vragen over deze vacature? Neem dan snel contact op met Ladan Khoshbou!
Contactgegevens
Ladan Khoshbou
Databankweg 26 D
3821 AL Amersfoort

Telefoon: 06-20665973
Email: ladan.khoshbou@bmc.nl",-1.0,-1,https://indeed.nl/rc/clk?jk=843e193d90686d33&from=vj&sjdu=XS8FHEpkgQqaEtMQAY8jTuzDb8-muxPCkmXk3AaBMHG6Qj_zFPNx5WecenTrbBNn&spon=1&adid=293185235&mvj=0&vjfrom=vjs&pos=bottom&ad=-6NYlbfkN0BKVd9g7U62PO4LbTyORsl_zSz1bpykZAlNiYUFl0stxspjvIYrhs0huYep7hbUfYHnpEx0cyNqMDoNdRM994OGtevB7QIp22biFaV94Xme1BF0vYG-sj1fhMjPJVFmTrqZ8GFlE0WHvO-KVHNwO-s0zNqKYXaqZsJBRA2YgTKuR-LMlhUoxBGvFS1am63E3YifhtOvsbyHtrRMWkVmaf0cXnRuwAv8WGhjoLvwS9CQAReloqtJX8LEBYsEzo0kiIHbtETIM3lnwsOt2xI0GOaL2GX6cBcY6w8LaUuaDSg3QcByc-4TSiDDJvRP4iM32Fbxzd9ukHjq0NfniXpIWdXak1VrwivaRUyuoVs-6ivXpMOWaDkR_a1tWxoFwAkdGbRh2N5ZSdC9c3Z18fokEiPUv955zK8Rqj_eM0s3wVTAGYCG31Z3I58q6Ui_EN2T-uTKrrkiH1W-TQXcm4ySJPcoGbpOG_vXMW1E6rl8souWt9XqodEQAHglj4Pd03r9REtv5g9baRjbr884A-l_aMxNNSU8h4HNCh8v07eXKGlhz7g-pe6SW--jPKcZWscktn1mkryoQ78ndT3sGUtzJ_Kb8qn3k1JkUhIbE867SVh4JVx8-l3Ot3Fh&astse=567a9bb3eab23be9&assa=6795,https://nl.indeed.com/vacature-bekijken/pagead/clk?mo=r&ad=-6NYlbfkN0BKVd9g7U62PO4LbTyORsl_zSz1bpykZAlNiYUFl0stxspjvIYrhs0huYep7hbUfYHnpEx0cyNqMDoNdRM994OGtevB7QIp22biFaV94Xme1BF0vYG-sj1fhMjPJVFmTrqZ8GFlE0WHvO-KVHNwO-s0zNqKYXaqZsJBRA2YgTKuR-LMlhUoxBGvFS1am63E3YifhtOvsbyHtrRMWkVmaf0cXnRuwAv8WGhjoLvwS9CQAReloqtJX8LEBYsEzo0kiIHbtETIM3lnwsOt2xI0GOaL2GX6cBcY6w8LaUuaDSg3QcByc-4TSiDDJvRP4iM32Fbxzd9ukHjq0NfniXpIWdXak1VrwivaRUyuoVs-6ivXpMOWaDkR_a1tWxoFwAkdGbRh2N5ZSdC9c3Z18fokEiPUv955zK8Rqj_eM0s3wVTAGYCG31Z3I58q6Ui_EN2T-uTKrrkiH1W-TQXcm4ySJPcoGbpOG_vXMW1E6rl8souWt9XqodEQAHglj4Pd03r9REtv5g9baRjbr884A-l_aMxNNSU8h4HNCh8v07eXKGlhz7g-pe6SW--jPKcZWscktn1mkryoQ78ndT3sGUtzJ_Kb8qn3k1JkUhIbE867SVh4JVx8-l3Ot3Fh&p=14&fvj=1&vjs=3,2 dagen geleden,2 dagen geleden,2021-01-24,en,Neutral
31,publieke administratie,Indeed,pj_81873bb0a40d0468,Senior Account-en Contractmanager Sociaal Domein,Adjust Inkoop Consulting BV, NoordHolland Noord,"Heb jij veel strategische en financiële ervaring op het gebied van Jeugdhulp of het Sociaal Domein? Kom dan het team van onze opdrachtgever versterken voor een project voor een gemeente in Noord-Holland. Het team gaat over het beschikbaar stellen van jeugdzorg op een kosteneffectieve wijze. Hiervoor werken wij aan een nieuwe verwervingsstrategie. De opgave van ons team staat het komende jaar in het teken van het ontwikkelen van professionele zakelijkheid en data gedreven werken. Beleid en contractmanagement werken zeer nauw samen aan deze opgave.Wat ga je doen?Je bent de projectleider van het dossier kostenbeheersing. Jij brengt inhoudelijk het proces van beleid en account op efficiënte wijze samen. Je vertaalt het beleid naar de contracten met de contractpartners en stemt af met andere stakeholders;Je zorgt voor een goede uitvoering van de contracten en stuurt op doelmatigheid, kwantiteit, budget en kwaliteit;Je stuurt met behulp van KPI’s. Je constateert tijdig afwijkingen ten opzichte van de prognose;Je maakt de consequenties inzichtelijk en stuurt hier vervolgens op bij;Je onderhoudt de relatie met de contractpartners en voert regelmatig contract- en ontwikkelgesprekken;Je stemt af met de collega’s van functioneel en administratief beheer met betrekking tot contractaanpassingen;Samen met jouw collega’s van beleid bepaal je de visie op de zorgmarkt en de ontwikkelingen op het gebied van contractmanagement in het bijzonder. Door jouw programmering zorg je dat de geboden jeugdhulp aansluit op de lokale en regionale behoeften. Van daaruit kun je meerjarenramingen opstellen;Je adviseert het management en het bestuur over de financiële en kwalitatieve resultaten;Je werkt samen op strategische accounts omtrent regionaal en bovenregionaal beleid met een aantal gemeenten.Wie ben jij?Een financieel sterke en ervaren account- en contractmanager, die zich kenmerkt als hard op de inhoud en zacht op de relatie;Jouw affiniteit met zowel jeugdhulp (of het sociaal domein) als contractmanagement lezen we graag terug in je CV en motivatie;Voor het behalen van de beoogde resultaten beschik je een flinke dosis incasseringsvermogen en toon je daadkracht waar nodig.Adjust is hét consultancybureau gespecialiseerd in inkoop, aanbestedingen, contractmanagement en (beleids)advisering. Voor overheden en bedrijven. Al 15 jaar gaan we voor het beste resultaat, met oog voor de impact van elk besluit, op zakelijk én menselijk vlak. Omdat winst meer is dan alleen kostenbesparing.Werken bij Adjust is werken aan inhoudelijk interessante projecten bij mooie klanten. Samen met ruim 40 collega’s die vooroplopen in de ontwikkelingen binnen de publieke en private sector.Het gaat hier om een vaste positie op basis van werving & selectie waarbij je door Adjust tijdens het sollicitatieproces wordt begeleidt en je hierna direct in dienst treedt bij onze opdrachtgever.Wat krijg jij?Onze opdrachtgever wil een diverse en inclusieve organisatie zijn. Een organisatie die ruimte biedt aan iedereen, de kracht van diversiteit en talenten van medewerkers benut, om betere resultaten te behalen voor de stad. Zij streven naar een organisatie die een afspiegeling is van de regionale samenleving;Een plek in een gezellig en hardwerkend team met 5 collega’s. De functie is een mix van inhoud en bedrijfsvoering binnen een lokale, regionale en landelijke context, en vergt nog verdere uitwerking;Een structurele functie voor 36 uur, waarbij we starten met een contract voor een jaar. We zetten dit bij goed functioneren graag om naar een vast dienstverband.;Het salaris is afhankelijk van ervaring en opleiding en bedraagt maximaal schaal 11A bij een fulltime aanstelling in een 36-urige werkweek (exclusief 17,05% Individueel Keuze Budget );Uiteraard krijg je een goed pakket aan secundaire arbeidsvoorwaarden zoals flexibele werktijden en de mogelijkheid om inhoudelijke en vaardigheidstrainingen te volgen.Contractduur 12 maandenSoort dienstverband: Fulltime, Bepaalde tijdSalaris: €3.500,00 - €5.500,00 per maandAanvullende betalingen:VakantiegeldArbeidsvoorwaarden:Budget voor professionele ontwikkelingPensioenReiskostenvergoedingWerk vanuit huisWerkschema:ma-vrErvaring:sociaal domein: 3 jaar (Aanbevolen)Opleiding:HBO (Aanbevolen)Taal:Nederlands (Vereist)Voorzorgsmaatregelen tegen het coronavirus:Op afstand solliciterenEr gelden richtlijnen voor social distancingVirtuele vergaderingenEr zijn ontsmettings-, desinfecteer- of schoonmaakprocedures van kracht",-1.0,-1,https://indeed.nljavascript:void(0);,https://nl.indeed.com/vacature-bekijken/pagead/clk?mo=r&ad=-6NYlbfkN0BW7OESMTeHT41o_4VxPibgHIdOJKDQ1HZwkJ-STc0hTAvvFvMCvcccf1VQV7JG9JAJujFu0nD19Nynu-NxzrHXkIgVxBQ1hpKCaKDVd1rYTAUCbUTsdiXEKcMKEmAhv8BaS9Arv9e69fnZdWX_E2a25tyRgY3HYo6hGQKDg1g2o65TZ9Kw0dtWLt9E5PEXCReLsJqD05k871SuZApDKWTngOYoMdrdUDoZEC0LnbUDIJGgSTE4zhY0DQ2-qVj3TIbEHm_JTkcgCA2L549yMrGhkCw26VYbJ-KHV4qiyGXPVTpRcPlJGsqzWfRWtbafUYe9WLEyAkCabF6nU3qKdHMSy85plIEpbMcmep0E63v2ZL34YApXZHAnz-abl-6GiSXEnqdaR6AYEcfvhBAu2IjToIrKUz2j9ADiesglJNMLgZwGmh_gYpthWT0fj8zgapff8Q2WxgMRMfGM14OsuL3EYYBqc8PqPJb-uuwxk_tjG1--Bj7tY7cM34oQ9iDOXiAX5IFA2FjXzg==&p=15&fvj=1&vjs=3,2 dagen geleden,2 dagen geleden,2021-01-24,en,Neutral
