,Search Keyword,Platform,Job ID,Job Title,Company Name,Location,Job Description,Rating,Employment Type,Company URL,Job URL,Job Age,Job Age Number,Collection Date,Language,Gender
5,accommodation,Indeed,p_28d5e3d843abfeff,Warehouse Operators,Masimo, Amsterdam,"Masimo (NASDAQ: MASI) headquartered in Irvine, California, is a fast-growing and award-winning international medical technology and device company with operations spanning the globe. We develop innovative, noninvasive monitoring technologies that save, extend and improve the lives of people of all ages, in all walks of life. These revolutionary technologies are helping to solve ""unsolvable"" problems that have plagued the healthcare industry, while taking the pain and discomfort out of blood monitoring. For 30 years, innovation has been and will continue to be our passion. We are looking to recruit the position of:

Warehouse Operator


Job Summary:

The Warehouse Operator B is responsible for intermediate level handling of one or more of the following areas: receiving, warehousing and distribution functions for raw materials, in-process good, and quality auditing functions for released finished products and supplies, configuration activities


Duties & Responsibilities:

Pre-shipment inspection for accuracy and conformance;
Goods receipt, put-away, order picking, order packing, order shipping, and order posting;
Cycle counting and general record keeping;
Utilize automated shipping systems to process domestic orders for shipping;
Reorder and maintain adequate level of shipping supplies;
Replenishment of inventories and shipping stations;
Organize and maintain good housekeeping in warehouse;
Schedule shipment pick-ups;
Routinely lifts and carries up to 50 pounds;
May operate a Forklift / Reach-truck as required;
Perform other duties as assigned


Minimum & Preferred Qualifications and Experience:
Minimum Qualifications:

Prior experience in warehouse shipping and receiving practices;
General mathematical skills;
Ability to read, understand, and follow Company quality policy;
Experience with inventory control systems and cycle counting;
Must be able to routinely lift and carry up to 50 pounds;
Good communication and computer skills;
Good housekeeping and record skills;
Certification Reach-truck and Forklift truck
Hands on mentality.
Ability to work in two-shift system.


Preferred Qualifications:

Prior w arehouse and manufacturing facility experience;
Prior Reach-truck operations experience;
Prior quality inspection experience;
Technical back-ground
Dutch/ English speaking


Education:

High School diploma (MBO)
Technical background
Certificate Reach-truck and Forklift truck


VOG certificate of conduct will be required


Physical requirements/Work Environment

This position primarily works in a warehouse environment. Must be able to routinely lift and carry up to 50 pounds. May sometimes operate a Forklift as required. It requires frequent sitting, standing and walking. Daily use of a computer and other computing and digital devices is required. May stand for extended periods when working in the warehouse or walking in the facilities. Some local travel is necessary, so the ability to operate a motor vehicle and maintain a valid Driver’s license is required.

The physical demands of the position described herein are essential functions of the job and employees must be able to successfully perform these tasks for extended periods. Reasonable accommodations may be made for those individuals with real or perceived disabilities to perform the essential functions of the job described.

Masimo is proud to be an EOE/, M/F/D/V, and we are committed to Diversity at every level


Are you looking for uncommon opportunities with an extraordinary company?

We are looking for people who can, do and will make a difference. Are you interested to hear more about this position?


Please send your full application through our website.

To learn more about us, please visit: www.masimo.com


#LI-AK2
Back Share
Apply Now",-1.0,-1,https://indeed.nl/rc/clk?jk=28d5e3d843abfeff&from=vj&mvj=0&vjfrom=vjs&pos=bottom&astse=16f12eb7fa6a43eb&assa=241,https://nl.indeed.com/vacature-bekijken?jk=28d5e3d843abfeff&fccid=a50c3f331564a694&vjs=3,Meer dan 30 dagen geleden,Meer dan 30 dagen geleden,2021-01-20,en,Female
6,accommodation,Indeed,p_e129c209dfec0b4c,Reservations Intern,The Student Hotel, Amsterdam Noord,"Reservation team of TSH is looking for an intern that can start 1st of March. As Reservation Intern you will work in an enthusiastic team of reservation experts in a highly changing and international environment! The TSH Central Reservations Department handles reservations for all TSH locations.

(Please note: only students are eligible; you need to be registered at a university)


In case you don’t know who we are (ahem):

TSH is a game-changer. Our unique hotel concept offers student accommodation as well as long and short stay options for students-at-heart, together with epic facilities and exciting co-working spaces.

Currently located in Amsterdam, The Hague, Eindhoven, Maastricht, Groningen, Dresden, Berlin, Florence, Barcelona, Vienna and with Delft and Bologna just joined the family, The Student Hotel is a truly new hospitality concept in the hearth of Europ

Why do we need you

Play with a wink! As Reservations intern you handle all requests from the guests and partners via phone and email, regardless how big the challenge is.

What will you be doing to make that happen

Get to understand the guest journey and work processes that are needed to guarantee a smooth experience.
Create a smooth workflow for both external as internal guests, from the moment a reservations request is received until the reservation is completed.
Learn to understand the market segments and how these reservation types are handled.
Learn to intake, process and follow-up reservation requests, taking contract conditions into consideration.
Process all bookings, amendments, cancellations in the Property Management System, keeping both guest satisfaction as TSH goals in mind.
Acquire knowledge of two different PMS’s: Hetras and MEWS.
Understand all the tasks on the daily / weekly / monthly task list.
Handle complaints from guests by using the guidelines that are provided under the supervision of the senior team members.
Manage the internal and external relationships; with colleagues and with our guests.
Communicate reservation information to operational departments.

Who are you

Hospitality and guest service are in your DNA!
You responsible, pro-active and flexible (available to work in the weekend, once or twice)
You have an eye for detail
Master communicator!
Excellent spoken and written business English (other languages are a plus!)
Must: Living in the Amsterdam area

Why TSH?

From the front desk staff and the F&B specialists at each hotel location to the Amsterdam based HQ team, we value hard, disruptive, unconventional workers and with that at our core we’ve established a European team that’s achieved huge success in growing The Student hotel over the last few years.

What do we offer you?

An amazing work environment with a fantastic vibe and lots of positive energy.
Time carved out for you to work on your own research-project
On the job coaching and guidance
Monthly compensation for your internship.
The opportunity to work at a dynamic, young, international organization; we’re a real game changer in the hospitality industry
A first glimpse into the world of Sales with one of the most innovative players in the hospitality market.
Staff Discount when eating in any The Commons in Europe
Discount rate when staying in any of our Hotel across Europe
Discount of everything at our TSH shop!
Get your friends and family to stay in our hotels with a discount
Bonus referral scheme
Make use of our gym for free!

We want you to be you. No uniform, tattoos are cool, your hairstyle is yours, not ours. Basically, we don’t want to change who you are because we think the best hospitality comes from people who can be themselves and show customers their personality. Our team is diverse, representing more than one nationality, gender, age, sexual orientation, religion, culture and personality type. That’s what makes our team so special.

Join The Student Hotel

Excited? Want to apply? You can do this by clicking the apply button beneath, answering a few questions and sending your CV/LinkedIn profile.",-1.0,-1,https://indeed.nljavascript:void(0);,https://nl.indeed.com/vacature-bekijken?jk=e129c209dfec0b4c&fccid=49f7bc79aa89d6b5&vjs=3,Meer dan 30 dagen geleden,Meer dan 30 dagen geleden,2021-01-20,en,Female
7,accommodation,Indeed,p_0a5470febfc57005,NGO Finance Traineeship in Myanmar,Medical Action Myanmar, Amsterdam,"Do you want to gain experience in finance and at the same time support us to provide a million medical consultations a year in some of the poorest and vulnerable communities in Myanmar?Medical Action Myanmar is a Dutch iNGO which runs several large urban clinics and also provides healthcare to over 1700 remote villages. We are offering a one-year traineeship to those who have the ambition to start a finance career in international development. The selected trainee will work directly with the Finance Director and support over 800 staff and 1700 volunteers, all around the country.What we offer:One-year traineeship: hands on experience in financial management, reporting and policy shapingBased on volunteer contract, with expenses paid like ticket, insurance, visa, accommodation and food allowanceThe opportunity to live, work and travel in the dynamic political and socio-economic context of Myanmar, with Yangon as your base station.We are looking for someone who:has strong analytical skills: University degree in related fieldcan easily adapt to a changing environment and workloadhas a solid foundation of knowledge in accounting and financial reportingis not afraid to take on another challenge (work experience or extracurricular activities are an advantage)Apply before: 25th of January 2021. Proposed starting date: March 2021Contractduur 13 maandenDeadline sollicitaties: 25-1-2021Verwachte startdatum: 1-3-2021Job Types: Full-time, Internship, ContractWork Remotely:NoCOVID-19 Precaution(s):Remote interview processPersonal protective equipment provided or requiredTemperature screeningsSocial distancing guidelines in placeVirtual meetingsSanitizing, disinfecting, or cleaning procedures in place",-1.0,-1,https://indeed.nljavascript:void(0);,https://nl.indeed.com/vacature-bekijken/company/Medical-Action-Myanmar/jobs/Ngo-Finance-Traineeship-Myanmar-0a5470febfc57005?fccid=280b4c4f3fa6e0ed&vjs=3,Meer dan 30 dagen geleden,Meer dan 30 dagen geleden,2021-01-20,en,Female
8,accommodation,Indeed,p_f882d845a895c7f8,Executive Assistant,"Komatha Impex Pvt Ltd,", Amsterdam,"The ideal candidate must have multi-tasking abilities with excellent communication & good exposure in administrative & time management.ResponsibilitiesActing as point of contact & dealing with correspondence and phone callsManaging Director's calendar & schedule meetings with customers/clientsBooking and arranging travel & accommodationsOrganising events & conferencesReminding MD on important tasks and deadlinesImplementing & maintaining procedures/administrative systemsLiaising with staff/customers/suppliersFile managementMaintaining facebook & instagram for promotional activitiesMaintaining company website & updating it whenever requiresTaking care of all admin related activitiesFinding the schedules of food shows & make necessary arrangements to participate world-wideTaking care of sales & commercial partQualificationsMinimum 3 to 4yrs professional experience as Executive personal assistantAny Bachelor's degreeExcellent oral & written communication skillsWilling to travel in & around the world basis the requirementJob Type: Full-timeSalary: €1,500.00 - €2,000.00 per monthWork Remotely:No",-1.0,-1,https://indeed.nljavascript:void(0);,"https://nl.indeed.com/vacature-bekijken/company/Komatha-Impex-Pvt-Ltd.,/jobs/Executive-Assistant-f882d845a895c7f8?fccid=2df573f8536c56bd&vjs=3",Meer dan 30 dagen geleden,Meer dan 30 dagen geleden,2021-01-20,en,Female
9,accommodation,Indeed,p_df219b5ecaad0b11,"Digital Production Coordinator, Amsterdam",Jam3, Amsterdam,"Hi. We’re Jam3, a design and experience agency. We help modern brands launch their products and design new customer experiences in digital, and beyond.

Our team brings folks together from around the world. We have Strategy, Creative, Experience Design and Production all under one roof (four roofs, actually). This amazing fusion of talents lets us make things we could never make alone.

Innovating all day makes us pretty fun people to work with too. We’re curious about new ideas, we know how to make them happen, and we’re always there to support each other throughout the process.

If you like making good things better you’ll fit right in.

As our new Production Coordinator, your role is to be a swiss army knife for our Producers, completing tasks on their behalf or owning your own tasks within a production.

You’ll be responsible for supporting a team of Producers and Executive Producers on anything from website redesigns to installations for our clients worldwide. We're project-based, so we're always working with someone interesting, be it adidas, Facebook, Google, Oculus, Netflix, or Diageo.

Read on for details! We’re looking forward to meeting you.

The Real Opportunity!


Aid the production team in the success of our projects, contributing to client facing and internal projects
Manage your time against a diverse set of tasks across multiple productions, prioritizing & executing with efficiency
Learn quickly and adapt to new technology and approaches to production. Always be thinking of the best possible solution for the specific challenge at hand.
Work well within a team setting to build consensus, gather facts, determine the best course of action and ensure all members are on board with delegated tasks
Develop your client management skills, with the goal of making the client experience enjoyable, predictable and collaborative.
Help manage timelines, budgets and relationships with our vendors and teams to ensure quality.
Support and contribute to internal projects, directly managing production resources as needed (marketing activities, Jam3 website, Jam3 merchandise, booking travel, etc)
Support the office manager with administrative tasks as required


Be prepared to discuss things like:


Your career aspirations in digital production
Current web and technology trends that excite you


Jam3 is an equal opportunity employer. We welcome and encourage all applicants. Accommodations are available on request for candidates taking part in all aspects of the selection process.",-1.0,-1,https://indeed.nljavascript:void(0);,https://nl.indeed.com/vacature-bekijken?jk=df219b5ecaad0b11&fccid=eb26fc835559d2fa&vjs=3,Meer dan 30 dagen geleden,Meer dan 30 dagen geleden,2021-01-20,en,Female
10,accommodation,Indeed,p_3416973b9765117e,Human Resources Generalist,Alimentiv, AmsterdamZuidoost,"JOB LOCATION: Amsterdam, the Netherlands (Office-based)

JOB TITLE: Human Resources Generalist (Full time, limited term 1 year)

REPORTS TO: Manager, Human Resources (US & Europe)

DEPARTMENT/UNIT NAME: Corporate Operations > Human Resources

JOB SUMMARY:

This is an exciting opportunity to be the first Netherlands-based employee in Human Resources for Alimentiv. The HR Generalist (HRG) is responsible for providing HR operational and administrative support for: Organizational Effectiveness, Workforce Planning and Talent Management, Learning and Development, Health Safety and Wellness, Employee Relations, Total Rewards, and HR Metrics and Reporting in a global, shared-services context. The HRG will interface with other members of the HR team, managers, employees, and external stakeholders and will participate in other special projects/duties as assigned.

AREAS OF RESPONSIBILITY:

HR Operations and Administrative Support

Organizational Effectiveness


Administer changes to the organization structure.
In conjunction with the SMHRE, create and/or facilitate the distribution of employee engagement surveys; Compile data and contribute to employee engagement initiatives.
Identify, document and communicate HR risks to the Manager, HR (MHR).
Assist in the creation and delivery of HR communications.


Workforce Planning and Talent Management


Prepare, review, and file global employment agreements for new employees.
Administer the end-to-end new onboarding process for new employees and contingent workers including documentation, facilitation, and IT equipment requests.
Provide support to managers and employees regarding performance management; Collaborate with Managers to create Performance Improvement Plans at the employee level.
Support the talent acquisition lifecycle for assigned positions when required.
In conjunction with the MHR, update career mapping visuals.
Liaise with Immigration vendor(s) to coordinator employee work or travel related authorizations.


Learning and Development


Plan, facilitate and/or participate in New Employee Orientation.
In conjunction with the Learning and Development Specialist support LMS administration, reporting, and troubleshooting; Liaise with the LMS vendor as needed.


Health, Safety, and Wellness


Maintain knowledge of legislation, regulations, and standards regarding workplace health and safety.
Lead disability management cases for assigned employees and coordinate with vendor.
Administer absence management program for assigned employees.


Employee Relations


Maintain knowledge of legislation that affects global HR practices; Monitor regulatory adherence of HR policies and programs and contribute to new policy development.
Respond to and resolve assigned HR inquiries with a customer service focus.
Conduct case investigations for assigned employees; Manage conflict resolution and in conjunction with MHR, issue disciplinary action when required.
Ensure confidential, accurate and organized document management of HR records and files.
Administer the exiting process for employees and contingent workers; In conjunction with the MHR, conduct employee terminations.
Support Diversity and Inclusion initiatives.


Total Rewards


Provide ad-hoc support to the Total Rewards & HR Analytics Specialist for pension/benefits, merit increases, and bonuses.
Reiterates key messaging to employees and managers regarding total rewards.
Facilitate the global employee recognition and service award program; Ensure information is accurately recorded in the HRIS.
HR Metrics, Reporting, and Financial Management
Record and make changes to employee information in the HRIS.
Participate in and support periodic HR and QA Audits.
Liaise and provide support to the Payroll & Accounting Coordinator as needed.
Assist in the planning and implementation of new HR systems.
Provide HR-related information to internal stakeholders to support ongoing initiatives.


Professional Practice


Act with integrity and balance the interest of all parties in carrying out HR activities; Model ethical practices for staff.
Adhere to HR legal requirements in carrying out all HR activities; keep current on changes to the laws that govern HR practices.
Maintain awareness of broad economic, societal, technological, political, global, and demographic trends; Evaluate the credibility of sources of information.


QUALIFICATIONS:

The ideal candidate will possess a varied background in Human Resources across Talent Acquisition, Employee Relations, Health & Wellness, and Total Rewards. In addition, the successful candidate will have strong knowledge and experience in applying employment legislation/standards in the Netherlands and more broadly in Europe. Previous experience in the Life Sciences/Professional Services Industries, or Shared Services environment is an asset. Participation in HR professional practice/HR certification is considered an asset. The successful candidate will have highly refined communication, interpersonal, and organizational skills. Further, the ideal candidate will be comfortable working independently in a fast-paced environment. A minimum of an undergraduate degree and 1-3 years of relevant experience OR a college diploma and 4-6 years of experience. Fluency in Dutch and English is required.

WORKING CONDITIONS:

 Office-based
Accommodations for job applicants with disabilities are available",-1.0,-1,https://indeed.nljavascript:void(0);,https://nl.indeed.com/vacature-bekijken?jk=3416973b9765117e&fccid=dfe344fd30931322&vjs=3,Meer dan 30 dagen geleden,Meer dan 30 dagen geleden,2021-01-20,en,Female
