,Search Keyword,Platform,Job ID,Job Title,Company Name,Location,Job Description,Rating,Employment Type,Company URL,Job URL,Job Age,Job Age Number,Collection Date,Language,Gender
0,psychologen,Indeed,pj_55edffb202aa4b06,Junior begeleider kinderen met ASS (Autisme),Stichting Het Robertshuis, Hilversum,"Wie zijn wij?Stichting het Robertshuis is per direct op zoek naar junior begeleiders. Het Robertshuis biedt dagbehandeling voor kinderen, jeugdigen en (jong-)volwassenen met een stoornis binnen het Autisme Spectrum (ASS) met onder andere locaties in regio 't Gooi (Laren, Soest en 's Gravenland). Dit doen we dagelijks met een jong, gedreven en enthousiast team.Wat ga je doen?Als junior begeleider verzorg en begeleid je de kinderen middels intensieve methodieken conform het zorgleefplan. Dit doe je om de ontwikkeling te stimuleren en de zelfredzaamheid te vergroten van de kinderen, jeugdigen en (jong-)volwassenen.Middels behandelmethodieken, zoals ABA (Applied Behaviour Analysis), PRT (Pivotal Response Treatment) en DTT (Discrete Trial Training), werk je dagelijks aan deze doelen. Het groepje kinderen dat onder je verantwoording valt, betreft een maximaal aantal van drie kinderen, waardoor de behandeling zeer effectief is en het wat betreft het kunnen werken aan gestelde doelen, haalbaar is.Met de andere begeleiders van de groep vorm je een hecht team, dat wordt aangestuurd door de senior begeleider. Door jouw dagelijkse begeleiding van de kinderen signaleer je de behoeften, mogelijkheden, knelpunten en probleemsituaties van de kinderen en de afdeling en deze informatie geef je door aan de senior begeleider. Ook ben je in staat vragen van ouders/verzorgers te signaleren en door te geven aan je senior begeleider.Daarnaast ligt het registreren, rapporteren en verstrekken van informatie over de dagelijkse gang van zaken binnen jouw verantwoordelijkheidsgebied. Verder vragen we van je ondersteunende werkzaamheden te verrichten. Ten slotte ben je als junior begeleider verantwoordelijk voor het uitvoeren van de protocollen en de binnen de stichting geldende procedures.Wat zijn de functie-eisen?Als junior begeleider ben je enthousiast en heb je affiniteit met de doelgroep. Je hebt een improviserend vermogen en bent in staat om probleemoplossend te werken. Ook ben je stressbestendig en kun je je flexibel opstellen.Om informatie goed over te kunnen dragen ben je zowel mondeling als schriftelijk vaardig. Je hebt een MBO niveau 4, HBO of universitair werk- en denkniveau en je bent in het bezit van rijbewijs en een eigen auto.ArbeidsvoorwaardenHet Robertshuis biedt je een uitdagende en stimulerende omgeving. Je werkt in kleine en hechte teams, waarbij je samen aan het doel werkt, namelijk de ontwikkeling van kinderen. De functie is te vervullen op fulltime basis (36 uur verdeeld over 5 dagen per week) of parttime basis (24 uur verdeeld over 2,5 dag per week), waarbij de enige onregelmatige dienst om de week overdag op zaterdag kan worden ingepland.Ook zijn er doorgroeimogelijkheden bij relevante achtergrond en passende motivatie tot senior begeleider of gedragswetenschapper; al onze gedragswetenschappers, orthopedagogen en (kinder-)psychologen werkzaam binnen de organisatie zijn begonnen als junior begeleider. Het betreft een arbeidsovereenkomst voor bepaalde periode, waarbij uitzicht is op een vast dienstverband. Inschaling en arbeidsvoorwaarden zijn conform CAO Gehandicaptenzorg.Interesse?Ben je geïnteresseerd en wil jij ons team komen versterken? Reageer dan op deze vacature, bezoek onze website via www.hetrobertshuis.nl of bel 035-5312163 voor meer informatie.Soort dienstverband: Fulltime, ParttimeArbeidsvoorwaarden:ReiskostenvergoedingWerkschema:Dagdienstma-vrWeekend",-1.0,-1,https://indeed.nljavascript:void(0);,https://nl.indeed.com/vacature-bekijken/pagead/clk?mo=r&ad=-6NYlbfkN0CLhKDGpeobdSuxWhJg1dcBH14RzxCRkpb10PTnA9Zo8uAoOe087Jsv9ylYOIZ_oDnW23xFn0rhX7wUSNjVPn76DL7sOgKQ95IFlIJPl48sCHAF3CW3jbp0j4lW6GXsYGjA2c2H-rONZA8OMX5zYWnPw1P2D5Lt3Q5lLeM1tCRnbi1nGlnqDs-H5qhXz-IFJQVrR23uzk67WJ9HJAWY1NKA2_9CPmD6bAC0BU1W62Wd8lRvVl9ZxeBBzlKYyW7sCWXCHhSJCYmN1LxKuEY-f--VnrJz0vMa3dubq9VWt2tAAvl4cUTTiUjjgMb4HC3JKsdWPbHPSOh53FT0H0uQNGfsLhUxt4O_u6weq63Y80r9vQ8GbLDI_Dgu0qoIUYyHehxtZNM7ZCcWlEaQU6eXlVJ3Ut0U2eaIkl2UcyJpNZNKZrUT85l5pXRo4jhrhdd9cnyKUBoGxdUc0agF1e_w_ixf&p=0&fvj=1&vjs=3,2 dagen geleden,2 dagen geleden,2021-01-24,en,Female
1,psychologen,Indeed,p_1694b6620affff9e,Studentendecaan locatie Haarlem,Hogeschool Inholland, Haarlem,"Jouw rol
Je bent de begeleider van onze studenten – Je biedt een luisterend oor, informeert en adviseert over alles wat onze studenten tijdens hun studie tegenkomen. Dit doe je tijdens individuele (inloop) spreekuren. Tijdens deze spreekuren kun je o.a. de volgende taken verwachten:
Je adviseert en begeleidt studenten met vragen over landelijke en regionale (onderwijs)wet- en regelgeving in relatie tot hun persoonlijke situatie.
Je ondersteunt studenten bij procedures als de Bindend Studieadvies (BSA) en bij vraagstukken die te maken hebben met bijvoorbeeldd financiën, studiefinanciering en medische of privéomstandigheden.
Je biedt psychosociale ondersteuning en verwijst studenten door naar eerstelijns en tweedelijns hulpverlening voor specialistische ondersteuning, zoals psychologen.
Je adviseert en begeleidt studenten bij klachten, bezwaar- en beroepsprocedures.
Waar mogelijk proberen je de positie van bijzondere groepen, zoals bijvoorbeeld functiebeperkte en internationale studenten, te waarborgen en te versterken.
Je doet dit alles op een coachende, oplossingsgerichte, manier. Kortom, je hebt een rol die écht het verschil maakt.

Je bent adviseur studievoortgang – Jij bent degene die aanpassingen in het onderwijsprogramma voor studenten kan organiseren. Op deze manier lever je een belangrijke bijdrage aan het voorkomen van studie uitval. Ook adviseer je examencommissies bij individuele aanvragen van studenten.

Je bent collega/teamlid – Naast jouw rol als decaan voor studenten trek je ook gezamenlijk op met je ‘collegadecanen’ van andere vestigingen om continue verbetering en innovatie van het decanaat binnen onze hogeschool te bereiken. Samen dragen jullie bij aan de ontwikkeling en uitvoering van beleid, bijvoorbeeld het subsidiebeleid voor studentenorganisaties en de ontwikkeling van beleid op een speciaal vlak, bijvoorbeeld buitenlandse studenten.

Goed om te weten
1. Om in aannmerking te komen voor de functie van studentendecaan vragen wij ruime ervaring als jongerewerker, psychosociaal ondersteuner en je bent een echte (energieke en enthousiasmerende) teamplayer, iemand die vanuit de toegevoegde waarde voor de organisatie kan omgaan met dilemma's, vraagstukken weet te herkaderen en in staat is om verbinding te creëren. Dit zijn 3 harde eisen. Daarnaast is het hebben van kennis van landelijke en regionale (onderwijs)wet- en regelgeving een pré.

2. Op dit moment werken wij 80% vanuit huis. Dat houdt in dat vergaderingen, spreekuren en trainingen voornamelijk vanuit huis worden verzorgd. Je zal daarom bij ons veel werken met Microsoft Teams, Zoom, en andere applicaties die het digitaal onderwijs en communiceren mogelijk maken.
Wie ben jij
Je hebt minimaal een afgeronde HBO+/WO niveau, bijvoorbeeld Psychologie/Pedagogiek/Juridisch/Sociaal.
Je bent vaardig in het toepassen van juridische regelingen.
Je kan zowel individueel als in teamverband functioneren.
Je hebt plezier in het werken met jongeren en kent de uitdagingen waar jongeren voor staan. Je hebt een luisterend oor, maar hoort ook wat de student nodig heeft.
Je kent je weg in de stad Haarlem en je kent de sociale kaart om de jongere heen.
Je bent toegankelijk en benaderbaar en in staat de student verder te helpen in zijn of haar leerweg bij ons aan de Hogeschool, je kent de drempels, blokkades en tegenslagen die op het pad van de student kunnen komen en kunt hierin adviserend en daar waar nodig coachend optreden.
Tenminste 5 jaar passende werkervaring bij voorkeur in het hoger onderwijs of in de zorg is een pré.
Ervaring en affiniteit in het omgaan met psychosociale problematiek.
Je beschikt over uitstekende gespreksvaardigheden en kan deze situationeel toepassen.
Je weet hoe je gespreksverslaglegging op accurate wijze in DGRS (ons intern registratiesysteem) vastlegt.
Je hebt een brede kijk op ontwikkelingen in het hbo en de samenleving. Dit is een pré.
Wat bieden wij
Het betreft een tijdelijk dienstverband van 12 maanden met op mogelijkheid tot een hernieuwd contract (vast dienstverband).
Een salaris van maximaal € 5.026,85 bruto per maand, schaal 11 bij een volledig dienstverband.
Een werkweek van 32 uur per week. Dit staat gelijk aan 0.8 fte.
Een goed te bereiken werkplek in Haarlem. Alle gemaakte reiskosten met openbaar vervoer worden 100% vergoed. Kies je voor eigen vervoer weet dan dat je hierin beperkt vergoed wordt.
Een uitbetaling van een vakantietoeslag van 8% in mei.
Een uitbetaling van een eindejaarsuitkering van 8,3% in december.
Een ruime verlofregeling waarin je je eigen keuzes kunt maken. Bijvoorbeeld: bij een fulltime-aanstelling en een gekozen werkweekvariant van 40 uur per week heb je jaarlijks 428 verlofuren. Dit zijn 53,5 vakantiedagen. Onze verlofregeling is inclusief de verplichte vrije dagen en de nationale en erkende feestdagen.
Een aantrekkelijke pensioenregeling bij ABP (Pensioenfonds voor overheid en onderwijs).
Je krijgt van ons genoeg ruimte (tijd) en ruime middelen (geld) voor professionele en persoonlijke ontwikkeling. Wij vinden het belangrijk dat je altijd bereid bent om te leren. Bij ons staat leren=durven centraal.
Er wordt een verzekering tegen gedeeltelijke arbeidsongeschiktheid voor je afgesloten die volledig door ons, Hogeschool Inholland, wordt betaald.
Je hebt bij ons recht op een ruimhartige regeling betaald ouderschapsverlof en een aanvulling op de wettelijke regelingen als het gaat om partnerverlof bij de geboorte of adoptie van jouw kind(je).
Een prettige en informele werkomgeving, waarin we onze collega’s en studenten bij naam kennen.
Naast bovengenoemde arbeidsvoorwaarden bieden wij ook een keuzemenu aan. In dit keuzemenu zit o.a. de mogelijkheid tot het kopen en verkopen van bovenwettelijke verlofuren, het fietsplan en de mogelijkheid van saldering woon-werkverkeer en vakbondscontributie.

Sociale partners blijven inzetten op verhoging van de kwaliteit van het onderwijs en onderzoek, van de onderwijsorganisatie en van het personeel. Wij volgen de cao hbo. Een uitstekend pakket aan primaire en secundaire arbeidsvoorwaarden.
Jouw werkomgeving
Als je komt werken bij Inholland, dan ervaar je dat studenten én collega's bij ons centraal staan. Onze cultuur is persoonlijk en dichtbij, dat betekent een leer-en werkomgeving waarin we elkaar bij naam kennen. Bij ons krijg je de ruimte om je zowel professioneel als persoonlijk te blijven ontwikkelen, in elke rol en op elk niveau. Om zo een inspirerend voorbeeld te zijn voor onze studenten (en zij voor ons) en relevant te blijven in een steeds veranderende wereld.

Op onze 8 locaties verspreid over de Randstad, van de kop van Noord-Holland tot de Drechtsteden, moedigen we onze studenten aan om door te groeien tot zelfverzekerde professionals die de samenleving duurzamer, gezonder en creatiever maken. Vanuit een veilige basis bereiden we hen voor op de banen van morgen. Dit doen we met een breed hbo-onderwijsaanbod en onderzoek, dat zo goed mogelijk aansluit op de ontwikkelingen in de praktijk en dat gericht is op verschillende interessegebieden: van gezondheidszorg tot economie en van techniek tot onderwijs.

Onze docenten en collega's van de stafdiensten leggen de lat hoog, voor onze studenten, voor elkaar en voor zichzelf. In de steeds veranderende wereld heb je moed nodig om je jezelf kwetsbaar op te stellen en je mening te durven aanpassen. En lef te hebben om kritisch te blijven, dingen uit te proberen en je gevoel te volgen. Continu blijven zoeken, vallen, opstaan en doorgaan. Leren = durven!",-1.0,-1,https://indeed.nl/rc/clk?jk=1694b6620affff9e&from=vj&mvj=0&vjfrom=vjs&pos=bottom&astse=e21e505135c78671&assa=7166,https://nl.indeed.com/vacature-bekijken?jk=1694b6620affff9e&fccid=b75000dcc110c92e&vjs=3,2 dagen geleden,2 dagen geleden,2021-01-24,en,Female
2,psychologen,Indeed,p_1c2903786351d916,Twee gedreven GZ-psychologen,Ingeborg Douwes Centrum, Amsterdam,"(16 uur tot 24 uur)

Jouw werk

De essentie van je werk is zorgen dat mensen met de diagnose kanker deze heftige levensgebeurtenis goed kunnen opvangen, doorstaan en verwerken. Als psycholoog speel je een betekenisvolle rol in hun (trauma)verwerking en het hervinden van zingeving. Doel is dat de cliënt (of hun kinderen, partners of nabestaanden) een nieuwe balans vindt en de impactvolle gebeurtenis(sen) kan integreren in zijn of haar leven.

Je bent verantwoordelijk voor een goede intake, diagnostisering en indicatiestelling. In overleg met de cliënt stel je een behandelplan op. Binnen de BGGZ ben je regiebehandelaar. Binnen de SGGZ ben je dat onder verantwoordelijkheid van een klinisch psycholoog.

Dagelijks neem je deel aan de diagnostiekbespreking onder leiding van een klinisch psycholoog. Maandelijks is er intervisie waarbij alle psychologen aanwezig zijn.

Jouw profiel
Je bent een BIG geregistreerde GZ-psycholoog.
Je hebt ervaring en affiniteit met de psycho-oncologie; bij voorkeur heb je er ook werkervaring in.
Je hebt ervaring met de behandelvormen die we bieden.
Je vindt het leuk om te werken in een overzichtelijke organisatie waar mensen zich met hart en ziel inzetten voor de cliënten en omzien naar elkaars persoonlijk welzijn.
Je kunt het aan om met mensen te werken die een levensbedreigende ziekte hebben.
Je hebt een zelfstandige houding.
Wat wij bieden

Momenteel zoeken wij twee GZ-psychologen:

voor 16 uur tot 24 uur

In beide gevallen gaat het om een contract voor bepaalde tijd, voor de duur van 1 jaar, met de intentie om deze om te zetten in een contract voor onbepaalde tijd.

De CAO ziekenhuizen is van toepassing. Afhankelijk van ervaring en opleiding zijn deze functies ingeschaald in FWG-schaal 65.

Naast goede arbeidsvoorwaarden, zoals een reiskostenregeling, eindejaarsuitkering en persoonlijk levensfasebudget biedt het OLVG meer waardevolle extra’s via het OLVG Meerkeuzesysteem Arbeidsvoorwaarden, zoals korting op verzekeringen. Je kunt binnen dit systeem de arbeidsvoorwaarden passend maken op jouw situatie.

Je komt te werken in een enthousiast en gespecialiseerd team, met daarin onder andere een klinisch psycholoog, een psychotherapeut, GZ-psychologen, kinder- en jeugdpsychologen, een haptotherapeut en een mindfulnesstrainer.

De psycho-oncologie is niet alleen een boeiend vakgebied maar is ook volop in beweging. Er is veel ruimte voor eigen initiatief en participatie in scholing, onderzoek en innovatieprojecten. Naast intervisie en supervisie zijn er mogelijkheden tot bij- en nascholing en het volgen van trainingen.

Het team telt dertien mensen, de sfeer is goed, we hechten aan collegialiteit en hebben oog voor elkaar. Dat is niet onbelangrijk in deze werkomgeving waarbij we dagelijks te maken hebben met de grote vraagstukken, die letterlijk over leven en dood gaan.

We werken vanuit verschillende locaties in Amsterdam en Haarlem.

Over het Ingeborg Douwes Centrum

Het Ingeborg Douwes Centrum biedt mensen psychologische (na)zorg bij kanker. Onze psychologische behandelingen hebben als doel het verbeteren van de kwaliteit van leven, zingeving, verwerking van kanker en re-integratie in de maatschappij. We bieden zowel basis- als specialistische ggz aan en afhankelijk van de behoefte van de cliënt is deze individueel-, systeem-, relatie- of groepsgericht.

Onze behandelingen zijn evidenced based. We hebben expertise op het gebied van EFT, zingeving, ACT, EMDR, CGT, visualisatie- en ontspanningstechnieken. We participeren in onderzoek om het vakgebied verder te ontwikkelen en innoveren. En we bieden scholing aan om de deskundigheid te vergroten.

Jaarlijks behandelen we ongeveer 700 mensen: mensen met of na kanker, partners, kinderen en nabestaanden. Zij kunnen bij ons terecht ongeacht de aard en de ernst van de kanker, de fase van behandeling en het perspectief.

Het Ingeborg Douwes Centrum is een kleinschalige organisatie met korte lijnen. Organisatorisch is het centrum onderdeel van OLVG

Solliciteren of meer weten?

Wil je meer informatie of heb je vragen, neem dan contact op met Eline Aukema, hoofd van het Ingeborg Douwes Centrum. Per mail: e.aukema@olvg.nl of telefonisch: 020 – 480 75 80. Je kunt ook contact opnemen met Wim Kraay, klinisch psycholoog bij het Ingeborg Douwes Centrum, per mail: w.kraay@olvg.nl .

Wil je graag deel uit gaan maken van ons team, stuur dan je sollicitatie naar ingeborgdouwescentrum@olvg.nl, ter attentie van Eline Aukema. We maken graag kennis met je.",-1.0,-1,https://indeed.nl/rc/clk?jk=1c2903786351d916&from=vj&mvj=0&vjfrom=vjs&pos=bottom&astse=8d4e43e580347f09&assa=8570,https://nl.indeed.com/vacature-bekijken?jk=1c2903786351d916&fccid=334e0cb450744367&vjs=3,2 dagen geleden,2 dagen geleden,2021-01-24,en,Female
3,psychologen,Indeed,p_09fd27356cb3034a,Medisch maatschappelijk werker Revalidatiegeneeskunde,Academisch Medisch Centrum, Amsterdam,"Wat ga je doen

De afdeling Revalidatiegeneeskunde is op zoek naar een poliklinisch medisch maatschappelijk werker (m/v) voor 24 uur per week. Je wordt onderdeel van het kinderrevalidatieteam waarbinnen we ons richten op een aantal specialistische patientgroepen. We doen diagnostiek en begeleiding van kinderen en hun ouders/verzorgers met vragen over de ontwikkeling, waarbij nog niet altijd een diagnose is gesteld. We begeleiden en monitoren kinderen met een spierziekte, spina bifida en cerebrale parese en ondersteunen ouders/verzorgers in de begeleiding van hun opgroeiende kind.

Je werkt in een multidisciplinair behandelteam en brengt samen met het team het gezin in kaart en inventariseert vragen op het psychosociale, emotionele, en materiële vlak. Je zoekt naar geschikte oplossingen of verwijzingen en begeleidt in het vinden van een geschikte vervolgsetting voor het kind.

Binnen de discipline en het multidisciplinaire team, wordt aan deskundigheidsbevordering en intervisie gedaan. Van elkaar leren, samen ontwikkelen en implementeren vinden doorlopend plaats.

Wat we van je verwachten
Je hebt een HBO Maatschappelijk Werk diploma en minimaal 2 jaar werkervaring;
bij voorkeur heb je stage- of werkervaring in het medisch maatschappelijk werk binnen de kinderrevalidatie;
je hebt affiniteit met ouderbegeleidingstrajecten;
je gaat het gesprek aan met ouders/verzorgers rondom het veranderd toekomstperspectief voor hen en/of hun kind;
je pakt praktische zaken op rondom opvang, vervolgsetting, huisvesting en financien. Verwerking, rouw en acceptatie zijn thema’s die aan bod komen;
je bent ondernemend en doelgericht;
zowel zelfstandig als het werken in een team passen jou goed;
je kunt duidelijk en bondig, mondeling en schriftelijk rapporteren;
je heb zicht op de sociale kaart van Amsterdam en omstreken en je kan goed contacten onderhouden met stakeholders betrokken bij de zorg rondom de kinderen (collega’s in 2de en 1ste lijn, gemeente, SJG, OKT teams, Kinderdagcentra etc).
Waar ga je werken

De afdeling Revalidatiegeneeskunde is een innovatieve behandel, onderzoeks- en onderwijsomgeving waarin interdisciplinair en hecht wordt samengewerkt en evidence-based wordt behandeld. Er werken zo’n 200 medewerkers verdeeld over twee locaties (VUmc en AMC) Vier gespecialiseerde revalidatieunits leveren evidence based zorg gericht op kinderen, neurologische aandoeningen en aandoeningen van het bewegingsapparaat (acuut en chronisch). De unit kinderrevalidatie, bestaande uit twee hoogleraren, senior onderzoekers, PhD studenten, artsen en paramedici worden gaandeweg de fusie gecentraliseerd op locatie AMC.

Het kinder behandelteam bestaat uit zeven revalidatieartsen een physician assistant, een verpleegkundige, meerdere AIOS, een paramedisch leidinggevende, elf kinderfysiotherapeuten, zes (kinder)ergotherapeuten, vijf logopedisten, twee medisch maatschappelijk werkers en twee psychologen. Het kinderteam verricht naast poliklinische zorg, klinische zorg op de kinderafdelingen van het Emma kinderziekenhuis.

Als maatschappelijk werker ben jij primair betrokken bij het poliklinische expertiseteam dat zich richt op op de diagnostiek en bahandeling van jonge kinderen met een ontwikkelingsachterstand.

Wat we je bieden

Wij bieden je ruime gelegenheid tot ontplooiing, verdieping en verbreding, extra scholing en een plek om te groeien! Werken bij Amsterdam UMC betekent werken in een inspirerende en professionele omgeving waar ontwikkeling, in alle opzichten, wordt gestimuleerd.
Het salaris ligt tussen € 3.050,- en € 4.200,- bruto per maand op basis van 36 uur (schaal 9 CAO UMC)
Het salaris is exclusief eventuele toeslagen voor onregelmatige diensten, vakantiegeld (8%) en een eindejaarsuitkering (8,3%).Wij bieden in eerste instantie een arbeidsovereenkomst aan voor 12 maanden, met uitzicht op een vast dienstverband bij goed functioneren.Naast uitstekende bereikbaarheid met het OV, zijn er voor medewerkers ook parkeerplaatsen beschikbaar. Wil je op de fiets komen dan kan je gebruik maken van de fietsregeling.Pensioen wordt opgebouwd bij het ABP. Amsterdam UMC draagt een groot deel van de premie bij (70%).Wij hebben een zeer actieve personeelsvereniging en organiseren verschillende (sportieve) activiteiten en evenementen door het jaar heen.Bij ons heb je gratis en onbeperkt toegang tot het trainingsaanbod van onze online leeromgeving GoodHabitz.

Kijk voor een overzicht van al onze andere arbeidsvoorwaarden op https://werkenbijamc.nl/arbeidsvoorwaarden/.

Laten we kennis maken

Wil je direct solliciteren? Gebruik dan de knop ‘solliciteren’ op deze pagina.

Wil je eerst meer informatie? Neem dan gerust contact op met Els Spaargaren (Paramedisch manager kinderteam), via 06 50 06 30 65 of Michael van der Ouderaa (Manager), via 020 – 566 2918.

Wij zien uit naar onze kennismaking!

Een screening zal onderdeel uitmaken van de selectieprocedure. Toegang tot DigiD is hiervoor noodzakelijk.

LET OP: In verband met de bestuurlijke fusie tussen AMC en VUmc, geldt voor deze vacature dat medewerkers van AMC én VUmc plaatsnemen in de selectiecommissie. Door jouw sollicitatie te versturen, ga je ermee akkoord dat jouw CV en Motivatiebrief door AMC ook gedeeld worden met (de bij de behandeling van deze vacature betrokken medewerkers van) VUmc en zij dus inzage hebben in de door jou opgestuurde persoonsgegevens.",-1.0,-1,https://indeed.nl/rc/clk?jk=09fd27356cb3034a&from=vj&mvj=0&vjfrom=vjs&pos=bottom&astse=ff0dfe7261022aa5&assa=186,https://nl.indeed.com/vacature-bekijken?jk=09fd27356cb3034a&fccid=280e9a541be45c33&vjs=3,2 dagen geleden,2 dagen geleden,2021-01-24,en,Female
