,Search Keyword,Platform,Job ID,Job Title,Company Name,Location,Job Description,Rating,Employment Type,Company URL,Job URL,Job Age,Job Age Number,Collection Date,Language,Gender
40,psychologen,Indeed,p_6be539aa4b4f8699,Regiebehandelaar (GZ-psycholoog / Psychotherapeut / Klinisch Psycholoog),De Waag, Amsterdam,"Locatie Amsterdam

Als regiebehandelaar bij de Waag Amsterdam kom je te werken in een enthousiast en innovatief team van professionals! Zo werken we met Virtual Reality en EFT. Ook investeert de Waag in je persoonlijke ontwikkeling door middel van een individueel opleidingsbudget.

Regiebehandelaar (GZ-psycholoog / Psychotherapeut / Klinisch Psycholoog)

(32-36 uur, Zorglijn Agressie en Vermogen of Huiselijk Geweld)

Als behandelaar kom je te werken in het team Agressie en Vermogen of Huiselijk Geweld. Onze teams bestaan uit enthousiaste en bevlogen behandelaren die tot doel hebben om gezamenlijk de veiligheid te vergroten. Er is veel ruimte voor inbreng van eigen expertise en voldoende vrijheid dit toe te passen in behandelingen. Beide teams bestaan uit collega’s met diverse achtergronden zoals psychiaters, (KP/GZ)- psychologen, systeemtherapeuten en orthopedagogen generalisten. Er werken zowel beginnende collega’s als behandelaren met jarenlange ervaring. Humor is voor ons een belangrijk ingrediënt om gezond en met plezier aan het werk te blijven.

We zijn gericht op groei en innovatie. Sinds kort kunnen we bijvoorbeeld Virtual Reality toevoegen aan onze behandelingen. Ook vinden we het belangrijk dat collega’s zich blijven ontwikkelen. Je krijgt dan ook een eigen opleidingsbudget wat je kunt inzetten naar eigen wensen. Naast dat we een gedreven team zijn, is er ook veel ruimte voor gezelligheid.

Wat ga je doen?

Je voert zelfstandig intakes, diagnostiek en behandelingen uit.
Je neemt wekelijks deel aan multidisciplinaire besprekingen binnen het team.
Naast de directe cliëntenzorg is er de mogelijkheid je in te zetten voor neventaken zoals het verder ontwikkelen van het behandelaanbod.
Naast intensieve samenwerking met collega's, zoekt het team de verbinding met allerlei ketenpartners.
Je doet voorstellen voor verbetering van de inhoud van kwaliteit van de zorg (innovatie en ontwikkeling).
Naast je eigen caseload, treed je op als regiebehandelaar in (complexe) casuïstiek.


Wat neem je mee?

Je beschikt over een BIG-registratie als GZ-Psycholoog, Klinisch Psycholoog of Psychotherapeut.
Je hebt werkervaring binnen de forensische zorg en bij voorkeur ervaring met behandeling.
Je hebt ervaring met het verrichten van intakes, uitvoeren van risicotaxaties en opstellen van behandelplannen.
Je bent verbindend, integer en kan de-escalerend optreden.


Wat bieden wij je?

Ontwikkelmogelijkheden, zowel in de dagelijkse praktijk van je werk, als door het volgen van (interne) trainingen en opleidingen. We besteden veel aandacht aan begeleiding en intervisie.
Een jaarlijks individueel opleidingsbudget.
Daarnaast bieden wij je uitdagend en veelzijdig werk in een professionele omgeving waar collega's intensief met elkaar samenwerken.
De functie is ingeschaald in FWG 65 conform de salarisschalen van de CAO GGZ (min. € 4.053,- max. € 5.439,- bruto per maand op basis van een 36-urige werkweek). Inschaling is afhankelijk van opleiding en ervaring. Ook ontvang je een 13e maand.
Onze locatie in Amsterdam is goed bereikbaar met OV. Daarnaast hebben we een dakterras waar we graag samen lunchen wanneer het zonnetje doorbreekt.
Als je wilt, kun je als onderdeel van de procedure een dag(deel) meelopen om kennis te maken met ons team en het werkveld


Over de Waag

De Waag is de oudste en grootste aanbieder van ambulante forensische psychiatrie in Nederland. Sinds 1992 behandelen we jongeren met gedragsproblemen en volwassenen met agressieproblemen, problemen rondom huiselijk geweld of seksueel overschrijdend gedrag. Wil je meer weten over onze organisatie? Kijk dan op www.dewaagnederland.nl.

Enthousiast?

Wij komen graag met je in contact! Solliciteer via de link “solliciteer direct” op www.werkenbijdfzs.nl/vacatures. Voor meer informatie over de vacature kun je contact opnemen met: Nannie Faber (06-52570113) Teamleider zorglijn Huiselijk Geweld of met Natascha Königs (06-15967850) Teamleider zorglijn Agressie en Vermogen.

Een referentiecheck maakt onderdeel uit van de selectieprocedure. Voor de aanstellingsprocedure is het overleggen van een “Verklaring omtrent het Gedrag” (VOG) een verplicht onderdeel.

Acquisitie door werving en selectie-, detacherings- of uitzendbureaus naar aanleiding van deze advertentie wordt niet op prijs gesteld.",-1.0,-1,https://indeed.nl/rc/clk?jk=6be539aa4b4f8699&from=vj&mvj=0&vjfrom=vjs&pos=bottom&astse=ace52bcfbde05982&assa=4491,https://nl.indeed.com/vacature-bekijken?jk=6be539aa4b4f8699&fccid=811be73526668321&vjs=3,Meer dan 30 dagen geleden,Meer dan 30 dagen geleden,2021-01-24,en,Female
41,psychologen,Indeed,p_57e9f67544c91a34,Casemanager - polikliniek Hoorn,GGZ NoordHollandNoord, Westfriesland,"Een crisisbestendige ambulante casemanager met ervaring in de doelgroep kinderen en jeugd. Dat is waar wij naar op zoek zijn! Ben jij die nieuwe collega? Dan hebben wij een plek voor je in ons team in Hoorn voor 32 uur per week!
Waar ga je werken?
Triversum, de kind- en jeugddivisie van GGZ Noord-Holland-Noord, biedt vanuit een aantal poliklinieken verspreid over Noord-Holland ambulante specialistische GGZ-hulp aan kinderen van 0-18 jaar en hun ouders. De multidisciplinaire teams die binnen de poliklinieken werkzaam zijn voorzien zowel in diagnostiek, diverse vormen van individuele behandeling, groepsbehandeling,
gezinsbehandeling als ouderbegeleiding. Het team in Hoorn bestaat o.a. uit psychiaters, (klinisch en GZ-) psychologen, psychotherapeuten, sociaal psychiatrisch verpleegkundigen en autisme-hometrainers. Stuk voor stuk zeer gedreven professionals die dagelijks alles uit de kast halen om de beste zorg te leveren aan een bijzondere en kwetsbare doelgroep.
Het poliklinische multidisciplinaire team in Hoorn bestaat uit ongeveer 65 collega’s. Het is een team waar je jezelf kunt ontwikkelen, veel kunt leren en plezierig kunt werken. Wij hechten veel waarde aan een betrokken en professionele collega die dagelijks het beste uit zichzelf wil halen om daarmee de beste zorg aan onze cliënten te kunnen leveren. De problematiek van de kinderen en jongeren is zeer divers waardoor geen dag hetzelfde is. Je komt terecht in een team waar een goede sfeer heerst met een open en lerende cultuur.
Je werkt samen met het IHT team Jeugd, van waaruit je ambulante werkzaamheden verricht ten behoeve van kinderen en ouders in crisis.
Wat ga je doen?
Als casemanager coördineer je de zorg van cliënten met langdurige en ernstige psychiatrische problemen, gericht op een zo maatschappelijk mogelijk bestaan. Je biedt praktische hulp bij de cliënt thuis en tijdens een eventuele crisissituatie. De wensen en mogelijkheden van de cliënt en zijn systeem zijn daarbij het uitgangspunt. Jij helpt ze met het realiseren en ontwikkelen.
In het kort:
Je hebt een coördinerende behandeltaak.
Je biedt praktische hulp bij de cliënt thuis en tijdens een crisissituatie.
Je bent samen met de regiebehandelaar verantwoordelijk voor het plannen en uitvoeren van de behandeling.
Naast je persoonlijke caseload heb je ook een verantwoording in de opschaling die je samen met het team verzorgt.
Je levert een actieve bijdrage aan de verdere ontwikkeling van het team waarbij je nauw samenwerkt met andere disciplines van het team, andere mensen uit de organisatie en ketenpartners.
Wie ben jij?
Natuurlijk verwachten we ook een en ander van jou!
Jij…

- hebt bij voorkeur een HBO-V, B-verpleging opleiding of SPH aangevuld met een casemanagement- of FACT-opleiding

hebt ruime ervaring met de doelgroep en met het ambulant werken
bent in staat te werken vanuit een gelijkwaardige samenwerkingsrelatie met de
cliënt

kunt zowel zelfstandig als in teamverband werken en je hebt uitstekende organisatorische kwaliteiten en kan goed met digitale middelen overweg
bent een crisisbestendige, humoristische en daadkrachtige ambulant werker
je hebt ervaring met het werken met kinderen en ouders waarbij toegewerkt wordt naar herstel van de crisis door het aanreiken en vergroten van levensvaardigheden.Je bent in het bezit van een rijbewijs
Om voor deze functie in aanmerking te komen kun je een VOG overhandigen welke niet ouder is dan drie maanden op het tijdstip waarop je in dienst komt. Daarnaast ben je in het bezit van een rijbewijs en ben je gevaccineerd of heb je er geen bezwaar tegen om gevaccineerd te worden tegen Hepatitis-B.
Wat wij bieden
De arbeidsvoorwaarden zijn geregeld in de CAO Geestelijke Gezondheidszorg.

Salaris: FWG 50 Maximaal € 3.678,00 bruto per maand (afhankelijk van opleiding en ervaring).Eindejaarsuitkering van 8,33% en vakantietoeslag 8%.
- Meerkeuzesysteem arbeidsvoorwaarden (o.a. fiets- en sportplan).

166 vakantie uren en 35 LFB uren per jaar op basis van fulltime dienstverband (36 uur).
Mogelijkheid om deel te nemen aan collectieve ziektekostenverzekering.
Goede pensioenregeling met werkgeversbijdrage van 50%.
Onbeperkt toegang tot het digitale opleidingsaanbod op ons Centrale Leerplatform (waaronder GoodHabitz en GGZ Ecademy).Het betreft een dienstverband voor onbepaalde tijd.
Informatie
Voor nadere informatie over deze vacature kun je contact opnemen met Saskia Wijga te bereiken op: 0653734880 .

Over GGZ Noord-Holland-Noord
Wij zijn 2100 mensen die allen op eigen wijze bijdragen aan betere geestelijke gezondheidszorg voor
onze klanten. GGZ Noord-Holland-Noord bestaat ondertussen zo’n 85 jaar en houdt zich vanaf oprichting al bezig met vermaatschappelijking van de GGZ en het ontwikkelen van allerhande nieuwe methoden. Dat wij bekend staan als innovatieve GGZ maakt ons trots, maar niet lui. Er is immers nog zoveel te verbeteren in de nationale en internationale geestelijke gezondheidszorg.",-1.0,-1,https://indeed.nl/rc/clk?jk=57e9f67544c91a34&from=vj&mvj=0&vjfrom=vjs&pos=bottom&astse=e142a346b4e4ca47&assa=6250,https://nl.indeed.com/vacature-bekijken?jk=57e9f67544c91a34&fccid=3e72a3b08ecc5315&vjs=3,Meer dan 30 dagen geleden,Meer dan 30 dagen geleden,2021-01-24,en,Female
42,psychologen,Indeed,p_c39bd498220e6c51,GZ psycholoog/Orthopedagoog generalist- 24,Opvoedpoli, Alkmaar,"Ben jij een betrokken behandelaar met ervaring als GZ-psycholoog of orthopedagoog-generalist, Bied jij de begeleiding aan onze collega’s en voer jij de regie over de behandelingen? Word je uitgedaagd door complexe systeemproblematiek en werk je graag multidisciplinair? Dan bieden wij jou de prachtige functie van GZ-psycholoog / Regiebehandelaar in Alkmaar! Het is bespreekbaar om de vacature parttime te vervullen.
Wat ga je doen

De Opvoedpoli is een ambitieuze organisatie waarbinnen we ons sterk maken voor vernieuwing van de jeugdhulp en jeugd GGZ. Dat vraagt om verantwoordelijke, ondernemende, eigenzinnige denkers en doeners die hun professionele kennis en gezond verstand gebruiken. We werken met veel verschillende disciplines en specialismen, denk aan o.a. coaches, psychologen, orthopedagogen en verschillende vaktherapeuten. De Opvoedpoli biedt integrale hulp. De primaire focus ligt telkens op het systeem. Daarbij zijn alle collega’s getraind in het signaleren van en werken met veiligheid in het gezin. Vanuit een brede blik leveren we met elkaar maatwerk in antwoord op de vragen van gezinnen. Niet het aanbod staat centraal, maar de vraag van gezinnen en het realiseren van oplossingen. Doen wat nodig is, is ons motto. Specifieke aandachtsgebieden bij ons zijn multi-stress gezinnen, complexe problematiek (waaronder trauma en hechting), veiligheid en intercultureel werken.
Als GZ-psycholoog / regiebehandelaar bij de Opvoedpoli ben je betrokken bij het hele proces van intake, consultatie en deelname aan (multidisciplinaire) overleggen, tot het uitvoeren van diagnostiek, opstellen van behandelplannen, adviseren en uitvoeren van behandeling. Je voert de regie over je eigen behandelingen en coördineert – wanneer collega’s betrokken zijn bij de behandeling – het totaal aan zorg voor de jeugdige en het gezin..Met je collega’s bepaal je samen het beleid en het behandelplan rondom de cliënt en bewaak je het zorg pad.In het kader van werkbegeleiding ben je iemand die constructieve feedback kan geven vanuit een positief uitgangspunt. Bij ons heerst er een fijne leer- en ontwikkelingsstructuur waarbij iedereen zijn of haar vragen kan en mag stellen.
Waarom werken bij De Opvoedpoli? GZ-psycholoog / regiebehandelaar Renske deelt haar ervaring:“Bij De Opvoedpoli werken we echt onderscheidend ten opzichte van andere organisaties. Out of the box en outreachend werken zijn geen loze termen bij De Opvoedpoli. We zijn daar waar het voor de cliënt nodig is; we komen bij de mensen thuis, gaan mee naar school en gaan zo nodig het gesprek aan met de gemeente. We zoeken ook de samenwerking op met andere organisaties als dat in het belang is van de cliënt. Binnen de poli staat er echt een team, we doen het samen. Je voelt het vertrouwen van je collega’s en er is ruimte voor kwetsbaarheid. En niet onbelangrijk, humor staat hoog in het vaandel! Daarnaast heb je de gelegenheid zelf je werk in te delen en te organiseren, dus alle gelegenheid om werk en privé goed te combineren.”
Wat vragen wij van jou
Je bent een ervaren GZ-psycholoog, Orthopedagoog-Generalist, Psychotherapeut op het gebied van diagnostiek en behandeling;
Je hebt ervaring in het begeleiden van collega’s;
Gezien de diversiteit aan problematiek vragen we een variatie aan ervaring in bijvoorbeeld vrijwillige en/of gedwongen begeleiding en behandeling;
Je bent een energieke, open collega en je bent flexibel, systeemgericht en oplossingsgericht;
Je stelt de veiligheid van het kind centraal;
Je bent empathisch, kunt goed luisteren en aansluiten op de ander en ook directief zijn wanneer nodig;
Je kunt zowel zelfstandig als in teamverband werken. Je vindt het leuk om te werken in een omgeving waar vrijheid en verantwoordelijkheid onlosmakelijk met elkaar verbonden zijn.
Wanneer je bij ons komt werken, vragen wij om een VOG (Verklaring omtrent Gedrag)
Wat bieden wij jou
Een aanstelling in een divers, gedreven en gezellig team;
Een contract voor de duur van één jaar met uitzicht op een vast dienstverband;
De Opvoedpoli kent een eigen arbeidsvoorwaardenregeling met aandacht voor ontwikkeling en scholing;
Salariëring is afhankelijk van opleiding en ervaring.
Solliciteer en contact

Ben jij de GZ-psycholoog, Orthopedagoog-Generalist of Psychotherapeut voor de volgende stap in zijn/haar carrière? Solliciteer dan direct! Voor vragen en extra informatie kan je contact opnemen Nicolien Jongma, manager, via telefoonnummer 06 5701 49 64
Interne kandidaten hebben voorrang in deze procedure. Acquisitie wordt niet op prijs gesteld.",-1.0,-1,https://indeed.nl/rc/clk?jk=c39bd498220e6c51&from=vj&mvj=0&vjfrom=vjs&pos=bottom&astse=b6be2eeb9c357d3f&assa=8033,https://nl.indeed.com/vacature-bekijken?jk=c39bd498220e6c51&fccid=3973d7ac2179c2df&vjs=3,Meer dan 30 dagen geleden,Meer dan 30 dagen geleden,2021-01-24,en,Female
43,psychologen,Indeed,p_8dac52e133e17254,Junior begeleider,Stichting Het Robertshuis, Laren,"Wie zijn wij?
Stichting het Robertshuis is per direct op zoek naar junior begeleiders. Het Robertshuis biedt dagbehandeling voor kinderen, jeugdigen en (jong-)volwassenen met een stoornis binnen het Autisme Spectrum (ASS) met onder andere locaties in regio ‘t Gooi (Laren, Soest, ‘s Gravenland). Dit doen we dagelijks met een jong, gedreven en enthousiast team.
Wat ga je doen?
Als junior begeleider verzorg en begeleid je de kinderen middels intensieve methodieken conform het zorgleefplan. Dit doe je om de ontwikkeling te stimuleren en de zelfredzaamheid te vergroten van de kinderen, jeugdigen en (jong-)volwassenen.
Middels behandelmethodieken, zoals ABA (Applied Behaviour Analysis), PRT (Pivotal Response Treatment) en DTT (Discrete Trial Training), werk je dagelijks aan deze doelen. Het groepje kinderen dat onder je verantwoording valt, betreft een maximaal aantal van drie kinderen, waardoor de behandeling zeer effectief is en het wat betreft het kunnen werken aan gestelde doelen, haalbaar is.
Met de andere begeleiders van de groep vorm je een hecht team, dat wordt aangestuurd door de senior begeleider. Door jouw dagelijkse begeleiding van de kinderen signaleer je de behoeften, mogelijkheden, knelpunten en probleemsituaties van de kinderen en de afdeling en deze informatie geef je door aan de senior begeleider. Ook ben je in staat vragen van ouders/verzorgers te signaleren en door te geven aan je senior begeleider.
Daarnaast ligt het registreren, rapporteren en verstrekken van informatie over de dagelijkse gang van zaken binnen jouw verantwoordelijkheidsgebied. Verder vragen we van je ondersteunende werkzaamheden te verrichten. Ten slotte ben je als junior begeleider verantwoordelijk voor het uitvoeren van de protocollen en de binnen de stichting geldende procedures.
Wat zijn de functie-eisen?
Als junior begeleider ben je enthousiast en heb je affiniteit met de doelgroep. Je hebt een improviserend vermogen en bent in staat om probleemoplossend te werken. Ook ben je stressbestendig en kun je je flexibel opstellen.
Om informatie goed over te kunnen dragen ben je zowel mondeling als schriftelijk vaardig. Je hebt een MBO niveau 4, HBO of universitair werk- en denkniveau en je bent in het bezit van rijbewijs en een eigen auto.
Arbeidsvoorwaarden
Het Robertshuis biedt je een uitdagende en stimulerende omgeving. Je werkt in kleine en hechte teams, waarbij je samen aan het doel werkt, namelijk de ontwikkeling van kinderen. De functie is te vervullen op fulltime basis (36 uur verdeeld over 5 dagen per week) of parttime basis (24 uur verdeeld over 2,5 dag per week), waarbij de enige onregelmatige dienst om de week overdag op zaterdag is ingepland.
Ook zijn er doorgroeimogelijkheden bij relevante achtergrond en passende motivatie tot senior begeleider of gedragswetenschapper; al onze gedragswetenschappers, orthopedagogen en (kinder-)psychologen werkzaam binnen de organisatie zijn begonnen als junior begeleider. Het betreft een arbeidsovereenkomst voor bepaalde periode, waarbij uitzicht is op een vast dienstverband. Inschaling en arbeidsvoorwaarden zijn conform CAO Gehandicaptenzorg.
Interesse?
Ben je geïnteresseerd en wil jij ons team komen versterken? Stuur dan je sollicitatie met een (korte) motivatie en CV naar info @hetrobertshuis.nl of bel 035-5312163 voor meer informatie.
Soort dienstverband: Voltijd, Deeltijd
Opleiding:
MBO (Vereist)",-1.0,-1,https://indeed.nl/rc/clk?jk=8dac52e133e17254&from=vj&mvj=0&vjfrom=vjs&pos=bottom&astse=2a63e155202fa14c&assa=4721,https://nl.indeed.com/vacature-bekijken?jk=8dac52e133e17254&fccid=ec772936ac950a3d&vjs=3,Meer dan 30 dagen geleden,Meer dan 30 dagen geleden,2021-01-24,en,Female
44,psychologen,Indeed,p_639fa6f09c49f617,Master-psychologen Forensisch Ambulante Zorg (regio Utrecht),Inforsa, Amsterdam,"Master-psychologen Forensisch Ambulante Zorg (regio Utrecht)
Onze Forensische poli biedt hoogstaande forensische behandelingen vanuit een historie in de forensische verslavingszorg. Binnen dit nog jonge team is veel ruimte voor innovatie en creativiteit met als doel het voorkomen en terugdringen van recidieve. Ben jij een master-psycholoog met de juiste mindset of zelfs met forensische ervaring? Dan gaan we graag met je in gesprek!
Organisatie: Inforsa
Geplaatst op: 21 januari 2021
Sluitingsdatum: 4 februari 2021
Vacaturenummer: 21109
Min. aantal uren: 24
Max. aantal uren: 36
Locatie: Utrecht
Opleiding: WO
Contracttype: Regulier contract
Recruiter: Sebastiaan Honders
Waar hebben we jouw talent voor nodig?
Wij zijn op zoek naar enthousiaste master-psychologen voor onze forensische poli in Utrecht.
Als basispsycholoog maak je deel uit van een multidisciplinair behandelteam. Eén van je voornaamste taken is het voeren en uitwerken van intakegesprekken voor de FAZ. Hiertoe dien je te beschikken over je basisaantekening psychodiagnostiek. Daarnaast ben je werkzaam als behandelaar waarbij je beschikt over een afgeronde basiscursus CGT (zowel het inleidende- als het verdiepende deel). Je ontvangt ten minste tweewekelijks supervisie van een GZ-psycholoog.
Als basispsycholoog ontvang je hiërarchisch leiding van de manager bedrijfsvoering en de manager behandelzaken.
Wie ben jij?
Je bent afgestudeerd psycholoog, met een basisaantekening psychodiagnostiek;
Ervaring met de forensische doelgroep is een grote pre;
Je hebt minimaal twee jaar ervaring binnen de GGZ als basispsycholoog;
Je kunt zelfstandig intakes uitvoeren en hebt aantoonbare ervaring met het geven van (geprotocolleerde) behandeling;
Je bent in staat samen te werken in grotere verbanden en bereid tot overleg. Je hebt overtuigingskracht en gevoel voor humor, je bent besluitvaardig en stressbestendig;
Je kunt zelfstandig en gestructureerd werken en je dossiervoering bewaken;
Je hebt de CGT basiscursus afgerond.

Het overleggen van een verklaring omtrent gedrag maakt deel uit van de sollicitatieprocedure.
Wat krijg je van ons?
Wij bieden een interessante en afwisselende baan in een dynamische werkomgeving.
Het betreft een aanstelling voor bepaalde tijd voor de duur van 1 jaar met de mogelijkheid tot verlenging. Het salaris en de arbeidsvoorwaarden zijn overeenkomstig de CAO GGZ en functiegroep 60 (€2963,- t/m €4620,-). Arkin beschikt over aanvullende arbeidsvoorwaarden zoals een goede regeling studiefaciliteiten en regeling OV-woonwerkverkeer die aanvullend is op de CAO. Arkin heeft een breed (intern) aanbod van scholings- en trainingsmogelijkheden.
Wie zijn wij?
Inforsa is één van de merken van Arkin en biedt behandeling, begeleiding en reclasseringsprogramma’s voor volwassenen met complexe meervoudige problemen op psychiatrisch en forensisch gebied.

Forensisch Ambulante Zorg
De Forensisch Ambulante Zorg (FAZ) is actief in Amsterdam met outreachende teams en een polikliniek én in de Gooi & Vechtstreek, regio Eemland, Utrecht, Amersfoort en Veenendaal met outreachende teams.
De FAZ behandelt cliënten met een forensische titel of met vergelijkbare risico’s en problematiek met als doel de kans op recidive te voorkomen. De FAZ levert een onmisbare bijdrage aan het behandelen van forensische en ontwrichtende cliënten. Er wordt intensief samengewerkt met gemeentelijke instanties, reclasseringsorganisaties, collega GGZ aanbieders en Dienst Justitiële inrichtingen (DJI).
De Forensisch Psychiatrische Polikliniek (FPP) Utrecht
De FPP te Utrecht is een team bestaande uit: GZ-psychologen, basispsychologen, een psychiater en opleidingen tot GZ-psycholoog.
De Forensisch Psychiatrische Polikliniek onderscheidt zich ten opzichte van andere forensische aanbieders vanwege de doelgroep. Client kunnen bij ons zowel vrijwillig in zorg komen, als binnen een verplicht kader. Onze cliënten hebben vaak problemen op meerdere leefgebieden en tonen grensoverschrijdend gedrag voortkomend uit (soms ernstige) verslavings-, psychiatrische en persoonlijkheidsproblematiek al dan niet in combinatie met een verstandelijke beperking. Alle behandelingen zijn erop gericht om het recidiverisico te verlagen.

Forensisch Fact-team (FFT) Utrecht
Het forensisch Fact-team in Utrecht onderscheidt zich ten opzichte van andere aanbieders vanwege de combinatie van outreachende zorg en poliklinische behandelingen. Daarnaast zijn we expert op het gebied van verslavingsproblematiek bij forensische cliënten.
De cliënten in het forfact team hebben te kampen met een variëteit aan psycho(sociale)problematiek; psychiatrische-verslavings-, persoonlijkheidsproblematiek, al dan niet in combinatie met een verstandelijke beperking, waarbij vaak grensoverschrijdend gedrag kan worden gezien. Daarnaast spelen er veelal problemen op diverse levensgebieden en is er sprake van schulden, dakloosheid, ontbreken van een dagbesteding of sociaal netwerk. Hierdoor is intensieve zorg noodzakelijk. Middels de (stedelijke- en regionale) keten-aanpak worden cliënten gestabiliseerd en behandeld.

Vanwege de groei van ons team in Utrecht zijn we op zoek naar basispsychologen.
Het team van de forensische poli is een team in ontwikkeling dat zich kenmerkt door gedrevenheid, vakkundigheid en creativiteit
Als psycholoog ben je inzetbaar als diagnosticus en als behandelaar binnen de forensische poli. Daarnaast kun je deels komen te werken binnen één van de penitentiaire Instellingen in de regio waarin wij ook werkzaam zijn. Je werkt nauw samen met jouw team en zorgt samen met je collega’s dat de zeer complexe problematiek van de cliënten, die afhankelijk zijn van (intensieve) ambulante zorg, beheersbaar blijft en verbeterd wordt.
Wil je meer weten?
Ben je een enthousiaste, ervaren professional die wil werken in een organisatie die volop in beweging is, dan nodigen wij je graag uit te solliciteren. Voor meer informatie en vragen over deze vacature kun je contact opnemen met Ellen Rosenberg (manager behandelzaken), telefoon 06 50 58 91 61.",-1.0,-1,https://indeed.nl/rc/clk?jk=639fa6f09c49f617&from=vj&mvj=0&vjfrom=vjs&pos=bottom&astse=b7fe58e86f123224&assa=8258,https://nl.indeed.com/vacature-bekijken?jk=639fa6f09c49f617&fccid=1e98ad7130230bba&vjs=3,Meer dan 30 dagen geleden,Meer dan 30 dagen geleden,2021-01-24,en,Female
