,Search Keyword,Platform,Job ID,Job Title,Company Name,Location,Job Description,Rating,Employment Type,Company URL,Job URL,Job Age,Job Age Number,Collection Date,Language,Gender
15,psychologen,Indeed,pj_0cde3d3ed55ab51d,Psycholoog (incl. traineeship),Psion BV, Nederland,"Wij veranderen de psychische begeleiding in Nederland. Help je ons mee?Ben jij een enthousiaste, net of bijna afgestudeerde psycholoog met lef én ben je op zoek naar een mooie uitdaging om jezelf verder te ontwikkelen in het vak? Dan is deze vacature bedoeld voor jou!PSION helpt organisaties en hun medewerkers bij preventie en aanpak van psychische klachten. Wij zijn betrokken, proactief, willen geen ""etiketten plakken"" en blijven niet hangen in protocollen en medische diagnoses. Onze psychologen gaan met maximale inzet en energie aan de slag met individuele medewerkers die uitgevallen zijn uit het werk of uit dreigen te vallen met psychische klachten. Naast het vormgeven van deze individuele begeleiding, adviseren we de medewerker en zijn/haar werkgever dan ook over passende inzetbaarheid. Wij sturen hierbij maximaal op eigen verantwoordelijkheid en mogelijkheden tot positieve verandering. We geloven daarbij dat werk over het algemeen bijdraagt aan een sneller herstel!Het succes van deze aanpak is bijzonder groot en wij mogen ons dan ook verheugen in een toenemend aantal klanten in alle branches door heel Nederland. Door deze snelle groei zijn we binnen ons jonge, enthousiaste en gedreven team op zoek naar nieuwe (net) afgestudeerde psychologen in (met name) de volgende regio’s;Noord-HollandUtrechtGelderlandZuid-HollandBrabantLimburgZeelandWe proberen daarbij uiteraard zoveel als mogelijk rekening te houden met de regio waarin je woont.De collega die we zoeken: Heeft een afgeronde opleiding toegepaste psychologie of een afgeronde academische opleiding psychologieWordt enthousiast bij het lezen over onze visie op psychische begeleidingLaat zich niet leiden door protocollen, maar vertrouwt op eigen kennis en kundeHeeft de ambitie om iets moois te maken van zijn loopbaan en heeft geen 'negen tot vijf mentaliteit'Kan goed zelfstandig werken, maar wil ook graag onderdeel zijn van een hecht teamIs in het bezit van een rijbewijs B en vindt regelmatig achter het stuur zitten geen probleemEn herkent zichzelf in ondergenoemde eigenschappen:Is energiek, enthousiast en durft zichzelf te zijnGaat voor succes en heeft lefIs communicatief vaardig en klant- en resultaatgerichtIs creatiefIs ondernemend en voelt zich goed in een adviserende rolTraineeshipEen PSION-psycholoog word je niet zomaar: door zes maanden betaald te werken en te leren, groei je in deze rol en kom je alles te weten over de cultuur en werkwijze van PSION. Tijdens het traineeship staat centraal dat je gaat leren door het vooral ‘gewoon’ te doen. Je pakt vanaf het begin clientgesprekken op (uiteraard onder begeleiding van een geroutineerde psycholoog) en van daaruit gaan we met elkaar kijken waar je staat, wat je ontwikkelmogelijkheden zijn, waar je aandachtspunten liggen en welke trainingen er nodig zijn om je uiteindelijk zelfstandig binnen ons PSION-team aan de slag te kunnen laten gaan.De trainingen vinden plaats op onze hoofdkantoren (Nieuwegein en Etten-Leur). Echter, het traineeship bestaat vooral uit het voeren van clientgesprekken met geroutineerde psychologen. Daarin kun je (grotendeels) rekening houden met de regio waar je woont. Wat wel belangrijk is om te vermelden: het traineeship wordt zo ingestoken dat we in die periode maximaal investeren in je toekomst, dus als het daarvoor nodig is om een aantal dagen bij een gekozen psycholoog aan te sluiten buiten jouw regio, wordt wel verwacht dat je hiervoor bereid bent te reizen.In principe wordt er elke twee maanden een nieuw traineeship gestart.Wat hebben we te bieden?Dit leer- / werktraject is een geweldige kans om jezelf te ontwikkelen tot een collega die het verschil maakt op de werkvloer en bij de doelgroep. Tijdens het traineeship investeren we samen in een mooie toekomst. We geven je hierbij een passende vergoeding en stellen je al een auto ter beschikking.Wanneer je het traineeship succesvol doorloopt, ben je daarna verzekerd van een vaste aanstelling binnen PSION met de daarbij behorende marktconforme (secundaire) arbeidsvoorwaarden.Wie zijn wij?PSION staat voor Psychische Interventies en Ondersteuning Nederland. We zijn een jonge, stabiel groeiende organisatie. Onze kracht ligt in kennis, zeer deskundige en ervaren psychologen, korte en directe communicatie en transparantie naar onze opdrachtgevers. De psychologen van PSION weten de balans te vinden tussen enerzijds empathie en mensgerichtheid, en anderzijds het belang van de organisatie. PSION heeft haar hoofdkantoor in Nieuwegein en een dependance te Etten-Leur. Echter, de psychologen zijn werkzaam door heel Nederland (uiteraard wordt zo veel als mogelijk rekening gehouden met woonplaats).PSION is onderdeel van de ParaDIGMA Groep: een innovatieve, trendsettende en snelgroeiende groep van samenwerkende bedrijven met expertise op alle deelgebieden van Duurzame Inzetbaarheid.Het aanvragen van een Verklaring Omtrent Gedrag (VOG) is onderdeel van de sollicitatieprocedure.Soort dienstverband: Fulltime, Bepaalde tijd",-1.0,-1,https://indeed.nljavascript:void(0);,https://nl.indeed.com/vacature-bekijken/pagead/clk?mo=r&ad=-6NYlbfkN0Apv4msLeE5_PzJSWjrlwd3USSkLBa0vWKD0egsxYt6d-pDWgBO7dazYTazQon43D4V03MkihpZfTxbt3vrRlsSnpKwEfBe4y6gl6H_uHEL8cSlf2RKJ3NJd3GX9lYEV1sQegno0jbaH_4JNLpZ3002EKKuEzaM49hnmKRJnfwYPMH6i6GIDGuypzPjt33ZVtiDLolkIgs035aMHIhhYYh080ayW-w54tpO0ytrDVA7gEr04UvRUj-uy976ofDT60N2Y-4LYmE3ypBxKQWWJwV7EbLtrKNaO6mQpDRaEyVqHxWzw8rw_Uij-xz3FyLbmC6kzhBdsU62t-x2MOJwxp9RC_9VjrWc5WxAzl_K9yXxk8cuHp1VmrBwHcrdPKxC_NgNPADuTqaKXwxffd-8mnBa9JwCjYuGk7HAJ08Ig93iXY9Vjbsg494_1chVPukV0s75dSVzwPdBotNf6uAtMdCysfmvcq_B0WQ=&p=9&fvj=1&vjs=3,2 dagen geleden,2 dagen geleden,2021-01-24,en,Female
16,psychologen,Indeed,p_fac387f7c0782d8f,Teamleider (Fysiotherapeut of (GZ) psycholoog),Winnock  onderdeel van Zorg van de Zaak Netwerk, Amsterdam,"Ben jij (psychosomatisch) fysiotherapeut of (GZ)-psycholoog met bij voorkeur leidinggevende ervaring in de medisch specialistische revalidatiezorg en word je enthousiast als mensen - mede door jouw coaching – het heft in eigen hand nemen met betrekking tot hun eigen functioneren? Vind jij het daarnaast een uitdaging om samen met een team zorg te dragen voor de personele, financiële en contractuele afgesproken resultaten, waarbij jij de verantwoordelijkheid draagt? Dan zijn wij op zoek naar jou als teamleider!Voor de vestiging Den Haag/Amsterdam zoeken we per direct een Teamleider (4-5 dagen per week).Wat ga je doen?Als teamleider ben je verantwoordelijk voor de personele, financiële en contractuele afgesproken resultaten van het team (2 vestigingen). Je zorgt voor samenwerking met de andere teams van Winnock en organisatieonderdelen van Zorg van de Zaak. Je hebt oog voor zowel het belang van de organisatie als het belang van het team.Daarnaast ben je bij voorkeur ook in de cliëntenzorg actief, zodat jij weet wat zich op de werkvloer afspeelt en zowel in contact staat met de cliëntzorg als de operationele processen in de organisatie.De taakomschrijving omvat onder andere:· Je geeft hiërarchisch leiding aan de leden van het team. Je bent een teamspeler, maar durft beslissingen te nemen wanneer dit nodig is en hier verantwoordelijkheid voor te dragen.· Je werkt bij voorkeur ook als uitvoerend professional (ongeveer 25- 50 %).· Je bent lid van het management team en geeft gevraagd en ongevraagd advies aan de directeur.· Je verbindt als cultuurdrager de visie van Winnock en Zorg van de Zaak met de dagelijkse bedrijfsvoering.· Je geeft mede vorm aan de transitie van zelfsturing naar professioneel leiderschap.· Je draagt zorg dat de teamleden zich houden aan de voor Winnock geldende inhoudelijke-, financiële-, beleids- en wet- en regelgeving kaders.· Je bent verantwoordelijk voor de kwantitatieve en kwalitatieve prestaties van de medewerkers en ondersteunt de medewerkers actief door bijvoorbeeld de medewerker(s) te coachen.· Je signaleert en rapporteert tijdig en proactief alle afwijkingen die een mogelijke impact hebben op bedrijfsvoering en/of dienstverlening en draagt daar oplossingen voor aan.Kennis, ervaring en talentenDe ideale collega is een (psychosomatisch) fysiotherapeut of (GZ)-psycholoog met bij voorkeur leidinggevende ervaring in de medisch specialistische revalidatiezorg.Je hebt aantoonbare ervaring met leidinggeven aan organisaties met professionals.Je bent bekend met groepsdynamisch werken en je bent een betrouwbare, integere en energieke teamspeler.Je hebt van nature overwicht en bent analytisch sterk.Je bent klantgericht en hebt een helicopterview.Je bent resultaatgericht en je denkt in mogelijkheden.Je functioneert op HBO+ of academisch werk- en denkniveau.Je in het bezit bent van een rijbewijs en een auto (zodat je in staat bent aanwezig te zijn op meerdere vestigingen).Wie zijn wij?Winnock is een erkende medisch specialistische instelling voor poliklinische revalidatiezorg. Winnock biedt mensen met gecompliceerde gezondheidsproblematiek een nieuw perspectief en is daarnaast specialist in Nederland op het gebied van re-integratie in eigen werk van mensen met langer bestaande gezondheidsklachten. Al 30 jaar begeleidt Winnock mensen die door gezondheidsklachten minder goed functioneren, verzuimen of arbeidsongeschikt zijn, bij het herstel van hun klachtonafhankelijk functioneren in werk en/of maatschappij. Hierbij worden talenten, krachten en mogelijkheden zoveel mogelijk benut. De werkwijze die Winnock daarbij hanteert, is interdisciplinair. Teams van psychologen, fysiotherapeuten/bewegingsdeskundigen, medisch specialisten, planners en office coördinatoren werken intensief samen. Opdrachtgevers en verwijzers zijn onder andere verzekeraars, werkgevers, bedrijfsartsen, medisch specialisten en huisartsen. De medewerkers van Winnock kenmerken zich door resultaatgericht werken vanuit betrokkenheid.Winnock is onderdeel van het Zorg van de Zaak Netwerk. Zorg van de Zaak Netwerk bestaat uit diverse organisaties op het gebied van bedrijfsgezondheidszorg zoals arbodiensten, expertisebedrijven voor bedrijfsmaatschappelijk werk, arbeidsdeskundigen en loopbaanadviseurs. Kortom, organisaties die helpen om medewerkers gezond te laten werken, verzuim te beperken en de inzetbaarheid van medewerkers te verhogen.ArbeidsvoorwaardenEen interessante, uitdagende functie in een ambitieuze werkomgeving die volop in ontwikkeling is. Een salaris conform de cao ZKN met goede secundaire arbeidsvoorwaarden. Het betreft een functie voor minimaal 32 uur per week voor de vestigingen Amsterdam & Den Haag.InformatieHeb je specifieke vragen over deze vacature? Neem contact op met Joke van Wijk (Directeur) via telefoonnummer 06-21577285.SolliciterenHeb je interesse in deze vacature? Solliciteer dan direct met jouw cv en motivatie.Acquisitie n.a.v. deze advertentie wordt niet op prijs gesteld.Parttime uren: 32-40 per weekSoort dienstverband: Fulltime, ParttimeWerkschema:ma-vr",-1.0,-1,https://indeed.nl/rc/clk?jk=fac387f7c0782d8f&from=vj&mvj=0&vjfrom=vjs&pos=bottom&astse=8ec6237b0eefabe6&assa=1752,https://nl.indeed.com/vacature-bekijken/company/Zorg-van-den-Zaak/jobs/Teamleider-fac387f7c0782d8f?fccid=c1dd637f91fc2162&vjs=3,2 dagen geleden,2 dagen geleden,2021-01-24,en,Female
17,psychologen,Indeed,p_d5da3ccbcebb32ab,Basispsycholoog Volwassenen – Hartje Amsterdam,Mentaal Beter, Amsterdam,"Parttime
24 - 32u per week
Salarisindicatie
€2963 - €4620
Werkervaring
2 jaar
Kwalificatie
WO niveau
Vacature informatie
Per 1 januari is PEP overgenomen door Mentaal Beter en zullen zij hun bestaande werkzaamheden onder de Mentaal Beter vlag voortzetten. Tijdens het integratieproces worden de mooie aspecten en kwaliteiten van PEP Psychologen en Mentaal Beter met elkaar gecombineerd om zo tot een harmonieuze samenwerking te komen. Voor deze vestiging zijn wij per direct op zoek naar een ervaren basispsycholoog die het leuk vindt om deze uitdaging aan te gaan!

Wat ga je doen?
Je behandelt een cliëntpopulatie die een grote verscheidenheid aan psychische problemen kent, waaronder bijvoorbeeld PTTS, persoonlijkheidsproblematieken, angst- en stemmingsstoornissen. Behandelingen vinden in de G-BGGZ en in de SGGZ plaats en worden individueel aangeboden en in groepsverband aangeboden. Dit gebeurt zowel face-to-face als digitaal. Tijdens de behandelingen staat de hulpvraag van de cliënt centraal waarbij er zoveel mogelijk gebruik wordt gemaakt van evidence-based behandelmethodieken zoals; CGT, EMDR, schematherapie en ACT.
Wie zoeken wij?
Je hebt een afgeronde WO opleiding Psychologie.
Je hebt minimaal 2 jaar relevante werkervaring in de BGGZ en SGGZ.
Je hebt de basisopleiding CGT afgerond en hier ervaring in opgedaan.
Het zou mooi zijn als je ook de basisopleiding EMDR en schematherapie op zak hebt.
Je bent zelfstandig, maar schroomt niet om hulp en advies in te winnen bij collega’s.
Zelfreflectie vind je belangrijk, je bent ambitieus en leergierig.
Je ziet jezelf werken in een zelfsturende organisatie, bent ondernemend en zelfstandig en vindt het leuk om te helpen bouwen.
Je bent innovatief en staat open voor nieuwe ontwikkelingen en wilt hier graag in meedenken.
Team Amsterdam
PEP Psychologen is per 1 januari 2020 overgenomen door Mentaal Beter. Tijdens het integratieproces worden de mooie aspecten en kwaliteiten van PEP Psychologen en Mentaal Beter met elkaar gecombineerd om zo tot een harmonieuze samenwerking te komen. Voor de psychologen die er al werkzaam zijn, zal het een fase zijn waarin er gezocht wordt naar een mooie balans tussen wat zij al jaren lang gewend zijn en wat deze overname hen zal brengen.

Het is een divers team van in totaal 28 psychologen dat grotendeels uit GZ-psychologen bestaat. Daarnaast werken er ook psychotherapeuten, een klinisch psycholoog 2 basispsychologen en een aantal piogs. Een aantal van de GZ-psychologen zullen op termijn de opleiding tot psychotherapeut volgen. Er wordt samengewerkt met een vaste Psychiater en een groot aantal huisartsen en KNO-artsen op het gebied van tinnitus. Enkele behandelaren zijn werkzaam in de functie van POH-ggz bij huisartspraktijken.

De praktijk is gevestigd in Amsterdam Oud-Zuid waarbij de cliëntenpopulatie voornamelijk hoogopgeleide (studenten) zijn. De behandelingen vinden plaats in G-BGGZ en SGGZ en is er ruimte om zowel kort- als langdurige behandelingen aan te bieden.
Wat bieden we jou?
Wij bieden een prettige werkplek in een gezellig, inspirerend en bevlogen team waarin kwaliteit van zorg en zorg voor elkaar hoog in het vaandel staan.

Daarnaast bieden we het volgende:

Salaris conform cao ggz, functiegroep 60.
Leuke secundaire arbeidsvoorwaarden, waaronder reiskostenvergoeding, fietsplan, pensioenregeling, eindejaarsuitkering, verlofdagen en (digitale) teamuitjes.
De mogelijkheid om thuis te werken (ook na Covid-19). Laptop wordt hierbij gefaciliteerd.
Een persoonlijk opleidingsbudget voor het volgen van opleidingen.
De mogelijkheid om in-company opleidingen te volgen.
En op termijn de GZ-opleiding.

Wil je meer weten over de arbeidsvoorwaarden? Neem dan hier een kijkje: Arbeidsvoorwaarden.
Over Mentaal Beter
PEP (Praktijk van Eerstelijnspsychologen en Psychotherapeuten) is in 1982 opgericht door een aantal jonge klinisch psychologen. Hun missie: toegankelijke en kwalitatief hoogstaande psychologische hulp voor iedereen. Per 1 januari is PEP overgenomen door Mentaal Beter en zullen zij hun bestaande werkzaamheden onder de Mentaal Beter vlag voortzetten.

Mentaal beter worden en blijven – dat is waar wij voor staan! Het is ons doel om mensen te helpen met het aanpakken van psychische problemen die hun dagelijks leven belemmeren. Mentale vitaliteit is immers van uiterst groot belang voor het leiden van een gelukkig leven.

Wij zijn een curatieve geestelijke gezondheidszorg (ggz) aanbieder met een landelijk netwerk bestaande uit (GZ-) psychologen, orthopedagogen, psychotherapeuten, klinisch psychologen en psychiaters. Met ruim 1000 medewerkers verspreid over 100 locaties door heel Nederland, werken we volgens onze vier kernwaarden: persoonlijk, duidelijk, doelgericht en actief samenwerken. Daarnaast zijn wij continu op zoek naar effectievere en innovatieve behandelmogelijkheden.

Zowel jong als oud kunnen bij ons terecht voor behandelingen in de generalistische basis ggz (gb-ggz) en specialistische ggz (s-ggz). Wij zijn gespecialiseerd in het behandelen van lichte tot matige klachten. Het verminderen van klachten is echter niet het enige waaraan wij werken: bij elke behandeling zorgen we ervoor dat mensen groeien in hun zelfredzaamheid en weer de regie over hun eigen leven kunnen oppakken, ongeacht hun leeftijd.
Enthousiast geworden?
Solliciteren kan via onderstaande sollicitatiebutton. Wil je eerst nog meer weten over deze vacature? Neem dan contact op met Nadiah Polak (Corporate Recruiter) via 06 510 124 81.

Voor meer informatie over Mentaal Beter kijk je op onze website.

De sollicitatieprocedure gaat gewoon door. Echter zal het eerste kennismakingsgesprek telefonisch of online via videobellen worden gevoerd in verband met de corona maatregelen. Tevens wordt er geen einddatum gehanteerd en zolang de vacature online staat is deze nog actueel.

Acquisitie naar aanleiding van deze vacature wordt niet op prijs gesteld en niet in behandeling genomen.",-1.0,-1,https://indeed.nl/rc/clk?jk=d5da3ccbcebb32ab&from=vj&mvj=0&vjfrom=vjs&pos=bottom&astse=9f9faea1b1c62b48&assa=114,https://nl.indeed.com/vacature-bekijken?jk=d5da3ccbcebb32ab&fccid=6b9aa5569b1f04d6&vjs=3,2 dagen geleden,2 dagen geleden,2021-01-24,en,Female
18,psychologen,Indeed,p_53e4f0aa31abd307,(GZ) psycholoog (zzp of loondienst),Skils  onderdeel Zorg van de Zaak Netwerk, Amsterdam,"Wij geloven dat werk gelukkig maakt…jij ook?Wat ons betreft betekent dat dus: jij een leuke baan en de cliënt wordt goed geholpen. Iedereen gelukkig, het mes snijdt aan twee kanten…of misschien nog wel aan meer kanten. Bij ons werk je samen aan het resultaat. Vanuit ‘krachtdenken’ en ‘wat-kan-er-wel’ betrekken wij op onderdelen de bedrijfsarts en de leidinggevende bij een duurzame oplossing voor de cliënt. Dit doen wij middels oplossingsgerichte therapie en cognitieve gedragstherapie (CGT). Ook werken wij veel met Mindfulness based interventies, ACT en EMDR.Medewerker van Skils aan het woord‘Ik kwam uit de reguliere GGZ en wilde eens wat anders. Werken bij Skils is ook echt anders! Ik kan uiteenlopende en volledige behandelingen uitvoeren, daarnaast is er continu focus op maatschappelijk functioneren en inzetbaarheid in werk. Het heeft mij verrast hoe verrijkend het is om de werkcontext te betrekken bij herstel. Vroeger dacht ik dat arbeidsgerelateerde zorg saai was. Skils bewijst het tegendeel. Je put uit zowel je klinische kennis als uit je adviesvaardigheden en leert over organisatiekunde.’Voor meerdere vestigingen van Skils (verspreid door heel Nederland) zijn wij op zoek naar nieuwe collega (GZ) psychologen. Het aantal uren per week en voor welke vestiging(en) je zal gaan werken, bepalen we samen.We zijn zowel op zoek naar (GZ) psychologen die in loondienstverband voor Skils willen werken als naar zzp (GZ) psychologen die zich naast hun eigen praktijk willen verdiepen in het werkveld arbeid & psyche.Wat ga je doen?Wij geloven dat psycholoog zijn een ambacht is. Dat jij gelukkig wordt van werken met zowel je hoofd, je hart als ook je handen. Wij zoeken (GZ)psychologen die kunnen overstijgen en reflecteren, die dit doen vanuit ware empathie en cliënten een stevige hand bieden bij het zetten van moeilijke stappen. Sluit je aan?Een greep uit je takenpakket:Diagnostiek en indicatiestelling GBGGZIndividuele behandeling en werkgeversactiviteitenVerder bieden we je de mogelijkheid tot:Het geven van competentie trainingen aan cliëntenHet uitvoeren van psychodiagnostische expertisesHet geven van trainingen bij organisaties (werkstresspreventie, mentale veerkracht, Breinvriendelijk werken)Wat bieden wij?Wij vinden het belangrijk, dat jij je werk op een duurzame en voor ons beiden haalbare manier kunt inrichten. De cultuur van Skils laat zich omschrijven als gelijkwaardig, inspirerend, warm en hard werken. Wij bieden je een uitdagende baan met veel dynamiek en dagen je uit op de gebieden productiviteit en zorgvuldigheid. We hebben 7 hoofdvestigingen (en diverse spreekuurlocaties) door het hele land, er is dus altijd wel een vestiging bij jou in de regio!Breinvriendelijk werkenActueel binnen Skils is Breinvriendelijk werken. Digitalisering, het altijd ‘aanstaan’, het voortdurend laten kapen van de aandacht en toegeven aan switchtasken zorgt voor onnodige mentale belasting met stressklachten als gevolg. Daarom wil Skils - zowel in ons eigen bedrijf als in ons werk met cliënten en klanten – werken vanuit de huidige (neuropsychologische) kennis over focus en aandacht. Doe je mee?Meer weten over Breinvriendelijk werken, onze ideeën en aanpak? Kijk op https://www.zorgvandezaak.nl/breinvriendelijkwerken/Wat breng je mee?Bij Skils hebben wij een professionele, persoonlijke aanpak hoog in het vaandel staan. Daarom zijn wij op zoek naar collega’s die klantgericht zijn, stressbestendig, flexibel en oplossingsgericht. Met een proactieve en dienstverlenende instelling pas je heel goed bij Skils. Daarnaast ben je bekend met of nieuwsgierig naar het werken op het snijvlak van gezondheid en werk.Skils is onderdeel van het Zorg van de Zaak Netwerk. Zorg van de Zaak Netwerk bestaat naast psychologische dienstverlening uit diverse organisaties die helpen om medewerkers gezond te laten werken, verzuim te beperken en de inzetbaarheid van medewerkers te verhogen.Nieuwsgierig?Heb je interesse, behoefte aan meer informatie of wil je het werken bij ons verkennen d.m.v. een gesprek met een van onze psychologen? Neem gerust contact met ons op en bel 06-18357827 (Mathilde Hoogerdijk, recruiter). Heb je direct al het gevoel dat we bij elkaar passen? Solliciteer dan direct!Soort dienstverband: Freelance/ZZP, Onbepaalde tijdWerkschema:Flexibel werkroosterma-vr",-1.0,-1,https://indeed.nl/rc/clk?jk=53e4f0aa31abd307&from=vj&mvj=0&vjfrom=vjs&pos=bottom&astse=df43dc9e98c56543&assa=6660,https://nl.indeed.com/vacature-bekijken/company/Zorg-van-den-Zaak/jobs/-53e4f0aa31abd307?fccid=c1dd637f91fc2162&vjs=3,2 dagen geleden,2 dagen geleden,2021-01-24,en,Female
