,Search Keyword,Platform,Job ID,Job Title,Company Name,Location,Job Description,Rating,Employment Type,Company URL,Job URL,Job Age,Job Age Number,Collection Date,Language,Gender
31,psychologen,Indeed,p_bb89c108b219328f,GZ-psycholoog,De Waag, Zaandam,"Locatie Zaandam

Ben jij onze enthousiaste nieuwe collega die zich graag wil ontwikkelen in het forensische werkveld? Wil je daarnaast aan de slag met onze unieke behandelprogramma’s en op deze manier een actieve bijdrage leveren aan het verminderen van risicovol gedrag en daarmee aan een veiligere samenleving? Dan komen we graag in contact met jou!


Voor de Waag in Zaandam, zorglijn Agressie en Vermogen, zoeken wij een:

GZ-psycholoog
(32-36 uur)

Als je bij de Waag werkt, werk je aan zorg voor veiligheid. Wij bieden gespecialiseerde zorg voor mensen met grensoverschrijdend of strafbaar gedrag. Door samen met de cliënt te onderzoeken welke hulpvraag hij heeft en te kijken naar de risicofactoren en stoornis die een rol spelen bij het strafbare of grensoverschrijdende gedrag wordt de behandeling vormgegeven. De behandeling wordt ondersteund door diverse zorgprogramma’s. Een goede behandeling betekent een positiever leven en meer veiligheid voor de cliënt, zijn naasten en de samenleving.

De Waag heeft sinds enkele jaren een vestiging in Zaandam. Het team bestaat uit enthousiaste (GZ-) psychologen, systeemtherapeuten, een psychiater en orthopedagoog-generalisten die intensief met elkaar samenwerken. De Waag heeft een stevige basis in de Zaanstreek. We zijn gericht op verdere groei en verwachten daar van jou een actieve bijdrage in.

Wat ga je doen?

Je bent (regie)behandelaar binnen het behandelteam, waarbij je je eigen individuele caseload als behandelaar bedient. Daarnaast ben je als regiebehandelaar betrokken bij behandelingen van collega’s.
Er is wekelijks multidisciplinair overleg met psychiater en/of klinisch psycholoog, (GZ-) psychologen, orthopedagogen en systeemtherapeuten.
Je draagt bij aan de opzet en implementatie van beleid en het verder ontwikkelen van het behandelaanbod.
Je doet voorstellen voor verbetering van de inhoud en kwaliteit van de zorg (innovatie en ontwikkeling).
Je biedt (mogelijk) begeleiding aan GZ-psychologen in opleiding.


Wat neem je mee?

Je bent BIG-geregistreerd en beschikt over een registratie als GZ-psycholoog.
Je hebt affiniteit en/of ervaring met de forensische doelgroep.
Je bent verbindend, integer en kan de-escalerend optreden.


Wat bieden wij je?

Ontwikkelmogelijkheden, zowel in de dagelijkse praktijk van je werk, als door het volgen van (interne) trainingen en opleidingen. We besteden veel aandacht aan begeleiding en intervisie.
Een jaarlijks individueel opleidingsbudget.
Daarnaast bieden wij je uitdagend en veelzijdig werk in een professionele omgeving waar collega's intensief met elkaar samenwerken.
De functie is ingeschaald in FWG 65 conform de salarisschalen van de CAO GGZ (min. € 4.053,- max. € 5.439,- bruto per maand op basis van een 36-urige werkweek). Inschaling is afhankelijk van opleiding en ervaring. Ook ontvang je een 13e maand.
De locatie is goed bereikbaar met de auto en er is in de nabije omgeving voldoende parkeergelegenheid.


Over de Waag
De Waag is de oudste en grootste aanbieder van ambulante forensische psychiatrie in Nederland. Sinds 1992 behandelen we jongeren met gedragsproblemen en volwassenen met agressieproblemen, problemen rondom huiselijk geweld of seksueel overschrijdend gedrag.


Interesse?
Wij komen graag met je in contact! Wij nodigen graag nieuwe uit collega’s met uiteenlopende achtergronden en een brede maatschappelijke blik die zich graag verder willen ontwikkelen in het forensische werkveld. Solliciteer via de link “solliciteer direct” op www.werkenbijdfzs.nl/vacatures.

Voor meer informatie over de vacature kun je contact opnemen met Simone Dust, Teamleider, via 06-29541289.

Een referentiecheck maakt onderdeel uit van de selectieprocedure. Voor de aanstellingsprocedure is het overleggen van een “Verklaring omtrent het Gedrag” (VOG) een verplicht onderdeel.

Acquisitie door werving en selectie-, detacherings- of uitzendbureaus naar aanleiding van deze advertentie wordt niet op prijs gesteld.",-1.0,-1,https://indeed.nl/rc/clk?jk=bb89c108b219328f&from=vj&mvj=0&vjfrom=vjs&pos=bottom&astse=0abfd6466d327da2&assa=1598,https://nl.indeed.com/vacature-bekijken?jk=bb89c108b219328f&fccid=811be73526668321&vjs=3,Meer dan 30 dagen geleden,Meer dan 30 dagen geleden,2021-01-24,en,Female
32,psychologen,Indeed,p_a06e836bd95c503d,GZ psycholoog,Parnassia, Beverwijk,"GZ psycholoog
Ook nu in coronatijd werven wij door: Parnassia zoekt voor het FACT team in Beverwijk een GZ psycholoog.
Dit ga je doen
Ben jij een betrokken GZ psycholoog met affiniteit voor EPA problematiek, die ons behandelteam wil komen versterken?

Ons FACT team bestaat uit een betrokken groep mensen, met verschillende opleidingsachtergronden en expertises (psychiaters, GZ psycholoog, SPV, maatschappelijk werkers). De problematiek van onze doelgroep is divers. We behandelen mensen met psychoses, trauma, angst-, stemmings-, en persoonlijkheidsstoornissen. We werken hierbij als team hecht samen, hebben waar nodig contact met ketenpartners en betrekken familie in het behandeltraject.

We vinden het belangrijk om te blijven ontwikkelen en organiseren daarom regelmatig cursussen op teamniveau. Voor GZ psychologen zijn er ook mogelijkheden voor scholing, bijvoorbeeld deelname aan de opleiding tot EMDR therapeut.

Jouw verantwoordelijkheden:
Psychologische behandeling als, cognitieve gedragstherapie, onderzoeken gedachtenpatronen en EMDR
Systeemgesprekken en zo mogelijk MBT of schematherapie
Screening en diagnostiek, meedenken over complexe casussen
Begeleiding van basispsycholoog
Bijdrage aan de ontwikkeling van psychologische behandeling voor ernstig psychiatrische patiënten (EPA) en de implementatie van deze behandeling in de FACT methodiek
Samenwerken in het team, kennis overdragen en vakinhoudelijke adviezen delen
Dit ben jij
Wij zoeken een afgestudeerde, BIG geregistreerde, GZ psycholoog. Je hebt ervaring in het uitvoeren van individuele behandelingen en hebt een herstelgerichte manier van denken en werken.

Om in aanmerking te komen voor deze functie is een positieve Verklaring Omtrent Gedrag (VOG) vereist.
Het natrekken van referenties, integriteitscontrole via het Waarschuwingsregister Zorg & Welzijn en het controleren van diploma’s maken onderdeel uit van de sollicitatieprocedure.
Wij bieden
Wij bieden onze collega’s gevarieerd en zinvol werk in een professionele en prettige werkomgeving. Daarbij hoort natuurlijk een goed pakket aan arbeidsvoorwaarden conform cao GGZ. Klik hier voor meer informatie over onze arbeidsvoorwaarden.

Het betreft een functie voor 16-24 uur per week. Je krijgt een jaarcontract met uitzicht op een vast dienstverband. Het salaris bedraagt minimaal € 4053,- en maximaal € 5439,- (FWG 65) bruto per maand op basis van een werkweek van 36 uur.
Werken bij Parnassia Groep
Parnassia is gevestigd in de regio's Haaglanden en Noord-Holland. Wij behandelen en begeleiden volwassenen met ernstige psychiatrische aandoeningen (EPA) en ouderen met psychiatrische problemen of dementie.

Parnassia is onderdeel van Parnassia Groep, een werkgever in de geestelijke gezondheidszorg die streeft naar een inclusieve cultuur met gelijke kansen voor iedereen. We maken geen onderscheid op gebied van geslacht, geloof, sociale achtergrond, geaardheid of etniciteit. Wij vinden het belangrijk om van en mét elkaar te leren, dat iedereen zichzelf kan zijn en een ieder zich gewaardeerd voelt. Bij ons kun je bijdragen aan tal van specialisaties, wetenschappelijke onderzoeken en via onze eigen Parnassia Groep Academie gebruik maken van (geaccrediteerde) opleidingsmogelijkheden. Alleen in een werkomgeving waarin we openstaan voor verschillen, halen we het beste uit onszelf, kunnen we creatieve en innovatieve oplossingen bieden voor onze patiënten en succesvol zijn.
Interesse?
Heb je vragen? Neem dan contact op met Marije Borgman, leidinggevende bedrijfsvoering, via 06-82106307.",-1.0,-1,https://indeed.nl/rc/clk?jk=a06e836bd95c503d&from=vj&mvj=0&vjfrom=vjs&pos=bottom&astse=a725b861b3bdd77a&assa=5939,https://nl.indeed.com/vacature-bekijken?jk=a06e836bd95c503d&fccid=cfda046816edda9e&vjs=3,Meer dan 30 dagen geleden,Meer dan 30 dagen geleden,2021-01-24,en,Female
33,psychologen,Indeed,pj_b2ac7dc99f6508b1,Basispsycholoog,Geduld Interventies GGZ, Amsterdam Noord,"WAAR KOM JE TE WERKEN?Geduld Interventies GGZ heeft een specifieke deskundigheid in het behandelen van bijna alle voorkomende vormen van verslavingen en de onderliggende psychische problematiek. Met name de onderliggende problematiek wordt bij veel instellingen onderschat en wordt bij ons intensief behandeld zodat de behoefte aan “vluchten” verdwijnt. Hierdoor komt duurzaam herstel op de eerste plaats. De behandeling kan zowel klinisch als ambulant. Je komt te werken in een multidisciplinair team van psychologen, GGZ-psycholoog, verslavingsarts en psychiater.WAT GA JE DOEN?Uitvoeren en rapporteren van intakes, individuele sessies en groepsessiesVoorbereiden op behandelingen en relevante behandelinformatie overdragen aan back-office en behandelteamOnderhouden van behandelcontacten van je caseloadDagelijks uitvoeren van correcte zorgregistratie en zorgadministratie in ons EPD (Medicore)WAT HEB JE GEDAAN?Afgeronde universitaire opleiding tot psycholoog met aantekening diagnostiekErvaring in de verslavingszorg is een préKennis en/of ervaring met het 12 stappen Minnesota model, CGT en ACT is een préZelfstandige en pro-actieve instellingCliëntgericht en teamspirit zonder 9-5 mentaliteitGoede mondelinge en schriftelijke communicatieve vaardigheden zowel in Nederlands als EngelsSecundaire arbeidsvoorwaarden:Werk vanuit huis mogelijkhedenPensioenVakantiegeldParttime uren: 32-36 per weekVerwachte startdatum: 18-10-2020Soort dienstverband: Fulltime, Parttime, Onbepaalde tijdSalaris: Vanaf €2.400,00 per maand",-1.0,-1,https://indeed.nljavascript:void(0);,https://nl.indeed.com/vacature-bekijken/pagead/clk?mo=r&ad=-6NYlbfkN0AqxTU6vVxNoWgk64x9mfQ1EMJPa1iU-xl8vkHjW75vs0lK6i9o9sXVx5H_KTkUUIHBD_19cBLZaralOOOXT7iErfTDlZcL1EKS75atlUbNRvYKMTYyCqMeWjpbYucrykCXOgTDDtRmRwBO6nOMzpF9C8WKCEhjvYnnJ3iEu0u02ZPzpR2Y1_0wz6myPrPBgAlb7ZkoaKCj2kpOUuG9GeC0E8jpEb9uHZaSCz-rwHEu4xHiK2LpQCxbifVXaAUJC7_5lGX0BVQv4NdX_9Ekcdthwr-DrlIkPTwdlfGmFqzCxvK1Z2eTTvhhXfbQA7wYEZbv1Zv0rAXCf1yII3Qaf8-MC4S0EUy8-izEXF0fV3VKJsSx-qG8NUSJ3jPKgdJYcRgy3k3Y88aAGG5IyQlEPxFE8FRamuB40NfW6lDo6FmIaRtDmZjbPxieMW0OTVjxsbg2oXq0LssLcA==&p=0&fvj=1&vjs=3,Meer dan 30 dagen geleden,Meer dan 30 dagen geleden,2021-01-24,en,Female
34,psychologen,Indeed,pj_ad46c864fcf1d29c,Basispsycholoog volwassenen – Haarlem,Mentaal Beter, Haarlem,"Parttime
24 - 32u per week
Salarisindicatie
€2963 - €4620
Werkervaring
2+ jaar
Kwalificatie
WO niveau
Vacature informatie
Omdat we hard aan het groeien zijn, zijn we per direct op zoek naar meerdere ervaren basispsychologen die minimaal 24 uur per week kunnen werken.

Wat ga je doen?
Mentaal Beter biedt geestelijke gezondheidszorg aan cliënten met psychische stoornissen en/of systeemproblemen die een belemmering vormen in hun dagelijks leven. Je geeft hierbij kortdurende individuele – en indien gewenst groepsbehandelingen aan volwassen in zowel de basis ggz als ook de specialistische ggz met behulp van e-Health programma’s. Dit doe je geprotocollisseerd, vraaggestuurd en cliëntgericht. Tevens doe je naast intakes en behandelingen ook diagnostisch onderzoek. In overleg met een regiebehandelaar geeft je een indicatie voor een passend behandelaanbod. Ook nodigen wij je uit om mee te helpen bij de ontwikkeling van ons nieuwe behandelaanbod.
Wat zoeken wij?
Je hebt een afgeronde WO opleiding Psychologie;Je hebt minimaal 2 jaar relevante werkervaring in de BGGZ en SGGZ;Ervaring met complexe doelgroepen is een pré;Je hebt ervaring met het afnemen van intakes, kortdurende individuele behandelingen en protocollaire behandelingen;De basisopleiding CGT is een must;Ervaring met EMDR, oplossingsgerichte therapie en schematherapie is een pré;Je staat ervoor open om online te behandelen;Je ziet jezelf werken in een zelfsturende organisatie en bent ondernemend;Je bent zelfstandig, maar schroomt niet om hulp en advies in te winnen bij collega’s;Je hebt een goede zelfreflectie en bent leergierig;Je bent innovatief en staat open voor nieuwe ontwikkelingen en wilt hier graag in meedenken.
De locaties
Werken bij Mentaal Beter is onderdeel zijn van één gezamenlijk doel: “Heel Nederland Mentaal Beter”. Van Groningen tot Terneuzen en van Hoofddorp tot Tilburg. Ieder team heeft een eigen verhaal, iedere collega een eigen motivatie. Samen zijn we één geheel, één organisatie, met dezelfde kernwaarden: persoonlijk, duidelijk, doelgericht en actief samenwerken.

Voor onze vestiging in Hoofddorp en IJmuiden zijn we op zoek naar meerdere basispsychologen. Beide teams bestaat uit verschillende disciplines zoals GZ-psychologen, een Psychiater, PIOG’s en Basispsychologen. Er wordt in een klein team gewerkt, zodat we op een laagdrempelige en persoonlijke manier met elkaar samenwerken. Doordat we een klein team zijn, zijn er veel mogelijkheden breed te behandelen. We werken middels een zelfsturende organisatiestructuur, waardoor we veel invloed hebben op de dagelijkse gang van zaken in de praktijk wat leidt tot een hoge mate van betrokkenheid van de teamleden. Vanuit het management word je gestimuleerd om binnen de zorg te innoveren en jezelf te ontwikkelen door middel van bijscholing, cursussen en workshops.
Wat bieden we jou?
Wij bieden een prettige werkplek in een gezellig, inspirerend en bevlogen team waarin kwaliteit van zorg en zorg voor elkaar hoog in het vaandel staan. Wij werken in kleine teams, volgens de Holacracy-methode. Dit is een besturingsmodel waar de verantwoordelijkheden worden verdeeld over alle medewerkers binnen deze locatie. Door effectieve overleggen is er veel ruimte voor eigen initiatief en worden spanningen en problemen snel en doelgericht aangepakt om ontwikkeling mogelijk te maken. Op deze manier werken we op een laagdrempelige en persoonlijke manier wat leidt tot een hoge mate van betrokkenheid, toegankelijkheid en openheid binnen het team.

Daarnaast bieden we een salaris conform cao ggz, functiegroep 60 (minimaal €2.963,- en maximaal €4.620,- bruto per maand o.b.v. 36 uur) en leuke secundaire arbeidsvoorwaarden, waaronder reiskostenvergoeding, fietsplan, verlofdagen, teamuitjes, een jaarlijks Mentaal Beter festival en een Mentaal Beter dag. Maar ook een opleidingsbudget voor het volgen van opleidingen en de mogelijkheid om in-company opleidingen te volgen. Neem dan hier een kijkje: Arbeidsvoorwaarden.
Over Mentaal Beter
Mentaal beter worden en blijven – dat is waar wij voor staan! Het is ons doel om mensen te helpen met het aanpakken van psychische problemen die hun dagelijks leven belemmeren. Mentale vitaliteit is immers van uiterst groot belang voor het leiden van een gelukkig leven.

Wij zijn een curatieve geestelijke gezondheidszorg (ggz) aanbieder met een landelijk netwerk bestaande uit (GZ-) psychologen, orthopedagogen, psychotherapeuten, klinisch psychologen en psychiaters. Met ruim 1000 medewerkers verspreid over 100 locaties door heel Nederland, werken we volgens onze vier kernwaarden: persoonlijk, duidelijk, doelgericht en actief samenwerken. Daarnaast zijn wij continu op zoek naar effectievere en innovatieve behandelmogelijkheden.

Zowel jong als oud kunnen bij ons terecht voor behandelingen in de generalistische basis ggz (gb-ggz) en specialistische ggz (s-ggz). Wij zijn gespecialiseerd in het behandelen van lichte tot matige klachten die te maken hebben met depressie, angststoornissen, trauma, ADHD, autisme en somatisch-symptoomstoornissen. Het verminderen van klachten is echter niet het enige waaraan wij werken: bij elke behandeling zorgen we ervoor dat mensen groeien in hun zelfredzaamheid en weer de regie over hun eigen leven kunnen oppakken, ongeacht hun leeftijd.
Reageren
Solliciteren kan via onderstaande sollicitatiebutton of je kan jouw cv en motivatie sturen via sollicitatie@mentaalbeter.nl onder vermelding van ‘Basispsycholoog volwassenen – regio Haarlem’ t.a.v. Nadiah Polak. Wil je eerst nog meer weten over deze vacature? Neem dan contact op met Nadiah Polak (Corporate Recruiter) via 06 510 124 81.

De sollicitatieprocedure gaat gewoon door. Echter zal het eerste kennismakingsgesprek telefonisch of online via videobellen worden gevoerd in verband met de #corona maatregelen. Tevens wordt er geen einddatum gehanteerd en zolang de vacature online staat is deze nog actueel.

Acquisitie naar aanleiding van deze vacature wordt niet op prijs gesteld en niet in behandeling genomen.",-1.0,-1,https://indeed.nl/rc/clk?jk=ad46c864fcf1d29c&from=vj&sjdu=a1klg9xDNw2PDAa0o3I6geCqPkdGYZLuNOZ0T-50DLmhvqUf3qpFZvpgdjcCfzroV0P54yk7b1EkyH9QiDobpq8oVDRlx9tuZwqQJx9Wt_yhEBVs4UlC01H0-VvNv2bT7lOwkSJxu6Dk7BlHnA_Z0we7wMB7tlivF6bZNGlRlV_XwxTVivFrGvR0j6ARfPRv&spon=1&adid=285336891&mvj=0&vjfrom=vjs&pos=bottom&ad=-6NYlbfkN0Al1QVGkrYBHxU2pDEz8HRJnRglUIAsxv3-6AYQbB5ymKzk2iiOJGfZvCP655jnSIbEZVz7w8T7yNq4HO5alaODLOUnmZ4j6FV1nYPj9_EJjSOUpTOeZeMQpm4hy4kJ3wN3feIaJBY0SMnSqu5KM323gFHu2kkT3SuDOZXmX9e9leswaeR4-sjK_QEOftrvVQl6COxElLECzJRravjR4LG8q63ZoBsQI088Q13z-0Cx3R895a60ML_hqRUqFS9zIvA3sLluAU3MkA6RtWBCS32Ij7nLlwzFn5e91nKtRu67TNDIoiDu-cwyKZ8uk_lbtrtOBFsXFap4Gg-SZWfgc8-nJ05ww-zz94O1rbb-cDTghaV_LJG1SxkMQDs3B-RVWeYgefp6UHImO2QCjP2TWlQtnPmoUkZXecQCUNO7UXjOOcXLwatSt6SUaGYP3gIVQkmJ81I5Aoi2_hXVvZwDVALJH1WMGp62iNWad7TBUVL9hQ3o5NGiZpo6GozhcQAv8WbX-wrm5FJYDI9uMQQiiZMiumN64XdILU3GU0_tKFZkzoSGlZp7WGUawKa71KDtj9ot_IcaymInzMDL4rjfQGn89M3PwMHIreypOkz2rATiF65XzmmUloLRjv8ned5kHEHVe18fL8meIOkWG9xoDpqHsi7C991rkp3vJfjqJDmKJJlxYoFY3UNoKDf6jjY3Chs=&astse=1a1a8af33b8e6b3c&assa=8391,https://nl.indeed.com/vacature-bekijken/pagead/clk?mo=r&ad=-6NYlbfkN0Al1QVGkrYBHxU2pDEz8HRJnRglUIAsxv3-6AYQbB5ymKzk2iiOJGfZvCP655jnSIbEZVz7w8T7yNq4HO5alaODLOUnmZ4j6FV1nYPj9_EJjSOUpTOeZeMQpm4hy4kJ3wN3feIaJBY0SMnSqu5KM323gFHu2kkT3SuDOZXmX9e9leswaeR4-sjK_QEOftrvVQl6COxElLECzJRravjR4LG8q63ZoBsQI088Q13z-0Cx3R895a60ML_hqRUqFS9zIvA3sLluAU3MkA6RtWBCS32Ij7nLlwzFn5e91nKtRu67TNDIoiDu-cwyKZ8uk_lbtrtOBFsXFap4Gg-SZWfgc8-nJ05ww-zz94O1rbb-cDTghaV_LJG1SxkMQDs3B-RVWeYgefp6UHImO2QCjP2TWlQtnPmoUkZXecQCUNO7UXjOOcXLwatSt6SUaGYP3gIVQkmJ81I5Aoi2_hXVvZwDVALJH1WMGp62iNWad7TBUVL9hQ3o5NGiZpo6GozhcQAv8WbX-wrm5FJYDI9uMQQiiZMiumN64XdILU3GU0_tKFZkzoSGlZp7WGUawKa71KDtj9ot_IcaymInzMDL4rjfQGn89M3PwMHIreypOkz2rATiF65XzmmUloLRjv8ned5kHEHVe18fL8meIOkWG9xoDpqHsi7C991rkp3vJfjqJDmKJJlxYoFY3UNoKDf6jjY3Chs=&p=1&fvj=0&vjs=3,Meer dan 30 dagen geleden,Meer dan 30 dagen geleden,2021-01-24,en,Female
35,psychologen,Indeed,pj_1df553452671b299,Psychotherapeut of GZ-psycholoog gezocht,Praktijk voor Psychotherapie Amsterdam eo, Amsterdam Zuid,"Wij zoeken een Psychotherapeut of GZ-psycholoog die graag wil werken in een praktijk waar kwaliteit en ruimte voor ontwikkeling voorop staan. Praktijk voor Psychotherapie Amsterdam e.o. is een GGZ-instelling die onze cliënten kwalitatief de best mogelijke zorg wil bieden. Naast onze psychologen, bestaat ons multidisciplinair team uit BIG-geregistreerde psychotherapeuten, klinisch en gz-psychologen.Daarnaast zijn we vanaf 2021 ook een praktijkinstelling voor de GZ-opleiding. Onderdeel van de functie is dat je praktijkopleider bent en begeleiding biedt aan de opleideling.Wij vragen:- Een afgeronde opleiding tot Psychotherapeut of GZ-psycholoog- Je bent BIG geregistreerd- Bereidheid een VOG verklaring aan te vragen- Affiniteit met psychoanalytische psychotherapie is een preHet betreft een functie met een nulurencontract, met een minimum van 20 uur per week. Een ORT-regeling (*30% bovenop het basis bruto uurloon) is hierop van toepassing. Hoogte van salaris is in overleg en op basis van opleiding en ervaring. Kosten woon-werkverkeer worden vergoed. Wekelijks volg je supervisie (vergoed) en maandelijks intervisie (vergoed). Ook is er wekelijks een literatuurbespreking inzake psychoanalytische theorie en psychoanalytische therapie. Voor vragen over de vacature kun je bellen met Silas de Bruijn op 06-30713691.Secundaire arbeidsvoorwaarden:Werk vanuit huis mogelijkhedenFlexibele werkurenVakantiegeldParttime uren: 20 per weekSoort dienstverband: Fulltime, Parttime, Bepaalde tijd, Onbepaalde tijdAanvullende betalingen:13e maandOveruren uitbetaaldVakantiegeldWerkschema:AvondwerkFlexibel werkroosterma-vrWeekendThuiswerken:YES_OCCASIONALLY",-1.0,-1,https://indeed.nljavascript:void(0);,https://nl.indeed.com/vacature-bekijken/pagead/clk?mo=r&ad=-6NYlbfkN0CMKBtj3NdwSwCIa26fLVE-JXWZHusFwQOpwaNnWlaZSav-aJM7IYQEUU8f9o-Ld_DYqDgYHJWfKoO8UdwfxEXVyG9a565bE6_qKEuiUze4rL0LsQ-P2FIAJvwI0qmWck6leNGQ9h9GKJb0C8245mzM0DqYExF77AOiT7wndhcAS775ZO7B6BNfS22jdmBzgE9x9JVUa4eSTPSuar37n9elc_c_A793XXbcSTf0aTQ6XneDRCdMP38aur3Jr00Nnbi0MbDH8G_Pr64u36JJMEc8Hk_VOCp85EbCVGTevgZiX-eMzVhP-pGIdc5JajnMyORZ-Hc7ggAiZgJjxABu9fMZ4Uv7eYenMolKj0CR6hRYF7wjre0oKGhv9jKqIQmz87MSJmS-DELXzqxddWQCvHNHOcok0lXgoywSXv7Ad2CygZZrxYLx8ikV0EzbLWLPQj3MqVmDZ_EleGPJ8UlpViP6R1fnWDIL36Il_hBi9YhescrsGth73vLr&p=2&fvj=1&vjs=3,Meer dan 30 dagen geleden,Meer dan 30 dagen geleden,2021-01-24,en,Female
